text,date,geo,hashtags,tweet_id,mentions,permalink,replies,retweets,replies_to,mentioned_urls
"to be honest, there is no reason the 3m corp cannot sell masks wholesale to consumers & groups directly. why,? we realize currying favor with donny may seem important but doing this? would help mitigate the spread of death. who will buy your products if a 3rd of us die?",2020-04-19 22:22:46+00:00,,,1251999708278673410,@3M,https://twitter.com/CynicalVision50/status/1251999708278673410,0,0,stonecold2050,https://twitter.com/stonecold2050/status/1251980443961790465
"any other citizen saying or doing what trump does would be ‘baker act(ed)”held for a minimum 72hr psychiatric-eval hold. he is a clear and present-danger & active threat to threehundredmillion here, not to mention himself. time to order comprehensive mental & physical evaluation.",2020-04-19 22:14:01+00:00,,,1251997506755592202,,https://twitter.com/CynicalVision50/status/1251997506755592202,0,2,glennkirschner2,https://twitter.com/glennkirschner2/status/1251636316648935426
"here‘s what happens when one believes the bible is a history book, fox news is real & trump is a “good president”. actually saying & believing crazy stuff like this is how gop scum interview for positions in trumps fourthreich. she also thinks medical science is just an “opinion”",2020-04-19 22:00:55+00:00,,,1251994212616359938,,https://twitter.com/CynicalVision50/status/1251994212616359938,0,0,realTuckFrumper,https://twitter.com/realTuckFrumper/status/1251930190772461568
"sick. mcconnell is being paid to decimate america, democracy & willingly violate his *oath of office. beyond unamerican. his overt complicity to help trump declare war on americans & the united states should mandate beeyocthmcconnels censure & removal well before november.",2020-04-19 21:49:28+00:00,,,1251991328763924482,,https://twitter.com/CynicalVision50/status/1251991328763924482,0,0,RepAdamSchiff,https://twitter.com/RepAdamSchiff/status/1251953011880058881
"euphemistic language pouring out of “mainstream” outlets is the beginning of normalizing the trump threat. additionally re-defining basic words like right, wrong and fact. observe reality & we see that an impeached, psychotic russian employee declared war on america & americans ",2020-04-19 13:47:32+00:00,,,1251870048802783232,,https://twitter.com/CynicalVision50/status/1251870048802783232,0,0,thenation,https://twitter.com/thenation/status/1251866390245658627
"starting in the 1950’s-to the present day, while america was becoming a world power and a positive example of a democracy, russia studied our every move. learning how to dismantle it all. focusing on racial & religous division-they now own a psychopath who hates america & helps ",2020-04-19 13:28:59+00:00,,,1251865380588568576,,https://twitter.com/CynicalVision50/status/1251865380588568576,0,0,RWPUSA,https://twitter.com/RWPUSA/status/1251859843801067520
"yo. we were waiting for you, but yes. trump is again fighting his war on americans and ‘spinning’ us all into a mass grave. he’s supporting the russian take over-still. other than that? you didn’t miss much.",2020-04-19 13:20:21+00:00,,,1251863204319371269,,https://twitter.com/CynicalVision50/status/1251863204319371269,1,0,TinaMorphis,https://twitter.com/TinaMorphis/status/1251859817116958720
"ok, i get the concept, but for those of us who enjoy some good, clean, amateur mycology-in the forest -fun, just how do folks find them? do foraging for & identifying these require a truffle hunting porcine? don’t really have room to keep a pig where can one go to find more info?",2020-04-19 13:16:19+00:00,,,1251862192699424771,,https://twitter.com/CynicalVision50/status/1251862192699424771,0,0,TheDailyShroom,https://twitter.com/TheDailyShroom/status/1251710518152364032
"i always respond to those by reminding them using painmedications long term, in parallel, it’s a lot like taking *plavix daily to “manage” a heart condition or insulin to manage diabetes. it’s standard & a safe thing to do. can one od on *plavix or insulin? sure. stigmakills ",2020-04-19 13:10:47+00:00,,#StigmaKills,1251860799263518721,,https://twitter.com/CynicalVision50/status/1251860799263518721,0,2,Shasta_Rayne,https://twitter.com/Shasta_Rayne/status/1251706662454472704
definitely russia.,2020-04-18 21:22:22+00:00,,,1251622120007839745,,https://twitter.com/CynicalVision50/status/1251622120007839745,0,0,learnpolsci,https://twitter.com/learnpolsci/status/1251615578772721665
here are two who should definitely *rot in prison.,2020-04-18 21:06:18+00:00,,,1251618077290217472,,https://twitter.com/CynicalVision50/status/1251618077290217472,0,0,TeaPainUSA,https://twitter.com/TeaPainUSA/status/1251564849630449666
phuqthenazis. we kicked their asses once. never forgive never forget,2020-04-18 21:04:31+00:00,,,1251617630563295237,,https://twitter.com/CynicalVision50/status/1251617630563295237,0,0,WritesMore,https://twitter.com/WritesMore/status/1251591265893912579
diamond and silk.,2020-04-18 20:51:22+00:00,,,1251614322020712451,,https://twitter.com/CynicalVision50/status/1251614322020712451,0,0,barondamm,https://twitter.com/barondamm/status/1251307093484687360
"superb advice. i personally act as if i’m immunocompromised and symptomatic. i’m not, but my ‘extra precautions’ may minimize my chances of infection. and i wear a mask to protect others...just in case.",2020-04-18 18:49:34+00:00,,,1251583668373635072,,https://twitter.com/CynicalVision50/status/1251583668373635072,0,0,pottymouthbaker,https://twitter.com/pottymouthbaker/status/1251582486641074176
my nephews the same age as your son. my brother is your age suffering crohn’s disease & offered ‘junior’ two options. 1-don’t go out with friends...or 2-wear a mask at all times in the house in addition to leaving his clothes outside & immediately showering upon return. he’s in.,2020-04-18 18:46:16+00:00,,,1251582838778015745,,https://twitter.com/CynicalVision50/status/1251582838778015745,0,0,YvetteJacqR,https://twitter.com/YvetteJacqR/status/1251286484113592320
"i’ve got a problem with math. testing 152 per 100,000 people= .00152%. that’s 1520 per million. 300million being america’s population. and if there were 100 million tests done? that would still be roughly 66% of folks untested. when considering an airborne pathogen? or ",2020-04-18 18:40:02+00:00,,,1251581269529579520,,https://twitter.com/CynicalVision50/status/1251581269529579520,1,1,JoyAnnReid,https://twitter.com/JoyAnnReid/status/1251486407106969600
here we see a typical magat-sycophant ron desantis. he’s proven it’s not enough to showcase stupidity with words. he’s providing a low iq-tutorial of why he’s got no biological kids. he can’t figure that out either. if stupid was a disease? he’d have succumbed a long time ago ,2020-04-18 18:19:06+00:00,,,1251576001164972034,,https://twitter.com/CynicalVision50/status/1251576001164972034,0,0,joe_viterbo,https://twitter.com/joe_viterbo/status/1251480510179803140
yeah. the kids are paying more for their hookiz. does anyone really think these loser “women” would do this free?,2020-04-18 18:07:45+00:00,,,1251573142935519232,,https://twitter.com/CynicalVision50/status/1251573142935519232,0,0,PoliticusSarah,https://twitter.com/PoliticusSarah/status/1251562103284150273
"and not a single police “officer” pretending to protect the general public. busy being passive, they’re a criminal protection racket. of course, they don’t protect anyone. except whitesupremacists, nazis, magats. “protect and serve”?..who do they *protect? trumptraitorterrorist",2020-04-18 17:59:56+00:00,,#TrumpTraitorTerrorist,1251571177388204032,,https://twitter.com/CynicalVision50/status/1251571177388204032,0,0,kenmartin73,https://twitter.com/kenmartin73/status/1251270788755398657
"even if there were 1,000 test per 100,000 people. it would be only 1%. but trump doesn’t want tests. having fewer than 100 tests per 100,000 is 1/100th of a% some people say this domesterrorism-others say mass murder. what say you? is trump committing terrorism-or-mass murder?",2020-04-18 17:16:30+00:00,,,1251560248281890823,,https://twitter.com/CynicalVision50/status/1251560248281890823,0,0,picardonhealth,https://twitter.com/picardonhealth/status/1251506052396449794
it’s repulsive magatmorons dare invoke the name of rosa parks. seems as if they ‘think’ they’re doing something positive. how long before they invoke rev. dr. king in their dangerous acts claiming they’re out there to ‘break the chains of oppresion’ ohhhyeah i have a dream.,2020-04-18 17:00:15+00:00,,,1251556156977418241,,https://twitter.com/CynicalVision50/status/1251556156977418241,0,0,Helens31Self,https://twitter.com/Helens31Self/status/1251550646442000385
"i find this intriguing. and basically true. in my own observation, that percentage increases as the size of the kitchen decreases. culminating at 100%-if one is both married and has a small kitchen. not even your life insurance policy would cover that scenario.",2020-04-18 16:55:20+00:00,,,1251554920328761347,,https://twitter.com/CynicalVision50/status/1251554920328761347,0,0,SteveMartinToGo,https://twitter.com/SteveMartinToGo/status/1251551464050188288
we now call this domestic terrorism. but socialmurder still accurately describes it.,2020-04-18 16:47:35+00:00,,,1251552970480726017,,https://twitter.com/CynicalVision50/status/1251552970480726017,0,0,DanielPCarroll2,https://twitter.com/DanielPCarroll2/status/1251537837217939457
let’s be honest. matt gaetz is a recidivist felon. 1-felony dui and no less than seventeen jailable other-related offenses. a true gop” leader”...in arrests.,2020-04-18 16:32:53+00:00,,,1251549272073535493,,https://twitter.com/CynicalVision50/status/1251549272073535493,0,0,windowjack1945,https://twitter.com/windowjack1945/status/1251497197906079744
no. and as always underwear is optional ,2020-04-18 16:28:05+00:00,,,1251548061572218880,,https://twitter.com/CynicalVision50/status/1251548061572218880,0,0,ItsSamG,https://twitter.com/ItsSamG/status/1251546607323144193
yes. and that’s the point. f. o and d...roger. trump will be joining you soon. hey. request solitary confinement. that should help.,2020-04-18 16:20:19+00:00,,,1251546109505409024,,https://twitter.com/CynicalVision50/status/1251546109505409024,0,0,realTuckFrumper,https://twitter.com/realTuckFrumper/status/1251499983179677697
no. trump must be forcibly removed on charges of domestic terrorism. our military knows they have a drug addled psychotic russian employee who is actively endangering americans and america ~,2020-04-18 01:51:42+00:00,,,1251327515760754688,,https://twitter.com/CynicalVision50/status/1251327515760754688,0,2,PamKeithFL,https://twitter.com/PamKeithFL/status/1251199532475527169
and florida is blocking the covid-19 death toll in nursing homes.,2020-04-18 01:36:41+00:00,,,1251323734079700998,,https://twitter.com/CynicalVision50/status/1251323734079700998,0,4,jialynnyang,https://twitter.com/jialynnyang/status/1251227602053890050
wrestled to the ground and handcuffed by some sane military personnel who know the cic is issuing armed-terrorist threats. then suspend his tweeter account.,2020-04-18 01:30:29+00:00,,,1251322175874895878,,https://twitter.com/CynicalVision50/status/1251322175874895878,0,0,AmyAThatcher,https://twitter.com/AmyAThatcher/status/1251218140983328768
"if you’re searching for words, try these; premeditated mass murder. genocide....but the most accurate? domestic terrorism.",2020-04-17 23:49:07+00:00,,,1251296664574443521,,https://twitter.com/CynicalVision50/status/1251296664574443521,0,0,funder,https://twitter.com/funder/status/1251287741117145093
yeah. nazis have a helluva sense of *irony.,2020-04-17 22:26:55+00:00,,,1251275978409680897,,https://twitter.com/CynicalVision50/status/1251275978409680897,0,0,4everNeverTrump,https://twitter.com/4everNeverTrump/status/1251266347134103552
no leader. a terrorist would.,2020-04-17 22:22:15+00:00,,,1251274803782258688,,https://twitter.com/CynicalVision50/status/1251274803782258688,0,1,RickSmithShow,https://twitter.com/RickSmithShow/status/1251250506787434498
"trump redefines domestic terrorism. face it. he did not *react poorly. he acted on purpose. declaring war on americans. again. psychotic? of course. only his forced removal will help. the cia is used to toppling fascist dictators. where are they, cheyenne mountain? scorchedearth",2020-04-17 21:53:14+00:00,,#ScorchedEarth,1251267502044258304,,https://twitter.com/CynicalVision50/status/1251267502044258304,0,0,GovCTW,https://twitter.com/GovCTW/status/1251222834808000514
"trump supports and encourages violence. “they’re nazis, but they like me” and who will charge trumpregime for domestic terrorist acts?",2020-04-17 18:40:21+00:00,,,1251218959984201728,,https://twitter.com/CynicalVision50/status/1251218959984201728,1,0,Free_Media_Hub,https://twitter.com/Free_Media_Hub/status/1251172678939095043
"great question, john. i think of it this way; if today-100 million tests were available, it would still not be enough. if 100 million face masks or ventilations we’re available? it would, at best, be nowhere near enough. so, maybe 5,000? it’s not incompetence. it’s declaring war.",2020-04-17 14:47:33+00:00,,,1251160375942234113,,https://twitter.com/CynicalVision50/status/1251160375942234113,0,0,JohnFugelsang,https://twitter.com/JohnFugelsang/status/1251130871651938305
"so, tell me which “churches” are handing out hits of acid as communion wafers? her cult sounds like fun. bathing in the blood do americans. and supporting trump, a domestic terrorist? yeah. you suck. we’re sure your *g-d would be pleased.",2020-04-17 14:31:34+00:00,,,1251156354112172040,,https://twitter.com/CynicalVision50/status/1251156354112172040,0,0,realTuckFrumper,https://twitter.com/realTuckFrumper/status/1250912241207001089
"sorry, cohen committed several capital crimes. besides crimes against america and essentially treason-willingly. phuq’em. let him rot in prison.",2020-04-17 13:59:32+00:00,,,1251148292450217986,,https://twitter.com/CynicalVision50/status/1251148292450217986,0,0,learnpolsci,https://twitter.com/learnpolsci/status/1251143049129766912
"i never knew kenya had republicans. boy, did sonko screw up. he should have proposed including some heroin. far fewer people die from it than die of alcohol use/abuse. both are deadly, but not as deadly as stupidity.",2020-04-17 13:08:24+00:00,,,1251135421754605574,,https://twitter.com/CynicalVision50/status/1251135421754605574,0,0,CNN,https://twitter.com/CNN/status/1251128311255838720
"brad? you’re a dick. there are no areas without “cases”. being a traitor pays well, huh?",2020-04-17 13:02:57+00:00,,,1251134051408318472,,https://twitter.com/CynicalVision50/status/1251134051408318472,0,0,parscale,https://twitter.com/parscale/status/1250960450210185218
phiqoff “dr” phil...ya gotdam nazi.,2020-04-17 12:42:00+00:00,,,1251128780506181632,,https://twitter.com/CynicalVision50/status/1251128780506181632,0,0,MontyBoa99,https://twitter.com/MontyBoa99/status/1250998886983970819
the founding fathers would have roped mcconnell for treason. it would have been a swingin ‘time at the tree.,2020-04-17 12:39:46+00:00,,,1251128218872156166,,https://twitter.com/CynicalVision50/status/1251128218872156166,0,0,raggapegs,https://twitter.com/raggapegs/status/1251124363207815171
america’s homegrown terrorists. uneducated angry white males. thanx fbi. armed black males? you know poloce would have “dispersed” them. the kkk needs to be eradicated.,2020-04-17 12:38:08+00:00,,,1251127805502464000,,https://twitter.com/CynicalVision50/status/1251127805502464000,0,0,Forbes,https://twitter.com/Forbes/status/1251123129465868288
make no mistake. the “trump family business” is criminal fraud. the core competency of trumporg is money laundering being treasonous americans owned by russia he fights for his life every day. the minute he steps outta line? whacked by any one of vlads buddies following him ,2020-04-17 12:31:39+00:00,,,1251126173054242816,,https://twitter.com/CynicalVision50/status/1251126173054242816,0,0,raggapegs,https://twitter.com/raggapegs/status/1251124438348771329
this is insanely hysterical. the “crazy edwina” of the pants game.,2020-04-17 12:14:26+00:00,,,1251121842699599875,,https://twitter.com/CynicalVision50/status/1251121842699599875,0,1,JoshMankiewicz,https://twitter.com/JoshMankiewicz/status/1250973838940049409
nonordinary. my new favorite word.,2020-04-16 22:16:02+00:00,,,1250910851369926658,,https://twitter.com/CynicalVision50/status/1250910851369926658,0,0,ShroomStreet,https://twitter.com/ShroomStreet/status/1250910083078184960
"and how *best to dry them before storing? i realize heats not great, but aside from a food dehydrator, how’s that done?",2020-04-16 14:44:54+00:00,,,1250797318225506304,,https://twitter.com/CynicalVision50/status/1250797318225506304,0,0,TheDailyShroom,https://twitter.com/TheDailyShroom/status/1250793921497780224
"i’m sorry, what? 200 alcohol-prep pads ‘normally’ cost under $5.00.",2020-04-16 12:59:02+00:00,,,1250770676572659714,,https://twitter.com/CynicalVision50/status/1250770676572659714,0,0,BradReason,https://twitter.com/BradReason/status/1250769542990696450
russian owned criminal terrorists. a single word? traitors.,2020-04-16 12:45:57+00:00,,,1250767387328159745,,https://twitter.com/CynicalVision50/status/1250767387328159745,0,0,Rad99004,https://twitter.com/Rad99004/status/1250570936769626112
we have a career criminal committing this same crimes for which he was impeached. and he will not cease until removal. now. issue arrest orders. trump must go.,2020-04-16 12:42:51+00:00,,,1250766604616503296,,https://twitter.com/CynicalVision50/status/1250766604616503296,0,0,MollyJongFast,https://twitter.com/MollyJongFast/status/1250556507822993409
"yes. as nobody has a built in immunity to it, it must first run its course, devestating as this is with no medical science. after an abatement period, folks may get careless or may have incubating during wave-1. without aggressive work in biochemistry & pharmacology, wave-2. ",2020-04-16 12:08:28+00:00,,,1250757953558384640,,https://twitter.com/CynicalVision50/status/1250757953558384640,0,0,sdr_medco,https://twitter.com/sdr_medco/status/1250549086970880004
"well, if your the crafty sort, one bra=two masks. technically so you’ve got that goin’ for you.",2020-04-16 00:42:57+00:00,,,1250585437816655878,,https://twitter.com/CynicalVision50/status/1250585437816655878,0,0,minkpinkustink,https://twitter.com/minkpinkustink/status/1249137555888640000
no. some other countries have outright banned fox for precisely this reason. a total ban on fox needs to happen here as well. same with oan and russiatv. first ammendment doesn’t cover dangerous lies and propaganda. sue them. murdoch profits from america’s demise. trump too.,2020-04-16 00:35:52+00:00,,,1250583652062371842,,https://twitter.com/CynicalVision50/status/1250583652062371842,0,0,thehill,https://twitter.com/thehill/status/1250580946472099840
"beyond treason. his ties to russia go back decades. there’s nothing he wouldn’t do for them. including mass murder, so yeah. g’head rearrange the deck chairs. censure, block and remove trump from any further actions.",2020-04-16 00:26:18+00:00,,,1250581248201961472,,https://twitter.com/CynicalVision50/status/1250581248201961472,0,0,AshaRangappa_,https://twitter.com/AshaRangappa_/status/1250561560302555139
and will they be charged interest for this loan? it wouldn’t be a trumpdisaster without interest & more fraud scam. we never studied “terrorist economic theory” in school. vulture capitalism comes close. but not when federally mandated.,2020-04-15 22:04:19+00:00,,,1250545513734250496,,https://twitter.com/CynicalVision50/status/1250545513734250496,0,0,realTuckFrumper,https://twitter.com/realTuckFrumper/status/1250534118363824128
"wild guess; you guys didn’t kiss dicklesshitlerdonnys ass, right? see, the wwe controls the sba. texas must obviously have more wrestling than california & requires more loans...or something. either option is sickening. dangerous if this plays out.",2020-04-15 21:59:42+00:00,,,1250544354042798082,,https://twitter.com/CynicalVision50/status/1250544354042798082,0,0,RepSpeier,https://twitter.com/RepSpeier/status/1250494075721191425
"the impeached psychoterrorist continues to kill americans. the only urgent move needed is to censure,remove & reimpeach. remove the cause of the problem. we’ll work on medical science once he’s out of america’s way.",2020-04-15 21:38:37+00:00,,,1250539045861625856,,https://twitter.com/CynicalVision50/status/1250539045861625856,0,0,nytopinion,https://twitter.com/nytopinion/status/1250532063989596168
"wait. investigation of the ‘origin’ of mueller’s damning evidence? here, maybe this will help; because ample evidence existed proving trumps ties to russia subverted an american election. because trump is, was and continues to be a criminal. there. case closed. imprisonbarr ",2020-04-15 21:34:34+00:00,,,1250538029409800199,,https://twitter.com/CynicalVision50/status/1250538029409800199,0,0,ErinBanco,https://twitter.com/ErinBanco/status/1250227983283077121
the idiocracy is confederate. modern day terrorists for trump nice they blocked ems vehicles. thoughtful. the fact these protesters cheering the demise of everyones health are not arrested but people protesting against the fatfascist are?,2020-04-15 21:20:30+00:00,,,1250534489585004557,,https://twitter.com/CynicalVision50/status/1250534489585004557,0,0,fccmal,https://twitter.com/fccmal/status/1250502144853147648
no,2020-04-15 19:20:08+00:00,,,1250504198464122887,,https://twitter.com/CynicalVision50/status/1250504198464122887,0,0,MadamZolar,https://twitter.com/MadamZolar/status/1250207221587337219
nazis.,2020-04-15 16:58:53+00:00,,,1250468649183391744,,https://twitter.com/CynicalVision50/status/1250468649183391744,0,0,KassandraSeven,https://twitter.com/KassandraSeven/status/1250466460977283074
"intentional, dangerous & illegal. when these actions are taken against americans by trump, it’s terrorism. premeditated mass murder. genocide. so, yeah-“dangerous”",2020-04-15 15:53:46+00:00,,,1250452264822755328,,https://twitter.com/CynicalVision50/status/1250452264822755328,0,0,kyledcheney,https://twitter.com/kyledcheney/status/1250449218457735172
"a relative who lives in ny and filed taxes last year got hers. and that’s great. but ssdi recipients are stuck. these folks don’t count, i realize a fixed income while the cost of everything doubles isn’t a “pressing issue” for the psychoterrorist. anyone on ssdi get a dime?",2020-04-15 15:51:39+00:00,,,1250451730535497729,,https://twitter.com/CynicalVision50/status/1250451730535497729,0,0,AngryPaws2,https://twitter.com/AngryPaws2/status/1250448310483255297
traitor. psychopath. criminal frud. russian employee. domestic terrorist. call this what it is. if another country did this? america would declare war.,2020-04-15 13:40:59+00:00,,,1250418848572018688,,https://twitter.com/CynicalVision50/status/1250418848572018688,0,0,StefSimanowitz,https://twitter.com/StefSimanowitz/status/1247294204742598656
terrible? no. it’s your patriotic duty. hoping the terrorist who declared war on americans drops dead? yeah. then a few hundredmillion of us are “terrible people”,2020-04-15 12:34:59+00:00,,,1250402236771024899,,https://twitter.com/CynicalVision50/status/1250402236771024899,0,0,jamnspoon2,https://twitter.com/jamnspoon2/status/1250217937673293833
"someone once said all use is medicinal. i didn’t think so when first hearing it but now i see why. all use is beneficial. having tried’ it since 1980, i cannot claim a ‘recreational’ benefit. aside from recreation. semantics? perhaps, but i’d use *beneficial over medical any day.",2020-04-14 23:25:20+00:00,,,1250203516913750021,,https://twitter.com/CynicalVision50/status/1250203516913750021,0,0,Peter_Grinspoon,https://twitter.com/Peter_Grinspoon/status/1250201017733570561
the russians also have an entire floor there as do the saudis & other frenemies. but $2mil a month? wow. do they get cable?,2020-04-14 23:17:08+00:00,,,1250201453442076674,,https://twitter.com/CynicalVision50/status/1250201453442076674,0,0,bobcesca_go,https://twitter.com/bobcesca_go/status/1250199644820340736
you first.,2020-04-14 23:05:10+00:00,,,1250198441436856320,,https://twitter.com/CynicalVision50/status/1250198441436856320,0,0,mog7546,https://twitter.com/mog7546/status/1250145097234210817
trump has been buying testimonies for decades folks. what shocks and repulses me most perhaps is who’s selling.,2020-04-14 23:02:23+00:00,,,1250197741839552512,,https://twitter.com/CynicalVision50/status/1250197741839552512,0,0,NeonNettle,https://twitter.com/NeonNettle/status/1250193247038779399
"t***p purposely cutting the legs out from under vital agencies, organizations and programs to help americans in crisis-or things that work in general, are acts of terrorism. criminal behavior again. his new world order doesn’t have any of us in it. barr is seeing to it.",2020-04-14 22:56:05+00:00,,,1250196156375871488,,https://twitter.com/CynicalVision50/status/1250196156375871488,0,0,HawaiiDelilah,https://twitter.com/HawaiiDelilah/status/1250190890234073088
don’t fall for losing the stillness of your being to the noises of your mind. don’t be distracted. nourish the core of your being. your humanity.,2020-04-14 21:07:24+00:00,,,1250168805306875905,,https://twitter.com/CynicalVision50/status/1250168805306875905,0,0,wendchymes,https://twitter.com/wendchymes/status/1250164696361177091
