text,date,geo,hashtags,tweet_id,mentions,permalink,replies,retweets,replies_to,mentioned_urls
"it would appear that anti abortion and anti-women’s autonomy folks should accurately be called the “right to death” movement. beyond those already dead, add the children locked in cages they keep not caring about. massmurderbymandate trumpsgenocide",2020-07-06 01:14:48+00:00,,#MassMurderByMandate #TrumpsGenocide,1279946870362722312,,https://twitter.com/CynicalVision50/status/1279946870362722312,0,0,SlavicLady88,https://twitter.com/SlavicLady88/status/1279851902432350208
truth? trump committed treason. he is a traitor owned by russia. he betrayed america’s military. our country is weaker for it. the founding fathers would have tried trump for treason. full stop.,2020-07-05 17:22:20+00:00,,,1279827968496480257,,https://twitter.com/CynicalVision50/status/1279827968496480257,0,0,dierdrelewis,https://twitter.com/dierdrelewis/status/1279821391630602241
what a demented use of the “military” after treason? no biggie. this pathetic scene looks like the mengele family reunion.,2020-07-05 16:26:52+00:00,,,1279814010817445891,,https://twitter.com/CynicalVision50/status/1279814010817445891,0,0,girlsreallyrule,https://twitter.com/girlsreallyrule/status/1279770732067684356
"it’s become more clear the gop has adopted the “if one falls, we all fall” defense when it comes to covering for treason. republicans, russia and traitor have all become synonymous. as has trump become synonymous with treason. many of us who swore an oath to serve detest traitors",2020-07-05 16:14:52+00:00,,,1279810988452306944,,https://twitter.com/CynicalVision50/status/1279810988452306944,0,0,DavidCornDC,https://twitter.com/DavidCornDC/status/1279776714185420804
"never forget that in addition to being a rapist, racist, pedophile, russian employee, a psychopath nazi and incest master... trump committed treason.",2020-07-05 14:26:48+00:00,,,1279783795001110535,,https://twitter.com/CynicalVision50/status/1279783795001110535,0,0,Eleven_Films,https://twitter.com/Eleven_Films/status/1279551007924486145
why do you think kardashian’s met with trump?,2020-07-05 14:23:10+00:00,,,1279782881129369601,,https://twitter.com/CynicalVision50/status/1279782881129369601,0,0,joshtpm,https://twitter.com/joshtpm/status/1279609485062012928
dude. you have gotta cut back on your lsd intake. people are starting to notice.,2020-07-05 14:21:18+00:00,,,1279782411816050688,,https://twitter.com/CynicalVision50/status/1279782411816050688,0,0,kanyewest,https://twitter.com/kanyewest/status/1279575273365594112
"well, any sleazy salesman will say if you have to ask the cost, it’s too much” besides, americans already own them. our taxes paid for’em. they’re only a couple billion each but trump “needs” them",2020-07-05 14:19:56+00:00,,,1279782065177853952,,https://twitter.com/CynicalVision50/status/1279782065177853952,0,0,sarahcpr,https://twitter.com/sarahcpr/status/1279562549365702657
committed treason. full stop america.,2020-07-05 14:17:00+00:00,,,1279781326556672000,,https://twitter.com/CynicalVision50/status/1279781326556672000,0,0,ProjectLincoln,https://twitter.com/ProjectLincoln/status/1279763408905256960
jared did not ‘half-ass’ anything. he ‘whole-assed’ it. he’s an asswhole,2020-07-05 14:15:49+00:00,,,1279781030052990978,,https://twitter.com/CynicalVision50/status/1279781030052990978,0,0,CREWcrew,https://twitter.com/CREWcrew/status/1279641185750061056
waddaya kidding me? jodi ernst is sara palin-level batshit crazy. she supports russia. anyone supporting trump supports eussia. get it straight.,2020-07-05 14:14:11+00:00,,,1279780620546310144,,https://twitter.com/CynicalVision50/status/1279780620546310144,0,0,mkraju,https://twitter.com/mkraju/status/1279771163502280706
trump committed treason. whaddaya expect? he is owned by russia. his interest is not americans.,2020-07-05 13:20:06+00:00,,,1279767010495397890,,https://twitter.com/CynicalVision50/status/1279767010495397890,0,0,RawStory,https://twitter.com/RawStory/status/1279507127518801920
america knows precisely what’s in ivankas nda.,2020-07-05 13:18:37+00:00,,,1279766633603575809,,https://twitter.com/CynicalVision50/status/1279766633603575809,0,0,RWPUSA,https://twitter.com/RWPUSA/status/1279621457073635333
who knows about “law” more than criminals?,2020-07-05 13:17:32+00:00,,,1279766362789945344,,https://twitter.com/CynicalVision50/status/1279766362789945344,0,0,OMGno2trump,https://twitter.com/OMGno2trump/status/1279557192195203072
“...and we have built our entire administration on this”,2020-07-05 13:16:37+00:00,,,1279766133227356160,,https://twitter.com/CynicalVision50/status/1279766133227356160,0,0,thehill,https://twitter.com/thehill/status/1279758174770380802
"and in a related story, susan collins office reports today she may be “miffed”",2020-07-05 13:15:41+00:00,,,1279765896635076609,,https://twitter.com/CynicalVision50/status/1279765896635076609,0,0,Libertea2012,https://twitter.com/Libertea2012/status/1279758180776423425
america is living orwell’s nightmare.,2020-07-05 13:10:34+00:00,,,1279764608304197637,,https://twitter.com/CynicalVision50/status/1279764608304197637,0,0,OMAHAGEMGIRL,https://twitter.com/OMAHAGEMGIRL/status/1279758580116148224
"awww, that’s mean...and i love it ",2020-07-05 13:00:10+00:00,,,1279761993847767041,,https://twitter.com/CynicalVision50/status/1279761993847767041,0,0,AngryBlackLady,https://twitter.com/AngryBlackLady/status/1279607515508961282
"trump must be immediately re impeached. and this time, held accountable for treason. simultaneously impeach ag barr-imprisonment. these are america’s biggest threats. speaker of the house can mandate an independent neuropsychiatric eval to determine trumps“fitness to hold office”",2020-07-05 12:58:46+00:00,,,1279761640641171457,,https://twitter.com/CynicalVision50/status/1279761640641171457,0,0,StephenGlahn,https://twitter.com/StephenGlahn/status/1279758698798252032
wow. amazing data. did they actually do a *study or something? anyone who’s ever been to a bar on this planet knows this.,2020-07-05 12:54:29+00:00,,,1279760563220946945,,https://twitter.com/CynicalVision50/status/1279760563220946945,0,0,realTuckFrumper,https://twitter.com/realTuckFrumper/status/1279758559719436289
demented psychopath and traitor. trump committed treason.,2020-07-05 12:48:02+00:00,,,1279758938897031168,,https://twitter.com/CynicalVision50/status/1279758938897031168,0,0,VicBergerIV,https://twitter.com/VicBergerIV/status/1279593014277505024
hold trump accountable for treason. mandate a neuropsychiatric exam while he’s in pre-trial detention. unfittobepresident,2020-07-05 12:44:45+00:00,,#UnfitToBePresident,1279758110752677889,,https://twitter.com/CynicalVision50/status/1279758110752677889,0,0,VicBergerIV,https://twitter.com/VicBergerIV/status/1279593014277505024
melanie’s employee contract doesn’t include being here or “looking like she gives a shit” in it. and she wants out.,2020-07-05 12:34:29+00:00,,,1279755530525949954,,https://twitter.com/CynicalVision50/status/1279755530525949954,0,0,realTuckFrumper,https://twitter.com/realTuckFrumper/status/1279606039806119936
"aww phuq these two. couldn’t trump buy any smarter black people? he got kanye and ben, not a good look. racist pos. these two morons are an affront to women, black people everywhere and humanity itself.",2020-07-05 12:30:59+00:00,,,1279754647629111296,,https://twitter.com/CynicalVision50/status/1279754647629111296,0,0,ratemyskyperoom,https://twitter.com/ratemyskyperoom/status/1279566256903819264
"these morons came out to support an impeached nazi & traitor. full stop. trump killed over 150,00 americans on purpose, works for russia and has decimated america’s military making us weaker. he committed treason.",2020-07-05 12:21:01+00:00,,,1279752139015884807,,https://twitter.com/CynicalVision50/status/1279752139015884807,0,0,Amy_Siskind,https://twitter.com/Amy_Siskind/status/1279608944122646530
"nixon’s ag did prison time, didn’t he?",2020-07-05 11:49:05+00:00,,,1279744102305759234,,https://twitter.com/CynicalVision50/status/1279744102305759234,0,0,JoyceWhiteVance,https://twitter.com/JoyceWhiteVance/status/1279735802679959552
this could literally be a scene from the movie “idiocracy”,2020-07-05 11:48:13+00:00,,,1279743887523950592,,https://twitter.com/CynicalVision50/status/1279743887523950592,0,0,Meg4Congress,https://twitter.com/Meg4Congress/status/1279546752765497344
many of us are running from the *president. he committed treason.,2020-07-05 11:44:55+00:00,,,1279743055688499201,,https://twitter.com/CynicalVision50/status/1279743055688499201,0,0,LaurenWern,https://twitter.com/LaurenWern/status/1279660774131208192
republicans approve of treason. they are securing their places on the reichstag in trumps america. traitors to their offices and their country. racists cut from the cloth of “confederate roots”(fu mcconnell) pedophiles. rapists. nazis. fascists. criminals. this today’s gop russia,2020-07-05 11:42:51+00:00,,,1279742536416931840,,https://twitter.com/CynicalVision50/status/1279742536416931840,0,2,Weinsteinlaw,https://twitter.com/Weinsteinlaw/status/1279611673582632961
"trumps ‘handlers’ really should consider hiring a vet to stand out of camera-shot with a device holding a thorazine tipped dart. there doesn’t seem to be any other way to stop his meltdown. and by vet, i mean veteranarian. he hasn’t the credibility to even say vietnam. traitor.",2020-07-05 11:36:56+00:00,,,1279741045820010498,,https://twitter.com/CynicalVision50/status/1279741045820010498,0,0,tribelaw,https://twitter.com/tribelaw/status/1279728530960584707
american heroes will once again defeat the nazis by kicking your crazy ass to the curb. traitor.,2020-07-05 01:08:21+00:00,,,1279582858135379968,,https://twitter.com/CynicalVision50/status/1279582858135379968,0,0,Kokomothegreat,https://twitter.com/Kokomothegreat/status/1279552798896594944
"you mean beside his cognitive decline, overwhelming dementia or the fact he’s whacked out of his head on drugs? which one?",2020-07-05 01:03:51+00:00,,,1279581723882409984,,https://twitter.com/CynicalVision50/status/1279581723882409984,0,0,ProjectLincoln,https://twitter.com/ProjectLincoln/status/1279570698026078208
"trump is an actual nazi. employs many. his gop locks children in cages. trump has killed 150,000 americans so far. he’s deputized the military to gas & kill americans. his hate filled rhetoric is goebbels incarnate. he committed treason. hold trump accountable for genocide too.",2020-07-05 00:58:44+00:00,,,1279580435794845696,,https://twitter.com/CynicalVision50/status/1279580435794845696,0,1,realTuckFrumper,https://twitter.com/realTuckFrumper/status/1279563188057636864
and make no mistake desantis is killing citizens for trump-who committed treason to help russia. desantis therefore works to help russia ~,2020-07-04 21:38:56+00:00,,,1279530158559506432,,https://twitter.com/CynicalVision50/status/1279530158559506432,0,0,funder,https://twitter.com/funder/status/1279519424551301122
drug addled psychopath. committing treason because russia paid him.,2020-07-04 20:39:19+00:00,,,1279515154204557312,,https://twitter.com/CynicalVision50/status/1279515154204557312,0,0,ImpeachmentHour,https://twitter.com/ImpeachmentHour/status/1279476946989187072
"let’s put this in perspective. we see here the worst of america. supporters of an impeached traitor who committed treason. a psychopath who hates america and who works for russia. a traitor who has killed over 150,000 americans. violating both the constitution & oath of office.",2020-07-04 20:12:51+00:00,,,1279508493796597760,,https://twitter.com/CynicalVision50/status/1279508493796597760,0,0,davidcicilline,https://twitter.com/davidcicilline/status/1279246402565165056
“jabba the putz” putin’s *ball-boy.,2020-07-04 19:39:56+00:00,,,1279500207516987393,,https://twitter.com/CynicalVision50/status/1279500207516987393,0,0,JayLionel7,https://twitter.com/JayLionel7/status/1279435834756866053
trump committed treason. he must be deported. locked in a cage.,2020-07-04 19:36:46+00:00,,,1279499412868403202,,https://twitter.com/CynicalVision50/status/1279499412868403202,0,0,crampell,https://twitter.com/crampell/status/1279411886539374594
a demented psychopath.,2020-07-04 19:33:35+00:00,,,1279498611441700865,,https://twitter.com/CynicalVision50/status/1279498611441700865,0,0,JJohnsonLaw,https://twitter.com/JJohnsonLaw/status/1279395393617477632
the impeached demented psychopath who committed treason.,2020-07-04 19:15:36+00:00,,,1279494084747505670,,https://twitter.com/CynicalVision50/status/1279494084747505670,0,1,AynRandPaulRyan,https://twitter.com/AynRandPaulRyan/status/891308786010341377
here are the hookersfortrump.,2020-07-04 18:43:51+00:00,,,1279486093294014464,,https://twitter.com/CynicalVision50/status/1279486093294014464,0,0,AdamParkhomenko,https://twitter.com/AdamParkhomenko/status/1279243648639602688
drug dealer. but there’s no health insurance or 401k.,2020-07-04 15:10:16+00:00,,,1279432346207485952,,https://twitter.com/CynicalVision50/status/1279432346207485952,0,0,country_gigi,https://twitter.com/country_gigi/status/1278776004677382144
"trump committed treason on behalf of russia & sold us out. the only thing left before martial law is to solidify us-vs-them. the final division. and we’ve seen, police protect them, violent against us. being as violent and unamerican as possible knowing trump “has their backs” ",2020-07-04 15:09:07+00:00,,,1279432055194030085,,https://twitter.com/CynicalVision50/status/1279432055194030085,0,0,GetWisdomDude,https://twitter.com/GetWisdomDude/status/1279429952299991041
on what planet does a know nothing hookers opinion matter. if she’s being paid to be with jr? one of the hookersfortrump. i don’t see any real woman wanting “some of that trump money” what’s her background...syphilis?,2020-07-04 15:00:03+00:00,,#HookersForTrump,1279429774872645632,,https://twitter.com/CynicalVision50/status/1279429774872645632,0,0,MollyJongFast,https://twitter.com/MollyJongFast/status/1279412310541586432
"dear , please pay attention unless an immediate motion is made to impeach barr and reimpeach trump as well as remove them now, nothing else will matter don’t be mad, we know you’ve got it rough. hold trump accountable for treason we’ll never see november otherwise ",2020-07-04 12:53:55+00:00,,,1279398031419416576,@SpeakerPelosi,https://twitter.com/CynicalVision50/status/1279398031419416576,0,0,TeamPelosi,https://twitter.com/TeamPelosi/status/1279158142945964033
"trump committed treason. literally. he’s been working for russia since before day 1. so has randpaul, giuliani, mcconnell and 8 gop criminals.",2020-07-04 12:47:48+00:00,,,1279396494085423107,,https://twitter.com/CynicalVision50/status/1279396494085423107,0,3,mog7546,https://twitter.com/mog7546/status/1279391527459008513
"it’s just my opinion, and i’m a smartass, but i think fox & their treasonous ilk are trying to create a new *brand of reality show. “armageddon porn” they decided “violence porn” made cops look bad. chaos and dividing america is their ‘core business’. all *media?~6 companies ",2020-07-04 12:44:40+00:00,,,1279395702767071232,,https://twitter.com/CynicalVision50/status/1279395702767071232,0,0,Okie_Resister,https://twitter.com/Okie_Resister/status/1279178070897889282
"the ubiquity of fentanil, sufentanil, carfentanil & their analogs dominate street drugs. the suffering patients who’ve been ‘discharged’ from their dr’s care face a stark choice. die of heartattack or fentanil od. thanx to dea & prop there was never a “prescription opioid crisis”",2020-07-04 12:32:36+00:00,,,1279392667575730176,,https://twitter.com/CynicalVision50/status/1279392667575730176,0,0,Pharmaciststeve,https://twitter.com/Pharmaciststeve/status/1279197651720945664
otherwise known as the “pedophile playas ball”,2020-07-04 12:21:17+00:00,,,1279389819777495040,,https://twitter.com/CynicalVision50/status/1279389819777495040,1,6,CitizensFedUp,https://twitter.com/CitizensFedUp/status/1279387935897464832
"well, the people around, & that surround, him are droppin’ like flies. with this trump hoaxvirus, many people feel “just fine” until they faceplant. his cognitive decline is increasing as is his dementia.",2020-07-04 12:17:36+00:00,,,1279388893717151745,,https://twitter.com/CynicalVision50/status/1279388893717151745,0,0,SteveSchmidtSES,https://twitter.com/SteveSchmidtSES/status/1279251628735041537
" are traitors. it is clear to see who they work for. they stand, arm in arm, united against america. for cash. they’ll even happily cover for trump committing treason.",2020-07-04 00:14:38+00:00,,,1279206953760231432,@SenateGOP,https://twitter.com/CynicalVision50/status/1279206953760231432,0,0,Alyssa_Milano,https://twitter.com/Alyssa_Milano/status/1279186579253231621
"when was last time a sheriff advocated for an irresponsible public health threat, endorsing his officers to rely, instead, on ‘freedom of choice’? it’s reprehensible to think spreading a fatal disease is a “choice” a sheriff is held accountable to not endanger citizens health.",2020-07-04 00:07:02+00:00,,,1279205037965705219,,https://twitter.com/CynicalVision50/status/1279205037965705219,0,0,ResisterSis20,https://twitter.com/ResisterSis20/status/1279157572474454017
"this south dakota “sheriff” is an asshole magat. “freedom of choice?” from what, to contract a deadly virus? wattadickhead this move identifies *sheriff idiot as a trump supporter and whitesupremacist. anyone allowing dicklesshitlerdonny? who disputes science? russia. trump ",2020-07-03 23:44:17+00:00,,,1279199314817036288,,https://twitter.com/CynicalVision50/status/1279199314817036288,0,0,ResisterSis20,https://twitter.com/ResisterSis20/status/1279157572474454017
"trump was impeached then committed treason and fraud. he is the most virulent threat america has ever faced. we call on our military to remove mr trump immediately and use the ucmj to hold him accountable for treason. as a treasonous cic, military intervention is required now ",2020-07-03 23:37:26+00:00,,,1279197588974120962,,https://twitter.com/CynicalVision50/status/1279197588974120962,0,0,politvidchannel,https://twitter.com/politvidchannel/status/1279018196587048962
the face of treason. trump.,2020-07-03 21:13:07+00:00,,,1279161273582747650,,https://twitter.com/CynicalVision50/status/1279161273582747650,0,0,katgal2,https://twitter.com/katgal2/status/1279122826344226826
"it’s called treasonous, not ‘complacent’",2020-07-03 21:00:42+00:00,,,1279158145139585026,,https://twitter.com/CynicalVision50/status/1279158145139585026,0,0,realTuckFrumper,https://twitter.com/realTuckFrumper/status/1279126804905824258
allow me to translate; “when biden wins i will skip to russia” let’s just save alotta time. convict and remove trump for treason now. the highest of all high crimes.,2020-07-03 20:15:17+00:00,,,1279146716550348802,,https://twitter.com/CynicalVision50/status/1279146716550348802,0,0,VABVOX,https://twitter.com/VABVOX/status/1279139774104842241
donald trump committed treason. he works for russia.,2020-07-03 19:50:25+00:00,,,1279140460309745666,,https://twitter.com/CynicalVision50/status/1279140460309745666,0,0,co_rapunzel4,https://twitter.com/co_rapunzel4/status/1279137773501505537
trump supports russia putting a bounty on killing us soldiers. he committed treason as well as being a traitor. we already know he should be taken out of office now. trump must be held accountable for treason.,2020-07-03 19:46:16+00:00,,,1279139416200675331,,https://twitter.com/CynicalVision50/status/1279139416200675331,0,0,ewarren,https://twitter.com/ewarren/status/1279114798295388162
he only went *golfing because he heard there was a bunker on the 6th green.,2020-07-03 17:17:08+00:00,,,1279101883643318272,,https://twitter.com/CynicalVision50/status/1279101883643318272,0,0,funder,https://twitter.com/funder/status/1279087373255671809
massmurderbymandate from the impeached traitor guilty of treason. it’s legal now,2020-07-03 15:23:58+00:00,,#MassMurderByMandate,1279073404163940352,,https://twitter.com/CynicalVision50/status/1279073404163940352,0,0,SafetyPinDaily,https://twitter.com/SafetyPinDaily/status/1279051362781855744
sounds a lot like “a night in jonestown” to me. russia smiles. donny gets to live another day. if anyone is really wondering what *worries trump? russia 86’ing him the minute he steps outta line. protecting their investment. more kfb/gru agents surround him than ‘secret ‘service.,2020-07-03 13:03:48+00:00,,,1279038129371074563,,https://twitter.com/CynicalVision50/status/1279038129371074563,0,0,NinjaEconomics,https://twitter.com/NinjaEconomics/status/1279022076645593088
that depends how one defines *suicide. and treason. if you mean russia’s overt attempt to *dissapear anyone who would possibly pose a threat to their investment in the “goldenmoron” and have him held accountable for treason? no. it’s not suicide. it’s gop *dissent control.,2020-07-03 12:56:49+00:00,,,1279036374377795585,,https://twitter.com/CynicalVision50/status/1279036374377795585,0,0,sdr_medco,https://twitter.com/sdr_medco/status/1278824737507094533
"intriguing question. seems they’re really into having us “try it” almost disregarding tofu is about as tasty as jell-o. thanxnothanx...i’d rather eat mushrooms as a meat substitute. so, imho...it’s *possible they know they don’t have to but wanna recruit others cuz they got sold.",2020-07-03 12:48:36+00:00,,,1279034303901556737,,https://twitter.com/CynicalVision50/status/1279034303901556737,0,0,LittleVodkaOwl,https://twitter.com/LittleVodkaOwl/status/1278740691712000000
trump committed treason. say it.,2020-07-03 12:42:32+00:00,,,1279032777996992518,,https://twitter.com/CynicalVision50/status/1279032777996992518,0,0,thehill,https://twitter.com/thehill/status/1279022326365880325
mcconnell is a traitor. he works for russia. against america.,2020-07-03 12:21:14+00:00,,,1279027420889260035,,https://twitter.com/CynicalVision50/status/1279027420889260035,0,0,debbyswihart,https://twitter.com/debbyswihart/status/1279019384342827008
every state needs to ban concealed & open carry of firearms. start with the whitesupremacists magats. nobody has the right to endanger the public by carrying a firearm. nobody has a “right” to carry a weapon. not even police. they have a loosely worded federal mandate.,2020-07-03 12:16:36+00:00,,,1279026254251986945,,https://twitter.com/CynicalVision50/status/1279026254251986945,0,1,TravisAllen02,https://twitter.com/TravisAllen02/status/1278873172746604546
"well, barr did visit jeffy epstein. he was so sad, he hung himself* mcconnell is not the only “grim reaper”",2020-07-03 12:04:42+00:00,,,1279023259703484416,,https://twitter.com/CynicalVision50/status/1279023259703484416,0,0,richardmarx,https://twitter.com/richardmarx/status/1278834380551544833
russia’s not done yet.,2020-07-03 02:07:44+00:00,,,1278873028475211776,,https://twitter.com/CynicalVision50/status/1278873028475211776,0,0,Amy_Siskind,https://twitter.com/Amy_Siskind/status/1278853753395990531
somebody please drug test ben carson already. because if he’s that ignorant and sober? he needs serious help.,2020-07-02 23:59:46+00:00,,,1278840820645408773,,https://twitter.com/CynicalVision50/status/1278840820645408773,0,0,thehill,https://twitter.com/thehill/status/1278837377641984000
no. this year russia is here.,2020-07-02 23:44:18+00:00,,,1278836928310280201,,https://twitter.com/CynicalVision50/status/1278836928310280201,0,0,ThePubliusUSA,https://twitter.com/ThePubliusUSA/status/1278799397845905409
i’m inclined to think he knows all about what the fbi is up to. trump is only concerned when it involves holding him accountable. credible intelligence about bounty’s on the heads of our military never make it through-it doesn’t concern him. but hold him accountable? gets action.,2020-07-02 23:42:23+00:00,,,1278836448570101760,,https://twitter.com/CynicalVision50/status/1278836448570101760,0,0,funder,https://twitter.com/funder/status/1278795208965185536
"this is precisely what putin paid trump for. trump committed treason. he’s already killed 150,000 americans. have the military forcibly remove trump for treason.",2020-07-02 20:25:30+00:00,,,1278786901705732101,,https://twitter.com/CynicalVision50/status/1278786901705732101,0,2,MeliMels99,https://twitter.com/MeliMels99/status/1278477834818777088
"ms maxwell is the link between jeffrey epstein, numerous politicians & rich folks, leading straight to the front door of the “trumpmodellingandteenagersextrafficking corp ”",2020-07-02 19:43:41+00:00,,,1278776377878208512,,https://twitter.com/CynicalVision50/status/1278776377878208512,0,1,judemgreen,https://twitter.com/judemgreen/status/1278756633665892353
no. “irregardless” is not a real word. more like a feeble attempt to use “irrespective” or “regardless” but not knowing what they mean. and another ‘non-word’? exspecially.,2020-07-02 19:35:19+00:00,,,1278774269678362631,,https://twitter.com/CynicalVision50/status/1278774269678362631,0,0,MerriamWebster,https://twitter.com/MerriamWebster/status/1278335251501236225
"donald trump committed treason. he has criminally violated the “oath of office” repeatedly. this should be it for him. full stop. impeach, remove and imprison bill barr. russian partnering with russia to steal an american election & kill american soldiers with his blessing ~",2020-07-02 19:28:41+00:00,,,1278772603121995776,,https://twitter.com/CynicalVision50/status/1278772603121995776,0,0,MeidasTouch,https://twitter.com/MeidasTouch/status/1278756695011819520
