text,date,geo,hashtags,tweet_id,mentions,permalink,replies,retweets,replies_to,mentioned_urls
for those curious about the latest move toward declaring antifascists bad & kkk and whitesupremacists good. ‘fascism’ is open to interpretation. he wants no criticism of his litany of failure the only conversation is getting trump remanded to a 72hour hold. neuropsychiatric eval.,2020-06-01 12:11:26+00:00,,,1267428541261627394,,https://twitter.com/CynicalVision50/status/1267428541261627394,0,0,therealBAMFHBIC,https://twitter.com/therealBAMFHBIC/status/1267291773992349696
"unless he’s put into a thorazine induced coma, he will find a way on tv today. and thinking otherwise means america doesn’t really understand malignant* narcissism. or the level of hatred trump has for america. unpresidented.",2020-05-31 16:46:31+00:00,,,1267135378454130690,,https://twitter.com/CynicalVision50/status/1267135378454130690,0,0,duty2warn,https://twitter.com/duty2warn/status/1267126728419229696
"well, everything should be fine now.",2020-05-31 11:22:48+00:00,,,1267053915968876545,,https://twitter.com/CynicalVision50/status/1267053915968876545,0,0,acnewsitics,https://twitter.com/acnewsitics/status/1266955757951434753
for nypd this seems to be s.o.p. *general immunity is bullshit and allows this violence by cops everywhere to go unchecked.,2020-05-31 11:17:26+00:00,,,1267052561883959298,,https://twitter.com/CynicalVision50/status/1267052561883959298,0,0,CoreyinNYC,https://twitter.com/CoreyinNYC/status/1266931352034856960
"problem is, all the “thugs” & “angry mobs” are your people. let’s hope barr is serious about prosecution of those crossing state lines to commit violence or domestic terrorism. throw in off duty cops assaults & executing americans & incite more violence to justify their behavior.",2020-05-31 10:58:12+00:00,,,1267047724521840640,,https://twitter.com/CynicalVision50/status/1267047724521840640,0,0,OMAHAGEMGIRL,https://twitter.com/OMAHAGEMGIRL/status/1266915235727724545
"time and again, we see “police” are violent perpetrators. police abuse is not random. it’s common.",2020-05-31 02:14:03+00:00,,,1266915814546059268,,https://twitter.com/CynicalVision50/status/1266915814546059268,0,0,skye_rtin,https://twitter.com/skye_rtin/status/1266877962877460480
that means barr. again.,2020-05-30 23:27:36+00:00,,,1266873929534189569,,https://twitter.com/CynicalVision50/status/1266873929534189569,0,0,MSNBC,https://twitter.com/MSNBC/status/1266828421142851586
putin’s other bitch.,2020-05-30 23:10:50+00:00,,,1266869708684492800,,https://twitter.com/CynicalVision50/status/1266869708684492800,0,0,thehill,https://twitter.com/thehill/status/1266859683135942656
a neuropsychiatric disease prevents dicklesshitler from balancing.,2020-05-30 23:08:59+00:00,,,1266869242584010753,,https://twitter.com/CynicalVision50/status/1266869242584010753,0,0,Carlolol2,https://twitter.com/Carlolol2/status/1266813237003120640
they warrant his arrest. but just add it to the ever growing list.,2020-05-30 23:02:29+00:00,,,1266867606868439043,,https://twitter.com/CynicalVision50/status/1266867606868439043,0,0,funder,https://twitter.com/funder/status/1266848136112353281
global embarrassment. american tragedy.,2020-05-30 20:58:11+00:00,,,1266836327447871489,,https://twitter.com/CynicalVision50/status/1266836327447871489,0,0,bill_auclair,https://twitter.com/bill_auclair/status/1266830993756839936
never forget trumps cfo was the first to get “immunity” and nobody’s even heard from him... money laundering and criminal fraud are their core competencies.,2020-05-30 14:50:08+00:00,,,1266743703697326082,,https://twitter.com/CynicalVision50/status/1266743703697326082,0,0,CSue8971,https://twitter.com/CSue8971/status/1266659380256276480
amen... ,2020-05-30 14:10:37+00:00,,,1266733758281113601,,https://twitter.com/CynicalVision50/status/1266733758281113601,0,0,philterlabs,https://twitter.com/philterlabs/status/1258453076303687682
here’s your “well regulated militia”-trumps hitler youth. the same whitesupremacists carry ar15’s in public. the same whitesupremacists the fbi don’t see as terrorists. the same whitesupremacists dressing children in military gear. whitesupremacists supporters of a massmurderer ,2020-05-30 13:58:22+00:00,,,1266730677317312513,,https://twitter.com/CynicalVision50/status/1266730677317312513,0,0,drmistercody,https://twitter.com/drmistercody/status/1266620951174631424
flynn committed treason. he just didn’t know he’d be recorded. there’s no way for that to “look good” as a retired general flynn must be held to a higher standard of conduct. no ankle bracelet here. federal lockup. no parole.,2020-05-30 02:06:12+00:00,,,1266551452757110784,,https://twitter.com/CynicalVision50/status/1266551452757110784,0,0,AngrierWHStaff,https://twitter.com/AngrierWHStaff/status/1266509459083362304
"yeah. they’re mandatory, i think. standard, like office furniture. many of these are are energy vampires. i saw it on tv.",2020-05-29 16:04:02+00:00,,,1266399913300156416,,https://twitter.com/CynicalVision50/status/1266399913300156416,0,0,RealRebelElle,https://twitter.com/RealRebelElle/status/1266127255098527751
"wheeling out the guillotine into the public square, impatiently waiting to parade all those chained politicians responsible, whilst simultaneously ensuring every peasant had rocks and farm implements at the ready with which to express their ‘displeasure’ that’s what they’d do.",2020-05-29 15:59:09+00:00,,,1266398685828702209,,https://twitter.com/CynicalVision50/status/1266398685828702209,0,0,TheUSASingers,https://twitter.com/TheUSASingers/status/1266176973216403457
"let the lawsuits begin. there are no “good cops”. if there were, this wouldn’t happen. every officer in america should have to reapply for their jobs & discharged when violations exist. most get less “training” than hairdressers. and it’s escalation training to increase arrests.",2020-05-29 11:53:49+00:00,,,1266336945371783169,,https://twitter.com/CynicalVision50/status/1266336945371783169,0,0,NewDay,https://twitter.com/NewDay/status/1266315061209030658
"that quote puts me in mind of one of his shorter pieces, he called the edge. “the only people who know where the edge is, have fallen off-hst",2020-05-29 11:42:11+00:00,,,1266334018200633344,,https://twitter.com/CynicalVision50/status/1266334018200633344,0,0,TheDailyShroom,https://twitter.com/TheDailyShroom/status/1266223846136446976
p,2020-05-29 00:41:43+00:00,,,1266167804845268992,,https://twitter.com/CynicalVision50/status/1266167804845268992,0,1,eVilleMike,https://twitter.com/eVilleMike/status/1266127396257882115
"no. this smarmy little shit, billionaire-dickless tyrant is one of the “bad guys” even though he has no dick. profiting from america’s destruction~selling hatred is big anyone still on fb is either ignorant or delusional thinking “friends” are real. this is what we’ve become. sad",2020-05-28 12:51:35+00:00,,,1265989092782858241,,https://twitter.com/CynicalVision50/status/1265989092782858241,0,0,duty2warn,https://twitter.com/duty2warn/status/1265956545361252352
"boyhowdy, you ain’t kidding. the trick, though is to do this without leaving the house ",2020-05-27 21:33:51+00:00,,,1265758139573571585,,https://twitter.com/CynicalVision50/status/1265758139573571585,0,0,shamedoll,https://twitter.com/shamedoll/status/1265722109420089344
"not saying she’s totally fulloshite, but if kayleigh had a sign language interpreter on screen with her for these extravaganza’s? they’d be doing that jerk-off motion the whole time.",2020-05-27 21:30:33+00:00,,,1265757306391875587,,https://twitter.com/CynicalVision50/status/1265757306391875587,0,0,B52Malmet,https://twitter.com/B52Malmet/status/1265751795747430400
"she wears green to slither away easily into the grass. a few things. the cupcake place is closed-take out only. it’s only your family’s mob connections that got you in with trump. and, yes. you’re going to be held accountable. remember the hatch act you violated-three times?",2020-05-27 21:26:12+00:00,,,1265756211288387586,,https://twitter.com/CynicalVision50/status/1265756211288387586,0,0,brooklynmutt,https://twitter.com/brooklynmutt/status/1265704971133165575
"ontario’s inability to deal with reality is much like trumps refusal to admit truth. in both cases, it wrong. it’s deadly. and in both cases, it’s massmurder by mandate to fail your country. the “new world order”means wiping out most of us anyway. we see this elsewhere daily.",2020-05-27 14:04:20+00:00,,,1265645013096112135,,https://twitter.com/CynicalVision50/status/1265645013096112135,0,0,patgagnon_75,https://twitter.com/patgagnon_75/status/1265621763792220160
"frontotemporal dementia syphilitic dementia decades of drug abuse-related dementia late stage alzheimer’s dementia. take your pick. trumps cognitive decline is getting worse daily. even if he weren’t prone to rage, insanity & being unable to balance. demand a medical eval. unfit",2020-05-26 23:44:47+00:00,,#UNFIT,1265428699542888448,,https://twitter.com/CynicalVision50/status/1265428699542888448,0,0,realTuckFrumper,https://twitter.com/realTuckFrumper/status/1265294290021806080
responsible is always a “good look”,2020-05-26 12:05:57+00:00,,,1265252834179715072,,https://twitter.com/CynicalVision50/status/1265252834179715072,0,0,TerryMoran,https://twitter.com/TerryMoran/status/1265119572702760961
considering fromtotemporal dementia and seeing the other outward signs of cognitive impairment and neurologic compromise we see trumps inability to balance while standing. often doing the “band leader “gestures-(accordion playing) move. other times he’s weaving & unstable. unfit,2020-05-26 11:17:42+00:00,,#UNFIT,1265240691753525248,,https://twitter.com/CynicalVision50/status/1265240691753525248,0,0,erikhalvorsen18,https://twitter.com/erikhalvorsen18/status/1265030829861986305
"really miss this show... but on topic, i’ve always gone out of my way to support nothing but small, and family run businesses and always have. some stores with gun control issues, i won’t visit at all. refuse.",2020-05-26 11:07:42+00:00,,,1265238175213129728,,https://twitter.com/CynicalVision50/status/1265238175213129728,0,0,magicraisin,https://twitter.com/magicraisin/status/1265148201402761216
florida. gottabe...here we have a visual representation of the phrase; “six pounds of shit in a five pound sack”...or pickup as it were.,2020-05-26 10:59:49+00:00,,,1265236192221683714,,https://twitter.com/CynicalVision50/status/1265236192221683714,0,0,eqracer,https://twitter.com/eqracer/status/1265147960637091840
"it’s critical to realize that fighting against science? is russia’s “go to” move. c’mon. look up the word *empirical. “that which is proven by experience or experiment”provable. science, by its nature is empiric. ‘gut-feeling’? just gas. never forget; opinions are like assholes.",2020-05-26 10:38:50+00:00,,,1265230908455600128,,https://twitter.com/CynicalVision50/status/1265230908455600128,0,0,ronda_rl,https://twitter.com/ronda_rl/status/1265098237544820736
"we know that trump hates america and americans. if you haven’t figured out that his only loyalty and allegiance is to russia, you’re watching fox and support america’s demise. and on top of that you’re a traitor. it’s simple.",2020-05-26 01:40:29+00:00,,,1265095428938379264,,https://twitter.com/CynicalVision50/status/1265095428938379264,0,0,WritesMore,https://twitter.com/WritesMore/status/1265093297992761345
"aside from dodging the responsibilities of being an adult male human, the only *excercise mr trump ever got was from pushing his luck, jumping to conclusions and, of course, running his mouth.",2020-05-25 21:37:07+00:00,,,1265034185967915008,,https://twitter.com/CynicalVision50/status/1265034185967915008,0,0,TZZToday,https://twitter.com/TZZToday/status/1265031844283760643
"since his swearing in trump has worked overtime against america & given russia preferred treatment. not a single thing done was for americans. only to us. so, impeachment for criminal obstruction of justice didn’t slow him down now he’s on to mass murder by mandate~100,000 ",2020-05-25 21:28:28+00:00,,,1265032006506872833,,https://twitter.com/CynicalVision50/status/1265032006506872833,0,1,funder,https://twitter.com/funder/status/1265017201184190465
"without a doubt,  as biden’s ag.",2020-05-25 16:37:35+00:00,,,1264958803730194437,@KamalaHarris,https://twitter.com/CynicalVision50/status/1264958803730194437,0,0,thomaskaine5,https://twitter.com/thomaskaine5/status/1264894006644875265
"phuq these nazi traitors. the antithesis of patriotic. week, uninformed, brainless. white trash to whom nobody’s ever said “no” we say no. take’em all out. deport the fascists and those who have no concept of america. we don’t need them or their leader, dicklesshitlerdonny ",2020-05-25 16:23:30+00:00,,,1264955261921431553,,https://twitter.com/CynicalVision50/status/1264955261921431553,0,0,dyannleroy,https://twitter.com/dyannleroy/status/1264940737147404289
"dear , does the speaker of the house hold authority to demand trump undergo a physical &amp; neuropsychiatric exam? if not, who does? beyond impeachment and obstructing justice he’s moved into mass murder by mandate. time for action. no time to point out the obvious ",2020-05-25 16:16:24+00:00,,,1264953473822580743,@SpeakerPelosi,https://twitter.com/CynicalVision50/status/1264953473822580743,0,0,SpeakerPelosi,https://twitter.com/SpeakerPelosi/status/1264931798418632705
good. nobody should risk their lives to “suffer fools”,2020-05-25 13:24:51+00:00,,,1264910303411736578,,https://twitter.com/CynicalVision50/status/1264910303411736578,0,0,JoshuaPotash,https://twitter.com/JoshuaPotash/status/1264889424468459520
"for context; during the last election dicklesshitlerdonny and his kgbgop declared democrat’s we’re voting then going outside to their cars and changing clothes-to vote again. to a lifelong criminal, following the law is not something he acknowledges as “legal”",2020-05-25 12:59:50+00:00,,,1264904005261692928,,https://twitter.com/CynicalVision50/status/1264904005261692928,0,0,JenaGriswold,https://twitter.com/JenaGriswold/status/1264587882619998210
"hey, at least they’re staying *busy. i bet this person ‘studied’ for their drugtest.",2020-05-25 12:27:52+00:00,,,1264895960414642176,,https://twitter.com/CynicalVision50/status/1264895960414642176,0,0,HoldMyBluntt,https://twitter.com/HoldMyBluntt/status/1264889089171566593
who is this?,2020-05-24 23:34:09+00:00,,,1264701248151998465,,https://twitter.com/CynicalVision50/status/1264701248151998465,0,0,fras99,https://twitter.com/fras99/status/1264623507092144135
"who wrote the ‘evidence’ that suggests sunlight kills covid? i’d really check into that. infectious pathogens don’t work that way but to answer, is it safe? no. not yet. not until mitigation efforts includes medical science studying things like transmissibility & stuff like that.",2020-05-24 23:27:03+00:00,,,1264699461776875525,,https://twitter.com/CynicalVision50/status/1264699461776875525,1,0,StarinaJohnson,https://twitter.com/StarinaJohnson/status/1264694316779180032
p,2020-05-24 15:50:25+00:00,,,1264584546244321281,,https://twitter.com/CynicalVision50/status/1264584546244321281,0,0,BuffyWicks,https://twitter.com/BuffyWicks/status/1264468446282084352
it’s mandatory to question trumps “mental state”,2020-05-24 15:20:50+00:00,,,1264577100197003264,,https://twitter.com/CynicalVision50/status/1264577100197003264,0,0,realTuckFrumper,https://twitter.com/realTuckFrumper/status/1264574511753527298
kyle....or biff. but i’m old school. i normally default to asswipe.,2020-05-24 14:32:22+00:00,,,1264564905522364416,,https://twitter.com/CynicalVision50/status/1264564905522364416,0,0,GJabberbox,https://twitter.com/GJabberbox/status/1264318637931986948
"newsflash: there is no justification to call this carniebarker *judge. hemorrhoid will suffice. considering how far up trumps ass she really is,thanx.",2020-05-24 14:24:49+00:00,,,1264563006861647883,,https://twitter.com/CynicalVision50/status/1264563006861647883,0,0,RN_DNP_CRNP_MPH,https://twitter.com/RN_DNP_CRNP_MPH/status/1264555958413537280
"sessions is a career scumbag and subhuman extraordinaire. he was there at trumptower meeting with the russians. it’s all there in mueller’s report. so, yes. the grandwizard took a quiet break, but is, was and continues to be paid by russia.",2020-05-24 14:19:01+00:00,,,1264561546027507712,,https://twitter.com/CynicalVision50/status/1264561546027507712,0,1,Narc_Problems,https://twitter.com/Narc_Problems/status/1264556163196170240
he’s also the first one to violate the oath of office by taking it.,2020-05-24 12:42:00+00:00,,,1264537128400232449,,https://twitter.com/CynicalVision50/status/1264537128400232449,0,0,CyrusMMcQueen,https://twitter.com/CyrusMMcQueen/status/1264334510344343552
"michael flynn retired from military service and committed treason. if he were held accountable under military law? ohhh, it’s a lot worse than prison. how all this gets overlooked is he worked directly for russia. trump helped. so the question; why does america allow treason?",2020-05-24 12:33:07+00:00,,,1264534893742129153,,https://twitter.com/CynicalVision50/status/1264534893742129153,0,0,SethAbramson,https://twitter.com/SethAbramson/status/1263892016179658758
those who give up liberties for temporary freedom deserve neither” considering the ‘liberties’ & freedoms they’re trading on is their lives & the lives of their families it seems none of these ever heard of that. or self control. this transcends selfish and priveledged combined.,2020-05-24 12:26:36+00:00,,,1264533256126566400,,https://twitter.com/CynicalVision50/status/1264533256126566400,0,0,johnpavlovitz,https://twitter.com/johnpavlovitz/status/1264419421923282944
thanx for your info. most people dont know of other medicinal aspects of mushrooms aside from healing psychoactive property. the first organ-transplant anti rejection-immunosuppressive drug was cyclosporin-a mushroom derived compound. it’s still used in eye drops-opthalmology ,2020-05-24 12:14:12+00:00,,,1264530134234734592,,https://twitter.com/CynicalVision50/status/1264530134234734592,0,0,TheDailyShroom,https://twitter.com/TheDailyShroom/status/1264493522524221440
"no. apparently you gotta have a gun. bear spray is an idea, though.",2020-05-23 22:48:21+00:00,,,1264327333655216129,,https://twitter.com/CynicalVision50/status/1264327333655216129,0,0,LindaSunday13,https://twitter.com/LindaSunday13/status/1264204629203656704
meanwhile they gladly share everything on facebook & elsewhere. and if they really believe their iphones not being tracked it completes the circle of stupidity.,2020-05-23 13:47:05+00:00,,,1264191120285851649,,https://twitter.com/CynicalVision50/status/1264191120285851649,0,0,donwinslow,https://twitter.com/donwinslow/status/1263983540405846019
"but “houses of worship” only worship cash now, al. the abstract concept of ‘god’ exists, for them, to cover their hatred. working for the betterment of society just isn’t profitable. that jesus guy really wasn’t a fan of churches and believed god lives in all men. not a building.",2020-05-23 01:57:47+00:00,,,1264012619201085440,,https://twitter.com/CynicalVision50/status/1264012619201085440,0,0,TheRevAl,https://twitter.com/TheRevAl/status/1263891891860516864
trump would fail a physical. especially if theres a cognitive skills test. besides he’s hiding his dna from one of his victims & also they might drugtest him if he did. his frontotemporal dementia prevents him from balancing. it’s not lifts pitching him forward. dementiadon,2020-05-22 23:29:20+00:00,,#DementiaDon,1263975260426289155,,https://twitter.com/CynicalVision50/status/1263975260426289155,0,1,realTuckFrumper,https://twitter.com/realTuckFrumper/status/1263965596917600256
"good as she is, stacey abrams isn’t right for this moment. it’s hard to think of two more awesomely qualified women than  &amp;  for biden to choose as vp. and although i know kamala would excel as vp, i really believe her expertise may be better utilized as ag ",2020-05-22 23:04:36+00:00,,,1263969035538096134,@KamalaHarris @ewarren,https://twitter.com/CynicalVision50/status/1263969035538096134,0,0,Strandjunker,https://twitter.com/Strandjunker/status/1263810406071533568
"i wouldn’t be a bit surprised if the oan lawsuit was dismissed because it lacked substance and was deemed without merit. in other words, the sandiego judge must have found ms maddow’s comments to be...somewhat accurate. but i’ll leave that to the actual attorneys to argue over.",2020-05-22 22:56:51+00:00,,,1263967084825935872,,https://twitter.com/CynicalVision50/status/1263967084825935872,0,0,seth_hettena,https://twitter.com/seth_hettena/status/1263908698969104386
"make believe tough guys on motorcycles fronting for another make believe tough guy russian employee currently decimating america. nice look, dicklesshitler.",2020-05-22 20:51:06+00:00,,,1263935440446533634,,https://twitter.com/CynicalVision50/status/1263935440446533634,0,0,jeffmason1,https://twitter.com/jeffmason1/status/1263862843985756160
"perhaps this is to facilitate “contact tracing” some scary shit when in the *wrong hands. like any facet of the us government. but, hey-it’s not like nsa doesn’t already know where everyone is.",2020-05-22 19:58:30+00:00,,,1263922204745576454,,https://twitter.com/CynicalVision50/status/1263922204745576454,0,0,WritesMore,https://twitter.com/WritesMore/status/1263919962453917697
"churches are all cash businesses that pay no taxes. so, sure it’s absolutely in line with the other *gut feelings he has.",2020-05-22 19:06:33+00:00,,,1263909128608665600,,https://twitter.com/CynicalVision50/status/1263909128608665600,0,0,axidentaliberal,https://twitter.com/axidentaliberal/status/1263903208990277634
from impeached american embarrassment to full on dictator.,2020-05-22 18:47:03+00:00,,,1263904221981806596,,https://twitter.com/CynicalVision50/status/1263904221981806596,0,0,thehill,https://twitter.com/thehill/status/1263891929068195840
“voter fraud” barely exists. electoral fraud is a major gop m.o. it got trump anointed. ask brian kemp or mitch mcconnell the russian employee.,2020-05-22 15:37:30+00:00,,,1263856520237920256,,https://twitter.com/CynicalVision50/status/1263856520237920256,0,0,BryanDawsonUSA,https://twitter.com/BryanDawsonUSA/status/1263639544269856768
it’s simple economics as the reason why. those making poverty wages can not afford it.,2020-05-22 15:29:53+00:00,,,1263854604049092609,,https://twitter.com/CynicalVision50/status/1263854604049092609,0,0,RobertW31430731,https://twitter.com/RobertW31430731/status/1263829132124839943
"trumps inability to stand still, or balanced while standing as well as his forward-pitch can be attributed to frontotemporal dementia. add to that, decades of amphetamine abuse & malignant narcissist psychopathy. america has every reason to demand a neuropsychiatric evaluation.",2020-05-22 14:44:02+00:00,,,1263843064398909442,,https://twitter.com/CynicalVision50/status/1263843064398909442,0,0,JohnnyBlkshrt,https://twitter.com/JohnnyBlkshrt/status/1263694445800640517
"precisely. this disgusting woman would have been shot, were she a black person.",2020-05-22 14:29:15+00:00,,,1263839343174696962,,https://twitter.com/CynicalVision50/status/1263839343174696962,0,1,santori_lisa,https://twitter.com/santori_lisa/status/1263829137195782144
"legitimately speaking, trump should face prison time now. if america were still a nation of laws, he’d be tweeting from lockup.",2020-05-22 14:14:29+00:00,,,1263835629835694080,,https://twitter.com/CynicalVision50/status/1263835629835694080,0,0,Endgame2021,https://twitter.com/Endgame2021/status/1263590124333326336
"every state must treat trump like an infectious disease. congratulations to michigan for being the first of, hopefully, many.",2020-05-22 13:56:36+00:00,,,1263831129460813824,,https://twitter.com/CynicalVision50/status/1263831129460813824,0,0,Dcl_60,https://twitter.com/Dcl_60/status/1263569502110978049
wearing a mask will not protect one from ignorance & stupidity. nope.,2020-05-22 13:53:08+00:00,,,1263830256827486210,,https://twitter.com/CynicalVision50/status/1263830256827486210,0,0,Monaheart1229,https://twitter.com/Monaheart1229/status/1263823818050715648
phuqthesenazis. why didn’t that cop shoot this asswipe magat?,2020-05-22 13:41:06+00:00,,,1263827226396631041,,https://twitter.com/CynicalVision50/status/1263827226396631041,1,0,santori_lisa,https://twitter.com/santori_lisa/status/1263823959700779015
"as weird an idea as that is, i’ve gotten feedback for an even better one. native peoples have enough on their plate. remember you can’t ‘hope’ or ‘pray’ this nazism away. but you can bury it in a very deep hole.",2020-05-22 12:31:18+00:00,,,1263809663491100679,,https://twitter.com/CynicalVision50/status/1263809663491100679,0,0,politicalblond,https://twitter.com/politicalblond/status/1263634778726625286
no. those are the same words.,2020-05-21 17:43:17+00:00,,,1263525789213081600,,https://twitter.com/CynicalVision50/status/1263525789213081600,0,0,PhDnotMD,https://twitter.com/PhDnotMD/status/1263524642586865664
"yes, a followup question: “are you really that ignorant”?",2020-05-21 16:15:37+00:00,,,1263503723285876739,,https://twitter.com/CynicalVision50/status/1263503723285876739,0,0,mmpadellan,https://twitter.com/mmpadellan/status/1263492328733507585
drugged out psychopath.,2020-05-21 13:34:07+00:00,,,1263463083600732160,,https://twitter.com/CynicalVision50/status/1263463083600732160,0,0,RepsForBiden,https://twitter.com/RepsForBiden/status/1260202664543092737
