text,date,geo,hashtags,tweet_id,mentions,permalink,replies,retweets,replies_to,mentioned_urls
oh wow. thanks for sharing this! i would take your courses . your writing on work/family/identity &amp; the pandemic is beautiful https://twitter.com/alyssaharad/status/1258751950528688128,2020-05-08 14:10:57+00:00,,,1258761308494848000,@OrahMark,https://twitter.com/Gail_G_Scott/status/1258761308494848000,0,0,,https://twitter.com/alyssaharad/status/1258751950528688128
things that don’t change ( ) as with covid19–lack of accurate publichealth data ( a measure of funding+ coordination +political will) results in failure to improve response &amp; be able to save lives.,2020-05-08 13:48:57+00:00,,#COVID19 #publichealth,1258755771896147970,,https://twitter.com/Gail_G_Scott/status/1258755771896147970,1,0,Gail_G_Scott,https://apnews.com/de404fd6795d4a61bc72c7df188eb9cd
"haven’t seen a study published yet on of jail deaths in u.s. =due to untreated withdrawal, have you? media stories have to be a data source since fed & state jail death data is lacking details. +coroner reports don’t always list this clearly. anyone on this,dm me, i’ll help!",2020-05-08 13:35:32+00:00,,,1258752395171037184,,https://twitter.com/Gail_G_Scott/status/1258752395171037184,1,0,AlexStevensKent,
very sorry for your loss ,2020-05-08 08:05:29+00:00,,,1258669335519911936,,https://twitter.com/Gail_G_Scott/status/1258669335519911936,1,0,Heyy_Jay,
"dr wolf, a web search will tell you both recreational cannabis & medical cannabis are legal in sf (& ca.) the article mentions the health dept providing medical cannabis. liquor stores & medical cannabis dispensaries are “essential” stores, almost everywhere. harmreduction",2020-05-08 01:40:49+00:00,,#harmreduction,1258572531088400392,,https://twitter.com/Gail_G_Scott/status/1258572531088400392,1,0,BornsteinKasha,
wouldn’t this violate the ada?,2020-05-08 01:14:34+00:00,,,1258565925407768581,,https://twitter.com/Gail_G_Scott/status/1258565925407768581,0,0,jesturiale,
very sorry for your loss ,2020-05-07 21:16:13+00:00,,,1258505944490635264,,https://twitter.com/Gail_G_Scott/status/1258505944490635264,0,0,erinbelieu,
congratulations!! ,2020-05-07 21:15:28+00:00,,,1258505753385553921,,https://twitter.com/Gail_G_Scott/status/1258505753385553921,0,0,katybkoz,
"i think george barnhill, the da in waycross, ga, should be fired. he wrote an official letter describing ahmaudarbery, before he recused himself, as a “burglary suspect” (he was not, but he was a black man jogging), who “attacked” the men (he was unarmed &amp; being hunted.)",2020-05-07 11:36:22+00:00,,#AhmaudArbery,1258360019810222081,,https://twitter.com/Gail_G_Scott/status/1258360019810222081,0,0,CharlesMBlow,https://twitter.com/CharlesMBlow/status/1258336486598094848
state & local officials & business leaders claim they are “following cdc guidelines” but the  was blocked from publishing detailed guidelines. another example of disdain for publichealth by our federal government.,2020-05-07 11:04:13+00:00,,#publichealth,1258351929740144640,@CDCgov,https://twitter.com/Gail_G_Scott/status/1258351929740144640,0,0,JonLemire,https://twitter.com/JonLemire/status/1258341898844069888
awful. so very sorry. ,2020-05-06 21:53:30+00:00,,,1258152939773931520,,https://twitter.com/Gail_G_Scott/status/1258152939773931520,0,0,PugMafia2,
nice.  has no idea what your talk is about and thinks it will sell “organic” hemp cbd. ,2020-05-06 21:51:14+00:00,,,1258152369285738507,@DiamondDemocra,https://twitter.com/Gail_G_Scott/status/1258152369285738507,1,0,TNREthx,
oh my. sorry brooke. how could you have known? lots of people with mild or atypical symptoms are being told they (probably) don’t have it & don’t need to be tested. at least you found out! take care & rest up. hope you feel better soon.,2020-05-06 20:37:50+00:00,,,1258133897919021060,,https://twitter.com/Gail_G_Scott/status/1258133897919021060,1,0,BrookeM_Feldman,
" reporting . the consequences of incompetence in emergency governance: a “wild west” for ppe wasting valuable time, funds—costing lives—fed by our federal gov’t allowing (even promoting!) profiteering, grifters, &amp; fixers at all levels.",2020-05-06 16:54:09+00:00,,,1258077605720358922,@propublica,https://twitter.com/Gail_G_Scott/status/1258077605720358922,0,0,davidmcswane,https://twitter.com/davidmcswane/status/1258035535936921601
"oops, typo-od= ot, which is either mot, and drot. and pa degree is = mspas (just relaunched ms in physician assistant studies)",2020-05-05 21:12:29+00:00,,,1257780226421129216,,https://twitter.com/Gail_G_Scott/status/1257780226421129216,0,0,Gail_G_Scott,
" pre-meds can &amp; do come to  from community college &amp; go on to med school, or stay here for ms, phd, pharmd, od, dpt, pa, mba. in fact, we have agreements w/8 area cc's re: transfer credits/bridge from as degree to a bs or grad degree here.",2020-05-05 21:01:45+00:00,,,1257777528841867272,@USciences,https://twitter.com/Gail_G_Scott/status/1257777528841867272,2,0,clairezagorski,https://www.usciences.edu/academics/articulations-affiliations/admission-from-partner-institution.html
prison roommate gets tortured (that word is accurate) for screaming for medical care for cellmate seizing/dying of covid. outrageous reports of extreme medical neglect &amp; abuse in u.s.correctional facilities now. there’d be even more if not for new barriers to communication.,2020-05-05 13:45:42+00:00,,#COVID,1257667791039221767,,https://twitter.com/Gail_G_Scott/status/1257667791039221767,1,0,ScottHech,https://twitter.com/ScottHech/status/1257663897420652544
ok. now do that...everywhere else.,2020-05-02 03:39:35+00:00,,,1256428094325489664,,https://twitter.com/Gail_G_Scott/status/1256428094325489664,0,1,SecAzar,
"understood. also true- uptake of obot was a 1 key outcome of education/knowledge+belief change. providers— % who started out *fearful* of sud patients—acting to integrate sud into their practices, even become sud specialists. for sure other variables drove action, as well! ",2020-05-02 03:11:54+00:00,,,1256421126894432259,,https://twitter.com/Gail_G_Scott/status/1256421126894432259,1,0,SotheranL,
i’m here for this comment. ,2020-05-02 02:00:36+00:00,,,1256403185696112646,,https://twitter.com/Gail_G_Scott/status/1256403185696112646,0,0,AbbyCScience,
"teaching the difference between “dependence” & “addiction” were of course, key parts of that education. must note—that difference was also very important to pharma co’s (on both pain & addiction med sides) that were invested in medicalization of sud.",2020-05-02 00:49:35+00:00,,,1256385312030437377,,https://twitter.com/Gail_G_Scott/status/1256385312030437377,0,0,Gail_G_Scott,
"when i was involved in & attending lots of physician/medical provider moud &amp; buprenorphine/obot education in mid-late 2000’s, i saw physicians, nurses, medical staff, etc. change negative perceptions &amp; beliefs re: recovery &amp; people w/oud— driven by medicalization of addiction.",2020-05-02 00:46:00+00:00,,#MOUD,1256384408409554945,,https://twitter.com/Gail_G_Scott/status/1256384408409554945,3,0,Gail_G_Scott,
"i am interested in ’s criticism of the disease model within anti-stigma /education vs the “medicalization” of addiction. can they be separated? aren’t there differences for diff. audiences? (pwud vs people in tx w/mat, vs “public” vs healthcare workers?)",2020-05-02 00:41:36+00:00,,,1256383301826351105,@MyHarmReduction,https://twitter.com/Gail_G_Scott/status/1256383301826351105,3,0,SotheranL,
"if she had taped her demo, then replayed it on reverse, she’d have to also reverse-fake the grape (which is whole at the beginning & cut when the demo starts, & at the end.)",2020-05-02 00:25:20+00:00,,,1256379209221537792,,https://twitter.com/Gail_G_Scott/status/1256379209221537792,1,0,vivsterBI,
"“this performance has long been deeply discordant, especially with trump’s little whammy-bar runs of gloating and grievance now playing over the daily drumbeat of mass death and economic devastation. it has finally begun to feel as dangerous as it is.”",2020-05-01 23:43:24+00:00,,,1256368654880518145,,https://twitter.com/Gail_G_Scott/status/1256368654880518145,0,0,newrepublic,https://twitter.com/newrepublic/status/1256365343452418048
good to know! i never took physics ,2020-05-01 13:54:46+00:00,,,1256220520841871367,,https://twitter.com/Gail_G_Scott/status/1256220520841871367,0,0,namethca,
https://twitter.com/claranellist/status/1235203227940990978?s=21,2020-05-01 13:50:17+00:00,,,1256219394927218695,,https://twitter.com/Gail_G_Scott/status/1256219394927218695,0,0,CareNavigating,"https://twitter.com/claranellist/status/1235203227940990978?s=21,https://twitter.com/claranellist/status/1235203227940990978"
this demo says it can be done https://twitter.com/claranellist/status/1235203227940990978?s=21:,2020-05-01 13:50:05+00:00,,,1256219345216208897,,https://twitter.com/Gail_G_Scott/status/1256219345216208897,1,0,BR3NDA,"https://twitter.com/claranellist/status/1235203227940990978?s=21,https://twitter.com/claranellist/status/1235203227940990978"
needed: policymaker-friendly journal articles & briefs calling out these outdated trainings. (also seen in certifications like pa’s for recovery support staff.) why: 1. incentivize *change* at  &amp; others. 2. get funding new curriculum. sciencematters mededsud,2020-05-01 13:44:06+00:00,,#sciencematters #MedEdSUD,1256217837280133120,@hazldnbettyford,https://twitter.com/Gail_G_Scott/status/1256217837280133120,0,0,billkinkle,
thanks for sharing. we’ll need more creative opportunities like this. i like what you did to be more personal (individual meetings.) ,2020-05-01 13:33:17+00:00,,,1256215113574625281,,https://twitter.com/Gail_G_Scott/status/1256215113574625281,0,0,gradydoctor,
i dislike smoking with a passion. encourage all ya’ll to quit tobacco ! but philly’s “rehab” smoking ban must go. people seeking treatment for opioid/ alcohol/ stimulant use disorder deserve to get care despite nicotine dependence. please dm if you have ideas! harmreduction,2020-04-30 17:21:07+00:00,,#harmreduction,1255910064000466944,,https://twitter.com/Gail_G_Scott/status/1255910064000466944,0,0,,
what will it take to stop this?!attn:  lawtwitter &amp; phlaw —are there legal levers?how many will be forced out of treatment to their deaths by the  misguided smoking ban (in the midst of covid19 crisis too!) shocking policy fail  ,2020-04-30 16:53:25+00:00,,#lawtwitter #phlaw #COVID19,1255903094069747715,@aclupa @DBHIDS @PHLPublicHealth @PADrugAlcohol,https://twitter.com/Gail_G_Scott/status/1255903094069747715,1,0,BrookeM_Feldman,https://twitter.com/BrookeM_Feldman/status/1255801276752973825
"alison, thanks for your efforts shining the light on this moud access issue. ",2020-04-30 16:37:12+00:00,,#MOUD,1255899011502018565,,https://twitter.com/Gail_G_Scott/status/1255899011502018565,1,0,alisonknopf,
"couriers from  bring methadone to otp patients’ homes. way to innovate ! is delivery happening (or planned) anywhere else for folks quarantined /can’t travel, &amp; out of take-home doses? imagine if pharmacies could help aatod   twitterx",2020-04-30 16:33:58+00:00,,#methadone #AATOD #TwitteRx,1255898198595551233,@nycHealthy @NYSOASAS @ASAMorg @samhsagov,https://twitter.com/Gail_G_Scott/status/1255898198595551233,0,0,alisonknopf,https://twitter.com/alisonknopf/status/1255876908950138880
deepest condolences for your loss ,2020-04-30 15:32:36+00:00,,,1255882754807357442,,https://twitter.com/Gail_G_Scott/status/1255882754807357442,0,0,SoberBrownBetty,
"to restate: in a congregate setting w/confirmed cases among staff & residents, can *asymptomatic* staff be mandated to take a test, for publichealth good. (once we have sufficient tests available.) forced quarantine, for some, may mean they don’t want to know if they have it.",2020-04-29 20:02:06+00:00,,#publichealth,1255588190569877504,,https://twitter.com/Gail_G_Scott/status/1255588190569877504,0,0,Gail_G_Scott,
lancaster co. pa jail only tests symptomatic patients & staff. they encourage *any* staff to get tested (free) but it’s not offered on-site. they said “we can’t make” staff get tested because “hr reasons.”  is that true?,2020-04-29 19:52:35+00:00,,,1255585794657529860,@coreysdavis,https://twitter.com/Gail_G_Scott/status/1255585794657529860,1,0,Sentinel_Vaughn,
i’m sorry for your loss ,2020-04-29 19:12:18+00:00,,,1255575656118857730,,https://twitter.com/Gail_G_Scott/status/1255575656118857730,0,0,OrinKerr,
"deepest condolences to you & your colleagues for your loss. i didn’t know her, but i am angry too. so many preventable deaths. it’s wrong.",2020-04-28 20:50:23+00:00,,,1255237949819674627,,https://twitter.com/Gail_G_Scott/status/1255237949819674627,0,0,DrTsion,
"summer publichealth problem: how to protect city residents “as the coronavirus crisis collides with the potentially deadly consequences of being poor, disabled or elderly during the hottest days of the year.”⁦⁩ ⁦⁦⁩",2020-04-28 15:47:01+00:00,,#publichealth,1255161606599819272,@jadabird @washingtonpost,https://twitter.com/Gail_G_Scott/status/1255161606599819272,0,1,,https://www.washingtonpost.com/national/will-summer-kill-coronavirus/2020/04/27/5ec70fd8-8670-11ea-a3eb-e9fc93160703_story.html
so sorry for your loss ,2020-04-28 12:33:21+00:00,,,1255112869005451267,,https://twitter.com/Gail_G_Scott/status/1255112869005451267,0,0,MiaMungin,
omg.,2020-04-27 19:40:26+00:00,,,1254857961039474688,,https://twitter.com/Gail_G_Scott/status/1254857961039474688,1,0,clairezagorski,
cupcakes without frosting are better than cakepops. fact.,2020-04-27 06:15:02+00:00,,,1254655276533284864,,https://twitter.com/Gail_G_Scott/status/1254655276533284864,0,0,MCBazacoPhD,
" fyi: wilbur buds. they’re older than hershey kisses &amp; are better chocolate. they are molded vs. dropped of dark (semisweet) chocolate or milk chocolate. not individually wrapped! locally, we can buy them by the pound in bulk. mail order: https://www.wilburbuds.com/",2020-04-27 06:13:46+00:00,,,1254654954041729024,@ScottMyers20,https://twitter.com/Gail_G_Scott/status/1254654954041729024,0,0,ScottMyers20,https://www.wilburbuds.com/
"of course, if reimbursement for substance use disorder/ behavioral health treatment for medicaid patients was significantly higher, & coupled w/funded adequate care coordination, our capacity challenges & provider shortages would disappear quickly! but we all know that.",2020-04-27 02:34:28+00:00,,,1254599768011128838,,https://twitter.com/Gail_G_Scott/status/1254599768011128838,0,0,Gail_G_Scott,
other variables i think should be in this hypothetical “ buprenorphine tx capacity &amp; access” study would be 1. financial incentives to get waivered (some systems now pay a bonus) 2. reimbursement for office visit 3. prior auth frequency 4. frequency of pharma sales rep calls,2020-04-27 02:17:48+00:00,,#buprenorphine,1254595571584770051,,https://twitter.com/Gail_G_Scott/status/1254595571584770051,1,0,Gail_G_Scott,
"dr quinton, online asynchronous training is mostly free, but there are in-person classes too. since buprenorphine training is offered by a handful of approved providers, trainings could be tracked/geomapped as a variable re: impact on overall access. i’d love to see this study!",2020-04-27 02:05:27+00:00,,#Buprenorphine,1254592463001567232,,https://twitter.com/Gail_G_Scott/status/1254592463001567232,1,0,jakequintonMD,
"great poster! look forward to seeing the paper. re: policy levers- i believe xing the x-waiver will help, but not eliminate, another (hard to measure) barrier; the discomfort many doctors have *treating* patients w/oud. i think this is rooted in stigma, fear, &amp; lack of training.",2020-04-27 01:35:07+00:00,,#stigma,1254584829536096257,,https://twitter.com/Gail_G_Scott/status/1254584829536096257,1,0,MaalikaB,
yes! i love to mail awesome baked sweets. (have an award-winning local baker that can contribute some ),2020-04-27 01:07:49+00:00,,,1254577960767631362,,https://twitter.com/Gail_G_Scott/status/1254577960767631362,0,0,ashrclayton,
stand your ground. ,2020-04-27 01:02:31+00:00,,,1254576625187987457,,https://twitter.com/Gail_G_Scott/status/1254576625187987457,0,0,RDashford,
congrat’s!!,2020-04-26 20:21:14+00:00,,,1254505840956104704,,https://twitter.com/Gail_G_Scott/status/1254505840956104704,1,0,zra_research,
wow.  did you see this?,2020-04-26 20:10:52+00:00,,,1254503232816242690,@ChipotleTweets,https://twitter.com/Gail_G_Scott/status/1254503232816242690,0,0,sportyginger,
 ,2020-04-26 20:06:37+00:00,,,1254502162421465089,,https://twitter.com/Gail_G_Scott/status/1254502162421465089,0,0,joshuafmask,
my college-educated parents call it “the clicker.”,2020-04-26 20:06:08+00:00,,,1254502041466081280,,https://twitter.com/Gail_G_Scott/status/1254502041466081280,0,0,revsarahhowler,
 ,2020-04-26 20:01:45+00:00,,,1254500938586435584,,https://twitter.com/Gail_G_Scott/status/1254500938586435584,0,0,angie_rasmussen,
 ,2020-04-26 20:01:22+00:00,,,1254500838996836353,,https://twitter.com/Gail_G_Scott/status/1254500838996836353,0,0,tressiemcphd,
 ,2020-04-26 20:00:38+00:00,,,1254500655458390024,,https://twitter.com/Gail_G_Scott/status/1254500655458390024,0,0,DrJenGunter,https://twitter.com/DrJenGunter/status/1254496768877711360
" patients can’t control whether caregivers, aids, technicians, or providers follow guidelines. the “consumer responsibility” mantra dr birx espoused, is baked into the u.s’s attempt to make a *free market* (largely for-profit) health system drive safety+ quality. it does not.",2020-04-26 19:13:03+00:00,,,1254488683010498566,,https://twitter.com/Gail_G_Scott/status/1254488683010498566,0,0,Jessnimm,
"yep. let’s ignore the systemic problems, because fixing them will be hard.",2020-04-26 15:04:38+00:00,,,1254426165051351046,,https://twitter.com/Gail_G_Scott/status/1254426165051351046,1,0,adfoxMD,
10th ,2020-04-25 20:29:42+00:00,,,1254145583268462593,,https://twitter.com/Gail_G_Scott/status/1254145583268462593,0,0,wokeSTEMteacher,
so sorry for your loss. ,2020-04-24 23:21:35+00:00,,,1253826448865009664,,https://twitter.com/Gail_G_Scott/status/1253826448865009664,0,0,BibatheDiva,
 i am here to say: i would if it were me. good luck!!,2020-04-24 16:00:43+00:00,,,1253715503421546499,,https://twitter.com/Gail_G_Scott/status/1253715503421546499,0,0,MorganCShields,
"oh, i think we do “realize”! just can’t get it changed...",2020-04-24 15:37:09+00:00,,,1253709571551608834,,https://twitter.com/Gail_G_Scott/status/1253709571551608834,1,0,DeannaHoak,
"meanwhile, here in pa, a pro-trump pac is running ads criticizing biden for being soft on china! https://www.axios.com/biggest-trump-super-pac-test-drives-beijingbiden-campaign-75582a64-6edc-48ec-9b38-f307816b6a32.html?",2020-04-24 14:06:49+00:00,,,1253686837379502082,,https://twitter.com/Gail_G_Scott/status/1253686837379502082,0,2,waltshaub,https://www.axios.com/biggest-trump-super-pac-test-drives-beijingbiden-campaign-75582a64-6edc-48ec-9b38-f307816b6a32.html
"https://www.cutco.com/company/aboutus.jsp american cutlery mfg that sells mostly through home demonstrations by commissioned freelance salespeople (although you can by online or from catalog too.) pricey, but good quality &amp; they’ll replace if one breaks or is damaged.",2020-04-24 03:08:39+00:00,,,1253521206558539776,,https://twitter.com/Gail_G_Scott/status/1253521206558539776,0,0,SFLforeclosures,https://www.cutco.com/company/aboutUs.jsp
they’re great knives though. made right in ny. my spouse sold them one college summer; we still use his set 40 years later! we gave our 5 adult kids cutco knife sets at christmas; sorry your cousin missed out on that order ,2020-04-24 03:04:22+00:00,,,1253520127649333252,,https://twitter.com/Gail_G_Scott/status/1253520127649333252,0,0,tressiemcphd,
"sad that  just canceled annual conference this fall, but glad they told us now! they’re exploring options for online posters/presentations, instead. brings silver lining of possibly in participation by many who’ve lost travel+conference funding anyway in academia",2020-04-24 01:47:55+00:00,,,1253500890251702272,@AMERSA_tweets,https://twitter.com/Gail_G_Scott/status/1253500890251702272,0,0,Gail_G_Scott,
"bet conference hotels= loathe to admit longterm/future losses they face now, like airline (which have been changing cancel/refund policies weekly!) org’s need min. 6 months out for plans, so it’s time now for hotels to agree to changes in fall ‘20 event contracts, move to ‘21.",2020-04-24 01:39:05+00:00,,,1253498667887202304,,https://twitter.com/Gail_G_Scott/status/1253498667887202304,1,0,,
"ok, understood.",2020-04-24 00:58:48+00:00,,,1253488529495203840,,https://twitter.com/Gail_G_Scott/status/1253488529495203840,0,0,knowledgejunki,
"becca, curious about your connection to filti business you are promoting? is that you in video? didn’t spot any address, location, ownership details in business website.",2020-04-24 00:28:28+00:00,,,1253480895643897856,,https://twitter.com/Gail_G_Scott/status/1253480895643897856,1,0,Gail_G_Scott,
"yes, still “filtering” microbes from air is all theoretical in community use of masks. those “% efficacy” data =lab demo’s, not real world use by people. isn’t benefit = physical barrier to deter spewing your droplets out: barrier outgoing, not filtering microbes incoming?",2020-04-24 00:21:00+00:00,,,1253479013890379776,,https://twitter.com/Gail_G_Scott/status/1253479013890379776,2,0,knowledgejunki,
"for community facemask use, not medical use, must consider wearability/ comfort to get people (who are not trained in wearing ppe) to keep them on for hours. more layers-whether nonwoven filter, cloth, etc. difficulty of breathing through mask &amp; likely misuse/noncompliance.",2020-04-24 00:01:52+00:00,,#facemask,1253474198741299201,,https://twitter.com/Gail_G_Scott/status/1253474198741299201,1,0,Gail_G_Scott,
" so i sewed cloth facemasks w/pockets, yet think adding “filters” is illusion of safety. why? 1) key purpose =protecting others from *your* droplets/breath/coughs, doubt filter improves this vs. 2 layers cloth. 2) cloth masks leak air from the sides when breathing in w/filter",2020-04-23 23:50:23+00:00,,#facemasks,1253471312674250758,,https://twitter.com/Gail_G_Scott/status/1253471312674250758,4,0,knowledgejunki,
"what? posting the pa businesses that got/didn’t get “life-sustaining” waivers may reveal *proprietary* info?! as a public health advocate, i support ’s &amp; ’s crisis powers+leadership. but our “transparency governor” is failing transparency.",2020-04-23 23:08:20+00:00,,,1253460730113937409,@GovernorTomWolf @SecretaryLevine,https://twitter.com/Gail_G_Scott/status/1253460730113937409,0,0,PaPostNews,https://twitter.com/PaPostNews/status/1253454188278943744
congratulations!! ,2020-04-23 22:21:08+00:00,,,1253448850079178755,,https://twitter.com/Gail_G_Scott/status/1253448850079178755,0,0,HannahZio,
so very sorry... no words. ,2020-04-23 00:28:55+00:00,,,1253118622085648384,,https://twitter.com/Gail_G_Scott/status/1253118622085648384,0,0,Mom2Nemo,
"“infectious pathogens are oftentimes invisible cargo: they won’t set off the metal detectors, but should nonetheless be treated as significant threats to the safety and well being of incarcerated individuals and prison staff alike”",2020-04-21 17:53:24+00:00,,,1252656697551831040,,https://twitter.com/Gail_G_Scott/status/1252656697551831040,0,1,gregggonsalves,https://twitter.com/gregggonsalves/status/1252640441968857088
happy bday!! you look fabulous. sorry you can’t have a real party.,2020-04-21 17:08:02+00:00,,,1252645278538256384,,https://twitter.com/Gail_G_Scott/status/1252645278538256384,0,0,GrannyCritter,
i’m sorry. that’s terrible.,2020-04-21 17:05:03+00:00,,,1252644529863360512,,https://twitter.com/Gail_G_Scott/status/1252644529863360512,0,0,KevinARing,
thanks for sharing jeff! will this be posted online without the “draft” watermark now that it was approved?,2020-04-21 16:56:42+00:00,,,1252642426201747456,,https://twitter.com/Gail_G_Scott/status/1252642426201747456,1,0,jefbratberg,
"wow, this is a badly written article to share. i guess this  account is a bot?",2020-04-21 16:24:16+00:00,,,1252634266846007298,@dmedialab,https://twitter.com/Gail_G_Scott/status/1252634266846007298,0,0,dmedialab,
" 5-year-old becomes first michigan child to die of covid-19. her parents, a detroit firefighter &amp; police offficer, don’t know how she was exposed to the virus. skylar did not have previous health issues.",2020-04-20 06:27:56+00:00,,,1252121805504028672,,https://twitter.com/Gail_G_Scott/status/1252121805504028672,0,0,,https://www.detroitnews.com/story/news/local/detroit-city/2020/04/19/5-year-old-first-michigan-child-dies-coronavirus/5163094002/
 is this software “glitch” the reason the death numbers from lancaster coroner’s office reported by lnp are so much higher than  reports?,2020-04-18 23:29:38+00:00,,,1251654150347280384,@HStaufferLNP @PAHealthDept,https://twitter.com/Gail_G_Scott/status/1251654150347280384,0,0,,https://whyy.org/articles/pa-underreported-18-of-covid-deaths-this-week-officials-blame-computer-glitches/
https://twitter.com/nhannahjones/status/1251640775638728709?s=21,2020-04-18 23:19:02+00:00,,,1251651481255763969,,https://twitter.com/Gail_G_Scott/status/1251651481255763969,1,0,bobscheer,"https://twitter.com/nhannahjones/status/1251640775638728709?s=21,https://twitter.com/nhannahjones/status/1251640775638728709"
oh no. condolences to you and to his family ,2020-04-18 20:39:12+00:00,,,1251611259084197888,,https://twitter.com/Gail_G_Scott/status/1251611259084197888,0,0,doscious1967,
we used to call that radio...,2020-04-18 19:58:24+00:00,,,1251600992807911428,,https://twitter.com/Gail_G_Scott/status/1251600992807911428,0,0,EuginhoCortez,
