text,date,geo,hashtags,tweet_id,mentions,permalink,replies,retweets,replies_to,mentioned_urls
congratulations!! ,2020-04-18 19:47:33+00:00,,,1251598258906038272,,https://twitter.com/Gail_G_Scott/status/1251598258906038272,0,0,amandahall33,
very sorry for your loss ,2020-04-18 18:58:05+00:00,,,1251585812430454786,,https://twitter.com/Gail_G_Scott/status/1251585812430454786,0,0,BCDreyer,
"wait, what? have to vet authors’ lives now before we read novels? didn’t know orson scott card was a bigot (or mormon) when i read ender’s game. i did learn roald dahl was anti-semitic, but still read his books to my kids;(they’re good.)find a better reason to trashtalk vp picks.",2020-04-18 18:24:12+00:00,,,1251577283250454528,,https://twitter.com/Gail_G_Scott/status/1251577283250454528,0,0,ft_variations,
but does it really? ,2020-04-18 18:02:59+00:00,,,1251571945407221760,,https://twitter.com/Gail_G_Scott/status/1251571945407221760,0,0,JohnFetterman,
"gotcha. thanks for the info! was for tone. and gknows, i’m rarely slow to call out coi (&amp; have on zac before, which i recall got  exercised on his behalf. lol.) don’t see how it’s applicable for this conv. tho . to you &amp; all hcws dealing w/covid19, ",2020-04-18 17:56:03+00:00,,#COVID19,1251570200635420673,@ADAWnews,https://twitter.com/Gail_G_Scott/status/1251570200635420673,3,0,obsteve1,
"all for lockboxes at home, & otps giving them out & well aware state reg’s differ from federal (& would love to see policy surveillance on this particular one!) i also see states modifying reg’s for covid19 &amp; think *travelling* w/bulky lockbox daily is one to change, if req’d.",2020-04-18 17:24:27+00:00,,#COVID19,1251562246968356865,,https://twitter.com/Gail_G_Scott/status/1251562246968356865,2,0,ADAWnews,
" at vitriolic replies. “consider carefully” is still cautionary &amp; not mandate. sure, folks can use backpacks/purses to hide lockboxes in travel. that being said, “child-resistant” caps = fine for controlled rxs dispensed at pharmacies, so why not otps (absent state mandate?)",2020-04-18 17:13:59+00:00,,,1251559613218070529,,https://twitter.com/Gail_G_Scott/status/1251559613218070529,3,0,obsteve1,
"raiding my fabric stash was the fun part of making facemasks. having to make them was the part. i am a quilter, own two bernina machines &amp; a vintage pfaff &amp; had already stocked up on elastic. yet i still dragged my feet before finally getting started. ",2020-04-18 16:51:21+00:00,,#facemasks,1251553917105815554,,https://twitter.com/Gail_G_Scott/status/1251553917105815554,0,0,Napir9,
yep. not arguing with you there.,2020-04-18 16:38:31+00:00,,,1251550690171858950,,https://twitter.com/Gail_G_Scott/status/1251550690171858950,0,0,EdFuller_PSU,
"in addition to the xmillion youtube instruction videos of diy sewn & no-sew facemasks (from new or used fabric, or even paper towels or coffee filters) i’m seeing folks making them for neighbors &amp; others who need help, or are overwhelmed or less able to diy.",2020-04-18 16:36:13+00:00,,#facemasks,1251550107692150784,,https://twitter.com/Gail_G_Scott/status/1251550107692150784,0,0,Gail_G_Scott,
,2020-04-18 16:30:08+00:00,,,1251548578910294021,,https://twitter.com/Gail_G_Scott/status/1251548578910294021,2,1,Gail_G_Scott,
,2020-04-18 16:29:45+00:00,,,1251548480532811778,,https://twitter.com/Gail_G_Scott/status/1251548480532811778,1,0,Gail_G_Scott,
,2020-04-18 16:27:10+00:00,,,1251547833062363137,,https://twitter.com/Gail_G_Scott/status/1251547833062363137,1,0,Gail_G_Scott,
"most people do have to make their own clothfacemasks , considering the gaps in supply right now. but anyone who owns scissors &amp; an old t-shirt can make one. instructions here:",2020-04-18 16:25:37+00:00,,#ClothFaceMasks,1251547440316022784,,https://twitter.com/Gail_G_Scott/status/1251547440316022784,2,0,Napir9,https://www.cdc.gov/coronavirus/2019-ncov/prevent-getting-sick/diy-cloth-face-coverings.html
oh atlanta- little feat,2020-04-18 15:09:11+00:00,,,1251528208199057409,,https://twitter.com/Gail_G_Scott/status/1251528208199057409,0,0,abefromanohio,
"or is their goal to employ more new staff at pt vs ft hours to spend less on benefits, continuing to subsidize a workforce with taxpayer dollars? (via low wages that require workers to still use safety net services: medicaid, food stamps, etc.)",2020-04-18 13:28:07+00:00,,,1251502774237487104,,https://twitter.com/Gail_G_Scott/status/1251502774237487104,1,0,nanainbyron,
"corey, our local jails are saying that they can only “encourage, not require” staff to get (free) covid19 testing —“for hr reasons”. (testing is not available on-site during workday yet, either.) once capacity ramps up, what info can i share w/them re: *mandated* tests?",2020-04-18 13:12:47+00:00,,#COVID19,1251498914630578177,,https://twitter.com/Gail_G_Scott/status/1251498914630578177,0,0,coreysdavis,
so sorry. be gentle with yourself & forgive yourself. your children will not remember this episode! they will remember the bigger picture of the loving parent you are. ,2020-04-17 21:52:04+00:00,,,1251267209520873474,,https://twitter.com/Gail_G_Scott/status/1251267209520873474,0,0,thatnrselife,
"asking your employee’s spouse to sign a nda is super odd & aggressive. re: after killing investigation, bloomberg news sought to silence reporter's wife : npr",2020-04-17 15:57:20+00:00,,,1251177935941312515,,https://twitter.com/Gail_G_Scott/status/1251177935941312515,1,0,,https://www.npr.org/2020/04/14/828565428/bloomberg-news-killed-investigation-fired-reporter-then-sought-to-silence-his-wi
"yes, link doesn’t work for me either. can you cite the paper you are quoting? thanks!",2020-04-17 15:17:21+00:00,,,1251167875685142528,,https://twitter.com/Gail_G_Scott/status/1251167875685142528,1,0,billkinkle,
"yep, & the 3 badass journalists who did the reporting on this were at  https://twitter.com/nickmiroff/status/1250572584317526017?s=21",2020-04-17 15:00:01+00:00,,,1251163514456150016,@washingtonpost,https://twitter.com/Gail_G_Scott/status/1251163514456150016,0,0,erinbiba,"https://twitter.com/nickmiroff/status/1250572584317526017?s=21,https://twitter.com/NickMiroff/status/1250572584317526017"
“i have to decide where in my life i can hold onto physical closeness: home or the ed. do i need to self-quarantine...to protect my family...” ⁦⁩ on ed staff facing decisions they’ve never had to worry about before.,2020-04-17 14:43:12+00:00,,,1251159279710560263,@PEMammen,https://twitter.com/Gail_G_Scott/status/1251159279710560263,0,0,,https://www.inquirer.com/opinion/commentary/coronavirus-emergency-doctors-self-isolation-essential-workers-20200416.html
 ,2020-04-16 21:15:42+00:00,,,1250895666416664582,@Rogue_RN @NationalSober,https://twitter.com/Gail_G_Scott/status/1250895666416664582,1,0,LauraHoge,
"agree: some pharmacists do treat pain patients badly. reducing discrimination &amp; stigma is top goal of prof’s like dr hill. providing info re: oud &amp; pain “together” makes sense *precisely* to distinguish btwn them. specific content feedback= , but objecting to structure? ",2020-04-16 21:13:07+00:00,,#discrimination #stigma #OUD #pain,1250895019331981314,,https://twitter.com/Gail_G_Scott/status/1250895019331981314,2,0,NitaGhei,
"imho overdose methadone data was largely pain not *stable* otp patients. isn’t the criticsm of take-home methadone—less possible problematic use by the patient, &amp; more: diversion/use by others? (&amp;/or accidental exposure risk to family members/children in home?)",2020-04-16 17:27:06+00:00,,#methadone,1250838140631343105,,https://twitter.com/Gail_G_Scott/status/1250838140631343105,2,0,ztalbott,
thank you     for your impactful journalism covid19 housing evictionban,2020-04-16 16:31:21+00:00,,#COVID19 #housing #evictionban,1250824108213968896,@propublica @JeffErnsthausen @emsimani @JustinElliott,https://twitter.com/Gail_G_Scott/status/1250824108213968896,0,0,JustinElliott,https://twitter.com/JustinElliott/status/1250752795629826050
"ugh. didn’t see the fb post, but sadly, the chronic pain “discussion” space seems so polarized now w/trolling & vitriol. *any* clinical resources can get attacked. we need more oud &amp; pain clinical ed, so don’t let it discourage you!",2020-04-16 15:37:10+00:00,,#OUD,1250810474712707072,,https://twitter.com/Gail_G_Scott/status/1250810474712707072,2,0,HillPharmD,
or lunch or dinner. isolating at home requires so much chocolate.,2020-04-16 13:53:09+00:00,,,1250784295393910787,,https://twitter.com/Gail_G_Scott/status/1250784295393910787,1,0,raulpacheco,
so very sorry for your loss ,2020-04-15 22:25:56+00:00,,,1250550955894079489,,https://twitter.com/Gail_G_Scott/status/1250550955894079489,0,0,SaminaChaudhr12,
what now? aerial spraying? what does that have to do with viruses?,2020-04-14 20:31:52+00:00,,,1250159861599526913,,https://twitter.com/Gail_G_Scott/status/1250159861599526913,1,0,Dianne_RD,
" in lancaster pa on 4/12, employees were not wearing facemasks, along with ~half of the shoppers. there were children running in the aisles &amp; people shopping in family groups (&amp; no facemasks.) do better wegman’s to set rules for safety! covid19",2020-04-14 14:44:30+00:00,,#facemasks #COVID19,1250072443487752192,@Wegmans,https://twitter.com/Gail_G_Scott/status/1250072443487752192,1,0,PAHealthDept,https://twitter.com/PAHealthDept/status/1250031045879062528
so sorry for your loss ,2020-04-14 04:32:28+00:00,,,1249918419509678081,,https://twitter.com/Gail_G_Scott/status/1249918419509678081,0,0,lynnv378,
very sorry for your loss ,2020-04-14 02:45:03+00:00,,,1249891388772225026,,https://twitter.com/Gail_G_Scott/status/1249891388772225026,0,0,DrRobinStevens,
this is terrible. is there a legislative fix?,2020-04-14 01:08:44+00:00,,,1249867150099189763,,https://twitter.com/Gail_G_Scott/status/1249867150099189763,0,0,jameskzeigler,
"’s closure of pa liquor stores causes a health hazard due to influx of pa residents driving to ohio, per gov. dewine. this was predictable!! publichealth &amp; harmreduction experts have repeatedly criticized this policy misstep.",2020-04-14 01:02:39+00:00,,#publichealth #harmreduction,1249865617727016960,@GovernorTomWolf,https://twitter.com/Gail_G_Scott/status/1249865617727016960,1,0,PatriotNews,https://twitter.com/PatriotNews/status/1249807185116348418
very sorry for your loss ,2020-04-14 00:44:54+00:00,,,1249861150566690817,,https://twitter.com/Gail_G_Scott/status/1249861150566690817,0,0,MegWolitzer,
 ,2020-04-14 00:39:53+00:00,,,1249859890853687296,,https://twitter.com/Gail_G_Scott/status/1249859890853687296,0,0,joshtpm,
so very sorry ,2020-04-13 20:30:40+00:00,,,1249797172511547394,,https://twitter.com/Gail_G_Scott/status/1249797172511547394,0,0,poppyculture181,
 ,2020-04-13 12:21:46+00:00,,,1249674136592449537,,https://twitter.com/Gail_G_Scott/status/1249674136592449537,0,0,NonprofitAF,https://twitter.com/NonprofitAF/status/1249587680788090880
so very sorry ,2020-04-12 16:43:31+00:00,,,1249377618312466434,,https://twitter.com/Gail_G_Scott/status/1249377618312466434,0,0,ChrisRen1701,
so very sorry ,2020-04-12 16:43:05+00:00,,,1249377510439170050,,https://twitter.com/Gail_G_Scott/status/1249377510439170050,0,0,txvoodoo,
so sorry for your loss. ,2020-04-12 16:42:48+00:00,,,1249377437240233984,,https://twitter.com/Gail_G_Scott/status/1249377437240233984,0,0,jandersUF,
i like the idea of supporting usps & each other by buying stamps online & sending more letters to family & friends (& encouraging kids to do that too.) ,2020-04-12 16:38:00+00:00,,,1249376232678047746,,https://twitter.com/Gail_G_Scott/status/1249376232678047746,1,0,SarcasticBride,https://twitter.com/SarcasticBride/status/1249172111278723072
ouch!!!,2020-04-12 16:30:19+00:00,,,1249374298919362563,,https://twitter.com/Gail_G_Scott/status/1249374298919362563,0,0,bethanyhallam,
resist,2020-04-11 23:21:33+00:00,,,1249115400496873472,,https://twitter.com/Gail_G_Scott/status/1249115400496873472,0,0,LadyOcciput,
 ,2020-04-11 22:52:27+00:00,,,1249108076906635265,,https://twitter.com/Gail_G_Scott/status/1249108076906635265,0,0,Mark_Shriver,
"everything said here re: nursing homes, including underreporting to date of the true incidence, and ineffective reaponse, is also true for prisons & jails.",2020-04-11 19:49:54+00:00,,,1249062134799048705,,https://twitter.com/Gail_G_Scott/status/1249062134799048705,0,0,ashdgandhi,
find a neighbor who has some & will share. not aware of any “tequila distilleries.”,2020-04-11 17:55:57+00:00,,,1249033462214004736,,https://twitter.com/Gail_G_Scott/status/1249033462214004736,0,0,JosephJaafari,
congratulations doctor! ,2020-04-09 18:04:46+00:00,,,1248310903482863618,,https://twitter.com/Gail_G_Scott/status/1248310903482863618,0,0,william_goedel,
administration blocks publichealth officials from being interviewed on cnn shows (to try to force cnn to air full 2 hour plus trump covid19 “briefings” again.) ,2020-04-09 17:30:53+00:00,,#publichealth #COVID19,1248302376445972481,,https://twitter.com/Gail_G_Scott/status/1248302376445972481,0,0,,https://www.cnn.com/2020/04/09/media/pence-office-tv-bookings-coronavirus/index.html
"...except when generic mfgs work together to lobby for the group’s benefit. per , which linked to reporting below from sludge: https://twitter.com/crewcrew/status/1248098333173915648?s=21 https://twitter.com/crewcrew/status/1248098333173915648",2020-04-09 15:42:31+00:00,,,1248275106218029057,@CREWcrew,https://twitter.com/Gail_G_Scott/status/1248275106218029057,0,0,Gail_G_Scott,"https://twitter.com/crewcrew/status/1248098333173915648?s=21,https://twitter.com/CREWcrew/status/1248098333173915648"
"yep. branded vs. generic will always be the difference re: advocacy, regulatory navigation, and funding for any new uses.",2020-04-09 14:17:59+00:00,,,1248253833366712321,,https://twitter.com/Gail_G_Scott/status/1248253833366712321,1,0,jimboo92,
people w/alcohol dependence/alcohol use disorder may not find beer/wine sufficient to avoid withdrawal (vs. higher proof liquor)or be able to access online. liquor store closures skew access to just those w/$$--just like cannabis prohibition. harmreduction = publichealth,2020-04-09 14:10:48+00:00,,#harmreduction #publichealth,1248252023880978433,,https://twitter.com/Gail_G_Scott/status/1248252023880978433,0,0,indiggio,
"the misguided decision to close pa liquor stores is on brand for ⁦⁩’s administration, which has failed to stand up &amp; be counted on harmreduction. syringe service programs are still illegal here fyi. publichealth healthpolicy",2020-04-09 02:23:45+00:00,,#harmreduction #publichealth #healthpolicy,1248074087047614464,@GovernorTomWolf,https://twitter.com/Gail_G_Scott/status/1248074087047614464,0,0,,https://blogs.scientificamerican.com/observations/yes-liquor-stores-are-essential-businesses/
so sorry for your loss. sincere condelences to your family. ,2020-04-09 02:00:30+00:00,,,1248068235859300357,,https://twitter.com/Gail_G_Scott/status/1248068235859300357,0,0,kristinlynae_,
agree w/kate.,2020-04-07 23:14:35+00:00,,,1247664096503312386,,https://twitter.com/Gail_G_Scott/status/1247664096503312386,0,1,billkinkle,https://www.justice.gov/crt/how-file-complaint
"glad you & your physician agreed that you should do what’s best for *your* health! i believe that u.s. pmps will revise their outdated protocols & move to individualized care plans. (because what choice will they have, when people like you have the courage to advocate?!) ",2020-04-07 15:58:06+00:00,,,1247554250198130688,,https://twitter.com/Gail_G_Scott/status/1247554250198130688,1,0,billkinkle,
so sorry evan. condolences to your family ,2020-04-07 01:43:21+00:00,,,1247339146340896769,,https://twitter.com/Gail_G_Scott/status/1247339146340896769,0,0,HorsePowerEv,
"for example, what is latest w/covid19 &amp; detainees at lancaster prison? publichealth experts are frantic about jails becoming ""kill boxes"" but it's been 10 days since an update on our county jail? prisonhealth is community health.   ",2020-04-06 19:26:31+00:00,,#COVID19 #Publichealth #Prisonhealth,1247244312720654339,@LancasterOnline @HStaufferLNP @CarterLNP,https://twitter.com/Gail_G_Scott/status/1247244312720654339,0,0,,
"hey  -many of your ""staff"" articles are now missing bylines? please report on of your staff laid off ( i.e. trustingnews) sad (&amp; worried) about less coverage of gov't &amp; local covid19 response. we need good journalism more now  ",2020-04-06 19:14:47+00:00,,#trustingnews #COVID19,1247241357946740744,@LancasterOnline @SuzCassidyLNP @TomMurse,https://twitter.com/Gail_G_Scott/status/1247241357946740744,1,0,,
unlikely that people will drive to buy  tickets if  &amp;  made a smart publichealth policy decision &amp; stopped lottery sales to deter non-urgent travel. however people do ignore stayhome orders for alcohol.,2020-04-06 18:48:27+00:00,,#publichealth #StayHome #StayHome,1247234731521032193,@PALottery @GovernorTomWolf @SecretaryLevine,https://twitter.com/Gail_G_Scott/status/1247234731521032193,0,0,,https://www.pennlive.com/business/2020/04/border-bleed-pennsylvanians-are-making-tracks-to-get-their-booze-during-fine-wine-good-spirits-stores-coronavirus-closure.html
"baffling that  ticket sales are *urgent* to public health, so it's fine for people to make special trips to buy them daily. meanwhile, against all harmreduction &amp; substanceusedisorder expert advice, liquor stores are closed (online is not access for poorest citizens.)",2020-04-06 18:41:26+00:00,,#harmreduction #substanceusedisorder,1247232969204469761,@PALottery,https://twitter.com/Gail_G_Scott/status/1247232969204469761,1,2,,
"this contradicts 's ""urgent need"" message; people do travel to buy *only*  tickets at c-stores. yet they won't get ""lottery withdrawal,"" unlike those crossing state lines to get liquor so they won't go into alcohol withdrawal.",2020-04-06 18:33:15+00:00,,,1247230906168991745,@SecretaryLevine @PALottery,https://twitter.com/Gail_G_Scott/status/1247230906168991745,1,0,,https://www.inquirer.com/news/delaware-travel-ban-police-liquor-stores-open-pennsylvania-alcohol-sales-20200403.html
": lottery ticket sales support senior services, &amp; are sold in convenience stores, which are essential businesses. that's why they are still being sold. (4/6, press conf.2 pm) how is this a publichealth argument? ",2020-04-06 18:23:28+00:00,,#publichealth,1247228443680477184,@GovernorTomWolf @SecretaryLevine,https://twitter.com/Gail_G_Scott/status/1247228443680477184,1,0,Gail_G_Scott,https://twitter.com/Gail_G_Scott/status/1246529289471877120?s=20
if your hospital policies require you to make outdated cookie-cutter rx choices for sick kids (of a drug you aren’t “a fan of” & a cochrane review doesn’t support) then time to update them! back to the point. you: plaquenil for covid is like tamiflu for flu in ‘09!! me: ,2020-04-06 01:03:33+00:00,,#COVID,1246966740245938182,,https://twitter.com/Gail_G_Scott/status/1246966740245938182,0,0,HandtevyMD,
"you said that if you rx plaquenil prophylactically at the population level (for your group of emts) it is just like tamiflu in 2009, which was also stockpiled & recommended for influenza outbreaks (w/insufficient evidence.) get the irony?",2020-04-06 00:27:02+00:00,,,1246957550987350016,,https://twitter.com/Gail_G_Scott/status/1246957550987350016,0,0,HandtevyMD,https://www.theguardian.com/business/2014/apr/10/tamiflu-saga-drug-trials-big-pharma
"arguing that tamiflu is “standard of care” is ironic, dr andtevy, since it’s not, and that drug was a case study in biased, poorly designed trials, hidden data, &amp; poor regulatory review.cochrane reviews 2014: https://www.cochranelibrary.com/content?templatetype=full&amp;urltitle=/cdsr/doi/10.1002/14651858.cd008965.pub4&amp;doi=10.1002/14651858.cd008965.pub4&amp;type=cdsr&amp;contentlanguage=&amp;highlightabstract=tamiflu",2020-04-06 00:14:02+00:00,,,1246954282227838978,,https://twitter.com/Gail_G_Scott/status/1246954282227838978,1,0,HandtevyMD,https://www.cochranelibrary.com/content?templateType=full&urlTitle=/cdsr/doi/10.1002/14651858.CD008965.pub4&doi=10.1002/14651858.CD008965.pub4&type=cdsr&contentLanguage=&highlightAbstract=tamiflu
"australian liquorice beats both (despite living a few miles from the  factory in pa, which scents the air with fake strawberry, i stand firm on this.) sorry y&amp;s candies/hershey co.",2020-04-05 23:18:39+00:00,,,1246940341481152514,@TWIZZLERS,https://twitter.com/Gail_G_Scott/status/1246940341481152514,0,0,ASlavitt,
really? what’s wrong with stirring it?,2020-04-05 00:26:23+00:00,,,1246595000626032640,,https://twitter.com/Gail_G_Scott/status/1246595000626032640,1,0,LadySMK,
 so shocked &amp; sorry. deepest condolences.,2020-04-04 20:14:17+00:00,,,1246531557055238144,,https://twitter.com/Gail_G_Scott/status/1246531557055238144,0,0,Mark_Shriver,
i met maeve a number of times when she was young girl. so very sorry for this tragic loss. deepest condolences. ,2020-04-04 20:10:00+00:00,,,1246530478540292098,,https://twitter.com/Gail_G_Scott/status/1246530478540292098,0,0,RepJoeKennedy,
"is there a more non-essential business in a pandemic- than state lotteries? seriously, why, governors, haven’t you shut them all down?! my relative, working for an “essential” store in ohio, has people coming in just to play the lottery instead of stayinghome &amp; he’s furious.",2020-04-04 20:05:16+00:00,,#Ohio #stayinghome,1246529289471877120,,https://twitter.com/Gail_G_Scott/status/1246529289471877120,1,3,,
i bet *everyone* is feeling this kind of anxiety! perhaps some of us can name it better than others? a symptom of stress for me is difficulty concentrating/getting tasks done. hang in there! time out in fresh air (& hopefully ) helps for me.,2020-04-04 13:25:01+00:00,,,1246428562657288192,,https://twitter.com/Gail_G_Scott/status/1246428562657288192,1,0,mynameisrachel,
"wow, you should have had a copy of the board order & access to all the info in your file, whether or not they endorse your application for reinstatement. the opaque nature of pmp’s is just hard to accept or understand. reformpmps",2020-04-03 23:17:40+00:00,,#reformPMPs,1246215320945205248,,https://twitter.com/Gail_G_Scott/status/1246215320945205248,0,0,billkinkle,
i’m so sorry bill. was hoping there would be flexibility during this crisis. hard to believe there is not. is it possible the board wouldn’t agree with pnap?,2020-04-03 23:05:03+00:00,,,1246212144884002822,,https://twitter.com/Gail_G_Scott/status/1246212144884002822,3,0,billkinkle,
"fyi, spotted in  on 4/2: osha is “taking a hands-off approach to thd coronavirus safety environment.” (paywall) https://www.wsj.com/articles/u-s-plant-workplaces-emerge-as-coronavirus-battlegrounds-11585775230",2020-04-03 20:08:21+00:00,,,1246167675405033472,@WSJ,https://twitter.com/Gail_G_Scott/status/1246167675405033472,0,0,LadyOcciput,https://www.wsj.com/articles/u-s-plant-workplaces-emerge-as-coronavirus-battlegrounds-11585775230
"personal & powerful, because of your vulnerability. ",2020-04-03 16:19:19+00:00,,,1246110038319673345,,https://twitter.com/Gail_G_Scott/status/1246110038319673345,1,0,BaDorfman,
yes. losing job =qualifying event for millions w/employer-provided health insurance. so they camn use aca exchanges to find a new plan (vs. pay cobra rates to keep old plan) but premiums still a challenge. those that qualify (esp. in expansion states) can apply for medicaid.,2020-04-03 12:46:46+00:00,,,1246056548608151553,,https://twitter.com/Gail_G_Scott/status/1246056548608151553,0,0,fly1nwa11,
uk addiction post-docs,2020-04-03 12:24:01+00:00,,,1246050822888263683,,https://twitter.com/Gail_G_Scott/status/1246050822888263683,0,0,SSA_Addiction,https://twitter.com/SSA_Addiction/status/1246048305303425025
words fail me.,2020-04-02 23:54:47+00:00,,,1245862272473284608,,https://twitter.com/Gail_G_Scott/status/1245862272473284608,0,0,atrupar,https://twitter.com/atrupar/status/1245852517474295809
"thank you, capt. brett crozier, for demanding action for those under your command who were sick. i don’t doubt that you did go up the command chain 1st. sadly whistleblowing has a cost, but it also probably saved some of your sailors’ lives.",2020-04-02 23:48:35+00:00,,#whistleblowing,1245860714440314880,,https://twitter.com/Gail_G_Scott/status/1245860714440314880,0,0,,https://www.nbcnews.com/news/military/navy-expected-relieve-captain-who-raised-alarm-about-covid-19-n1175351
"yes, wtaf. speaks to corporate /management cluelessness about how their workers want to be treated.",2020-04-02 23:30:25+00:00,,,1245856141638131712,,https://twitter.com/Gail_G_Scott/status/1245856141638131712,1,0,LadyOcciput,
" when our kids were young teens the four of them did a formal presentation, with a poster/ visual aids, for my spouse &amp; me on why we needed to get a (new) dog.",2020-04-02 21:55:12+00:00,,,1245832177205612545,,https://twitter.com/Gail_G_Scott/status/1245832177205612545,0,0,pamelacolloff,
"almost 40 years later, my family member is still angry at a pastor that said “it was god’s plan” at my 19-year old brother’s funeral. you don’t have to know what to say, but you should know what not to say. grief i’m very sorry for your loss. ",2020-04-02 16:54:39+00:00,,#grief,1245756541971714051,,https://twitter.com/Gail_G_Scott/status/1245756541971714051,4,2,ShannonDingle,
 ,2020-04-02 08:37:42+00:00,,,1245631482359496707,,https://twitter.com/Gail_G_Scott/status/1245631482359496707,0,0,MHPoison1,
"dr fink, workers in non-medical essential businesses (warehouses, grocery or c-stores) often *can’t* be physically-distant all day long w/colleagues & customers & do their jobs. don’t you agree that surgical-type facemasks have *some* benefit for them?",2020-04-01 13:19:44+00:00,,,1245340069654863874,,https://twitter.com/Gail_G_Scott/status/1245340069654863874,1,0,DavidSFink,
