text,date,geo,hashtags,tweet_id,mentions,permalink,replies,retweets,replies_to,mentioned_urls
"yaassss! here we go!  at  is bout that action extensive efforts underway to expand moud for those in our justice system - stay tuned, next event 6/29 with leaders from across nation. let's go  and  , bring it!",2020-06-17 18:43:38+00:00,,#MOUD,1273325449167482883,@oneillinstitute @GeorgetownLaw @ReginaLabelle @ShellyWeizman,https://twitter.com/icmyserenity/status/1273325449167482883,1,1,ReginaLabelle,https://twitter.com/ReginaLabelle/status/1273324342273810438
support  !,2020-06-17 18:37:01+00:00,,,1273323780513902595,@HopeAcademyRHS,https://twitter.com/icmyserenity/status/1273323780513902595,0,0,HopeAcademyRHS,https://twitter.com/HopeAcademyRHS/status/1273255979891798016
this is everything,2020-06-17 18:35:13+00:00,,,1273323330968399872,,https://twitter.com/icmyserenity/status/1273323330968399872,0,0,Recovery_ABrown,https://twitter.com/Recovery_ABrown/status/1273314648910159872
people who really want proper syringe disposal support syringe services because those enrolled in ssp are 3x more likely to dispose of syringes properly. deduction time- if you don't support ssp clearly you dont support proper disposal syringes. ,2020-06-15 22:35:24+00:00,,,1272658995564752902,,https://twitter.com/icmyserenity/status/1272658995564752902,0,1,HRCzarPHL,https://twitter.com/HRCzarPHL/status/1272601350367477766
"whiteprivilege - the story of what happens to most of white folks during their life and while they make their ""mistakes""",2020-06-15 20:25:27+00:00,,#WhitePrivilege,1272626293163638784,,https://twitter.com/icmyserenity/status/1272626293163638784,0,1,KristaVernoff,https://twitter.com/KristaVernoff/status/1272561179462754304
"prisons that charge $7 to load $20 on someone's account, agencies that seize property without crime/conviction... should i stop there or keep going?",2020-06-15 16:07:21+00:00,,,1272561340016726016,,https://twitter.com/icmyserenity/status/1272561340016726016,0,8,LeoBeletsky,https://twitter.com/LeoBeletsky/status/1272433809229635584
it was right when i was becoming super aware of my privilege- haner hernandez made me feel nice and uncomfortable. it was the most impactful session i'd attended in a long time,2020-06-15 12:05:43+00:00,,,1272500530493952003,,https://twitter.com/icmyserenity/status/1272500530493952003,0,0,icmyserenity,
"i agree the ""recovery"" movement lacks black voices. in every state i'm aware of- the path to recovery for white folks is wildly different than black/brown folks. did you know  had two keynotes on social equity last year at nat conf? my whole team learned a lot",2020-06-15 11:59:43+00:00,,,1272499020527796227,@FACESandVOICES,https://twitter.com/icmyserenity/status/1272499020527796227,1,0,BrookeM_Feldman,
,2020-06-14 14:55:25+00:00,,,1272180852353642497,,https://twitter.com/icmyserenity/status/1272180852353642497,0,0,jsexton76,
"this,  flooding communities with naloxone from border to border",2020-06-13 12:32:06+00:00,,,1271782397701492736,@overdoselifelin,https://twitter.com/icmyserenity/status/1271782397701492736,0,0,PortageRecovery,https://twitter.com/PortageRecovery/status/1271545831783612418
"due to how siloed the entire treatment system is from general healthcare system, really not surprising that we have this issue",2020-06-11 15:39:31+00:00,,,1271104786738405376,,https://twitter.com/icmyserenity/status/1271104786738405376,0,0,davidewlucas,
"no i have not, other than its overall ineffectiveness. even insurance companies would say how inadequate it is. they dont like paying for ineffective services either- nobody thinks its good except providers collecting $over and over for poor services",2020-06-11 15:06:01+00:00,,,1271096353259761673,,https://twitter.com/icmyserenity/status/1271096353259761673,1,0,davidewlucas,
"there isnt an ""all of the above"" ",2020-06-11 14:56:48+00:00,,,1271094034937851909,,https://twitter.com/icmyserenity/status/1271094034937851909,1,0,davidewlucas,
peer2peer responder2responder peer supports are vital and our first responders have been doing it for some time,2020-06-11 14:36:02+00:00,,#peer2peer #responder2responder,1271088810806456320,,https://twitter.com/icmyserenity/status/1271088810806456320,1,0,HalleckRachel,https://twitter.com/HalleckRachel/status/1271083845614534657
"damn right it is. several dollars per minute for phone calls is looting families. why arent we upset about that? lemme guess, they deserve it. robbing a marginalized population is what we allow to happen",2020-06-10 19:51:03+00:00,,#looting,1270805696729296902,,https://twitter.com/icmyserenity/status/1270805696729296902,0,0,kfnorris09,https://twitter.com/kfnorris09/status/1270801536034263043
"$7 charge to add $20 to someone's account in prison- why dont people get as upset about this? looting lemme guess, they ""deserve it""",2020-06-10 18:26:00+00:00,,#looting,1270784294357794821,,https://twitter.com/icmyserenity/status/1270784294357794821,1,5,LeoBeletsky,https://twitter.com/LeoBeletsky/status/1270779441753419781
who makes decisions on number of polling places? looks like reduced polling places and lack if training on new systems contributed,2020-06-10 14:23:49+00:00,,,1270723347924443136,,https://twitter.com/icmyserenity/status/1270723347924443136,2,0,JoeyFox1,
"yo,  what's the secretary of state's role in state elections? i know daily operations are with county, how does that position impact",2020-06-10 11:36:12+00:00,,,1270681166971101186,@JoeyFox1,https://twitter.com/icmyserenity/status/1270681166971101186,2,0,JoeyFox1,
"whoa...this has been unattainable forever. this has allowed bad folks to keep jobs with no oversight or accountability. whoever thinks protests dont work, think again!",2020-06-09 19:45:31+00:00,,,1270441918623821832,,https://twitter.com/icmyserenity/status/1270441918623821832,0,1,LegalAidNYC,https://twitter.com/LegalAidNYC/status/1270426824573685762
 ,2020-06-09 13:26:28+00:00,,,1270346526284447744,,https://twitter.com/icmyserenity/status/1270346526284447744,0,0,KirkFreemanLaw,
,2020-06-08 22:22:36+00:00,,,1270119060894670848,@cnelly4life,https://twitter.com/icmyserenity/status/1270119060894670848,0,0,INBMV,
this is how we end up with terrible outcomes for non violent interaction (like georgefloyd counterfeit $20) that leads to someone dying. basic human rights out window bc culture dictates focus on enforcement action,2020-06-08 20:36:24+00:00,,#GeorgeFloyd,1270092333560795137,,https://twitter.com/icmyserenity/status/1270092333560795137,0,0,Chris4Indy,https://twitter.com/Chris4Indy/status/1270087261179215872
"not being combative, it was subconscious and is for many. automatically think of violence with drugs or mh",2020-06-08 20:24:37+00:00,,,1270089371249709058,,https://twitter.com/icmyserenity/status/1270089371249709058,0,0,66lizzys,
why would someone mention violence for mental health calls?,2020-06-08 20:23:28+00:00,,,1270089080806785024,,https://twitter.com/icmyserenity/status/1270089080806785024,1,0,66lizzys,
this is stigma baked into consciousness. the belief that bc someone has a mental health/addiction issue that they're automatically violent of have weapons...,2020-06-08 20:12:02+00:00,,,1270086201735655424,,https://twitter.com/icmyserenity/status/1270086201735655424,1,0,66lizzys,https://twitter.com/66lizzys/status/1269894777228587011
"again- leo dont want to respond and most arent trained. we have professionals trained to do this and want to. some reallocating of responsibility will go a long way. congrats, you do have to do what you dont want to do anymore! and merry xmas to mh professional- you get to do it!",2020-06-08 20:09:57+00:00,,,1270085680161370116,,https://twitter.com/icmyserenity/status/1270085680161370116,0,0,MattHaneySF,https://twitter.com/MattHaneySF/status/1269762268679426048
"this...leo doesnt need to respond to homelessness. they dont like to, dont want to and arent trained to. we have folks that specialize in this - let's have them respond. its a win for everyone!",2020-06-08 20:07:19+00:00,,,1270085015615897600,,https://twitter.com/icmyserenity/status/1270085015615897600,0,0,MattHaneySF,https://twitter.com/MattHaneySF/status/1269763400411693057
"i guess ppl need to be more specific when they say defund police. my understanding is the need to reallocate some funds to social programs -like response to things like drug calls, mental health & ods that cops arent trained for. rev  who wants to privatize leo?",2020-06-08 19:53:46+00:00,,,1270081607337041920,@charlesharriso5,https://twitter.com/icmyserenity/status/1270081607337041920,0,0,charlesharriso5,https://twitter.com/charlesharriso5/status/1269979365644828672
rip stan. i've never been in a room or training that stan didnt talk about need for equality and culturally appropriate approaches for those with sud. criminal justice too - he was a titan with his advocacy,2020-06-08 17:52:43+00:00,,#RIP,1270051141133438978,,https://twitter.com/icmyserenity/status/1270051141133438978,1,1,IMHC_Indiana,https://twitter.com/IMHC_Indiana/status/1269845645055143938
this! supporting xthexwaiver does not equal wanting no education. education for bupe should be done in med school like every other medicine!,2020-06-08 16:14:50+00:00,,#xthexwaiver,1270026508640362501,,https://twitter.com/icmyserenity/status/1270026508640362501,0,0,LNelsonMD,https://twitter.com/LNelsonMD/status/1269971224207265792
"glad to have you on! not sure indy twitter is ready for all that , but i'm here for all that energy - welcome!",2020-06-08 12:58:29+00:00,,,1269977095784083457,,https://twitter.com/icmyserenity/status/1269977095784083457,1,0,Chris4Indy,
"and if you need an intro, check out this fb live  just dropped https://m.facebook.com/story.php?story_fbid=10107947775021950&amp;id=934884. tremendous insight into a number of areas. law enforcement in indy, culture, and more subject matter expertise...",2020-06-08 12:56:29+00:00,,,1269976593285480450,@Chris4Indy,https://twitter.com/icmyserenity/status/1269976593285480450,0,0,icmyserenity,"https://m.facebook.com/story.php?story_fbid=10107947775021950&id=934884,https://twitter.com/icmyserenity/status/1269963749508743168"
"yo- i need folks in my life that are about that action, bring and have range for all the worlds complexity &amp; nuance. grateful  is on this platform now, let's elevate this brothers voice &amp; support the change he will help bring. changethesystem blacklivesmatter",2020-06-08 12:05:27+00:00,,#ChangeTheSystem #blacklivesmatter #blacklivesmatter,1269963749508743168,@Chris4Indy,https://twitter.com/icmyserenity/status/1269963749508743168,0,0,,
this cannot go on. it'll will literally break a person mentally and is considered torture when done for more than a couple weeks. most in society of have no clue what this brings on people. measurable long term physiological effects...,2020-06-08 00:28:46+00:00,,,1269788423491063808,,https://twitter.com/icmyserenity/status/1269788423491063808,0,0,BlackAndPinkBos,https://twitter.com/BlackAndPinkBos/status/1269684146563092486
"damn, weve had us data on no cash bail for nearly 30 years and it took this long for states to catch up. safety threat should always determine incarceration not income or net worth. unfortunately, the latter is nearly always used",2020-06-07 13:49:27+00:00,,,1269627534397837314,,https://twitter.com/icmyserenity/status/1269627534397837314,1,0,EliNSavit,https://twitter.com/EliNSavit/status/1268390915816783878
saying someone is anti-police because they're anti-police brutality is like saying someone is anti-parent because they're anti child abuse. blacklivesmatter,2020-06-07 12:59:10+00:00,,#BlackLivesMatter #BlackLivesMatter,1269614878630830080,,https://twitter.com/icmyserenity/status/1269614878630830080,1,3,,
"so,  jas some updates to use of force policy for ....",2020-06-05 19:19:39+00:00,,,1268985855420649474,@IndyMayorJoe @IMPDnews,https://twitter.com/icmyserenity/status/1268985855420649474,0,0,AndrewSmithNews,https://twitter.com/AndrewSmithNews/status/1268985043608834054
"dont forget- this was covered up by all accounts until the video was leaked! police and prosecutors office were both okay with this. i used to think this type of stuff didnt happen, that people in these positions if authority must be ""good people"" - was so naive",2020-06-04 17:26:00+00:00,,,1268594867158036480,,https://twitter.com/icmyserenity/status/1268594867158036480,0,0,MeritLaw,https://twitter.com/MeritLaw/status/1268554702607835138
"this. give money to people to do the work who have been doing work. legal aid l, like  grantees. in indiana,  does amazing work",2020-06-03 14:43:35+00:00,,,1268191607695839233,@LSCtweets @inlegalsvc,https://twitter.com/icmyserenity/status/1268191607695839233,0,1,shannonmace,https://twitter.com/shannonmace/status/1268174530255687682
what is happening...,2020-06-02 21:38:27+00:00,,,1267933622419419136,,https://twitter.com/icmyserenity/status/1267933622419419136,0,0,GChernack,https://twitter.com/GChernack/status/1267904564516315136
"if ou are a, ""they must have done something to deserve it"" person, this is for you....disgusting clips from folks jacked up on adrenaline and taking it out on ppl in front of them....black ppl in front of them",2020-05-31 23:38:50+00:00,,,1267239144511598592,,https://twitter.com/icmyserenity/status/1267239144511598592,0,0,stevemullis,https://twitter.com/stevemullis/status/1266979219566989313
good folks doing good things....,2020-05-31 22:14:54+00:00,,,1267218018452602881,,https://twitter.com/icmyserenity/status/1267218018452602881,1,0,Edward_Holloran,https://twitter.com/Edward_Holloran/status/1267173239807188993
"how about more of this and less retreating to corners....this isnt binary, you can fight for social justice, eradicate police brutality and still support each other",2020-05-30 19:20:16+00:00,,,1266811685798580232,,https://twitter.com/icmyserenity/status/1266811685798580232,0,1,JasonKander,https://twitter.com/JasonKander/status/1266735093500051457
"wow,  &amp;  investing huge in recovery. not backing down during covid, doubling down! this project w , million dollar nalaxone challenge w , and more...thx!! , ,  ",2020-05-30 15:19:00+00:00,,,1266750967099404289,@FSSAIndiana @GovHolcomb @doverecovery @overdoselifelin @INDrugCzar @confectionsmd @HalleckRachel @Beckyb1545,https://twitter.com/icmyserenity/status/1266750967099404289,0,3,doverecovery,https://twitter.com/doverecovery/status/1266745197632925696
thanks ,2020-05-30 13:40:39+00:00,,,1266726216633069568,@Edward_Holloran,https://twitter.com/icmyserenity/status/1266726216633069568,0,0,Edward_Holloran,
as long as its not a knee on a football field...,2020-05-30 01:49:09+00:00,,,1266547161484931074,,https://twitter.com/icmyserenity/status/1266547161484931074,1,0,AttyAbdul,
this...,2020-05-30 01:47:21+00:00,,,1266546708080660485,,https://twitter.com/icmyserenity/status/1266546708080660485,0,0,MoenchKelly,https://twitter.com/MoenchKelly/status/1266527471714865152
"its devastating to see so many people speak up about tvs being stolen, but completely silent about someone being killed despite pleading they cannot breathe. we are in a terrible spot when ppl care more about electronics than humans beings dying",2020-05-29 23:01:18+00:00,,,1266504919563079680,,https://twitter.com/icmyserenity/status/1266504919563079680,0,2,,
looks like  and  are bringing the heat! looking forward to this event,2020-05-29 16:06:13+00:00,,,1266400463643172864,@WellnessIndiana @MikeThibideau,https://twitter.com/icmyserenity/status/1266400463643172864,0,2,bcuban,https://twitter.com/bcuban/status/1266369863519330304
bout time you came to hang out with us in indiana!,2020-05-29 16:04:50+00:00,,,1266400115281014786,,https://twitter.com/icmyserenity/status/1266400115281014786,0,0,bcuban,
"literally acting like ppl incarcerated done exist. surprise, these facilities/employees impact on community health! not to mention, ppl released daily into communities through state. again - just don't pretend like we care. own the fact society doesnt treat like humans beings",2020-05-27 22:54:52+00:00,,,1265778527422615558,,https://twitter.com/icmyserenity/status/1265778527422615558,0,0,ChatfieldKate,https://twitter.com/ChatfieldKate/status/1265641635905298433
"addxn medicine nearly non existent. if cardio admit, a specialist w all the ducklings- resident, students, etc. all learning/practicing. addxn admit - rarely get addx doc or have the addxn residency/addxn med students learning  working on it though, right ?",2020-05-26 13:32:49+00:00,,,1265274695282241536,@ACAAMorg @timkbrennan,https://twitter.com/icmyserenity/status/1265274695282241536,0,1,triciaewrightmd,
,2020-05-25 19:45:37+00:00,,,1265006123440050176,@iaprss,https://twitter.com/icmyserenity/status/1265006123440050176,0,0,RDashford,
we're pretty thankful for you too,2020-05-22 22:16:41+00:00,,,1263956978956750848,,https://twitter.com/icmyserenity/status/1263956978956750848,1,0,HalleckRachel,
leadership,2020-05-22 17:41:32+00:00,,#leadership,1263887732620898313,,https://twitter.com/icmyserenity/status/1263887732620898313,0,0,RDashford,https://twitter.com/RDashford/status/1263812041455874048
"its reality - this is hard.i fight for widespread bupe access pretty much daily. but, it is also currency, i would hate to see somebody die over fentanyl they bought with the bupe given at an ed, etc that they sold. this is a real life",2020-05-21 20:57:33+00:00,,,1263574676015587328,,https://twitter.com/icmyserenity/status/1263574676015587328,1,0,billkinkle,
"at least it makes sense now. theres only so many with such a terrible view that flies in face if all science. i'm up for debate, but not agenda that will inflict massive harm",2020-05-21 13:38:01+00:00,,,1263464065655099407,,https://twitter.com/icmyserenity/status/1263464065655099407,0,0,ZachWritesStuff,
this is scary...,2020-05-21 13:17:51+00:00,,,1263458988471078912,,https://twitter.com/icmyserenity/status/1263458988471078912,0,0,tmarshallmph,https://twitter.com/tmarshallmph/status/1263302464410804224
2020life,2020-05-20 15:51:37+00:00,,#2020life,1263135295710650368,,https://twitter.com/icmyserenity/status/1263135295710650368,0,0,Edward_Holloran,
"hep-c/hiv testing, access to recovery support services, food, civil legal aid and much much more. the name is actually misleading, it provides massive support for those who don't touch our system in typical fashion",2020-05-19 18:45:33+00:00,,,1262816683212890119,,https://twitter.com/icmyserenity/status/1262816683212890119,0,0,PAHarmReduction,https://twitter.com/PAHarmReduction/status/1262816009448284160
"correct. people/policy that do not support ssps support lead to more discarded syringes. those enrolled in ssp are more likely to properly dispose of syringes. so, if you don't want the made-up needle by the baby bottle, support your local ssp",2020-05-19 13:09:18+00:00,,,1262732059786829825,,https://twitter.com/icmyserenity/status/1262732059786829825,0,0,MyHarmReduction,https://twitter.com/MyHarmReduction/status/1262727676244250628
"i mean, if saving lives is your thing, i guess so ",2020-05-19 03:06:20+00:00,,,1262580317774364673,,https://twitter.com/icmyserenity/status/1262580317774364673,0,0,Beckyb1545,
how can any retail theft be worth someone possibly dying. clearly they are not a safety threat on a theft charge. and pregnant. anyone who thinks jail is a better alternative to anything has never been there...,2020-05-19 02:47:15+00:00,,,1262575519079567360,,https://twitter.com/icmyserenity/status/1262575519079567360,0,0,theappeal,https://twitter.com/theappeal/status/1261369255427141632
that's. my. governor https://twitter.com/govholcomb/status/1262381042268282886,2020-05-18 19:35:29+00:00,,,1262466860097900544,,https://twitter.com/icmyserenity/status/1262466860097900544,0,0,,https://twitter.com/GovHolcomb/status/1262381042268282886
wish every state had a governor office and  who supported ssps like indiana does- thanks doug! i can only hope that other states become as accepting as you all are. nextlevelrecovery,2020-05-18 18:16:57+00:00,,#NextLevelRecovery,1262447097485447171,@INDrugCzar,https://twitter.com/icmyserenity/status/1262447097485447171,0,1,INDrugCzar,https://twitter.com/INDrugCzar/status/1262445355528060929
"whoa!! $1 million in nalaxone!!! , ,  actions doing all the talking by getting life saving meds to families/communities. no better org to deliver than . 25,000 kits into to those who need most inthistogether nextlevelrecovery",2020-05-18 14:51:42+00:00,,#INthistogether #nextlevelrecovery,1262395441917964293,@GovHolcomb @INDrugCzar @FSSAIndiana @overdoselifelin,https://twitter.com/icmyserenity/status/1262395441917964293,0,0,INDrugCzar,https://twitter.com/INDrugCzar/status/1262382892627513344
"of note- while many are championing telehealth as solution to transportation issues and reaching rural places, it creates a new set of barriers. phones, tablets, and wifi should be able to be rx'd by provider as part of treatment delivery if needed",2020-05-18 12:55:12+00:00,,,1262366124718637057,,https://twitter.com/icmyserenity/status/1262366124718637057,1,3,DrAyanaJordan,https://twitter.com/DrAyanaJordan/status/1262321191693496322
the  always bringing - how lucky we are to have you in indiana,2020-05-15 17:59:06+00:00,,,1261355439196905473,@doverecovery,https://twitter.com/icmyserenity/status/1261355439196905473,2,1,doverecovery,https://twitter.com/doverecovery/status/1260641629523804165
"zero surprise. can justify it to ourselves however we want, but the reality is that we don't place the same value on the lives of those who are in our justice system",2020-05-14 17:45:49+00:00,,,1260989710912098307,,https://twitter.com/icmyserenity/status/1260989710912098307,0,0,angelaganote,https://twitter.com/angelaganote/status/1260973422450028547
this is my very definition of recovery...from trying to fit stuff in syringes to what can i fit in my taco skillet ,2020-05-14 13:03:13+00:00,,,1260918593077862402,,https://twitter.com/icmyserenity/status/1260918593077862402,0,0,traceyh415,https://twitter.com/traceyh415/status/1260759635088125953
"doesnt really mean anything. but, i believe ppl like  when he says it happens. i think its best not to use blanket assumptions in such a diverse group. also important to realize that there +/- of any big groups. good and bad med providers too. enjoyed the honest convo",2020-05-13 23:52:09+00:00,,,1260719511797485569,@billkinkle,https://twitter.com/icmyserenity/status/1260719511797485569,5,0,icmyserenity,
"was the case, i thought they were lying. i came to find out that some groups do treat ppl bad on meds, but its certainly not like that everywhere. if one mtg does it, then you know one mtg does it. i actually have never seen it and i've been to thousands - i realized that 2)",2020-05-13 23:48:28+00:00,,,1260718585690951681,,https://twitter.com/icmyserenity/status/1260718585690951681,1,0,icmyserenity,
"its important to note that this varies dramatically. i used to go back and forth bc i took my experience and applied it to all ts. ppl on my area are very accepting of meds, so i had never heard of someone being kicked out or treated bad. when i heard ppl on twitter say this 1)",2020-05-13 23:44:47+00:00,,,1260717656891678726,,https://twitter.com/icmyserenity/status/1260717656891678726,1,0,EFanningMadden,
"bill, that's one of the reasons you are the few people i engage with on this platform. truly open-minded and transparent in what is a very nuanced conversation. thank you for that",2020-05-13 18:57:57+00:00,,,1260645474429661184,,https://twitter.com/icmyserenity/status/1260645474429661184,0,0,billkinkle,
"perfectly highlights the stigma with addiction. normally when treatment is ineffective, we up the treatment. with addiction, we blame the patient when it doesn't work",2020-05-13 18:56:58+00:00,,,1260645225220853761,,https://twitter.com/icmyserenity/status/1260645225220853761,0,3,billkinkle,https://twitter.com/billkinkle/status/1260644467964440577
"we should all take a picture of this thread, we're having a nuanced conversation on twitter",2020-05-13 18:54:17+00:00,,,1260644553326882816,,https://twitter.com/icmyserenity/status/1260644553326882816,1,0,billkinkle,
i would say subset vs. small but whatever .,2020-05-13 18:52:40+00:00,,,1260644145766338560,,https://twitter.com/icmyserenity/status/1260644145766338560,2,0,billkinkle,
 we use terms like individual treatment plans etc but the reality is ppl get what that tx center offers which is usually limited -on both sides of the fence. most otp don't do naltrexone in the same way that many detoxes don't do buprenorphine/suboxone. both must be addressed,2020-05-13 18:50:52+00:00,,,1260643692311793664,,https://twitter.com/icmyserenity/status/1260643692311793664,1,0,billkinkle,
"strength based approaches, motivational int & stages of change can also apply to organizations. we don't expect people to change overnight, so why do we demand that orgs/groups of ppl do 180? should apply to orgs/groups just like it does ppl. after all orgs are made of ppl 2",2020-05-13 18:22:26+00:00,,,1260636537949245440,,https://twitter.com/icmyserenity/status/1260636537949245440,0,0,icmyserenity,
"yep, combination of actual treatment and mutual support = that's my jam. cannot we all just appreciate what each aspect brings. for a group that is supposed to focus on strength based approaches, seems like a lot of people act opposite when it comes to systems or organizations 1/",2020-05-13 18:18:42+00:00,,,1260635597611372544,,https://twitter.com/icmyserenity/status/1260635597611372544,2,1,sheldonbailey,
"yep, that's what i was tracking, tuning the same thing",2020-05-13 18:09:19+00:00,,,1260633233940766722,,https://twitter.com/icmyserenity/status/1260633233940766722,0,0,billkinkle,
