text,date,geo,hashtags,tweet_id,mentions,permalink,replies,retweets,replies_to,mentioned_urls
"also, while some may inappropriately interchange ts with treatment, they shouldnt. ts is social support, moud is treatment. anyone that tries to use ts as a medical intervention has already lost. they should both be applied, social support and medical intervention",2020-05-13 17:56:27+00:00,,,1260629998341427205,,https://twitter.com/icmyserenity/status/1260629998341427205,0,0,icmyserenity,
i absolutely did not say he was doing that. i'm saying the point he is making works both ways,2020-05-13 17:54:51+00:00,,,1260629596627767298,,https://twitter.com/icmyserenity/status/1260629596627767298,2,0,EFanningMadden,
equal and opposite true correct? those who dont believe will disregard the evidence put forth to support their cause?,2020-05-13 17:31:25+00:00,,,1260623698266148865,,https://twitter.com/icmyserenity/status/1260623698266148865,3,0,billkinkle,
big announcement from our statewide peer association - thanks for the leadership and adjustments during covid  ,2020-05-13 12:44:05+00:00,,,1260551386728669189,@iaprss @MHAofINDIANA,https://twitter.com/icmyserenity/status/1260551386728669189,0,1,iaprss,https://twitter.com/iaprss/status/1260548267399618561
recoverygoals,2020-05-12 22:12:51+00:00,,#recoverygoals,1260332134700638210,,https://twitter.com/icmyserenity/status/1260332134700638210,0,0,ShellyWeizman,
truth. has to be as easy to get treatment as it is drugs,2020-05-09 19:51:20+00:00,,#truth,1259209356421279746,,https://twitter.com/icmyserenity/status/1259209356421279746,0,0,davidthekick,https://twitter.com/davidthekick/status/1259166486599475202
great job !,2020-05-09 13:34:35+00:00,,,1259114544510562306,@Kimble_Indy,https://twitter.com/icmyserenity/status/1259114544510562306,0,0,,
so grateful for my colleagues!   are the best and the reason why  is changing the landscape for oud education,2020-05-08 22:37:57+00:00,,,1258888901164503040,@kkelley0614 @DrZacharyAdams @IndianaOUDecho,https://twitter.com/icmyserenity/status/1258888901164503040,0,1,IndianaOUDecho,https://twitter.com/IndianaOUDecho/status/1258844228840501249
"great messages from team !  and team bringing that flame as the kids say. thanks to 's kimble richardson for this, its great",2020-05-08 19:12:40+00:00,,,1258837240266063874,@FSSAIndiana @HalleckRachel @CHNw,https://twitter.com/icmyserenity/status/1258837240266063874,1,1,FSSAIndiana,https://twitter.com/FSSAIndiana/status/1258800921988956173
amazing message kimble!,2020-05-08 19:08:56+00:00,,,1258836300481904650,,https://twitter.com/icmyserenity/status/1258836300481904650,0,0,jimgavin,
"i have dreams too . also, i'm down for throwing rocks and what ""should be"" if that's what we're doing. but - are we ever fully prepared for emergencies/pandemics? no way to be fully prepared for these circumstances, although we should be in a better spot than we are.",2020-05-08 17:54:02+00:00,,,1258817450013077506,,https://twitter.com/icmyserenity/status/1258817450013077506,1,0,sheldonbailey,
there's a reason that most states considered alcohol sales in essential right? that's because cutting off a bunch of people from alcohol would create further healthcare issues. life seems always to be in the gray - neither extreme,2020-05-08 17:39:48+00:00,,,1258813867364360192,,https://twitter.com/icmyserenity/status/1258813867364360192,1,0,icmyserenity,
"do we do when hospitals are full and sont have room for hundreds of etoh w/d patients? i dont have a position on this bc theres a system component. in a perfect world, yes sud tx also. but theres not capacity so how to treat covid in this pop and keep safe? cont etoh is option2/3",2020-05-08 17:38:10+00:00,,,1258813455294967810,,https://twitter.com/icmyserenity/status/1258813455294967810,1,0,icmyserenity,
begs the question- should you have to go to sud treatment to get help for covid-19? alcohol wd is deadly obviously. will people stay in community and spread covid-19 if its insisted to stop drinking and that's mandated for covid-19 help? 1 fact: cant stop etoh abruptly. what 1/2,2020-05-08 17:35:20+00:00,,,1258812743844597769,,https://twitter.com/icmyserenity/status/1258812743844597769,1,0,sheldonbailey,
devastating - same debt from school but major limitations on proper employment to offset debt because he's paying a life sentence for of prior justice involvement. hard to have hope with these systemic barriers,2020-05-06 17:22:27+00:00,,,1258084727753510912,,https://twitter.com/icmyserenity/status/1258084727753510912,0,0,HorsePowerEv,https://twitter.com/HorsePowerEv/status/1258008416099934211
maybe this is my answer ,2020-05-05 14:25:02+00:00,,,1257677691551207425,,https://twitter.com/icmyserenity/status/1257677691551207425,0,0,ADAWnews,
with 88k dying a year from aud i would take something at 10 or 15% to save 10s of thousands of lives,2020-05-05 14:24:05+00:00,,,1257677452819730437,,https://twitter.com/icmyserenity/status/1257677452819730437,0,0,icmyserenity,
reduces alcohol use in a bunch of folks though right?,2020-05-05 14:23:09+00:00,,,1257677214717489152,,https://twitter.com/icmyserenity/status/1257677214717489152,1,0,ADAWnews,
"question? you think all the moud folks are going to be quick to adopt pharmacology for aud? vivitrol clearly reduces drinking. or, do you think it will it be impossible to give up the punching bag?",2020-05-05 14:00:26+00:00,,,1257671498518716417,,https://twitter.com/icmyserenity/status/1257671498518716417,2,0,ADAWnews,
"me too, me too. also, number of ppl in jail bc they cant meet terms of probation due to failed drug test is absurd. talk about addiction being chronic condition but we still criminalize the $hit out of it. relapse is common they say, but were going to put u in jail if not perfect",2020-05-02 22:18:54+00:00,,,1256709777599725570,,https://twitter.com/icmyserenity/status/1256709777599725570,1,0,angelaganote,
"wow,  bringing the on saturday morning w facts about our justice system. folks w $$have a system to pay off folks w ndas &amp; avoid criminal liability while poor ppl cannot even pay for adequate legal representation. it's a joke - but not funny at all",2020-05-02 18:08:42+00:00,,#facts,1256646813123256321,@angelaganote,https://twitter.com/icmyserenity/status/1256646813123256321,2,0,angelaganote,https://twitter.com/angelaganote/status/1256642248449589248
"complete garbage. it's unconscionable to cut people off from checking on family during a pandemic. the inhumane ways we treat those incarcerated. seriously, the ease in which ppl make thses decisions is so frustrating",2020-05-02 02:27:17+00:00,,,1256409897517887488,,https://twitter.com/icmyserenity/status/1256409897517887488,0,6,,https://www.cbsnews.com/amp/news/coronavirus-no-phone-email-inmates-federal-prisons-california-lompoc-terminal-island/?__twitter_impression=true
congrats andrew!,2020-05-01 16:32:01+00:00,,,1256260095580782592,,https://twitter.com/icmyserenity/status/1256260095580782592,1,0,AndrewSmithNews,
"hooray! dont let his humility fool you- i've sat in the in supreme court w him and cj rush as he provided guidance to our leaders on best path forward and watched him testify and advise legislative bodies around criminal justice initiatives. we miss him, he guided so many efforts",2020-04-30 01:10:57+00:00,,,1255665914600730625,,https://twitter.com/icmyserenity/status/1255665914600730625,0,0,BridgetMaryMc,
"amazing work being done in michigan by  around moud in justice system.  have you met  yet? indiana lost one of our greatest assets when he went to michigan, i hope you all make use of his amazing talent? brilliance is probably right word...",2020-04-30 00:14:26+00:00,,,1255651689853566977,@waynestate @BridgetMaryMc @ProfBradRay,https://twitter.com/icmyserenity/status/1255651689853566977,3,2,wsucbhj,https://twitter.com/wsucbhj/status/1255534813009678336
halftime,2020-04-29 19:42:59+00:00,,#halftime,1255583376112783365,,https://twitter.com/icmyserenity/status/1255583376112783365,0,0,AttyAbdul,https://twitter.com/AttyAbdul/status/1255573339877367809
correct- i've got mad love for my epidemiologist friends who have been in front lines of this fight! they've played a massive roll in getting it over the finish line in indiana. ain't that right !,2020-04-29 13:35:31+00:00,,,1255490903017500672,@PHNurseMadison,https://twitter.com/icmyserenity/status/1255490903017500672,0,0,maiasz,
great video! thanks for highlighting importance of peer supports!,2020-04-29 00:24:21+00:00,,,1255291798496387072,,https://twitter.com/icmyserenity/status/1255291798496387072,0,0,FSSAIndiana,
"""addiction thrives during isolation"" thanks  for this amazing video and explaining benefits for peersupportservices. grateful to have you as part of the http://www.indianarecoverynetwork.org and ! thanks for all you do",2020-04-29 00:23:50+00:00,,#peersupportservices,1255291669160833025,@b_dreiman @iaprss,https://twitter.com/icmyserenity/status/1255291669160833025,0,2,FSSAIndiana,"http://www.Indianarecoverynetwork.org,https://twitter.com/FSSAIndiana/status/1255211118747889664"
guessing the benzodiazepines reduction was as much about policy and refusal to rx as anything else right?,2020-04-29 00:15:16+00:00,,,1255289512688848896,,https://twitter.com/icmyserenity/status/1255289512688848896,0,0,LeoBeletsky,
here's some accurate info...https://twitter.com/overdoselifelin/status/1254872975863578624,2020-04-28 23:42:19+00:00,,,1255281221116006403,,https://twitter.com/icmyserenity/status/1255281221116006403,0,0,SessiBlanchard,"https://twitter.com/overdoselifelin/status/1254872975863578624,https://twitter.com/SessiBlanchard/status/1255181783748001797"
,2020-04-28 23:41:39+00:00,,,1255281054270787588,,https://twitter.com/icmyserenity/status/1255281054270787588,0,0,SessiBlanchard,https://twitter.com/overdoselifelin/status/1254872975863578624
thanks for your leadership here! let's see if this gets the same traction as the other piece.,2020-04-27 20:47:10+00:00,,,1254874753871106051,,https://twitter.com/icmyserenity/status/1254874753871106051,0,1,overdoselifelin,https://twitter.com/overdoselifelin/status/1254872975863578624
not shocking to see an increase in in overdoses - the lack if connection is literally killing people,2020-04-26 14:26:19+00:00,,,1254416521071337474,,https://twitter.com/icmyserenity/status/1254416521071337474,0,5,FranklinCoroner,https://twitter.com/FranklinCoroner/status/1254137978944999427
"devastating news. i know the governor, legislators and chief justice called for review of those who can be released, but this is a nightmare and we need more action here",2020-04-25 15:55:57+00:00,,,1254076692747993088,,https://twitter.com/icmyserenity/status/1254076692747993088,0,2,sean_fogler,https://twitter.com/sean_fogler/status/1253964488954560512
"i was supposed to be up there speaking may 7th, but that's pushed back until fall so i'll keep an eye out ",2020-04-25 15:45:59+00:00,,,1254074184227065856,,https://twitter.com/icmyserenity/status/1254074184227065856,1,0,professormccabe,
congrats!!  and  putting together some heavy hitters. my favorite social justice advocate  has got some tremendous talent around him up there!,2020-04-25 15:43:22+00:00,,,1254073524685324290,@WSU_Social_Work @waynestate @ProfBradRay,https://twitter.com/icmyserenity/status/1254073524685324290,1,1,professormccabe,
"agreed, health and safety should be everyone's concern. tweet seemed to implied he was justifying return bc they have minimal mortality rate. looks like his response was much more nuanced than that quote made it appear",2020-04-24 19:06:34+00:00,,,1253762273551814656,,https://twitter.com/icmyserenity/status/1253762273551814656,0,0,jeffjarvis,
be inspired! you got some smart and talented men and women going to make a difference!,2020-04-23 20:18:02+00:00,,,1253417870949670913,,https://twitter.com/icmyserenity/status/1253417870949670913,1,0,ShellyWeizman,
"also says how dangerous students can be right now...looks like you cherry picked a quote. daniel's- ""literally, our students pose a far greater danger to others than the virus poses to them. we all have a role, and a responsibility, in ensuring the health of the purdue community",2020-04-23 14:43:23+00:00,,,1253333655545540615,,https://twitter.com/icmyserenity/status/1253333655545540615,1,0,jeffjarvis,
,2020-04-23 14:38:41+00:00,,,1253332472642715649,@HalleckRachel,https://twitter.com/icmyserenity/status/1253332472642715649,0,0,alisonknopf,
congrats !  has a huge recovery advocate coming their way - she is fierce and second to none when it comes to combating stigma and promoting evidence! thank you dr. !,2020-04-23 12:25:07+00:00,,,1253298856286195713,@JoanDuwve @scdhec @JoanDuwve,https://twitter.com/icmyserenity/status/1253298856286195713,0,0,phlu,https://twitter.com/phlu/status/1253255717143928833
"see, most people dont know this is what makes you great! its not just twitter banter, you go out of way to help in any way you can - policy, direct services, slide decks, you name it . our state is so lucky to have you - love your honesty and vulnerability during these times",2020-04-23 01:53:26+00:00,,,1253139889098493953,,https://twitter.com/icmyserenity/status/1253139889098493953,0,0,confectionsmd,
can we peak at that slide deck.... ,2020-04-23 01:42:13+00:00,,,1253137068710072321,,https://twitter.com/icmyserenity/status/1253137068710072321,1,0,confectionsmd,
folks in recovery need to stay connected. new peer to peer meetings via http://www.indianarecoverynetwork.org will help. thanks for getting word out  and ,2020-04-23 01:39:45+00:00,,,1253136443796590592,@DWilliamsTV @WISH_TV,https://twitter.com/icmyserenity/status/1253136443796590592,0,3,,"http://Www.Indianarecoverynetwork.org,https://www.wishtv.com/news/medical/thousands-of-hoosiers-struggle-with-addiction-during-pandemic-but-theres-hope/"
i like this. i think stigma gets thrown around so much that it's lost a lot of its meaning to regular partners in the community. discrimination is more tangible than a very vague word of stigma,2020-04-22 19:33:03+00:00,,,1253044162057945088,,https://twitter.com/icmyserenity/status/1253044162057945088,1,0,tenuredaddict,
can we add discrimination- i realized a year or two ago that i was usongbthem interchangeably and shouldnt be obviously,2020-04-22 18:40:24+00:00,,,1253030913132449795,,https://twitter.com/icmyserenity/status/1253030913132449795,1,0,tenuredaddict,
completely utterly unacceptable. sud during hs shouldnt prevent a career later in life regardless of how sick they were - especially when that person is healthy,2020-04-22 18:38:00+00:00,,,1253030309739876353,,https://twitter.com/icmyserenity/status/1253030309739876353,0,0,Edward_Holloran,https://twitter.com/Edward_Holloran/status/1253027804985384960
this is devastating,2020-04-22 18:37:00+00:00,,,1253030056194191360,,https://twitter.com/icmyserenity/status/1253030056194191360,1,0,Edward_Holloran,
so true,2020-04-22 00:52:24+00:00,,,1252762139955208192,,https://twitter.com/icmyserenity/status/1252762139955208192,0,2,Recovery_ABrown,https://twitter.com/Recovery_ABrown/status/1252755444034125828
"despite the focus on physical health, hospital systems and mental health advocates want to remind hoosiers that resources are still available for mental health and addiction.",2020-04-21 02:55:49+00:00,,,1252430814131838978,,https://twitter.com/icmyserenity/status/1252430814131838978,0,2,,https://cbs4indy.com/news/amid-pandemic-mental-health-and-addiction-resources-still-available/
,2020-04-18 23:56:52+00:00,,,1251661004007632896,@iaprss,https://twitter.com/icmyserenity/status/1251661004007632896,0,0,RDashford,
last week,2020-04-18 03:54:03+00:00,,,1251358304317693953,,https://twitter.com/icmyserenity/status/1251358304317693953,0,0,HalleckRachel,
"i generally agree w point, but isnt dui problematic? that being said, problematic can age out, etc. lines are a little more fuzzy, but yes the threshold fornejtrybis much lower than person who goes to detix/etc",2020-04-17 19:27:43+00:00,,,1251230882398117889,,https://twitter.com/icmyserenity/status/1251230882398117889,0,0,billkinkle,
thx   for having me on to discuss interaction between sud/covid/policy &amp; emerging best practices. makes it even sweeter when i get to highlight in leaders     direct connection to recovery community,2020-04-17 17:12:32+00:00,,,1251196861521813505,@oneillinstitute @GeorgetownLaw @INDrugCzar @FSSAIndiana @confectionsmd @HalleckRachel,https://twitter.com/icmyserenity/status/1251196861521813505,0,2,GeorgetownLaw,https://twitter.com/GeorgetownLaw/status/1251160567160553483
.- i really got to talk about how folks like you can play a massive role in sud advocacy,2020-04-17 01:00:23+00:00,,,1250952210369982467,@Edward_Holloran,https://twitter.com/icmyserenity/status/1250952210369982467,1,0,Edward_Holloran,
"couple things i never thought would be written together: , lectures and my name. thanks  for placing value on advocacy and policy from those with lived experience. honored to be involved, thank you",2020-04-16 23:36:05+00:00,,,1250930997954314241,@GeorgetownLaw @ShellyWeizman,https://twitter.com/icmyserenity/status/1250930997954314241,2,2,ShellyWeizman,https://twitter.com/ShellyWeizman/status/1250873243201921024
"here it is, i've had many people ask for a recording of this roundtable",2020-04-15 21:00:56+00:00,,,1250529563563745282,,https://twitter.com/icmyserenity/status/1250529563563745282,0,1,ShellyWeizman,https://twitter.com/ShellyWeizman/status/1250528640737173510
"the real question is do they serve those amazing ribs (tony recipe). i've followed them (lol, the ribs) around for years...not sure if hes still involved w ",2020-04-15 18:14:12+00:00,,,1250487604413435905,@Dawsons_on_Main,https://twitter.com/icmyserenity/status/1250487604413435905,1,0,Edward_Holloran,
"it's not uncommon for doctor, nurse, & pilot programs to have good success rates but not for the reason they think. participants in these programs have much higher recovery capital. access to healthcare, transportation, stable housing, higher ed... these are barriers for others",2020-04-15 12:44:14+00:00,,,1250404566413316096,,https://twitter.com/icmyserenity/status/1250404566413316096,1,0,billkinkle,
,2020-04-14 20:43:06+00:00,,,1250162689982291975,@iaprss,https://twitter.com/icmyserenity/status/1250162689982291975,0,0,ShellyWeizman,
dont want to miss this ,2020-04-13 23:32:52+00:00,,,1249843025737592833,,https://twitter.com/icmyserenity/status/1249843025737592833,0,3,MHAofINDIANA,https://twitter.com/MHAofINDIANA/status/1249840937012002818
,2020-04-13 23:19:43+00:00,,,1249839715123167233,,https://twitter.com/icmyserenity/status/1249839715123167233,2,0,HalleckRachel,
also is helping provide employment- these folks were first to get furloughed do to covid. they can help get naloxone and other critical supplies into hands of those needed,2020-04-12 20:51:06+00:00,,,1249439924010586113,,https://twitter.com/icmyserenity/status/1249439924010586113,0,0,,
"we're hiring 50+ recovery coaches. specifically 2 help folks leaving corrections connect with up to date resources, meds, housing; recoverees at otps to remove any barriers around meds; domestic shelters and those experiencing homelessness. not a 100% fix but broadens bandwidth",2020-04-12 20:48:16+00:00,,,1249439211058495491,,https://twitter.com/icmyserenity/status/1249439211058495491,0,0,LeoBeletsky,
all these amazing leaders focused singularly on helping those with oud in our justice system!   has been a tremendous asset for indiana. thanks to  and  for supporting!,2020-04-11 14:07:07+00:00,,,1248975871874084865,@IUMedSchool @IndianaOUDecho @FSSAIndiana @INDrugCzar,https://twitter.com/icmyserenity/status/1248975871874084865,0,3,IndianaOUDecho,https://twitter.com/IndianaOUDecho/status/1248603248140980224
"one of the best experiences i've had professionally- getting to learn from some of indiana thought leaders in so many different areas of expertise is amazing-oh yeah, & it's all time serve incarcerated folks! ",2020-04-11 13:46:09+00:00,,,1248970594198138880,,https://twitter.com/icmyserenity/status/1248970594198138880,1,0,IndianaOUDecho,
hold strong captain!,2020-04-11 13:29:03+00:00,,,1248966291483959299,,https://twitter.com/icmyserenity/status/1248966291483959299,0,0,b_dreiman,
"pretty sure my ""fleeing"" felony is considered violent, which is garbage. not bc it's me, but because running away is not a violent act",2020-04-11 12:47:27+00:00,,,1248955821771370496,,https://twitter.com/icmyserenity/status/1248955821771370496,0,0,RoryFlemingEsq,
meaning outcome folks will be more willing to accept different politics and ideological views. it's a must in leo/courts work,2020-04-10 15:40:53+00:00,,,1248637081582215169,,https://twitter.com/icmyserenity/status/1248637081582215169,0,0,icmyserenity,
i struggle here too. i was told by my first mentor that a decision has to be made. extreme ideology will always be in public with sign making noise (invaluable) while outcome folks less vocal but in room writing the policy,2020-04-10 15:39:58+00:00,,,1248636851881160704,,https://twitter.com/icmyserenity/status/1248636851881160704,1,0,jeff_deeney,
"i'm hear for this- this is the convo i want but rarely occurs on twitter bc of complexity and nuance. it's much more complicated than ""everyone should do this""",2020-04-10 15:31:38+00:00,,,1248634753609326592,,https://twitter.com/icmyserenity/status/1248634753609326592,1,0,jeff_deeney,
"in genuinely curious on others opinion. its talked about a lot in advocacy circles, but i've not seen it unfold the way we've hoped in many situations. always appreciate the insight",2020-04-10 04:22:18+00:00,,,1248466310847062018,,https://twitter.com/icmyserenity/status/1248466310847062018,1,0,davidewlucas,
"hey there, this is actually not accurate and has been edited now multiple times. one head in the sand police chief that state leaders rebuked immediately and issued state to continue administration",2020-04-10 02:40:31+00:00,,,1248440696907972613,,https://twitter.com/icmyserenity/status/1248440696907972613,0,1,MyHarmReduction,
"so, unpopular take, i've actively tried in several situations get users from our ssp onto some boards or part of system and the turnout has been horrible. feels like advocates want it more than those i've engaged",2020-04-10 02:36:37+00:00,,,1248439715335897088,,https://twitter.com/icmyserenity/status/1248439715335897088,1,0,davidewlucas,
bupe is being rx'd in some jails as of a month ago but this seems to get the attention,2020-04-10 02:32:53+00:00,,,1248438775820271616,,https://twitter.com/icmyserenity/status/1248438775820271616,1,0,IanAlltyr,
can we get that headline to say one police chief in indiana? thanks for the other edits ,2020-04-10 02:31:58+00:00,,,1248438546005925888,@SessiBlanchard,https://twitter.com/icmyserenity/status/1248438546005925888,0,0,SessiBlanchard,
"yeah there's been two terrible law enforcement stories from about 92 counties...we got work to do, but that's not the standard by any means",2020-04-10 02:30:12+00:00,,,1248438100440879104,,https://twitter.com/icmyserenity/status/1248438100440879104,0,0,IanAlltyr,
a police chief,2020-04-10 02:27:19+00:00,,,1248437372322058241,,https://twitter.com/icmyserenity/status/1248437372322058241,0,0,icmyserenity,
"have you read since author made several edits? its not indiana, its police chief that has been rebuked by leaders. pretty misleading",2020-04-10 02:26:58+00:00,,,1248437284212482048,,https://twitter.com/icmyserenity/status/1248437284212482048,4,0,sean_fogler,
"4 a new diversion program for drug users & the addiction agency was one of first in country to do the blanket methadone take home while most fumbled around. oh, & massive networks of peers to help crim justice & otp folks. what assholes you talking about, so i can get to work?",2020-04-10 02:24:19+00:00,,,1248436618811199488,,https://twitter.com/icmyserenity/status/1248436618811199488,0,0,icmyserenity,
"also, what asshole leaders are you talking about? because most of them are crushing it right now looking out for drug users - who has been so terrible? governors putting millions into moud for jails, health dept just got ssp extended, impd working w /...",2020-04-10 02:20:55+00:00,,,1248435762044874754,@HiJAction @LeoBeletsky,https://twitter.com/icmyserenity/status/1248435762044874754,3,0,IanAlltyr,
"literally one head in the sand police chief, story is a bit misleading, author has made severaluldates since posting. leaders actually put out briefing saying it wasnt accurate and instructing to continue. its terrible dont get me wrong, but don't paint a broad brush there",2020-04-10 02:13:34+00:00,,,1248433915242508289,,https://twitter.com/icmyserenity/status/1248433915242508289,0,0,IanAlltyr,
be responsible and include this with article,2020-04-09 19:04:39+00:00,,,1248325973063487490,,https://twitter.com/icmyserenity/status/1248325973063487490,0,0,SessiBlanchard,https://twitter.com/overdoselifelin/status/1248308091810197505?s=19
"headline is crazy misleading - no verification on impd, why would you print without accuracy? you also didn't include our state release from dr. kaufman that dispelled myth that lawrence chief put out and told first responders to continue to use. clickbait- clean it up",2020-04-09 19:02:24+00:00,,,1248325405133733889,,https://twitter.com/icmyserenity/status/1248325405133733889,1,0,SessiBlanchard,
"it was posted 3 hours ago, so them flaming an old fire?",2020-04-09 18:47:49+00:00,,,1248321736199802880,,https://twitter.com/icmyserenity/status/1248321736199802880,0,0,overdoselifelin,
reaching out now. surprised  would include places that haven't confirmed - seems irresponsible to list  if they don't know yet,2020-04-09 17:51:03+00:00,,,1248307453466423298,@Filtermag_org @IMPDnews,https://twitter.com/icmyserenity/status/1248307453466423298,1,0,Ericmoss,
