text,date,geo,hashtags,tweet_id,mentions,permalink,replies,retweets,replies_to,mentioned_urls
dude didn't know they would riot during a pandemic and risk becoming infected. he had no intention of populations of black folk getting corona virus right?,2020-05-30 04:49:59+00:00,,,1266592669033066496,,https://twitter.com/jhopper23/status/1266592669033066496,0,0,,
dude with the knee in the throat didn't know people would riot if he murdered a black man in the street. while being filmed,2020-05-30 04:46:50+00:00,,,1266591878897496064,,https://twitter.com/jhopper23/status/1266591878897496064,1,0,,
how many rioters do you think got infected?,2020-05-30 04:45:31+00:00,,,1266591548021436416,,https://twitter.com/jhopper23/status/1266591548021436416,0,0,,
how many african american people do you think have become infected with the new corona virus?,2020-05-30 04:45:01+00:00,,,1266591421378650112,,https://twitter.com/jhopper23/status/1266591421378650112,0,0,,
,2020-05-30 03:43:08+00:00,,,1266575846766047232,,https://twitter.com/jhopper23/status/1266575846766047232,0,0,,https://youtu.be/fs1xHPU7WwA
,2020-05-30 03:43:03+00:00,,,1266575825408675840,,https://twitter.com/jhopper23/status/1266575825408675840,0,0,,https://youtu.be/zKCrSN9oXgQ
,2020-05-30 03:38:53+00:00,,,1266574778703343622,,https://twitter.com/jhopper23/status/1266574778703343622,0,0,,https://youtu.be/0hiUuL5uTKc
he looks like bentley,2020-05-30 00:08:35+00:00,,,1266521855331979265,,https://twitter.com/jhopper23/status/1266521855331979265,0,0,,
i just saw a good picture of george. he's unit.,2020-05-30 00:07:53+00:00,,,1266521679687122945,,https://twitter.com/jhopper23/status/1266521679687122945,0,0,,
it's worth it to find out if it's a tag or signature 27 has xo pink pajama pants.,2020-05-29 23:58:52+00:00,,,1266519409058709505,,https://twitter.com/jhopper23/status/1266519409058709505,0,0,,
xo,2020-05-29 23:57:36+00:00,,,1266519089951858689,,https://twitter.com/jhopper23/status/1266519089951858689,0,0,,
i wonder if the x was above the life jackets before he died or a brag after.,2020-05-29 23:55:57+00:00,,,1266518675776925696,,https://twitter.com/jhopper23/status/1266518675776925696,0,0,,
 this is the park they found ziyon' s body in the water.,2020-05-29 23:54:52+00:00,,,1266518400437637120,@TheRealCashis,https://twitter.com/jhopper23/status/1266518400437637120,3,0,,
so the soldiers on the outside are punished by their efforts if one of you gets tortured everytime they get a victory.,2020-05-29 19:26:49+00:00,,,1266450946747273217,,https://twitter.com/jhopper23/status/1266450946747273217,0,0,,
if you go to prison for unnecessary violence they hold you and torture you anytime they don't get their way about something in the outside.,2020-05-29 19:25:38+00:00,,,1266450648742023168,,https://twitter.com/jhopper23/status/1266450648742023168,0,0,,
let them be in their prison.,2020-05-29 19:15:58+00:00,,,1266448213684322304,,https://twitter.com/jhopper23/status/1266448213684322304,0,0,,
don't go to their prison for misdirected anger.,2020-05-29 19:15:29+00:00,,,1266448092884135936,,https://twitter.com/jhopper23/status/1266448092884135936,0,0,,
instead of rioting prepare for more hate.,2020-05-29 19:13:58+00:00,,,1266447711315742720,,https://twitter.com/jhopper23/status/1266447711315742720,0,0,,
the ceo of pride industries the president of the top of the white food chain.,2020-05-29 19:12:09+00:00,,,1266447255726219265,,https://twitter.com/jhopper23/status/1266447255726219265,0,0,,
is this a tongue?,2020-05-29 19:01:53+00:00,,,1266444670428573696,,https://twitter.com/jhopper23/status/1266444670428573696,0,0,,
,2020-05-29 18:20:07+00:00,,,1266434159288844288,,https://twitter.com/jhopper23/status/1266434159288844288,0,0,,https://youtu.be/s1XozsBN5Z4
,2020-05-29 18:20:03+00:00,,,1266434142612238336,,https://twitter.com/jhopper23/status/1266434142612238336,0,0,,https://youtu.be/58RSC7HO9aU
,2020-05-29 17:58:35+00:00,,,1266428742416523264,,https://twitter.com/jhopper23/status/1266428742416523264,0,0,,https://youtu.be/IUc0R8bbWQE
,2020-05-29 17:53:17+00:00,,,1266427408267137024,,https://twitter.com/jhopper23/status/1266427408267137024,0,0,,https://youtu.be/GeCClzNCfcA
,2020-05-29 17:37:31+00:00,,,1266423439516028928,,https://twitter.com/jhopper23/status/1266423439516028928,0,0,,https://youtu.be/jM4zFw7-ezg
,2020-05-29 17:33:50+00:00,,,1266422509986955266,,https://twitter.com/jhopper23/status/1266422509986955266,0,0,,https://youtu.be/BoEKWtgJQAU
your invited t the red pen purge.,2020-05-29 17:29:16+00:00,,,1266421363931090944,,https://twitter.com/jhopper23/status/1266421363931090944,0,0,,https://youtu.be/mN74kQfng1U
wby yu wasting your time? where's their shot callers?,2020-05-29 17:22:52+00:00,,,1266419753721098240,,https://twitter.com/jhopper23/status/1266419753721098240,0,0,,https://youtu.be/Mrtbw7usFrc
,2020-05-29 17:15:57+00:00,,,1266418009549103104,,https://twitter.com/jhopper23/status/1266418009549103104,0,0,,https://youtu.be/gEw3IxKym7o
,2020-05-29 17:11:34+00:00,,,1266416909412524034,,https://twitter.com/jhopper23/status/1266416909412524034,0,0,,https://youtu.be/hRK7PVJFbS8
milk,2020-05-29 17:01:54+00:00,,,1266414473897635841,,https://twitter.com/jhopper23/status/1266414473897635841,0,0,,
and i'm sorry that everyone is angry about george and forgetting about ziyon.,2020-05-29 05:24:39+00:00,,,1266239005181358080,,https://twitter.com/jhopper23/status/1266239005181358080,0,0,,
this was the cost of my laptop,2020-05-29 05:21:17+00:00,,,1266238158120685569,,https://twitter.com/jhopper23/status/1266238158120685569,0,0,,https://www.bbc.com/news/world-africa-47294715
savegeorge savegeorge's soul.,2020-05-29 02:43:13+00:00,,#savegeorge #savegeorge,1266198382164365313,,https://twitter.com/jhopper23/status/1266198382164365313,0,0,,
you are not helping george by hurting the officers that can take the bad officers down.,2020-05-29 02:18:19+00:00,,,1266192114804682752,,https://twitter.com/jhopper23/status/1266192114804682752,0,0,,
don't you people realize that those bad humans killed him on camera to start riots?,2020-05-29 02:17:29+00:00,,,1266191906511306754,,https://twitter.com/jhopper23/status/1266191906511306754,0,0,,
now ima ask yall to stop the violent riots. if you respond to anyone who didn't do this...you are as wrong as they are.,2020-05-29 02:16:54+00:00,,,1266191758666248192,,https://twitter.com/jhopper23/status/1266191758666248192,0,0,,
what is this fluid under the car? i got strangled and when i got to s point of no air for 2long i peed my pants then passed out. they knew he was dying.,2020-05-29 02:15:26+00:00,,,1266191387021565952,,https://twitter.com/jhopper23/status/1266191387021565952,0,0,,
why did they use a vehicle that says police on the license plate?,2020-05-29 02:15:25+00:00,,,1266191385465503744,,https://twitter.com/jhopper23/status/1266191385465503744,0,0,,
cancer,2020-05-29 02:10:22+00:00,,,1266190115505758208,,https://twitter.com/jhopper23/status/1266190115505758208,0,0,,
this is what the trash that threatens our children left on the table,2020-05-28 14:24:55+00:00,,,1266012581732380673,,https://twitter.com/jhopper23/status/1266012581732380673,0,0,,
paws,2020-05-28 14:24:36+00:00,,,1266012502032171009,,https://twitter.com/jhopper23/status/1266012502032171009,0,0,,
good,2020-05-28 12:43:02+00:00,,,1265986940718837760,,https://twitter.com/jhopper23/status/1265986940718837760,0,0,jhopper23,
and are the biggest threat to goid officers on many different violence levels including misrepresentation.,2020-05-28 12:40:17+00:00,,,1265986251754110982,,https://twitter.com/jhopper23/status/1265986251754110982,1,0,JamesCraigmyle,
before i read your thoughts and become biased my own thoughts are generally most officers are very good and have standards and morals. and in a nutshell the officers that are bad humans are bad humans they just pretended to be an officer to cause harm instead of good,2020-05-28 12:39:28+00:00,,,1265986043079086080,,https://twitter.com/jhopper23/status/1265986043079086080,0,0,JamesCraigmyle,
the officers in calaveras and in tuolmne told me to keep saying no to them.,2020-05-28 12:36:17+00:00,,,1265985242759704582,,https://twitter.com/jhopper23/status/1265985242759704582,0,0,,
it's what they do.,2020-05-28 12:35:22+00:00,,,1265985014405009408,,https://twitter.com/jhopper23/status/1265985014405009408,0,0,,
thats how i know that even if they get a pink blanket that still commit violence and harm on animals children the elderly and the sick.,2020-05-28 12:35:11+00:00,,,1265984964824199169,,https://twitter.com/jhopper23/status/1265984964824199169,0,0,,
that same girl that left the beheaded baby dear was one of. the females using physical mental and emotional torture on alpha,2020-05-28 12:34:01+00:00,,,1265984673567531009,,https://twitter.com/jhopper23/status/1265984673567531009,0,0,,
what pink blankets represent in hoe language.,2020-05-28 12:26:41+00:00,,,1265982828811939841,,https://twitter.com/jhopper23/status/1265982828811939841,0,0,,
that's how i know what pink blankets are.,2020-05-28 12:25:54+00:00,,,1265982628152262657,,https://twitter.com/jhopper23/status/1265982628152262657,0,0,,
his left hand and left knee.,2020-05-27 23:42:21+00:00,,,1265790475396509697,,https://twitter.com/jhopper23/status/1265790475396509697,0,0,,
notice how the animal was crushed near the letter p. and o.,2020-05-27 23:41:38+00:00,,,1265790296509435904,,https://twitter.com/jhopper23/status/1265790296509435904,0,0,,
el paso,2020-05-27 23:18:59+00:00,,,1265784595443671040,,https://twitter.com/jhopper23/status/1265784595443671040,0,0,,
who's team are you on?,2020-05-27 23:17:57+00:00,,,1265784337938563072,,https://twitter.com/jhopper23/status/1265784337938563072,0,0,SpaceX,
no flights on 27th.,2020-05-27 23:17:25+00:00,,,1265784201216790528,,https://twitter.com/jhopper23/status/1265784201216790528,0,0,SpaceX,
i can feel his heart ash on the left.,2020-05-27 23:07:56+00:00,,,1265781815073103872,,https://twitter.com/jhopper23/status/1265781815073103872,0,0,LegendsllLiveOn,
anthony bonez,2020-05-27 23:05:06+00:00,,,1265781100686667777,,https://twitter.com/jhopper23/status/1265781100686667777,0,0,,
pal,2020-05-27 23:04:36+00:00,,,1265780977550286848,,https://twitter.com/jhopper23/status/1265780977550286848,0,0,,
steele reserve 211,2020-05-27 23:04:21+00:00,,,1265780913213861889,,https://twitter.com/jhopper23/status/1265780913213861889,0,0,,
so is a.r.,2020-05-27 22:59:54+00:00,,,1265779792529379330,,https://twitter.com/jhopper23/status/1265779792529379330,0,0,,
brandon is from lincoln,2020-05-27 22:59:43+00:00,,,1265779745993551872,,https://twitter.com/jhopper23/status/1265779745993551872,0,0,,
only dexter and devin can talk to me right now.,2020-05-27 22:55:32+00:00,,,1265778692594098181,,https://twitter.com/jhopper23/status/1265778692594098181,0,0,,
but that would only make them unsafe right now so i dont call.,2020-05-27 22:55:02+00:00,,,1265778569508093953,,https://twitter.com/jhopper23/status/1265778569508093953,0,0,,
and i really like to call some of the women who run those safe houses just to see if they are safe right now.,2020-05-27 22:54:06+00:00,,,1265778333972746240,,https://twitter.com/jhopper23/status/1265778333972746240,0,0,,
i was put inside the eminate danger safe house 4 times.,2020-05-27 22:49:25+00:00,,,1265777154622537728,,https://twitter.com/jhopper23/status/1265777154622537728,0,0,,
trafficking whores still protecting their pimps.,2020-05-27 22:47:41+00:00,,,1265776720226906112,,https://twitter.com/jhopper23/status/1265776720226906112,0,0,,
are investigating child molestation child porn child rape and child prostitution. and the children inside being hidden like amonte,2020-05-27 22:47:04+00:00,,,1265776565779968000,,https://twitter.com/jhopper23/status/1265776565779968000,0,0,,
"has been invaded by trafficking whores marking employees of the underground, police officers they make false reports too to obtain which officer (s)",2020-05-27 22:46:00+00:00,,,1265776296874762240,,https://twitter.com/jhopper23/status/1265776296874762240,0,0,,
and what i found there was the real victims are very much in danger in the underground because the underground railroad,2020-05-27 22:44:37+00:00,,,1265775945509564416,,https://twitter.com/jhopper23/status/1265775945509564416,0,0,,
so i went to texas on the underground railroad.,2020-05-27 22:43:45+00:00,,,1265775731386118144,,https://twitter.com/jhopper23/status/1265775731386118144,0,0,,
you don't want to be near your kids your other family members your friends or children or pets.,2020-05-27 22:43:05+00:00,,,1265775561000972288,,https://twitter.com/jhopper23/status/1265775561000972288,0,0,,
"when people are on you cutting your clothes and linens with a razor peeing on on you when you sleep, putting cigarette burns on your animals and vandelizing your car.",2020-05-27 22:42:13+00:00,,,1265775343828299776,,https://twitter.com/jhopper23/status/1265775343828299776,0,0,,
21,2020-05-27 22:39:59+00:00,,,1265774782047383553,,https://twitter.com/jhopper23/status/1265774782047383553,0,0,,
so i pay attention to the numbers on the light poles.,2020-05-27 22:37:46+00:00,,,1265774223231868929,,https://twitter.com/jhopper23/status/1265774223231868929,0,0,,
and her car hit the light pole that then hit the garage connected to the house.,2020-05-27 22:37:18+00:00,,,1265774106835734528,,https://twitter.com/jhopper23/status/1265774106835734528,0,0,,
a street light pole hit our house and crushed the garage here because the daughter of a prison guard at folsom left her emergency brake disengaged,2020-05-27 22:36:39+00:00,,,1265773940703522816,,https://twitter.com/jhopper23/status/1265773940703522816,0,0,,
and a light pole marked 11137,2020-05-27 22:35:31+00:00,,,1265773655444709377,,https://twitter.com/jhopper23/status/1265773655444709377,0,0,,
this new murder of innocence is nearby the house accompanied by a surgical glove (the same kind of surgical gloves we have here at the house),2020-05-27 22:35:03+00:00,,,1265773540722139136,,https://twitter.com/jhopper23/status/1265773540722139136,0,0,,
this is what the puppies looked like on the left hand side of pool station road and patrick fair's clothes were in the ditch on the right side of pool station road as i drove to testify against brandon.,2020-05-27 22:34:28+00:00,,,1265773392189222912,,https://twitter.com/jhopper23/status/1265773392189222912,1,0,,
the polaris task force says it's the biggest case on their desk.,2020-05-27 22:28:48+00:00,,,1265771965689675781,,https://twitter.com/jhopper23/status/1265771965689675781,0,0,,
"there's many photos of those injurys and theres,many many subfiles to that file.",2020-05-27 22:28:11+00:00,,,1265771809778982912,,https://twitter.com/jhopper23/status/1265771809778982912,0,0,,
and after both convictions of those crimes i have family members involved in those crimes that filed papers to say i was 5150,2020-05-27 22:26:54+00:00,,,1265771490844110849,,https://twitter.com/jhopper23/status/1265771490844110849,0,0,,
i bit my tongue while he was strangling me. and i had a bruise on my left eye for one year.,2020-05-27 22:25:45+00:00,,,1265771201105768450,,https://twitter.com/jhopper23/status/1265771201105768450,0,0,,
i was hit in the face with a brass knuckle belt buckle was confiscated from my boyfriend at the time as a weapon.,2020-05-27 22:24:45+00:00,,,1265770947342000128,,https://twitter.com/jhopper23/status/1265770947342000128,0,0,,
 and she had possession of the phone cord brandon stole from me the day he strangled me and i passed out and peed my pants.,2020-05-27 22:23:35+00:00,,,1265770653317132288,@Oprah,https://twitter.com/jhopper23/status/1265770653317132288,0,0,,
" they threw black and white sheep dog puppies out the window of the car in front of me and ran them over to unidentifiable road kill the morning i drove to the court house to testify against brandon, the one that strangled me and briana bragged she sent him to strangle me",2020-05-27 22:22:48+00:00,,,1265770458118451200,@Oprah,https://twitter.com/jhopper23/status/1265770458118451200,0,0,,
they both got convicted. 922617,2020-05-27 22:18:44+00:00,,,1265769435463221248,,https://twitter.com/jhopper23/status/1265769435463221248,0,0,,
"the case number that i testified against child raping nazis before anyone tried to say i was crazy, to protect briana",2020-05-27 22:17:05+00:00,,,1265769019677667330,,https://twitter.com/jhopper23/status/1265769019677667330,0,0,,
hhashtag justin case namber 236033https://youtu.be/bwxazvhlyx,2020-05-27 22:15:23+00:00,,#Justin,1265768589782474753,,https://twitter.com/jhopper23/status/1265768589782474753,0,0,,
his hand is in his right pocket. he got paid.,2020-05-27 21:59:39+00:00,,,1265764632628621318,,https://twitter.com/jhopper23/status/1265764632628621318,0,0,,
this is signed by copper opolis where all the prison guards from sierra conservation prison live.,2020-05-27 21:58:55+00:00,,,1265764445348720641,,https://twitter.com/jhopper23/status/1265764445348720641,2,0,,
https://www.instagram.com/p/catczjwhcha/?igshid=13dzxxghhbato,2020-05-27 21:38:21+00:00,,,1265759269443350528,,https://twitter.com/jhopper23/status/1265759269443350528,0,0,,https://www.instagram.com/p/CAtCZJwHChA/?igshid=13dzxxghhbato
 musk im your evidence that nature controls life. not the grimm.,2020-05-27 20:26:28+00:00,,,1265741180651761664,@elon,https://twitter.com/jhopper23/status/1265741180651761664,0,0,,
i dont want the devin that licks whore to save animals or kids to call me. i want the devin that steals the pets and children that are being abused with the clean penis and clean mouth.,2020-05-27 20:10:55+00:00,,,1265737267898773504,,https://twitter.com/jhopper23/status/1265737267898773504,0,0,,
amador county,2020-05-27 19:50:19+00:00,,,1265732083814510592,,https://twitter.com/jhopper23/status/1265732083814510592,0,0,,
santa fe,2020-05-27 19:27:55+00:00,,,1265726447122972672,,https://twitter.com/jhopper23/status/1265726447122972672,0,0,,
another one of my enemies gone.. dem it.,2020-05-27 19:13:48+00:00,,,1265722892391550976,,https://twitter.com/jhopper23/status/1265722892391550976,0,0,,
,2020-05-27 16:43:15+00:00,,,1265685006845743106,,https://twitter.com/jhopper23/status/1265685006845743106,0,0,,
,2020-05-27 16:43:15+00:00,,,1265685006698999808,,https://twitter.com/jhopper23/status/1265685006698999808,0,0,,
,2020-05-27 16:43:15+00:00,,,1265685006669602817,,https://twitter.com/jhopper23/status/1265685006669602817,0,0,,
"proof is knowing it, without doubts.",2020-05-27 13:43:11+00:00,,,1265639689312071688,,https://twitter.com/jhopper23/status/1265639689312071688,0,0,,
proof is a way different feeling than you're pretty sure it's them but it's not certain.,2020-05-27 13:42:42+00:00,,,1265639567584931841,,https://twitter.com/jhopper23/status/1265639567584931841,0,0,,
"i didn't have proof of what happened to me in copper and yuba city, but i have proof now.",2020-05-27 13:41:18+00:00,,,1265639219239641088,,https://twitter.com/jhopper23/status/1265639219239641088,0,0,,
"it's pointless to placate them, they still commit the crime. but you can control when they commit it, so you can catch them.",2020-05-27 13:38:56+00:00,,,1265638623241621504,,https://twitter.com/jhopper23/status/1265638623241621504,0,0,,
"another pink blanket crime, the whore killed the animal anyway even after you licked her.",2020-05-27 13:38:08+00:00,,,1265638421344616450,,https://twitter.com/jhopper23/status/1265638421344616450,0,0,,
,2020-05-27 13:04:22+00:00,,,1265629920786386951,,https://twitter.com/jhopper23/status/1265629920786386951,0,0,,https://youtu.be/CWPo5SC3zik
,2020-05-27 12:58:55+00:00,,,1265628549882363904,,https://twitter.com/jhopper23/status/1265628549882363904,0,0,,https://youtu.be/pwBFOuCrdr4
ll wayne,2020-05-27 12:52:18+00:00,,,1265626888015187968,,https://twitter.com/jhopper23/status/1265626888015187968,0,0,,https://youtu.be/s1XozsBN5Z4
333,2020-05-27 12:50:41+00:00,,,1265626479884292105,,https://twitter.com/jhopper23/status/1265626479884292105,0,0,,
that's the 2nd child. the first child got mailed by s pitbull 27,2020-05-27 12:50:25+00:00,,,1265626411454181377,,https://twitter.com/jhopper23/status/1265626411454181377,0,0,,
,2020-05-27 05:45:29+00:00,,,1265519474364551168,,https://twitter.com/jhopper23/status/1265519474364551168,0,0,,https://sacramento.cbslocal.com/video/4566278-young-boys-body-found-in-american-river/
 thank you for starting the soul train on such a sad day.,2020-05-27 05:36:49+00:00,,,1265517291736834049,@questlove,https://twitter.com/jhopper23/status/1265517291736834049,0,0,,https://youtu.be/2owZXPyeilc
has anyone ever seen that movie sabrina?,2020-05-27 05:00:26+00:00,,,1265508138087743489,,https://twitter.com/jhopper23/status/1265508138087743489,0,0,,
how did trash whores ever get access to the animals in the first place,2020-05-27 04:59:26+00:00,,,1265507885318094851,,https://twitter.com/jhopper23/status/1265507885318094851,0,0,,
there's lots of pink blanket threats on the kangaroo and other animals at the xois and sanctuaries,2020-05-27 04:58:49+00:00,,,1265507729499664384,,https://twitter.com/jhopper23/status/1265507729499664384,0,0,,
"you may think a pink blanket stops the violence but the way i see it, it's double jeopardy, you lick their ass and they still kill the kid or animal.",2020-05-27 04:18:10+00:00,,,1265497498296233985,,https://twitter.com/jhopper23/status/1265497498296233985,0,0,,
and i dont like devils.,2020-05-27 03:27:48+00:00,,,1265484823386222593,,https://twitter.com/jhopper23/status/1265484823386222593,0,0,,
only devils consider the death of a child as victory.,2020-05-27 03:27:23+00:00,,,1265484721686896640,,https://twitter.com/jhopper23/status/1265484721686896640,0,0,,
i curse for all eternity anyone who helps a whore hurt babies.,2020-05-27 03:21:52+00:00,,,1265483332457910272,,https://twitter.com/jhopper23/status/1265483332457910272,0,0,,
i can still feel in my heart the screams of the 2 women on the shores reaction to finding the butler baby.,2020-05-27 03:20:47+00:00,,,1265483059123482625,,https://twitter.com/jhopper23/status/1265483059123482625,0,0,,
,2020-05-27 03:17:48+00:00,,,1265482308255023105,,https://twitter.com/jhopper23/status/1265482308255023105,0,0,,
,2020-05-27 03:08:25+00:00,,,1265479946719293440,,https://twitter.com/jhopper23/status/1265479946719293440,0,0,,https://youtu.be/SySW6lVW7D8
,2020-05-27 03:02:26+00:00,,,1265478439949099008,,https://twitter.com/jhopper23/status/1265478439949099008,0,0,,https://youtu.be/mN74kQfng1U
,2020-05-27 02:56:58+00:00,,,1265477066155147266,,https://twitter.com/jhopper23/status/1265477066155147266,0,0,,https://youtu.be/OOHqln1N2Q4
,2020-05-27 02:51:41+00:00,,,1265475735415779328,,https://twitter.com/jhopper23/status/1265475735415779328,0,0,,https://youtu.be/Mb1ZvUDvLDY
,2020-05-27 02:44:45+00:00,,,1265473991549968385,,https://twitter.com/jhopper23/status/1265473991549968385,0,0,,https://youtu.be/J7_bMdYfSws
,2020-05-27 02:40:39+00:00,,,1265472959243681795,,https://twitter.com/jhopper23/status/1265472959243681795,0,0,,https://youtu.be/3HU-KdHmYeA
,2020-05-27 02:37:01+00:00,,,1265472045216706560,,https://twitter.com/jhopper23/status/1265472045216706560,0,0,,https://youtu.be/QGKiC2suCHQ
,2020-05-26 21:56:08+00:00,,,1265401360347828225,,https://twitter.com/jhopper23/status/1265401360347828225,0,0,,
 r.c.,2020-05-26 20:43:35+00:00,,,1265383101393448967,@TheRealCashis,https://twitter.com/jhopper23/status/1265383101393448967,0,0,,
beyonce has a church in houston. her church does t rape or kill children.,2020-05-26 20:41:08+00:00,,,1265382483668824064,,https://twitter.com/jhopper23/status/1265382483668824064,0,0,,
they need to check to see if governor newsomes interpreter is accurately interpreting what he is saying,2020-05-26 19:45:27+00:00,,,1265368470515888128,,https://twitter.com/jhopper23/status/1265368470515888128,0,0,,
,2020-05-26 19:44:14+00:00,,,1265368166089125888,,https://twitter.com/jhopper23/status/1265368166089125888,0,0,,
seriel killers always take a trophy.,2020-05-26 18:48:31+00:00,,,1265354144602132480,,https://twitter.com/jhopper23/status/1265354144602132480,0,0,,
my kids don't understand trophy game. the devils commit.,2020-05-26 18:48:01+00:00,,,1265354015547600903,,https://twitter.com/jhopper23/status/1265354015547600903,0,0,,
,2020-05-26 18:39:53+00:00,,,1265351969490653185,,https://twitter.com/jhopper23/status/1265351969490653185,0,0,,https://youtu.be/KbI_awR4CKE
,2020-05-26 18:33:29+00:00,,,1265350361751027715,,https://twitter.com/jhopper23/status/1265350361751027715,0,0,,https://youtu.be/9RwVJVjjNA4
,2020-05-26 18:27:29+00:00,,,1265348849868005376,,https://twitter.com/jhopper23/status/1265348849868005376,0,0,,https://youtu.be/qsaTFcXVCNU
,2020-05-26 18:21:39+00:00,,,1265347380850774016,,https://twitter.com/jhopper23/status/1265347380850774016,0,0,,https://youtu.be/xRQnJyP77tY
,2020-05-26 18:17:48+00:00,,,1265346413187133441,,https://twitter.com/jhopper23/status/1265346413187133441,0,0,,
,2020-05-26 18:17:48+00:00,,,1265346412562116609,,https://twitter.com/jhopper23/status/1265346412562116609,0,0,,
i had a bob marley painting when i lived in yuba city. it said zion on it. i left it when i fled to texas. the whore was breaking into that house so she already has the trophy for zion.,2020-05-26 17:36:08+00:00,,,1265335925581570048,,https://twitter.com/jhopper23/status/1265335925581570048,0,0,,
2.27,2020-05-26 16:43:24+00:00,,,1265322657664229376,,https://twitter.com/jhopper23/status/1265322657664229376,0,0,,
may 25. 11:23am,2020-05-26 16:42:53+00:00,,,1265322526005006336,,https://twitter.com/jhopper23/status/1265322526005006336,0,0,,
,2020-05-26 16:41:20+00:00,,,1265322137969025026,,https://twitter.com/jhopper23/status/1265322137969025026,0,0,,
