text,date,geo,hashtags,tweet_id,mentions,permalink,replies,retweets,replies_to,mentioned_urls
i started documenting organized crime tags and threats 5 years ago.,2020-04-04 21:34:55+00:00,,,1246551851824111617,,https://twitter.com/jhopper23/status/1246551851824111617,0,0,,
texas d.o.d.has 4 cell phones of mine calaveras. yuba city. sacramento and humble texas.,2020-04-04 21:33:41+00:00,,,1246551539784626176,,https://twitter.com/jhopper23/status/1246551539784626176,0,0,,
santa cruz d.o.d. has my laptop from calaveras and yuba city,2020-04-04 21:32:35+00:00,,,1246551260745961472,,https://twitter.com/jhopper23/status/1246551260745961472,0,0,,
,2020-04-04 21:26:13+00:00,,,1246549659494973441,,https://twitter.com/jhopper23/status/1246549659494973441,0,0,,https://youtu.be/IDeOYw9uGmE
newman,2020-04-04 17:06:37+00:00,,,1246484331796639746,,https://twitter.com/jhopper23/status/1246484331796639746,0,0,,
all 3 of them are trash.,2020-04-04 17:05:25+00:00,,,1246484027978047488,,https://twitter.com/jhopper23/status/1246484027978047488,0,0,,
i can find check book entries in julianas writing for 3 25 thousand checks to nino.,2020-04-04 17:03:38+00:00,,,1246483579678285824,,https://twitter.com/jhopper23/status/1246483579678285824,0,0,,
while my mother was suck and i was in texas. juliana wrote multiple checks to nino for 25 thousand dollars a check.,2020-04-04 17:03:04+00:00,,,1246483434756661248,,https://twitter.com/jhopper23/status/1246483434756661248,0,0,,
but i think it's worth it to buy new tools to get rid of him.,2020-04-04 17:02:16+00:00,,,1246483236877766656,,https://twitter.com/jhopper23/status/1246483236877766656,0,0,,
he didn't even leave enough of my dad's tools or my tools to maintain the yards here.,2020-04-04 17:01:50+00:00,,,1246483127960141825,,https://twitter.com/jhopper23/status/1246483127960141825,0,0,,
nino juliana and briana spent years stealing my property and gave it to andy or kept it for themselves. nino has all the tools from copper yuba city and he took all my dad's tools here.,2020-04-04 17:01:21+00:00,,,1246483002982412288,,https://twitter.com/jhopper23/status/1246483002982412288,0,0,,
today is 4.4.2020,2020-04-04 16:51:25+00:00,,,1246480505018544129,,https://twitter.com/jhopper23/status/1246480505018544129,0,0,,
where they owned a house,2020-04-04 16:34:36+00:00,,,1246476273762762752,,https://twitter.com/jhopper23/status/1246476273762762752,0,0,,
because my parents didn't want child porn being filmed in the empty houses in lake tulloch shores in the winter.,2020-04-04 16:33:02+00:00,,,1246475880286662656,,https://twitter.com/jhopper23/status/1246475880286662656,0,0,,
in addition to andrew a prison guards daughter left he emergency brake off her car that rolled into a street light that hit my parents house and crushed their garage,2020-04-04 16:32:05+00:00,,,1246475638199816193,,https://twitter.com/jhopper23/status/1246475638199816193,0,0,,
then andrew got beaten nearly to death very close to the house.,2020-04-04 16:30:59+00:00,,,1246475360742420480,,https://twitter.com/jhopper23/status/1246475360742420480,0,0,,
anytime before he got beaten nearly to death everytime i called cal telephone the reps name was andrew for about a month.,2020-04-04 16:30:31+00:00,,,1246475246166663169,,https://twitter.com/jhopper23/status/1246475246166663169,0,0,,
cal telephone threatened what happened to andrew in advance of his brutal beating.,2020-04-04 16:29:49+00:00,,,1246475067225038853,,https://twitter.com/jhopper23/status/1246475067225038853,0,0,,
the grim congregate at old corner and at murphys pub,2020-04-04 16:24:54+00:00,,,1246473830555480064,,https://twitter.com/jhopper23/status/1246473830555480064,0,0,,
and from the tags im seeing here theres cannibals hee too or they are entering from yuba and marysvilke,2020-04-04 16:24:04+00:00,,,1246473621469446144,,https://twitter.com/jhopper23/status/1246473621469446144,0,0,,
there are tribes of grim (cannebals) people in calaveras tualonme and in yuba city marysville,2020-04-04 16:23:06+00:00,,,1246473379994951680,,https://twitter.com/jhopper23/status/1246473379994951680,0,0,,
all of them would kill any of us. all of them would kill kennedy.,2020-04-04 16:20:13+00:00,,,1246472651163308032,,https://twitter.com/jhopper23/status/1246472651163308032,0,0,,
welcome to the nazi guards celli circle,2020-04-04 16:18:59+00:00,,,1246472343393718274,,https://twitter.com/jhopper23/status/1246472343393718274,0,0,,
as well as all my personnel information from my internet use got violated whole i used that internet system.,2020-04-04 16:18:35+00:00,,,1246472242545840130,,https://twitter.com/jhopper23/status/1246472242545840130,0,0,,
200.00 in credits to my account disappeared after holly foster started working at cal telephone.,2020-04-04 16:17:51+00:00,,,1246472058407538688,,https://twitter.com/jhopper23/status/1246472058407538688,0,0,,
holly foster works at cal telephone. which means she has access to anyone with a phone or internet account.,2020-04-04 16:17:17+00:00,,,1246471913011961858,,https://twitter.com/jhopper23/status/1246471913011961858,0,0,,
i just know that they need to be caught and punished or there's never going to be peace for any of the children in my family,2020-04-04 16:15:33+00:00,,,1246471477513170944,,https://twitter.com/jhopper23/status/1246471477513170944,0,0,,
i'm pretty clear about what they're doing and gang tags and not a scared at all for someone they wanted to call paranoid schizophrenic don't you have to be scared i'm not scared of them i just know they need to get caught,2020-04-04 16:14:48+00:00,,,1246471291361619969,,https://twitter.com/jhopper23/status/1246471291361619969,0,0,,
brianna's half sister husband has been telling them which officers are investigating what. he works for santa clara pd so he knows which officers are investigating the trafficking tori tells brianna and brianna's house the traffickers then the officer dies the officers murdered,2020-04-04 16:14:13+00:00,,,1246471141339713539,,https://twitter.com/jhopper23/status/1246471141339713539,0,0,,
military boots are much stronger than whore boots.,2020-04-04 16:11:24+00:00,,,1246470433836126209,,https://twitter.com/jhopper23/status/1246470433836126209,0,0,,
too bad they didn't notice i wear military boots.,2020-04-04 16:11:03+00:00,,,1246470348213633029,,https://twitter.com/jhopper23/status/1246470348213633029,0,0,,
all 3 fosters kelly tiffany and holly wore a pair of brianas boots at a party i was at. it was their symbol to destroy me. you know these boots are made for walking...,2020-04-04 16:10:42+00:00,,,1246470259206279168,,https://twitter.com/jhopper23/status/1246470259206279168,0,0,,
the fosters operate their child porn and prostitution out of old corner on obyrnes ferry its where their headquarters,2020-04-04 16:09:23+00:00,,,1246469926979694592,,https://twitter.com/jhopper23/status/1246469926979694592,0,0,,
briana is an associate and a friend of all three fosters,2020-04-04 16:08:31+00:00,,,1246469707802087424,,https://twitter.com/jhopper23/status/1246469707802087424,0,0,,
the fosters are the pimps for child hook ups and child porn in calaveras county,2020-04-04 16:08:04+00:00,,,1246469595721912321,,https://twitter.com/jhopper23/status/1246469595721912321,0,0,,
murphy's bar supports the fosters kelly tiffany and holly,2020-04-04 16:07:31+00:00,,,1246469455657353217,,https://twitter.com/jhopper23/status/1246469455657353217,0,0,,
nino juliana and briana are human traffickers and are part of the circle that contracts to murder police.,2020-04-04 16:07:05+00:00,,,1246469346928410625,,https://twitter.com/jhopper23/status/1246469346928410625,0,0,,
all 3 of them caused harms to my children my nieces and nephews my parents and yo me. to help andy torture me for many many years,2020-04-04 15:51:18+00:00,,,1246465376524759042,,https://twitter.com/jhopper23/status/1246465376524759042,0,0,,
i dont want any of them.,2020-04-04 15:45:46+00:00,,,1246463982266810369,,https://twitter.com/jhopper23/status/1246463982266810369,0,0,,
delete them all i dont want any if them.,2020-04-04 15:45:28+00:00,,,1246463906731544576,,https://twitter.com/jhopper23/status/1246463906731544576,0,0,,
all 3 of them use mexican gangs for dirt.,2020-04-04 15:44:55+00:00,,,1246463769070333952,,https://twitter.com/jhopper23/status/1246463769070333952,0,0,,
since juliana nino and briana terrorized my life and stole or vandelized all my property. i'm more than sure it's time for that to happen to all of them.,2020-04-04 15:44:38+00:00,,,1246463699218345986,,https://twitter.com/jhopper23/status/1246463699218345986,0,0,,
i hope that whole area collapses. to get rid of all the baby fucking animal murdering monsters there.,2020-04-04 15:42:36+00:00,,,1246463188553486345,,https://twitter.com/jhopper23/status/1246463188553486345,0,0,,
drop kick murphy's and their fresh surrender to corona.,2020-04-04 15:41:03+00:00,,,1246462797489340417,,https://twitter.com/jhopper23/status/1246462797489340417,0,0,,
the gang arms are in yuba city.,2020-04-04 15:18:18+00:00,,,1246457072905932803,,https://twitter.com/jhopper23/status/1246457072905932803,0,0,,
,2020-04-04 15:00:49+00:00,,,1246452670702825472,,https://twitter.com/jhopper23/status/1246452670702825472,0,0,,
,2020-04-04 14:59:54+00:00,,,1246452442356580353,,https://twitter.com/jhopper23/status/1246452442356580353,0,0,,
its not the first time i have seen nails used as a threat to other humans,2020-04-04 14:58:11+00:00,,,1246452007126183936,,https://twitter.com/jhopper23/status/1246452007126183936,0,0,,
jody mcdermott uses nails for tags.,2020-04-04 14:57:42+00:00,,,1246451887353692160,,https://twitter.com/jhopper23/status/1246451887353692160,0,0,,
that nail bored into the sidewalk on top of blue lives matter materiel. is a mexican gang tag on first responder children.,2020-04-04 14:57:15+00:00,,,1246451772513603585,,https://twitter.com/jhopper23/status/1246451772513603585,0,0,,
they have also marked all the houses that have dogs in the back yards,2020-04-04 14:54:56+00:00,,,1246451191782891520,,https://twitter.com/jhopper23/status/1246451191782891520,0,0,,
and i have also showed you thru photos how many electrical panel covers they have already removed bolts. so they have immediate access to cause mayhem,2020-04-04 14:54:11+00:00,,,1246451000241614849,,https://twitter.com/jhopper23/status/1246451000241614849,0,0,,
they have also tagged where the fire hydrants are.,2020-04-04 14:52:15+00:00,,,1246450515870801922,,https://twitter.com/jhopper23/status/1246450515870801922,0,0,,
and if you go thru my past tweets you will find that i told all of you i found a dirty thermos on crossings by the freeway. before the outbreak.,2020-04-04 14:32:13+00:00,,,1246445474434797570,,https://twitter.com/jhopper23/status/1246445474434797570,0,0,,
both ms 13 and north nathaniel 14 are red triangle. they practice satanism.,2020-04-04 14:13:05+00:00,,,1246440659889750016,,https://twitter.com/jhopper23/status/1246440659889750016,0,0,,
both gangs practice eco terrorism.,2020-04-04 14:10:13+00:00,,,1246439936619769857,,https://twitter.com/jhopper23/status/1246439936619769857,0,0,,
i've seen north nathaniel mayhem tags here but the gardener seem to wear blue rags like ms-13,2020-04-04 14:08:16+00:00,,,1246439448339828736,,https://twitter.com/jhopper23/status/1246439448339828736,0,0,,
either way if they come into your neighborhood and start tagging electrical explosions you should be aware that they're doing it,2020-04-04 14:07:14+00:00,,,1246439185801605121,,https://twitter.com/jhopper23/status/1246439185801605121,0,0,,
norrh nathaniel is red bandana ms 13 is blue bandana,2020-04-04 14:05:24+00:00,,,1246438726328127488,,https://twitter.com/jhopper23/status/1246438726328127488,0,0,,
is that who the nazi guards getting tgeir illegal arms from,2020-04-04 14:04:50+00:00,,,1246438581918248960,,https://twitter.com/jhopper23/status/1246438581918248960,0,0,,
one of the hispanic news reporters is wearing red (north nathaniel 14) and showing her arms.,2020-04-04 14:04:20+00:00,,,1246438458345676801,,https://twitter.com/jhopper23/status/1246438458345676801,0,0,,
yuba city is as east as calaveras,2020-04-04 14:02:46+00:00,,,1246438061380001794,,https://twitter.com/jhopper23/status/1246438061380001794,0,0,,
i just know the hispanics coming into this area are leaving gang tags for sure.,2020-04-04 14:01:08+00:00,,,1246437653303578627,,https://twitter.com/jhopper23/status/1246437653303578627,0,0,,
i'm not saying all hispanics are bad.,2020-04-04 14:00:38+00:00,,,1246437523791863812,,https://twitter.com/jhopper23/status/1246437523791863812,0,0,,
and in both places it felt like living amoung demons devils and thieves.,2020-04-04 13:58:14+00:00,,,1246436920009166849,,https://twitter.com/jhopper23/status/1246436920009166849,0,0,,
more than 50% of the females practice prostitution and home and car invasion.,2020-04-04 13:57:30+00:00,,,1246436739192782848,,https://twitter.com/jhopper23/status/1246436739192782848,0,0,,
i constantly saw heinously tortured and murdered animals in those areas.,2020-04-04 13:56:52+00:00,,,1246436578685116416,,https://twitter.com/jhopper23/status/1246436578685116416,0,0,,
i lived in yuba city for a year. it was a year in hell. the only people as heinous as the hispanics in yuba city are the nazi prison guards and their friends and family in calaveras,2020-04-04 13:52:54+00:00,,,1246435579182469120,,https://twitter.com/jhopper23/status/1246435579182469120,0,0,,
the gangs are in control of everything there. the water the housing the social services. and those gang members trickle into here.,2020-04-04 13:46:15+00:00,,,1246433906930286596,,https://twitter.com/jhopper23/status/1246433906930286596,0,0,,
yuba city and marysville are breeding grounds for north nathaniel and ms gang members.,2020-04-04 13:45:24+00:00,,,1246433693071101952,,https://twitter.com/jhopper23/status/1246433693071101952,0,0,,
the only people who tag to cause public mayhem are gang members traffickers and meth people.,2020-04-04 13:43:30+00:00,,,1246433213142065153,,https://twitter.com/jhopper23/status/1246433213142065153,0,0,,
and the only hispanic individuals coming into this area are gardeners. pool builders.,2020-04-04 13:41:57+00:00,,,1246432822945918976,,https://twitter.com/jhopper23/status/1246432822945918976,0,0,,
and the tags on anything electrical plumbing in public where an explosion can be created.,2020-04-04 13:40:38+00:00,,,1246432494724845570,,https://twitter.com/jhopper23/status/1246432494724845570,0,0,,
the tag on the ladder to get up the water tank.,2020-04-04 13:39:54+00:00,,,1246432308371918851,,https://twitter.com/jhopper23/status/1246432308371918851,0,0,,
i know this by the black and white cop kids play here gang tag on the garbage can at the park.,2020-04-04 13:39:17+00:00,,,1246432154650726400,,https://twitter.com/jhopper23/status/1246432154650726400,0,0,,
there is m.s.13 and north nathaniel 14 here.,2020-04-04 13:38:06+00:00,,,1246431856892862465,,https://twitter.com/jhopper23/status/1246431856892862465,0,0,,
,2020-04-04 13:17:25+00:00,,,1246426651673505792,,https://twitter.com/jhopper23/status/1246426651673505792,0,0,,https://youtu.be/7P6N8r1kUTM
,2020-04-04 13:17:25+00:00,,,1246426651652571139,,https://twitter.com/jhopper23/status/1246426651652571139,0,0,,https://youtu.be/grPfVlj7Go4
,2020-04-04 06:19:56+00:00,,,1246321587638267904,,https://twitter.com/jhopper23/status/1246321587638267904,0,0,,https://youtu.be/p8fH9fV6Svw
,2020-04-04 06:10:26+00:00,,,1246319195005939712,,https://twitter.com/jhopper23/status/1246319195005939712,0,0,,https://youtu.be/6zXjMMpQOtE
,2020-04-04 06:00:16+00:00,,,1246316637684240384,,https://twitter.com/jhopper23/status/1246316637684240384,0,0,,https://youtu.be/X8LUd51IuiA
,2020-04-04 01:06:30+00:00,,,1246242707346866176,,https://twitter.com/jhopper23/status/1246242707346866176,0,0,,
,2020-04-03 21:01:38+00:00,,,1246181087300030464,,https://twitter.com/jhopper23/status/1246181087300030464,0,0,,https://youtu.be/uP6fkha9TVQ
,2020-04-03 20:43:10+00:00,,,1246176439289786368,,https://twitter.com/jhopper23/status/1246176439289786368,0,0,,https://youtu.be/ghZ1znTEZY0
,2020-04-03 20:42:25+00:00,,,1246176250219003904,,https://twitter.com/jhopper23/status/1246176250219003904,0,0,,https://youtu.be/LjxulQ1bEWg
they are not wearing masks. nobody thinks it's okay they are here. and there are multiple people in one truck.,2020-04-03 18:49:38+00:00,,,1246147865107247105,,https://twitter.com/jhopper23/status/1246147865107247105,0,0,,
https://www.onla.org/news/496819/covid-19-essential-businesses-guidelines.htm,2020-04-03 18:48:52+00:00,,,1246147675445006336,,https://twitter.com/jhopper23/status/1246147675445006336,0,0,,https://www.onla.org/news/496819/COVID-19-Essential-Businesses-Guidelines.htm
https://www.onla.org/news/496819/covid-19-essential-businesses-guidelines.htm,2020-04-03 18:14:05+00:00,,,1246138919349039106,,https://twitter.com/jhopper23/status/1246138919349039106,0,0,,https://www.onla.org/news/496819/COVID-19-Essential-Businesses-Guidelines.htm
none of us can go for our daily walk. while they are here.,2020-04-03 17:39:59+00:00,,,1246130337702227969,,https://twitter.com/jhopper23/status/1246130337702227969,0,0,,
i'm going to contact an attorney today.,2020-04-03 17:38:42+00:00,,,1246130015990734848,,https://twitter.com/jhopper23/status/1246130015990734848,0,0,,
i'm going to sue if my mother catches the virus or i do.,2020-04-03 17:38:13+00:00,,,1246129895178039297,,https://twitter.com/jhopper23/status/1246129895178039297,0,0,,
a female officer from roseville pd told me gardening and pool building are considered essential businesses.,2020-04-03 17:37:18+00:00,,,1246129662297702400,,https://twitter.com/jhopper23/status/1246129662297702400,0,0,,
halverson there is a pool being built. roseville tells me they aren't breaking the restrictions of essential businesses only.,2020-04-03 17:36:36+00:00,,,1246129486946426880,,https://twitter.com/jhopper23/status/1246129486946426880,0,0,,
these work crews are not wearing masks and they are parking in front of people's homes they aren't working on and leaving cigarette butts on the ground outside their cars.,2020-04-03 17:35:45+00:00,,,1246129275830337536,,https://twitter.com/jhopper23/status/1246129275830337536,0,0,,
excuse me mr. trump i'm in the sacramento area newsome is my governor and we have hispanic crews coming into our neighborhood daily. this neighborhood predominantly senior citizens over 70 years old.,2020-04-03 17:34:34+00:00,,,1246128975832735745,,https://twitter.com/jhopper23/status/1246128975832735745,0,0,,
eat. is the ax.,2020-04-03 12:45:02+00:00,,,1246056112048066560,,https://twitter.com/jhopper23/status/1246056112048066560,0,0,,
,2020-04-03 12:44:22+00:00,,,1246055945488052226,,https://twitter.com/jhopper23/status/1246055945488052226,1,0,,
,2020-04-03 12:43:55+00:00,,,1246055829729447936,,https://twitter.com/jhopper23/status/1246055829729447936,0,0,,
,2020-04-03 03:28:17+00:00,,,1245916000677064705,,https://twitter.com/jhopper23/status/1245916000677064705,0,0,,https://youtu.be/A09GZeORYlo
i'm not. they just don't like it i can see their contract or black tape and tags.,2020-04-03 03:26:27+00:00,,,1245915540519915521,,https://twitter.com/jhopper23/status/1245915540519915521,0,0,,
i'm gang affiliated because i can read gang tags. just ask the punishers.,2020-04-03 03:25:53+00:00,,,1245915397620002817,,https://twitter.com/jhopper23/status/1245915397620002817,0,0,,
"marshall doesn't know it, but them torturers do.",2020-04-03 03:24:41+00:00,,,1245915097630830594,,https://twitter.com/jhopper23/status/1245915097630830594,0,0,,
if we're going to talk about game of thrones.,2020-04-03 03:24:13+00:00,,,1245914978105700355,,https://twitter.com/jhopper23/status/1245914978105700355,0,0,,
marshall doesn't know i passed a prison key to the hp bed fellows of mine to get their friends out. they was holding hostage.,2020-04-03 03:23:53+00:00,,,1245914892671971333,,https://twitter.com/jhopper23/status/1245914892671971333,0,0,,
sunshines true story corner. this is just a story.,2020-04-03 03:23:03+00:00,,,1245914684789624832,,https://twitter.com/jhopper23/status/1245914684789624832,0,0,,
things marshall does not know.,2020-04-03 03:22:38+00:00,,,1245914580796100610,,https://twitter.com/jhopper23/status/1245914580796100610,0,0,,
,2020-04-03 01:39:19+00:00,,,1245888578153897985,,https://twitter.com/jhopper23/status/1245888578153897985,0,0,,https://youtu.be/zzGALF21xVs
the are all satanics. who congregate with nazis,2020-04-02 14:46:53+00:00,,,1245724387820503040,,https://twitter.com/jhopper23/status/1245724387820503040,0,0,,
that piece of shit and 65 are red pen. and satanic.,2020-04-02 14:46:13+00:00,,,1245724220442566659,,https://twitter.com/jhopper23/status/1245724220442566659,0,0,,
delete that i dont want it,2020-04-02 14:27:49+00:00,,,1245719591231225857,,https://twitter.com/jhopper23/status/1245719591231225857,0,0,,
,2020-04-01 23:34:32+00:00,,,1245494788742238208,,https://twitter.com/jhopper23/status/1245494788742238208,0,0,,https://youtu.be/OKkL1ndod6U
bb,2020-04-01 19:22:32+00:00,,,1245431372547686400,,https://twitter.com/jhopper23/status/1245431372547686400,0,0,,https://youtu.be/Eab_beh07HU
,2020-04-01 19:02:23+00:00,,,1245426301562785792,,https://twitter.com/jhopper23/status/1245426301562785792,0,0,,https://youtu.be/bgDILOXMmec
,2020-04-01 18:59:00+00:00,,,1245425450597244928,,https://twitter.com/jhopper23/status/1245425450597244928,0,0,,https://youtu.be/aGneKdKtsSQ
maybe a few of them.,2020-04-01 12:18:21+00:00,,,1245324622360244224,,https://twitter.com/jhopper23/status/1245324622360244224,0,0,,
there's a rat here.,2020-04-01 12:17:59+00:00,,,1245324530299494401,,https://twitter.com/jhopper23/status/1245324530299494401,0,0,,
,2020-04-01 04:02:23+00:00,,,1245199808387633153,,https://twitter.com/jhopper23/status/1245199808387633153,0,0,,https://youtu.be/lgSH3LPfo6g
,2020-04-01 03:52:39+00:00,,,1245197360185016320,,https://twitter.com/jhopper23/status/1245197360185016320,0,0,,https://youtu.be/dsE8ll4TUd4
"and theres many different species of birds, butterflies and bees in my yard and at this time the children can learn to identify different species of animals insects and bugs.",2020-04-01 00:42:47+00:00,,,1245149575725252608,,https://twitter.com/jhopper23/status/1245149575725252608,0,0,,
,2020-04-01 00:41:21+00:00,,,1245149214310465536,@WeathermanAdam,https://twitter.com/jhopper23/status/1245149214310465536,1,0,,
if you're not old enough to read upside down and backwards you're not old enough to talk to me,2020-03-31 22:45:57+00:00,,,1245120173226356736,,https://twitter.com/jhopper23/status/1245120173226356736,0,0,,
941,2020-03-31 17:02:24+00:00,,,1245033716436484098,,https://twitter.com/jhopper23/status/1245033716436484098,0,0,,
i pray to god the whore lifestyle dies with this plague.,2020-03-31 16:20:45+00:00,,,1245023235621543943,,https://twitter.com/jhopper23/status/1245023235621543943,0,0,,
i hope all the sex club members die. they spread disease and sickness.,2020-03-31 16:20:07+00:00,,,1245023077450182657,,https://twitter.com/jhopper23/status/1245023077450182657,0,0,,
let her be a foster smith.,2020-03-31 16:19:27+00:00,,,1245022908226789377,,https://twitter.com/jhopper23/status/1245022908226789377,0,0,,
in addition you aren't suppose to be selling t-shirts or sweatshirts to profit from the corona virus.,2020-03-31 16:19:01+00:00,,,1245022801318174721,,https://twitter.com/jhopper23/status/1245022801318174721,0,0,,
"'we want to 'foster' the fosters,are the epicenter of the sex club in calaveras that specializes in child porn and child hookups for their butt fuck buddies.",2020-03-31 16:18:24+00:00,,,1245022643020910595,,https://twitter.com/jhopper23/status/1245022643020910595,0,0,,
look at folsom stronger is begging to have the fosters lifestyle. nasty,2020-03-31 16:17:09+00:00,,,1245022331849719808,,https://twitter.com/jhopper23/status/1245022331849719808,0,0,,
they used oleander to make the virus.,2020-03-31 10:47:47+00:00,,,1244939443271688196,,https://twitter.com/jhopper23/status/1244939443271688196,0,0,,
auburn and hayward.,2020-03-31 10:35:41+00:00,,,1244936398064345088,,https://twitter.com/jhopper23/status/1244936398064345088,0,0,,
my brain is telling me that the areas with the largest corona virus numbers have an east problem. and i believe the wave doesnt stop until you locate the leak and eliminate it.,2020-03-31 10:23:16+00:00,,,1244933272724856832,,https://twitter.com/jhopper23/status/1244933272724856832,0,0,,
i think it's strange the first thing china opened was a mall.,2020-03-31 10:08:57+00:00,,,1244929669167644675,,https://twitter.com/jhopper23/status/1244929669167644675,0,0,,
,2020-03-31 03:46:28+00:00,,,1244833415070801920,,https://twitter.com/jhopper23/status/1244833415070801920,0,0,,https://youtu.be/kBhSh7y_IkM
,2020-03-31 03:36:49+00:00,,,1244830985092395009,,https://twitter.com/jhopper23/status/1244830985092395009,0,0,,https://youtu.be/qfORYJt3OJU
,2020-03-31 03:33:00+00:00,,,1244830026161221632,,https://twitter.com/jhopper23/status/1244830026161221632,0,0,,https://youtu.be/_21cZe2eO_I
,2020-03-31 03:26:22+00:00,,,1244828353963540480,,https://twitter.com/jhopper23/status/1244828353963540480,0,0,,https://youtu.be/Kw2FVxSOhv4
,2020-03-31 03:21:35+00:00,,,1244827153327243265,,https://twitter.com/jhopper23/status/1244827153327243265,0,0,,https://youtu.be/LgCWgfwlk0M
,2020-03-31 03:17:36+00:00,,,1244826148803981314,,https://twitter.com/jhopper23/status/1244826148803981314,0,0,,https://youtu.be/LTZ5VpfzoW0
,2020-03-31 03:12:38+00:00,,,1244824900939862016,,https://twitter.com/jhopper23/status/1244824900939862016,0,0,,https://youtu.be/la9Iy0RTvCI
,2020-03-31 03:07:41+00:00,,,1244823653599989760,,https://twitter.com/jhopper23/status/1244823653599989760,0,0,,https://youtu.be/OnDu1HHOo78
