text,date,geo,hashtags,tweet_id,mentions,permalink,replies,retweets,replies_to,mentioned_urls
whose recovery is it anyway...,2020-07-09 18:08:28+00:00,,,1281289130064961540,,https://twitter.com/NephetsYollam/status/1281289130064961540,0,0,JohnDivney,
"blown. away. but then she's way smarter than me, so...",2020-07-09 15:47:04+00:00,,,1281253547112370180,,https://twitter.com/NephetsYollam/status/1281253547112370180,0,0,ZoeDodd,
rake like physique...before the onset of 'dadbod',2020-07-09 14:39:06+00:00,,,1281236441733959681,,https://twitter.com/NephetsYollam/status/1281236441733959681,1,0,GBMC73,
aw thnx heather..will pass it on.x,2020-07-09 14:38:23+00:00,,,1281236262779793410,,https://twitter.com/NephetsYollam/status/1281236262779793410,0,0,happyherra,
 totally shona.,2020-07-09 14:24:52+00:00,,,1281232857369849856,,https://twitter.com/NephetsYollam/status/1281232857369849856,0,0,shonastraiton,
"..and also adding; the original poster of this video is clearly a racist dick, and i don't agree at all with his words or sentiment. i was only commenting on the crown behaviour. in fact jim, im gonnae delete it.",2020-07-09 14:23:02+00:00,,,1281232399884603392,,https://twitter.com/NephetsYollam/status/1281232399884603392,0,0,NephetsYollam,
"quickly adding, its obviously not okay to rob the amazon van either.",2020-07-09 13:53:55+00:00,,,1281225069654663169,,https://twitter.com/NephetsYollam/status/1281225069654663169,1,0,NephetsYollam,
robbing the amazon van- 1 thing robbing the woman of her bag like that..violently...disgusting.,2020-07-09 13:53:04+00:00,,,1281224857963937794,,https://twitter.com/NephetsYollam/status/1281224857963937794,1,0,InvisibleJim1,
another oldie naloxone pil,2020-07-09 13:40:22+00:00,,#naloxone #PIL,1281221661489090562,,https://twitter.com/NephetsYollam/status/1281221661489090562,0,0,,
"small, but might powerful.",2020-07-09 13:20:07+00:00,,,1281216565342601219,,https://twitter.com/NephetsYollam/status/1281216565342601219,0,3,TransformDrugs,https://twitter.com/TransformDrugs/status/1281161169177378817
 ,2020-07-09 13:04:08+00:00,,,1281212542128459776,,https://twitter.com/NephetsYollam/status/1281212542128459776,0,0,andrewlearmonth,
....nutritional excellence john. i salute you.,2020-07-09 12:39:26+00:00,,,1281206324651601920,,https://twitter.com/NephetsYollam/status/1281206324651601920,2,0,cothrom2003,
"to be fair i could with catching up with lee too, so two way street...",2020-07-09 12:36:56+00:00,,,1281205696340594688,,https://twitter.com/NephetsYollam/status/1281205696340594688,1,0,JohnDivney,
just remembered she met you before; at the first recovery walk down the green i think. 07 or something... cheers saket.,2020-07-09 12:35:24+00:00,,,1281205313023156226,,https://twitter.com/NephetsYollam/status/1281205313023156226,0,0,NephetsYollam,
 ,2020-07-09 12:31:02+00:00,,,1281204213813596161,,https://twitter.com/NephetsYollam/status/1281204213813596161,1,0,saket_sanju,
"that qualifier, yes john, but out in a later round.",2020-07-09 12:29:56+00:00,,,1281203936070905861,,https://twitter.com/NephetsYollam/status/1281203936070905861,0,0,JohnDivney,
obviously i've quit the sugar puffs and cheesy pasta now...totally played havoc with blood sugar,2020-07-09 12:28:33+00:00,,,1281203589327847425,,https://twitter.com/NephetsYollam/status/1281203589327847425,1,0,,
"just sharing an old photo for the fun of it. 2003 (or maybe it was 04..) this was a homeless world cup qualifier thing i played in. yes, i was very thin; my diet mainly consisted of sugar puffs, cheesy pasta and heroin at that point still, it was happy daze...",2020-07-09 12:25:08+00:00,,,1281202729105461249,,https://twitter.com/NephetsYollam/status/1281202729105461249,6,0,,
"och mate... talk later if you have time, eh? i'll take it over to dm to get a time.. ",2020-07-09 12:17:08+00:00,,,1281200716015599617,,https://twitter.com/NephetsYollam/status/1281200716015599617,1,0,LeeCollingham,
 ,2020-07-09 12:14:57+00:00,,,1281200165597196288,,https://twitter.com/NephetsYollam/status/1281200165597196288,0,0,caro4glasgow,
100%,2020-07-09 12:14:32+00:00,,,1281200058713673728,,https://twitter.com/NephetsYollam/status/1281200058713673728,0,0,maxblunt,
i used to use this slide in training...,2020-07-09 11:56:28+00:00,,,1281195513161887744,,https://twitter.com/NephetsYollam/status/1281195513161887744,0,0,,
ano...i was basically dicking around...ended up in the army for a wee while..had zero real idea about what i wanted to do. i remember saying i wanted to be a pathologist..but someone said i'd been watching to much quincy and not to be 'stupit' ,2020-07-09 11:53:52+00:00,,,1281194859127279616,,https://twitter.com/NephetsYollam/status/1281194859127279616,1,0,cothrom2003,
"awrite  found an old photo. you, eliza wheeler (the legend from dope) and me in beirut. hope you're well mate.",2020-07-09 11:51:02+00:00,,,1281194146464763904,@LeeCollingham,https://twitter.com/NephetsYollam/status/1281194146464763904,2,0,,
"thats right!! i remember that. hannah wanted to do medicine, switched to law at last minute. she now wants to take governments on.. ",2020-07-09 11:46:41+00:00,,,1281193050774155270,,https://twitter.com/NephetsYollam/status/1281193050774155270,1,0,cothrom2003,
thanks cal- the plan to have a lawyer on call is coming to fruition. ,2020-07-09 11:45:24+00:00,,,1281192726436986881,,https://twitter.com/NephetsYollam/status/1281192726436986881,0,0,CalWiseman,
shes amazing. ,2020-07-09 11:44:15+00:00,,,1281192437810167808,,https://twitter.com/NephetsYollam/status/1281192437810167808,0,0,louisestewart80,
"tbf all her own work and study, but yes immensely proud of her. like all dads im sure, its been a pleasure to watch her grow up... ",2020-07-09 11:43:25+00:00,,,1281192227876802561,,https://twitter.com/NephetsYollam/status/1281192227876802561,1,0,cothrom2003,
"another hugely proud day in my family- wee hannah malloy, my daughter, has achieved her law llb (hons). a 2:1 as well...clever cookie that she is... ",2020-07-09 11:25:55+00:00,,,1281187826143498241,,https://twitter.com/NephetsYollam/status/1281187826143498241,17,1,,
"the left gets rolled on legalizing pot — and legal protections for cops a ""unity"" task force on criminal justice reform created by biden's campaign rejects policies pushed by sanders supporters. https://www.politico.com/amp/news/2020/07/08/biden-legal-marijuana-police-protections-353585?__twitter_impression=true",2020-07-09 09:03:35+00:00,,,1281152005403283456,,https://twitter.com/NephetsYollam/status/1281152005403283456,0,0,,https://www.politico.com/amp/news/2020/07/08/biden-legal-marijuana-police-protections-353585?__twitter_impression=true
yes...this is me looking at the details of the actual progress the uk so far. apologies for the foul language- james is a respected harm reductionist and advocate for people who use drugs. any/all of them. not single issue..so errors are errors..i was annoyed. chilled now though,2020-07-08 14:26:24+00:00,,,1280870855619248128,,https://twitter.com/NephetsYollam/status/1280870855619248128,1,0,CLEARUK,
..that'll be how its a fucking mess then.,2020-07-08 14:15:38+00:00,,,1280868148250652673,,https://twitter.com/NephetsYollam/status/1280868148250652673,1,0,CLEARUK,
,2020-07-08 13:11:34+00:00,,,1280852024075210752,,https://twitter.com/NephetsYollam/status/1280852024075210752,2,0,p3t3rmcd,
,2020-07-08 12:48:41+00:00,,,1280846264964460544,,https://twitter.com/NephetsYollam/status/1280846264964460544,0,1,paulhutcheon,
 ,2020-07-08 07:13:15+00:00,,,1280761850599268352,,https://twitter.com/NephetsYollam/status/1280761850599268352,0,0,thelizardpope,
..is the 77 a day not the daily take home on a 25k salary? did you muddle numbers?,2020-07-08 06:50:39+00:00,,,1280756164926623745,,https://twitter.com/NephetsYollam/status/1280756164926623745,0,0,NephetsYollam,
the example given ; a salary of 25k only gives you around 1700 per month...how can a nurse on that salary be paying 1500 a month to park a car ,2020-07-08 06:49:36+00:00,,,1280755900731535360,@KayBurley,https://twitter.com/NephetsYollam/status/1280755900731535360,1,0,SkyNews,
"""the court heard officers witnessed mckenna speaking to a group of men “of drug user appearance” on gordon street."" ..of drug user appearance... seriously, that was used in a court.",2020-07-08 06:30:10+00:00,,,1280751009476861953,,https://twitter.com/NephetsYollam/status/1280751009476861953,1,1,Glasgow_Times,https://twitter.com/Glasgow_Times/status/1280747191364210689
"have one for drugs related/overdose deaths; gurenteed more people will have died, and will die from drds/ods than covid-19 in scotland. even international overdose awareness day goes unrecognised in scotland/uk.",2020-07-07 22:05:25+00:00,,,1280623986829701126,,https://twitter.com/NephetsYollam/status/1280623986829701126,0,0,LabourRichard,
all the way from glasgow ,2020-07-07 20:26:33+00:00,,,1280599103697760262,,https://twitter.com/NephetsYollam/status/1280599103697760262,0,0,davidthekick,
 ,2020-07-07 20:20:16+00:00,,,1280597522617073665,,https://twitter.com/NephetsYollam/status/1280597522617073665,1,0,JohnDivney,
 hi david just saying hi.,2020-07-07 20:19:00+00:00,,,1280597203246030850,@davidthekick,https://twitter.com/NephetsYollam/status/1280597203246030850,1,0,,
what leo said . seriously.,2020-07-07 20:00:30+00:00,,,1280592547836985344,,https://twitter.com/NephetsYollam/status/1280592547836985344,0,1,LeoBeletsky,https://twitter.com/LeoBeletsky/status/1280588713513238528
 ,2020-07-07 19:47:27+00:00,,,1280589266511372288,,https://twitter.com/NephetsYollam/status/1280589266511372288,1,0,JohnDivney,
"i'm inclined to concur with the hypothesis, and if not heroin itself, certainly counterfeit oxys. as the us must learn from other countries so must the uk and eu. https://twitter.com/ijdrugpolicy/status/1280526758534500352",2020-07-07 19:45:51+00:00,,,1280588859840102401,,https://twitter.com/NephetsYollam/status/1280588859840102401,0,2,,https://twitter.com/ijdrugpolicy/status/1280526758534500352
yeah...its complicated.,2020-07-07 19:40:58+00:00,,,1280587631882055682,,https://twitter.com/NephetsYollam/status/1280587631882055682,2,0,JohnDivney,
focused on what i can do/deliver mate.,2020-07-07 19:29:16+00:00,,,1280584688806113282,,https://twitter.com/NephetsYollam/status/1280584688806113282,1,0,JohnDivney,
"thanks jenny its an exellent session, and the students are always very engaged. worthy of note; it's probably one of the only healthcare and therapy areas where the 'patients' are criminalised, and where they'll likely experience more stigma being in tx treatment than not.",2020-07-07 19:01:36+00:00,,,1280577724093026306,,https://twitter.com/NephetsYollam/status/1280577724093026306,0,0,JScottUoB,
gave up im afraid. feel bad for fellow drug users in my country. but what can you do; policy makers (and media here) are interested in narratives that reinforce the long held biases. all the oxygen in the debate gets used up. its all a bit 'kumbya',2020-07-07 18:42:39+00:00,,,1280572955794210818,,https://twitter.com/NephetsYollam/status/1280572955794210818,1,0,methmaint,
"no, certain press has made the plight of the press massively worse. covid-19 hs just added to it.",2020-07-07 13:34:31+00:00,,,1280495410776342537,,https://twitter.com/NephetsYollam/status/1280495410776342537,0,0,iainmacwhirter,
perhaps of interest. maybe time for  to stand more firmly against the 'war on drugs'.,2020-07-07 11:40:09+00:00,,,1280466633023270912,@labour,https://twitter.com/NephetsYollam/status/1280466633023270912,0,0,LabourRichard,https://idpc.net/blog/2020/06/the-war-on-drugs-is-built-on-racism-it-s-time-to-decolonise-drug-policies
i'd have thought all of you would have been awake to it a long time ago.,2020-07-07 10:54:51+00:00,,,1280455230510043137,,https://twitter.com/NephetsYollam/status/1280455230510043137,1,0,MonicaLennon7,
"i think there's a lot of people who really need to see facial expression too, and masked up people everywhere can be a bit scary for some. at least with this you can smile ",2020-07-07 07:26:52+00:00,,,1280402889085771776,,https://twitter.com/NephetsYollam/status/1280402889085771776,0,0,afterprohibends,
i thought it was from yesterday?,2020-07-07 06:54:04+00:00,,,1280394637526663168,,https://twitter.com/NephetsYollam/status/1280394637526663168,0,0,afterprohibends,
"""coronavirus spreads through the air as aerosol, 230 scientists write in open letter to world health organization""",2020-07-07 06:42:46+00:00,,,1280391791645261824,,https://twitter.com/NephetsYollam/status/1280391791645261824,0,3,,https://www.abc.net.au/news/2020-07-06/aerosol-transmission-of-covid-19/12425852
"i have to say, ironmanvr is excellent. bit blown away by it tbh...i didn't think it would be as much fun as it is. be patient, and the flight control becomes really quite instinctive. 10/10 to  ",2020-07-06 17:18:29+00:00,,#IronManVR,1280189387658199043,@Camouflaj,https://twitter.com/NephetsYollam/status/1280189387658199043,0,0,,
excellent documentary. highly recommend!!,2020-07-06 16:06:42+00:00,,,1280171321532592129,,https://twitter.com/NephetsYollam/status/1280171321532592129,0,3,INPUD,https://twitter.com/INPUD/status/1280161041767374850
"william rees-mogg, father of  didn't appear to believe that prohibition worked at all. perhaps his son may hold a similar view. who knows. how times change, but somehow stay the same.",2020-07-06 14:29:29+00:00,,,1280146858002825217,@Jacob_Rees_Mogg,https://twitter.com/NephetsYollam/status/1280146858002825217,0,0,DrugWiseUK,https://twitter.com/DrugWiseUK/status/1280139440422367232
*expensive to deliver due to high salary costs of clinical staff involved* that can be overcame though...,2020-07-06 12:56:58+00:00,,,1280123576209879040,,https://twitter.com/NephetsYollam/status/1280123576209879040,0,0,SteveTransform,
the reporting would have been a bit 'meh' had the media aimed to set the seizures against the actual stocks and revenues of the market.,2020-07-06 12:21:15+00:00,,,1280114584775536641,,https://twitter.com/NephetsYollam/status/1280114584775536641,0,0,lamplightercop,
"""the revenue of the drugs industry is greater than the uk revenue of such large companies as aldi (£8.7 billion in 2016/17), boots (£6.9 billion in 2016/17) and easyjet (£5.0 billion in 2016/17)"". ht ",2020-07-06 12:06:26+00:00,,,1280110856718684160,@russwebt,https://twitter.com/NephetsYollam/status/1280110856718684160,1,0,lamplightercop,
thats a crackin picture...,2020-07-06 11:54:45+00:00,,,1280107916230623232,,https://twitter.com/NephetsYollam/status/1280107916230623232,3,0,JohnDivney,
"i believe  indicated his support for the provision of diamorphine in clinics, as part of structured treatment, and a means to keep people away from harmful street drugs (and acquisitive crime).",2020-07-06 11:07:55+00:00,,,1280096133021405184,@kitmalthouse,https://twitter.com/NephetsYollam/status/1280096133021405184,1,0,SteveTransform,
looks like the tasmanian papaver somniferum,2020-07-06 10:21:17+00:00,,,1280084396448583683,,https://twitter.com/NephetsYollam/status/1280084396448583683,0,0,SteveTransform,
dam treatment in the ioat clinic https://compendium.ch/fr/product/1179602-diaphin-ir-tabl-200-mg/mpro,2020-07-06 09:53:52+00:00,,,1280077496394940416,,https://twitter.com/NephetsYollam/status/1280077496394940416,0,0,,https://compendium.ch/fr/product/1179602-diaphin-ir-tabl-200-mg/mpro
"its an illusion, isnt it.",2020-07-06 09:37:36+00:00,,,1280073401395281922,,https://twitter.com/NephetsYollam/status/1280073401395281922,1,0,horror_jock,
"i mean, i can understand why there's so much congratulatory language, and quite a bit of showing off and 'flexing'. but in truth, when you set it against those revenues (not to mention the violence, the deaths, etc) it just looks like pr, propaganda, and self justification.",2020-07-06 09:36:22+00:00,,,1280073092052680704,,https://twitter.com/NephetsYollam/status/1280073092052680704,0,1,lamplightercop,
"worth the reminder, during all the encrochat reports. consumers in england and wales spent £9.4 billion on drugs in 2016/17. the largest market is opiates (£3.8 billion), followed by cannabis (£2.4 billion) and powder cocaine (£1.9 billion). dame black report 2020.",2020-07-06 09:22:20+00:00,,#EncroChat #drugs #opiates #cannabis #cocaine,1280069562877317121,,https://twitter.com/NephetsYollam/status/1280069562877317121,0,1,,
"its weird (not) how properly out of context these 'news' stories are. consumers in england and wales spent £9.4 billion on drugs in 2016/17. the largest market is opiates (£3 . 8 billion), followed by cannabis (£2.4 billion) and powder cocaine (£1.9 billion). dame black report.",2020-07-06 09:17:13+00:00,,,1280068271233007616,,https://twitter.com/NephetsYollam/status/1280068271233007616,2,1,lamplightercop,
what they said naloxone drug users are usually first responders to overdose.,2020-07-06 08:22:42+00:00,,#naloxone,1280054555443593217,,https://twitter.com/NephetsYollam/status/1280054555443593217,0,5,,
yup.,2020-07-05 21:36:29+00:00,,,1279891926402113539,,https://twitter.com/NephetsYollam/status/1279891926402113539,0,0,donemay,
"the misuse of drugs act; providing law enforcement with an excuse to stop anyone, anytime. more so if you're balck or if you're poor. and if you're both, it's double whammy.",2020-07-05 19:59:39+00:00,,,1279867557403656193,,https://twitter.com/NephetsYollam/status/1279867557403656193,3,11,AaronBastani,https://twitter.com/AaronBastani/status/1279733835958280192
its really not 'day one' again.,2020-07-05 17:55:25+00:00,,,1279836295255244807,,https://twitter.com/NephetsYollam/status/1279836295255244807,0,0,n0vaella,
free,2020-07-05 14:36:12+00:00,,,1279786159011479553,,https://twitter.com/NephetsYollam/status/1279786159011479553,1,0,911well,
party time up the milton ,2020-07-05 09:34:36+00:00,,,1279710258655571968,@andcunningham,https://twitter.com/NephetsYollam/status/1279710258655571968,0,0,Glasgow_Times,
decided to buy this today. seems legit. https://twitter.com/brightsider123/status/1279439651556777990,2020-07-04 21:23:16+00:00,,,1279526214118584321,,https://twitter.com/NephetsYollam/status/1279526214118584321,0,0,,https://twitter.com/brightsider123/status/1279439651556777990
missed the offies as well; in glasgow we have a 10pm cut off for alcohol sales from shops. i remember being elsewhere and rqcing to tesco at 9.55. security thought i was mad..,2020-07-04 21:09:42+00:00,,,1279522798155837441,,https://twitter.com/NephetsYollam/status/1279522798155837441,1,0,c_cannabiscafe,
biiiiig ask. its difficult to pull back from accepted and authorised comstructs. but i hear you.,2020-07-04 21:06:40+00:00,,,1279522037292249094,,https://twitter.com/NephetsYollam/status/1279522037292249094,0,0,DrugEquality,
subversion.,2020-07-04 18:40:35+00:00,,,1279485272292458496,,https://twitter.com/NephetsYollam/status/1279485272292458496,0,0,PeteWishart,
cheers andy.,2020-07-04 10:46:26+00:00,,,1279365950912040963,,https://twitter.com/NephetsYollam/status/1279365950912040963,0,0,arjmcauley,
all destined for scotland apparently.,2020-07-04 07:33:49+00:00,,,1279317474685652993,,https://twitter.com/NephetsYollam/status/1279317474685652993,1,0,NephetsYollam,https://twitter.com/Daily_Record/status/1279316514395439104?s=19
"i also think its fair to assume that the volume being produced and in circulation is so great, and with multiple suppliers that thats why you can buy bucketloads of the rubbish for fairly small amouts of money.",2020-07-04 07:24:28+00:00,,,1279315121580498944,,https://twitter.com/NephetsYollam/status/1279315121580498944,2,0,FurthofScotland,
this is an intresting paper on the subject re prevalence of use. maybe  could chip in in terms of prevalence also. ,2020-07-04 07:18:46+00:00,,,1279313687992504320,@arjmcauley,https://twitter.com/NephetsYollam/status/1279313687992504320,1,0,NephetsYollam,https://bpspubs.onlinelibrary.wiley.com/doi/full/10.1111/bcp.14397
"..was up early though, so.. ",2020-07-04 07:07:09+00:00,,,1279310765787414528,,https://twitter.com/NephetsYollam/status/1279310765787414528,0,0,NephetsYollam,
but i remember this at the end of 2018. suggested production of 20m. there was no drought when it was interrupted. street supply of counterfeit valium remained.,2020-07-04 07:05:58+00:00,,,1279310465735286784,,https://twitter.com/NephetsYollam/status/1279310465735286784,2,0,NephetsYollam,https://www.google.com/amp/s/www.dailyrecord.co.uk/news/scottish-news/paisley-breaking-bad-drugs-gang-13760354.amp
mate im sitting in ma houscoat..in my shed.,2020-07-04 07:03:50+00:00,,,1279309930575659008,,https://twitter.com/NephetsYollam/status/1279309930575659008,1,0,afterprohibends,
"if 100k people were buying illict benzos, each using 20 per week, then it woupd be about 14 weeks supply. don't know if 100k is +/-, and 20 per week sounds low, but... quickmaths backofafagpacket",2020-07-04 07:02:12+00:00,,#quickmaths #Backofafagpacket,1279309519042928642,,https://twitter.com/NephetsYollam/status/1279309519042928642,1,0,jqjasonkew,
first look inside the pub.,2020-07-04 04:44:12+00:00,,,1279274789153181696,,https://twitter.com/NephetsYollam/status/1279274789153181696,2,0,,
"totally. but then, we live in a city where its illegal to carry/drink beer in a plastic cup, while outside... two cheeks, one arse.",2020-07-03 20:43:36+00:00,,,1279153841955655680,,https://twitter.com/NephetsYollam/status/1279153841955655680,1,0,louisestewart80,
appreciate the support and encouragement ,2020-07-03 19:33:31+00:00,,,1279136204575948800,,https://twitter.com/NephetsYollam/status/1279136204575948800,0,0,afterprohibends,
"maybe i should just get on it, and taxi it to engerland at 5ish.",2020-07-03 19:16:12+00:00,,,1279131847914655744,,https://twitter.com/NephetsYollam/status/1279131847914655744,1,0,afterprohibends,
need to get to bed early. long journey so early rise. want to be there before the queues start forming. 6ampubcrawl,2020-07-03 19:05:55+00:00,,#6AMpubcrawl,1279129259953590273,,https://twitter.com/NephetsYollam/status/1279129259953590273,2,0,,
"why didn't the lord provost blast the lack of public amenities (covid-19 or not, they should)",2020-07-03 19:02:54+00:00,,,1279128499954094080,,https://twitter.com/NephetsYollam/status/1279128499954094080,0,0,Glasgow_Times,https://twitter.com/Glasgow_Times/status/1279127773190082560
when competence and incompetence collide.,2020-07-03 19:01:14+00:00,,,1279128080502665216,,https://twitter.com/NephetsYollam/status/1279128080502665216,0,0,JaneyGodley,https://twitter.com/JaneyGodley/status/1279094985414127622
"its coming up on 20, 25 years since the swiss broke the previously existing mould, and took the steps they did. they're in an admirable (not perfect) place, but it has taken a long time to get there.",2020-07-03 13:43:54+00:00,,,1279048223781531667,,https://twitter.com/NephetsYollam/status/1279048223781531667,0,0,NephetsYollam,
"the update was part of discussion with an in country provider of services. i'll source the information/guidance (it will be in german), but i think its not that big a deal in their eyes, and during covid-19, no different to providing methadone etc. its well established, as u know",2020-07-03 13:41:13+00:00,,,1279047547135365130,,https://twitter.com/NephetsYollam/status/1279047547135365130,1,0,clairerobbinsok,
"for people outside of glasgow, this only applies to glasgow. outside of glasgow you can all be trusted not to pee everywhere and throw plastic cups at each other. cheeky monkeys. happy friday ",2020-07-03 13:16:34+00:00,,,1279041344653209601,,https://twitter.com/NephetsYollam/status/1279041344653209601,0,0,Glasgow_Times,https://twitter.com/Glasgow_Times/status/1279040115822690304
"witherspoons the morra, 6.30am.",2020-07-03 12:59:24+00:00,,,1279037024574607361,,https://twitter.com/NephetsYollam/status/1279037024574607361,1,0,afterprohibends,
speechless. https://twitter.com/benkentish/status/1279019433156018177,2020-07-03 12:47:54+00:00,,,1279034129082966019,,https://twitter.com/NephetsYollam/status/1279034129082966019,1,0,,https://twitter.com/BenKentish/status/1279019433156018177
fresh,2020-07-03 12:21:10+00:00,,#fresh,1279027403269046273,,https://twitter.com/NephetsYollam/status/1279027403269046273,0,1,SuzanneSFAD,https://twitter.com/SuzanneSFAD/status/1278996610706485255
whats it called tim?,2020-07-03 08:03:00+00:00,,,1278962432069775361,,https://twitter.com/NephetsYollam/status/1278962432069775361,1,0,BinghamInfo,
"so far, in the past couple of months, i've had to remove a few ticks from our dog. only other times has been after 'countryside' trips, but the recent ones have been from walking about locally. i guess its the foxes and/or hedgehogs that carry them here nastybiteyweefeckers",2020-07-03 07:35:27+00:00,,#NastyBiteyWeeFeckers,1278955497312395265,,https://twitter.com/NephetsYollam/status/1278955497312395265,2,0,DorsetCCG,https://twitter.com/DorsetCCG/status/1278725379876884481
"still available on prime though..thats right now. delivery tomorrow. 5k/h excellent work by police, but not that impactful, overall. re illicit bezos use/benzo dependence-100% agree. scotland needs to grap the nettle though... even if it stings at but at first. you know it.",2020-07-02 21:40:11+00:00,,,1278805695748542468,,https://twitter.com/NephetsYollam/status/1278805695748542468,0,0,CatrionaMath,
