text,date,geo,hashtags,tweet_id,mentions,permalink,replies,retweets,replies_to,mentioned_urls
" well done the staff at  sydney misc. great video (of course thats not narcan, but thats okay...who cares ) naloxone harmreduction",2020-06-19 10:26:06+00:00,,#naloxone #HarmReduction,1273925012794347521,@weareuniting,https://twitter.com/NephetsYollam/status/1273925012794347521,0,0,,https://youtu.be/0eqZSy9aHuM
this is extremely important. if true.,2020-06-19 10:19:15+00:00,,,1273923289421938688,,https://twitter.com/NephetsYollam/status/1273923289421938688,0,0,PieterHog,
"in the uk, since 1991 apparently. must confess that despite having visited lots of cities in the uk, i still dont think i've seen one except for inside an existing service.",2020-06-19 10:16:19+00:00,,,1273922553313218560,,https://twitter.com/NephetsYollam/status/1273922553313218560,1,0,AlexStevensKent,
 ,2020-06-19 09:13:40+00:00,,,1273906784294633474,,https://twitter.com/NephetsYollam/status/1273906784294633474,0,0,dr_jdlivingston,https://twitter.com/dr_jdlivingston/status/1273653791854821378
"i think france, germany, other european countries ..even the some us states have them..",2020-06-19 08:45:14+00:00,,,1273899631156645888,,https://twitter.com/NephetsYollam/status/1273899631156645888,1,0,pwidpride,
"i imagine this would be fairly easy to overcome..in reality i mean. if a service wanted to provide it, and had the budget to do it, im sure a solution would be found.",2020-06-19 08:39:27+00:00,,,1273898177259802625,,https://twitter.com/NephetsYollam/status/1273898177259802625,1,0,WilliamHaydock,
scotland supplied around 1.5-2m wfi amps in 2017. i imagine it it must be closer to 2 million for 2019.,2020-06-19 08:29:59+00:00,,,1273895791652937731,,https://twitter.com/NephetsYollam/status/1273895791652937731,1,0,pwidpride,
"another woefully inaccurate, bias laden 'drugs' piece in the record today. your consistency is to be admired. never has a paper succeeded quite as much as you at poorly informing your readership on the subject 'drugs', or the people who use them .",2020-06-19 08:25:01+00:00,,,1273894543260295168,,https://twitter.com/NephetsYollam/status/1273894543260295168,1,3,,https://www.dailyrecord.co.uk/news/scottish-news/shocking-class-dunts-2020-scottish-22214129
thats kept behind the bar.,2020-06-18 19:59:37+00:00,,,1273706955048202241,,https://twitter.com/NephetsYollam/status/1273706955048202241,0,0,martinsmith02,https://youtu.be/DU97TGbp6po
but then its scotland...where convos still begin with 'whit school did ye go tae?' all these years (and campaigns) later.,2020-06-18 18:48:38+00:00,,,1273689093835296776,,https://twitter.com/NephetsYollam/status/1273689093835296776,1,0,NephetsYollam,
and sectarianism..instead of 'green or blue' pish.,2020-06-18 18:46:40+00:00,,,1273688600220229633,,https://twitter.com/NephetsYollam/status/1273688600220229633,2,0,NephetsYollam,
100%,2020-06-18 18:46:09+00:00,,,1273688466908471296,,https://twitter.com/NephetsYollam/status/1273688466908471296,1,0,TichWatson,
"..so it was acceptable, but now its not?",2020-06-18 18:45:58+00:00,,,1273688421307998210,,https://twitter.com/NephetsYollam/status/1273688421307998210,0,0,SusaninLangside,
....after the horse has bolted...,2020-06-18 18:09:45+00:00,,,1273679309417447425,,https://twitter.com/NephetsYollam/status/1273679309417447425,0,0,AamerAnwar,https://twitter.com/AamerAnwar/status/1273672249204191236
this is a disgraceful letter and should be withdrawn.,2020-06-18 18:08:06+00:00,,,1273678893694750720,,https://twitter.com/NephetsYollam/status/1273678893694750720,2,1,ScotsPolFed,https://twitter.com/ScotsPolFed/status/1273587406084530176
"fentanyl more likely first, short term. 3-5 years though...you betcha.",2020-06-17 22:47:33+00:00,,,1273386831510454280,,https://twitter.com/NephetsYollam/status/1273386831510454280,0,0,HealthSciYork,
"which is lovely, and what is its medicinal benefit; what unmet medical need can it meet?",2020-06-17 22:40:41+00:00,,,1273385100768677891,,https://twitter.com/NephetsYollam/status/1273385100768677891,0,0,TantalusLabs,
im still none the wiser. but i defo hear you ,2020-06-17 22:15:36+00:00,,,1273378789309976577,,https://twitter.com/NephetsYollam/status/1273378789309976577,0,0,c_cannabiscafe,
i don't understand what has changed or is being discussed. nothing appears to have changed from a licensing requirement or reporting pov.,2020-06-17 21:31:44+00:00,,,1273367750975598593,,https://twitter.com/NephetsYollam/status/1273367750975598593,1,0,afterprohibends,
"..my local, my londis... thats a brand pro strapline right there..particularly now.",2020-06-17 21:23:24+00:00,,,1273365652267511809,,https://twitter.com/NephetsYollam/status/1273365652267511809,0,0,NephetsYollam,
...no according to my local  it isny..,2020-06-17 21:21:16+00:00,,,1273365118508830720,@myLondis,https://twitter.com/NephetsYollam/status/1273365118508830720,1,0,STVNews,
"i agree with this guy. trade may be in the background, but i think he's right. this report is drug war propagandinised (which isn't a real word, but you'll know what i mean). ps- asud (drug user network) say its about race, not trade. i'll believe them too.",2020-06-17 21:18:29+00:00,,,1273364414570401795,,https://twitter.com/NephetsYollam/status/1273364414570401795,1,0,andcunningham,
whats going on davd? personally i find if you look em directly in the eye as they come through the door...show no fear.. ,2020-06-17 17:12:35+00:00,,,1273302531578499074,,https://twitter.com/NephetsYollam/status/1273302531578499074,0,0,foreigncorr1,
"applause  mp is 100% spot on. i remember raising this issue at a hustings in this constituency, before the last election. im fairly sure that 2 of the three prospective candidates didnt have much interest in matters relating to drug use, and defo not reforms",2020-06-17 16:20:27+00:00,,,1273289413464936448,@BellRibeiroAddy,https://twitter.com/NephetsYollam/status/1273289413464936448,0,2,LabourDrugRef,https://twitter.com/LabourDrugRef/status/1273223001190871041
simple rate is something like 15.5% just now (compound 16.5%)... boe base rate 0.1%...just thought debt might be a bit cheaper by now. something the government 'could' have intervened with..at least for now.,2020-06-17 15:55:24+00:00,,,1273283109379866624,,https://twitter.com/NephetsYollam/status/1273283109379866624,0,0,PaulJSweeney,
why don't intrest rates come down on credit cards?,2020-06-17 15:41:51+00:00,,,1273279701356863489,,https://twitter.com/NephetsYollam/status/1273279701356863489,1,0,,
trade name in the uk (for one brand) is 'xaggatin'. i think its also available as a generic too. https://www.medicines.org.uk/emc/product/2704/pil,2020-06-17 09:00:12+00:00,,,1273178621688102912,,https://twitter.com/NephetsYollam/status/1273178621688102912,0,0,NephetsYollam,https://www.medicines.org.uk/emc/product/2704/pil
and methylphenidate too pieter...i've sometimes wondered about prescription methylphenidate for stimulant users ...do you know if its used?,2020-06-17 08:58:36+00:00,,,1273178216702844930,,https://twitter.com/NephetsYollam/status/1273178216702844930,2,0,PieterHog,
"...aye, but think of all the social mobility through productivity and promotions at work...",2020-06-17 08:44:17+00:00,,,1273174615389540353,,https://twitter.com/NephetsYollam/status/1273174615389540353,1,0,TheNewImpostor,
nevergiveup keeponkeepingon such a battler russ ,2020-06-15 21:03:18+00:00,,#NeverGiveUp #KeepOnKeepingOn,1272635821628235776,,https://twitter.com/NephetsYollam/status/1272635821628235776,0,0,TheNewImpostor,
"brilliant. i echo this, and also for scotland and the uk.",2020-06-15 04:38:35+00:00,,,1272388009229520898,,https://twitter.com/NephetsYollam/status/1272388009229520898,0,0,guyfelicella,
"most other protests including blm had been called off because of the sectarian, racist 'loyalist' group who turned up to fight.. with pretty much anyone",2020-06-14 16:51:51+00:00,,,1272210151043477504,,https://twitter.com/NephetsYollam/status/1272210151043477504,0,0,Winston11004677,
you guys are crackin at the banjo...,2020-06-14 14:08:51+00:00,,,1272169134047014912,,https://twitter.com/NephetsYollam/status/1272169134047014912,1,0,Enoch01,
glasgow bearing the shame of its sectarianism and racism today.,2020-06-14 13:26:20+00:00,,,1272158434041966595,,https://twitter.com/NephetsYollam/status/1272158434041966595,0,0,,
"what is it with lardy, out of shape guys?",2020-06-14 13:11:48+00:00,,,1272154776571203584,,https://twitter.com/NephetsYollam/status/1272154776571203584,0,0,JakeWri38029870,https://twitter.com/JakeWri38029870/status/1272154085366673413
fuck. sake.,2020-06-14 12:02:00+00:00,,,1272137209710338048,,https://twitter.com/NephetsYollam/status/1272137209710338048,0,0,HeartScotNews,https://twitter.com/HeartScotNews/status/1272134594779852801
"look at these clowns. george sq glasgow, just seconds ago. 'loyalist defence leauge', who state they oppose antifa and blacklivesmatter (personally, i'd unleash the fucking hounds on em... ) webcam link https://www.glasgow.gov.uk/webcam and here's a story about it...",2020-06-14 11:48:24+00:00,,#Antifa #BlackLivesMatter #BlackLivesMatter,1272133784792698880,,https://twitter.com/NephetsYollam/status/1272133784792698880,1,0,Glasgow_Times,"https://www.glasgow.gov.uk/webcam,https://twitter.com/Glasgow_Times/status/1272125113186553858"
"i get there's a difference between 'pharmaceutical grade cannabinoids' as medicines (in terms of how regulators appraise medicines), and individual/community access for therapeutic or recreational use...i think there's a lack of dialogue around this.",2020-06-14 09:59:43+00:00,,,1272106434872979457,,https://twitter.com/NephetsYollam/status/1272106434872979457,1,0,horror_jock,
meanwhile...,2020-06-14 06:49:25+00:00,,,1272058546792869889,,https://twitter.com/NephetsYollam/status/1272058546792869889,1,0,afterprohibends,https://www.theguardian.com/society/2020/may/15/uk-cannabis-firm-bought-by-us-based-fund-in-multi-million-pound-deal
agreed.,2020-06-13 21:57:12+00:00,,,1271924608392933379,,https://twitter.com/NephetsYollam/status/1271924608392933379,0,0,jamesenglish0,
but worth it.,2020-06-13 21:56:24+00:00,,,1271924406202306568,,https://twitter.com/NephetsYollam/status/1271924406202306568,1,0,jamesenglish0,
its embarrassing.,2020-06-13 16:09:05+00:00,,,1271837003923980295,,https://twitter.com/NephetsYollam/status/1271837003923980295,0,0,InvisibleJim1,
the 'loyalist defence league'. currently raining in glasgow. ,2020-06-13 13:53:39+00:00,,,1271802919029964801,,https://twitter.com/NephetsYollam/status/1271802919029964801,0,0,Glasgow_Times,https://twitter.com/Glasgow_Times/status/1271801965262094336
that's a fairly wide and diverse range of speakers that is...,2020-06-13 12:54:36+00:00,,,1271788059986726912,,https://twitter.com/NephetsYollam/status/1271788059986726912,0,0,donemay,
what about that many ?,2020-06-13 12:49:18+00:00,,,1271786725161996289,,https://twitter.com/NephetsYollam/status/1271786725161996289,0,0,10DowningStreet,
looks that way im afraid...,2020-06-13 12:49:16+00:00,,,1271786718199513095,,https://twitter.com/NephetsYollam/status/1271786718199513095,0,0,GrahamParsons68,
bin a while...whit is ye dae again?,2020-06-13 12:47:48+00:00,,,1271786346886180865,,https://twitter.com/NephetsYollam/status/1271786346886180865,0,0,,
,2020-06-13 11:01:00+00:00,,,1271759468276191233,,https://twitter.com/NephetsYollam/status/1271759468276191233,1,7,Holbornlolz,
,2020-06-13 10:51:41+00:00,,,1271757126575276032,,https://twitter.com/NephetsYollam/status/1271757126575276032,1,1,,
"""engerland engerland engerlaaaaad"" and ""rule britannia, britannia rules the waves.."" and other classics at the beginning of the charge at the police in london watching the live feed here. the video is the start though.. londonprotests london https://www.pscp.tv/w/cbntfzu1nzk0mzb8mwrss1paemdudm1lqntwyuybefezlhosbjhjwhkmey6crl6ftc8jzlrqnejm",2020-06-13 10:45:42+00:00,,#londonprotests #London,1271755619788361728,,https://twitter.com/NephetsYollam/status/1271755619788361728,6,2,,https://www.pscp.tv/w/cbNTfzU1Nzk0MzB8MWRSS1paemdudm1LQntwyUybefEzLHosBJhjwhkmEy6CRL6Ftc8jzlRQnejM
..and remember they recently changed all that...late march/early april. update version was released mid april.,2020-06-12 17:37:19+00:00,,,1271496819391029254,,https://twitter.com/NephetsYollam/status/1271496819391029254,0,0,afterprohibends,
im sure its like riding a bike...where if you fall of once you might die...but a similar idea nevertheless. staysafe. catch you another time.,2020-06-12 17:30:10+00:00,,,1271495019250290688,,https://twitter.com/NephetsYollam/status/1271495019250290688,0,0,afterprohibends,
don't worry about it...im used to it another time perhaps.,2020-06-12 17:19:23+00:00,,,1271492306248622080,,https://twitter.com/NephetsYollam/status/1271492306248622080,0,0,afterprohibends,
"ah, right, thats fair enough.",2020-06-12 17:18:04+00:00,,,1271491975259262976,,https://twitter.com/NephetsYollam/status/1271491975259262976,0,0,afterprohibends,
aren't you happy about that?,2020-06-12 17:16:24+00:00,,,1271491556109942792,,https://twitter.com/NephetsYollam/status/1271491556109942792,0,0,afterprohibends,
great spot.,2020-06-12 15:34:49+00:00,,,1271465992577843200,,https://twitter.com/NephetsYollam/status/1271465992577843200,0,0,andcunningham,
"the point to my tweet was more about the use of brand names for pom cds, more than anything else. la bup is la bup. oral bup is oral bup. but aye, i'll email about it.",2020-06-12 14:06:14+00:00,,,1271443697415135232,,https://twitter.com/NephetsYollam/status/1271443697415135232,0,0,mblakebrough62,
ps....you what would be good...if you sent one to john strang  much of his (and others) research (and practice) is what made take home naloxone really happen. its what (really reall helped to) get kits licensed.,2020-06-12 13:28:18+00:00,,,1271434150537551873,@KingsAddictions,https://twitter.com/NephetsYollam/status/1271434150537551873,1,0,NaloxoneMan,
will do :),2020-06-12 12:16:14+00:00,,,1271416013771374593,,https://twitter.com/NephetsYollam/status/1271416013771374593,1,0,ArfonJ,
classic tune. thanks for that. ,2020-06-12 12:15:32+00:00,,,1271415839154155520,,https://twitter.com/NephetsYollam/status/1271415839154155520,0,0,JohnDivney,
"do people still get offered oral buprenorphine afron, or only the brand of long acting formulation you mentioned? will they get 'subutex' brand long acting bup, when thats launched next year by indivior?",2020-06-12 12:14:21+00:00,,,1271415541438320647,,https://twitter.com/NephetsYollam/status/1271415541438320647,1,0,ArfonJ,
finished it yet? hopefully it's gave you some insights an extremely well titled book.,2020-06-12 11:59:09+00:00,,,1271411716233015296,,https://twitter.com/NephetsYollam/status/1271411716233015296,1,1,GBMC73,
thats excellent. good man.,2020-06-12 11:49:11+00:00,,,1271409209675059202,,https://twitter.com/NephetsYollam/status/1271409209675059202,1,1,NaloxoneMan,
"""...when the oppressed become the oppressors...""",2020-06-12 11:36:35+00:00,,,1271406037397114880,,https://twitter.com/NephetsYollam/status/1271406037397114880,1,0,JohnDivney,
thats sunday morning viewing sorted. looking forward to this ,2020-06-12 09:19:21+00:00,,,1271371502907203586,,https://twitter.com/NephetsYollam/status/1271371502907203586,1,0,jamesenglish0,https://twitter.com/jamesenglish0/status/1271104299314094080
if done properly...,2020-06-12 09:14:58+00:00,,,1271370399578755073,,https://twitter.com/NephetsYollam/status/1271370399578755073,0,0,GBMC73,
"hi rebecca. can i ask- what point is it you're trying to make, or what is it you're highlighting? and is this any different from dial-a-booze, or from tesco dropping of your weekly wine or whisky?",2020-06-12 08:44:07+00:00,,,1271362632797257728,,https://twitter.com/NephetsYollam/status/1271362632797257728,0,0,RGray_87,
,2020-06-12 08:36:11+00:00,,,1271360639777325056,,https://twitter.com/NephetsYollam/status/1271360639777325056,1,1,,
 ,2020-06-12 07:02:18+00:00,,,1271337010385620992,,https://twitter.com/NephetsYollam/status/1271337010385620992,0,0,GrahamParsons68,
i'll raise you jock stein first manager of a uk team (celtic of course) to win the european cup,2020-06-12 06:55:20+00:00,,,1271335257133002753,,https://twitter.com/NephetsYollam/status/1271335257133002753,1,0,GrahamParsons68,
"has the number of people receiving opioid agonist treatment/medication increased for stockholm, or nationally?",2020-06-12 06:05:54+00:00,,,1271322816126672897,,https://twitter.com/NephetsYollam/status/1271322816126672897,1,0,martinkaberg,
 on it.,2020-06-11 21:11:08+00:00,,,1271188239035088896,,https://twitter.com/NephetsYollam/status/1271188239035088896,0,0,canadian_safe,
no probs.,2020-06-11 19:06:06+00:00,,,1271156774217842688,,https://twitter.com/NephetsYollam/status/1271156774217842688,0,0,NaloxoneMan,
ps- quoting ,2020-06-11 15:32:54+00:00,,,1271103122111414273,@WHO,https://twitter.com/NephetsYollam/status/1271103122111414273,0,0,NephetsYollam,
"annually, up to 10 million people suffer from lack of access to controlled medications. nearly 1 billion of those living today will encounter this problem sooner or later. most of them will be pain patients, others will be suffering from other conditions.",2020-06-11 15:31:11+00:00,,,1271102690215571457,,https://twitter.com/NephetsYollam/status/1271102690215571457,1,0,NephetsYollam,
"many countries have neglected their obligation under the un conventions to provide sufficient access to analgesics. severe under-treatment is reported in more than 150 countries, both developing and industrialized, accounting for about 80% of the world's population.",2020-06-11 15:30:33+00:00,,,1271102530798465032,,https://twitter.com/NephetsYollam/status/1271102530798465032,1,0,MonicaLennon7,
just had a chat with someone and it reminded me.. i must high five to all the current and former drug user activist 'critial thinkers' in scotland. the ones that refuse(d) to be coopted.,2020-06-11 14:51:42+00:00,,,1271092753145921536,,https://twitter.com/NephetsYollam/status/1271092753145921536,1,1,,
"homemade brownies, accompanied by squirty cream. a portrait. nephets, 2020.",2020-06-10 19:12:08+00:00,,,1270795902995910657,,https://twitter.com/NephetsYollam/status/1270795902995910657,1,0,nicnaccon,
special brownies...for special people...,2020-06-10 18:25:56+00:00,,,1270784279119892481,,https://twitter.com/NephetsYollam/status/1270784279119892481,0,0,nicnaccon,
"short term, yes....short term. lots of empathy for your situation. ",2020-06-10 00:09:13+00:00,,,1270508280650006530,,https://twitter.com/NephetsYollam/status/1270508280650006530,0,0,vickyrsharpey,
poor lady. unmanaged/manageable pain impacts massively on quality of life. but so does necking tramadol all day. plus its a weird drug. she deserves better.,2020-06-09 21:47:09+00:00,,,1270472527010304000,,https://twitter.com/NephetsYollam/status/1270472527010304000,1,0,JohnDivney,
"well...it doesn't feel like work when you love connecting (and reconnecting) with people, places ..and scenarios some times we're living in.",2020-06-09 21:44:17+00:00,,,1270471806609219587,,https://twitter.com/NephetsYollam/status/1270471806609219587,1,1,GBMC73,
"it would take half a dozen tweets to explain what i mean, but you no doubt get it. thanks for chatting louise. ",2020-06-09 21:34:11+00:00,,,1270469265905332224,,https://twitter.com/NephetsYollam/status/1270469265905332224,0,0,louisestewart80,
tell her to speak to her gp mate. its clearly not working if shes swallowing them all day. should only be every 4 to 6 hours according to patient info,2020-06-09 21:26:43+00:00,,,1270467384407719940,,https://twitter.com/NephetsYollam/status/1270467384407719940,1,0,JohnDivney,
boundried + targeted + broad ranging harm reduction offerings x unmet need = impact.,2020-06-09 21:19:38+00:00,,,1270465601174151169,,https://twitter.com/NephetsYollam/status/1270465601174151169,1,1,louisestewart80,
aye. totqlly missing it/them/the people accessing the mobile already!,2020-06-09 20:30:07+00:00,,,1270453142023475206,,https://twitter.com/NephetsYollam/status/1270453142023475206,1,0,louisestewart80,
impressive statement by  ceo. ,2020-06-09 20:11:55+00:00,,,1270448560350396418,@IBM,https://twitter.com/NephetsYollam/status/1270448560350396418,0,0,RT_com,https://twitter.com/RT_com/status/1270448077971865604
like tramadol.,2020-06-09 20:07:25+00:00,,,1270447430438400001,,https://twitter.com/NephetsYollam/status/1270447430438400001,1,0,CLEARUK,
it was an amazing team to work with. the mobile service complimented several other vital front facing services that were also operational at the time (or still are). mobile services are excellent.,2020-06-09 20:00:40+00:00,,,1270445729996320770,,https://twitter.com/NephetsYollam/status/1270445729996320770,1,0,louisestewart80,
it was a privilege to help out....really really was. ,2020-06-09 17:33:34+00:00,,,1270408709446021123,,https://twitter.com/NephetsYollam/status/1270408709446021123,3,3,,
mps eh? some bunch.,2020-06-09 17:11:51+00:00,,,1270403247858163714,,https://twitter.com/NephetsYollam/status/1270403247858163714,0,0,,
,2020-06-08 17:23:30+00:00,,,1270043788808007682,,https://twitter.com/NephetsYollam/status/1270043788808007682,0,0,Holbornlolz,
"'ethypharm and rssl partnership fast-tracks priority medicine' part of a covid19 response to medicine needs, in this instance fentanyl injection.",2020-06-08 14:29:14+00:00,,#COVID19 #fentanyl,1269999934243209217,,https://twitter.com/NephetsYollam/status/1269999934243209217,0,0,,https://www.cleanroomtechnology.com/news/article_page/Ethypharm_and_RSSL_partnership_fast-tracks_priority_medicine/166134
"the french large scale medicinal cannabis trial will now begin on jan 21, at the latest. 3000 patients, wide range of indications, and range of cannabinoid presentations (dried flowers, oils, capsules or infused beverages). cc  https://ansm.sante.fr/s-informer/actualite/experimentation-de-l-usage-medical-du-cannabis-poursuite-des-travaux-point-d-information",2020-06-08 12:44:09+00:00,,#cannabis,1269973489320185865,@TransformDrugs,https://twitter.com/NephetsYollam/status/1269973489320185865,0,6,,https://ansm.sante.fr/S-informer/Actualite/Experimentation-de-l-usage-medical-du-cannabis-poursuite-des-travaux-Point-d-Information
"..maybe thats also an age thing; fewer younger (street) heroin users, greater social awareness in the cops..",2020-06-07 21:49:37+00:00,,,1269748373797601280,,https://twitter.com/NephetsYollam/status/1269748373797601280,0,0,NephetsYollam,
"there's some truths in there, for sure. poor white heroin users would argue that they don't get lesser sentences or more favorable treatment by police. in the uk you'd be hard pushed to find a white heroin user who hasn't also been fucked over by the police.",2020-06-07 21:46:48+00:00,,,1269747665677549568,,https://twitter.com/NephetsYollam/status/1269747665677549568,1,0,jqjasonkew,
there's no cure for history.,2020-06-07 21:11:38+00:00,,,1269738815364759554,,https://twitter.com/NephetsYollam/status/1269738815364759554,1,0,SimonGreasley,
"don't doubt it for a second suzanne..not a second. i guess it a *thing* for me...i can't help but want people to understand the importance of not using naloxone, as much as using it when the time is right.x",2020-06-07 21:10:02+00:00,,,1269738411960799232,,https://twitter.com/NephetsYollam/status/1269738411960799232,0,0,SuzanneSFAD,
"if bristol was wrong, and that's the sentiment, then i expect most cities to be moving statues and changing street names etc in the weeks ahead.",2020-06-07 21:08:02+00:00,,,1269737908539469824,,https://twitter.com/NephetsYollam/status/1269737908539469824,1,0,JohnDivney,
"..and remind people about the training thats given too please. vital 1. what it is and isn't. 2. when it should be used. 3. how it should be used and 4, reporting/getting a replacement/resupply.",2020-06-07 20:59:09+00:00,,#vital,1269735672069455872,,https://twitter.com/NephetsYollam/status/1269735672069455872,2,1,SuzanneSFAD,
"as you said earlier john and as other folks have said a wing of a museum, alongside many many other artifacts currently designated as precious to 'british' history and culture.",2020-06-07 20:51:44+00:00,,,1269733807990726668,,https://twitter.com/NephetsYollam/status/1269733807990726668,1,0,JohnDivney,
oppressive governments (with progressive minded societies) for years. not just here of course. bouncing from crisis to crisis. hardly a surprise to be honest.,2020-06-07 20:39:16+00:00,,,1269730668990382082,,https://twitter.com/NephetsYollam/status/1269730668990382082,0,0,donemay,
"i saw they were eyeing up the churchill statue too. we've got loads and loads of statues up here, of merchant's from the 1600-1800...",2020-06-07 18:24:46+00:00,,,1269696820982226949,,https://twitter.com/NephetsYollam/status/1269696820982226949,1,0,donemay,
"sometimes, in order to fulfil thier 'need for significance', people behave terribly, don't they?",2020-06-07 13:57:20+00:00,,,1269629516688875522,,https://twitter.com/NephetsYollam/status/1269629516688875522,1,0,,
 ,2020-06-06 07:32:52+00:00,,,1269170376912834560,,https://twitter.com/NephetsYollam/status/1269170376912834560,0,0,donemay,
but you shouldn't have to if a cannabinoid derived medicine is shown as superior or non inferior to existing treatments. why should anyone discriminate against cannabinoids.,2020-06-04 23:51:07+00:00,,,1268691784093380609,,https://twitter.com/NephetsYollam/status/1268691784093380609,0,0,83XDev,
"i agree, however it's still a different thing from we are really talking about. pharmaceutical cannabinoids. proper, real pharmaceutical company involvement. not prohibition partners bs. proper medicine that cannot be derived from a home grow (therapeutic, not medicinal).",2020-06-04 23:30:48+00:00,,,1268686674411892736,,https://twitter.com/NephetsYollam/status/1268686674411892736,2,0,83XDev,
