text,date,geo,hashtags,tweet_id,mentions,permalink,replies,retweets,replies_to,mentioned_urls
will this tragedy finally make our concerns and the physical pain lived day to day months thru years become the reality we have been forced to live with since cdc guidelines illegally ripped out rights out from under our therapudic opiate care? now there's a shortage and sufferin,2020-04-04 13:28:08+00:00,,,1246429346191020032,,https://twitter.com/nogoddogs/status/1246429346191020032,3,2,CMerandi,
"f""ck off.",2020-04-03 01:44:48+00:00,,,1245889960961605632,,https://twitter.com/nogoddogs/status/1245889960961605632,0,0,annsommers8,
when this came out as one of the 'stable genius' actions... wth is wrong? seems very manipulated to muself. nonsensical.,2020-04-03 01:43:48+00:00,,,1245889708250537984,,https://twitter.com/nogoddogs/status/1245889708250537984,0,0,eugenegu,
so am i. very concerned. watching msm does nothing to make it easier to follow.... maybe their as confused as the nation. military presence is the next protocol once all states are in 'lockdown'. very concerning.,2020-04-03 01:38:49+00:00,,,1245888454401175553,,https://twitter.com/nogoddogs/status/1245888454401175553,1,0,process_x,
"wh is so far behind in response to this pandemic. to tie into this global cabal. another distraction for the incompetence of everything this administration continues to pretend as doing a terrific job. it's not just the usa, it's global. wtf.",2020-04-03 01:34:14+00:00,,,1245887299847622656,,https://twitter.com/nogoddogs/status/1245887299847622656,0,0,chrstphr_woody,
exactly.,2020-04-03 01:25:26+00:00,,,1245885085171277828,,https://twitter.com/nogoddogs/status/1245885085171277828,0,0,chrstphr_woody,https://twitter.com/chrstphr_woody/status/1245473457619570688
"potus and like need to remain vigilant re:: global pandemic occurring in real time. wtf. as usual, attempting to cta 's bc well we all know what he unnecessary fall out was with he fake opiate crisis. lie after lie after lie.",2020-04-03 01:23:39+00:00,,,1245884637928439808,,https://twitter.com/nogoddogs/status/1245884637928439808,0,0,EsperDoD,
karma can be quite an awakening.,2020-04-03 01:17:51+00:00,,,1245883177647984644,,https://twitter.com/nogoddogs/status/1245883177647984644,0,0,PainNewsNetwork,
your happiness is contagious! thanks. i've been obsessing over queen for months. not bc i watched the movie but bc i've been listening since the mid 1970's...opps. i was very young. like 2 years old! just joking be safe and happy. the other side is always around the corner. ,2020-04-02 00:00:45+00:00,,,1245501385019457536,,https://twitter.com/nogoddogs/status/1245501385019457536,0,0,CaliPrincess34,
difficult to know what may/may not happen to suffering cpp's. i've needed a provider for a few years and can not within 80-100 mile locate a single doctor who will write scheduled rx's.... considering the methadone clinic bc i had been rx'd it yrs ago and i have no complaints.,2020-03-31 23:37:24+00:00,,,1245133121445658626,,https://twitter.com/nogoddogs/status/1245133121445658626,0,0,drchetanmehta,
"most definitly. there is madnesses behind their""statistics"". as you stated on your tweet, avoiding those above mentioned cautions and keep in mind the exact language and how it s structured... i heard pence use 'surviellance' of the 200,000 possible victims mentioned today. hmm.",2020-03-31 23:31:43+00:00,,,1245131690487447554,,https://twitter.com/nogoddogs/status/1245131690487447554,0,0,reversechapter,
thanks for the song. singing is such a great way to relax and enjoy something that is all yours! this is the version i especially like. thanks for sharing. stay calm and safe ,2020-03-25 21:47:34+00:00,,,1242931153952268288,,https://twitter.com/nogoddogs/status/1242931153952268288,0,0,CaliPrincess34,
 shut up sg...,2020-03-25 13:30:31+00:00,,,1242806066624241665,@ScottGottliebMD,https://twitter.com/nogoddogs/status/1242806066624241665,0,0,,
really? smh... typical. bs. the us still waiting for covid19 tests... wtf,2020-03-25 13:25:54+00:00,,,1242804907792531457,,https://twitter.com/nogoddogs/status/1242804907792531457,0,0,PainNewsNetwork,https://twitter.com/PainNewsNetwork/status/1242769656030486533
would you upload it ? great song. love how stevie does like 4 different versions.,2020-03-24 16:37:51+00:00,,,1242490825520615424,,https://twitter.com/nogoddogs/status/1242490825520615424,2,0,CaliPrincess34,
the chain is an excellent song and thank you for singing landslide is also beautiful.,2020-03-24 14:37:56+00:00,,,1242460646366724097,,https://twitter.com/nogoddogs/status/1242460646366724097,1,0,CaliPrincess34,
become a totally emersed in queen sing all-day long! all-day long... all-day long. breaking out vinyl :: queen queen ll night at the opera sheer heart attack my son on the spectrum asd my dog the world continues... peace breathe. ... take a breath ,2020-03-24 02:47:39+00:00,,,1242281896333246464,,https://twitter.com/nogoddogs/status/1242281896333246464,1,0,GeorgeMgoblue07,
 you remy ,2020-03-24 02:37:28+00:00,,,1242279335240904709,,https://twitter.com/nogoddogs/status/1242279335240904709,0,0,malus_k,
 ,2020-03-24 02:24:31+00:00,,,1242276076598054913,,https://twitter.com/nogoddogs/status/1242276076598054913,0,0,manneb2015,https://twitter.com/manneb2015/status/1242228457083260929
boom following the $$$$:::fear::: humans die. societal breakdown.,2020-03-24 02:24:12+00:00,,,1242275996222599168,,https://twitter.com/nogoddogs/status/1242275996222599168,0,0,rmayemsinger,https://twitter.com/rmayemsinger/status/1242227055078412288
this pandemic is an exercise to break down the social and economic structure. a huge planned power-grab by the self appointed 'elite'. this is my take/opinion on this very 'coincldental' outbreak of this fear factor while primaries for the november election are planned. bzr.,2020-03-24 02:20:48+00:00,,,1242275140613935104,,https://twitter.com/nogoddogs/status/1242275140613935104,0,0,manneb2015,
go for it. anything everything is needed for this catastrophe.,2020-03-23 15:28:19+00:00,,,1242110938964283392,,https://twitter.com/nogoddogs/status/1242110938964283392,0,0,arahmanford,
pandemic... look into opiates and how they interact with our immune system ... please. josh bloom?!!!,2020-03-22 01:35:10+00:00,,,1241538882753253376,,https://twitter.com/nogoddogs/status/1241538882753253376,1,0,nogoddogs,https://twitter.com/nogoddogs/status/1240071667675783171
precious. ,2020-03-22 01:32:56+00:00,,,1241538320158646274,,https://twitter.com/nogoddogs/status/1241538320158646274,0,0,LevanCarrie,https://twitter.com/LevanCarrie/status/1239911606764658688
totally with you on this issue... it's the dea prop etc bureaucracy that just keeps pummeling this bs. doctors must step up for their patients. power in numbers. get it together doctors. yesterday. ,2020-03-19 20:35:35+00:00,,,1240738711471521794,,https://twitter.com/nogoddogs/status/1240738711471521794,0,0,Katamac1967,
really!!!! oh my stars. ok well then problem/pandemic soon to end oh yeah...,2020-03-19 20:30:34+00:00,,,1240737450282139648,,https://twitter.com/nogoddogs/status/1240737450282139648,0,0,JoshBloomACSH,
"we all own our pain so we as adults, should be immediately allowed to request and rec'v otc available opiate analgesics. thanks katamac",2020-03-18 15:50:46+00:00,,,1240304647203479552,,https://twitter.com/nogoddogs/status/1240304647203479552,0,0,Katamac1967,https://twitter.com/Katamac1967/status/1239843654983806976
hopefully. but then we're dealing with liers at the top of the pyramid. i'm quite use to isolation... people being forced or suggested to stay in residences... let's say one week and this is going to get very very freaky. what comes around... yep,2020-03-18 02:01:08+00:00,,,1240095864636522497,,https://twitter.com/nogoddogs/status/1240095864636522497,0,0,SoCalLakerGirl,
something we as chronic intractable pain persons have and know all to well.,2020-03-18 01:56:42+00:00,,,1240094748368568327,,https://twitter.com/nogoddogs/status/1240094748368568327,0,0,Katamac1967,https://twitter.com/Katamac1967/status/1239954984147382272
"causing pain issues to be ignored is only the fault of government agencies ::dea, cdc, peop hhs... on and on. asshats.",2020-03-18 01:55:08+00:00,,,1240094355328839681,,https://twitter.com/nogoddogs/status/1240094355328839681,0,0,ThomasKlineMD,
karma's a mfr. isolation bc of pain issues w/o any moderation opiate analgesics... taste the pain all prop zealots and all other anti opiate hyterical persons. your turn. just breathe and yoga. mindfulness for the mindless. oh this at least will be entertaining at some points.,2020-03-18 01:52:11+00:00,,,1240093611439652864,,https://twitter.com/nogoddogs/status/1240093611439652864,0,0,CherylIsanogle,https://twitter.com/CherylIsanogle/status/1239775040360648705
"bc of the lack of 2 months of preparation w/o available tests, i'm assuming the reported infections will b so under the actual correct amount of those infected. gov has to cover it's ass...",2020-03-18 01:29:37+00:00,,,1240087932502933504,,https://twitter.com/nogoddogs/status/1240087932502933504,0,0,thebee110,
 you coming correct with this shit!!!,2020-03-18 01:24:22+00:00,,,1240086610785505281,,https://twitter.com/nogoddogs/status/1240086610785505281,0,0,lifeofrickey,
"also, many will just blow 9ff symptoms of covid19v as the 'flu' esp. trumpians. the fed f*cked the entire country. purposely? i wouldn't know but... imo populations reset is the end goal for this over looked it's coming, it's here covid19 virus. too little way to late.",2020-03-18 01:21:53+00:00,,,1240085987960795136,,https://twitter.com/nogoddogs/status/1240085987960795136,0,0,CalebSpires,
"that's how doctors care now... dea is at fault as well as any other (prop) org. or agencies. patients with chronic documented pain issues at not addicts.... but doctors just to cta, keep it simple and just will not rx opiate analgesics. try this try that oh bs.",2020-03-18 01:14:44+00:00,,,1240084188780511236,,https://twitter.com/nogoddogs/status/1240084188780511236,0,0,sbcpp8675309,
been there bc of pain and driver's license suspension for 20 twenty years. yep. a few weeks and high % of people are going to loose their *hit. i've no prescriber for sched. analgesics. i've become comfortably numb... i think??? ,2020-03-18 00:36:36+00:00,,,1240074589864169472,,https://twitter.com/nogoddogs/status/1240074589864169472,0,1,AimlessRyan,
"because you may have been hypnotized, placed into a parallel universe where idiocracy rules that world.",2020-03-18 00:30:24+00:00,,,1240073028458950656,,https://twitter.com/nogoddogs/status/1240073028458950656,0,0,BernardKerik,
sorry l. for all the typo's. no working laptop/tablet available so i'm always using my phone to text and it really becomes annoying !,2020-03-18 00:27:55+00:00,,,1240072405692960768,,https://twitter.com/nogoddogs/status/1240072405692960768,1,0,nogoddogs,
never getting 'colds or flu type illnesses'. i had been taking rx'd opiates' for 15 years. so maybe opiates and our immune system are quite compatible with helping to suppress viruses. doubt any medical prof. would admit to this as fact but i know rhis about myself.,2020-03-18 00:24:59+00:00,,,1240071667675783171,,https://twitter.com/nogoddogs/status/1240071667675783171,0,0,nogoddogs,
"wouldn't that be just f*cking par for the course. opiate analgesics found to mobilize the immune response system!!! oh this actually may need to be looked into seriously. before my opiates were ripped from allowing me to have moderated pain, i took notice to the fact of never",2020-03-18 00:20:39+00:00,,,1240070575630028802,,https://twitter.com/nogoddogs/status/1240070575630028802,1,0,PainNewsNetwork,
unnecessary treatment,2020-03-17 12:41:03+00:00,,,1239894516192206849,,https://twitter.com/nogoddogs/status/1239894516192206849,0,0,Txsconstitution,https://twitter.com/Txsconstitution/status/1232725644422762496
hello i have no prescriber. 16 yrs 9n opiate analgesics and boom... cut off. no doctor to be found in rural area where i reside. best to all who have a prescription for opiate pain management. so tired of constantly being in pain.,2020-03-17 12:40:20+00:00,,,1239894335962976256,,https://twitter.com/nogoddogs/status/1239894335962976256,0,0,isiskat47,
"imo that horrible statement is exactly part of the end result of this global pandemic. also, this, imo, is another try at pop. culling. aids in the 80's/90's... 20 yrs later we have the laboratory built covid19. go ahead fb, shut me down.",2020-03-17 12:36:16+00:00,,,1239893313181880327,,https://twitter.com/nogoddogs/status/1239893313181880327,0,0,RogerTh71142375,
disgusting and evil. other humans are purposely making suffering w/o legal available rx opiate moderation. it's late. i hope not too late. stay strong and remain loud and vigilant to not punish pain. peace friends. ,2020-03-15 21:41:11+00:00,,,1239305671440584704,,https://twitter.com/nogoddogs/status/1239305671440584704,0,0,jmkillingnyc,
so predict. will we have to become multi affected with pnumonia also? possibly could turn 180 and rx'd opiates for c. p. ... only if accompanied by pnumonia. smfh stay safe my friend (s). ,2020-03-15 21:37:30+00:00,,,1239304744436457474,,https://twitter.com/nogoddogs/status/1239304744436457474,0,0,ravensspirit68,
"no legal fevers license sue to what i call vengeance injustice.. rural lw target spec persons and just talk and hareaas. for 20 yrs no license... i'm well versed in being tethered to my residence.14 day self or gov quarantine shit... like you 1/3 of my life has been f""cked b safe",2020-03-15 21:31:55+00:00,,,1239303337524236292,,https://twitter.com/nogoddogs/status/1239303337524236292,1,0,reversechapter,
thanks for the article. just to make a point.. how convenient that this bastard of a novel virus rears its destructive global head exactly during election primaries???? imo. engeniered to be released at exactly the beginning of 2020 primary election season. world out of balance,2020-03-15 20:56:21+00:00,,,1239294389014454272,,https://twitter.com/nogoddogs/status/1239294389014454272,0,0,StarvinLarry,
i'm going to follow your plan... maybe this will losen up the illegalities of ataright up dening doc chronic pain pts. the ability to be properly medicated w/prescribed opiate analgesics for pain moderation. no more rediculously ineffective modalities substitutes. outright. opps,2020-03-15 20:48:20+00:00,,,1239292368018460672,,https://twitter.com/nogoddogs/status/1239292368018460672,0,0,Bela_rocks,
i find it odd that putin hasn't been heard re::covid19. trump terrified the us with his head in ass comment via televised statement. curious as to putin's opinion bc trump's discourse almost seemed to be a plan to cause nationwide chaos.,2020-03-08 07:51:44+00:00,,,1236560216583475201,,https://twitter.com/nogoddogs/status/1236560216583475201,0,0,NYTScience,
sorry 4 typo's... he was raided by dea bc patient diverted/sold his rx's and person who bought died. that was not docs problem. the dea are the ss is continuing this scurge on prescribers. daily people euthanize their previous pets yet hans can't rec'v opiate analgesics 4 pain?,2020-03-08 07:42:15+00:00,,,1236557830536269824,,https://twitter.com/nogoddogs/status/1236557830536269824,1,0,ravensspirit68,
for 3 months. switched to dilaudid with small amt breakthrough meds. breakthrough medication was a 5 mg oxycodone always. then back to morphine sulphate etc. his reasoning was to vary the bopiate as to eliminate tolerancen and the need for an increase in my dosage. very good doc.,2020-03-08 07:35:25+00:00,,,1236556111584559104,,https://twitter.com/nogoddogs/status/1236556111584559104,0,0,ravensspirit68,
