text,date,geo,hashtags,tweet_id,mentions,permalink,replies,retweets,replies_to,mentioned_urls
another assult on patients who suffer from chronic pain conditions.,2020-05-20 08:34:12+00:00,,,1263025217099759617,,https://twitter.com/nogoddogs/status/1263025217099759617,0,1,Katamac1967,https://twitter.com/Katamac1967/status/1261781865632894977
another assult on chronic pain patients and the injustice of irrelevant bs treatment and options...,2020-05-20 08:32:47+00:00,,,1263024859988271104,,https://twitter.com/nogoddogs/status/1263024859988271104,0,0,Katamac1967,
overt authorization demonstrative behaviour...,2020-05-16 14:34:05+00:00,,,1261666233944018944,,https://twitter.com/nogoddogs/status/1261666233944018944,0,0,nogoddogs,
"and this push for ""tracing""... police nation marching lockstep... too close for comfort for me.",2020-05-16 14:32:19+00:00,,,1261665791348486147,,https://twitter.com/nogoddogs/status/1261665791348486147,1,1,reversechapter,
bull shit,2020-05-14 23:32:57+00:00,,,1261077066868457473,,https://twitter.com/nogoddogs/status/1261077066868457473,1,0,margaritamimi1,
"just stop already. nothing against cuomo but jeezus ... this democratic republic is in tatters, shattered from fed inaction prior to the shutdown of the us. this is a terrible time for so many and maybe everything should just ""0"" out and start fresh... probably an impossibility.",2020-05-14 23:29:58+00:00,,,1261076317052776448,,https://twitter.com/nogoddogs/status/1261076317052776448,0,0,NYGovCuomo,
thank you lauren enjoy the beautiful days...,2020-05-11 12:54:41+00:00,,,1259829279812194305,,https://twitter.com/nogoddogs/status/1259829279812194305,0,0,CIAAG_Lauren,
it's always those 'they' a-holes who are the causative' reason for allowing government to invade our privacy regarding our health and privacy conversations without providers. they need to go.,2020-05-11 12:52:53+00:00,,,1259828825153835009,,https://twitter.com/nogoddogs/status/1259828825153835009,0,0,thornton_melley,
"no opiate analgesics foe robert redfield, current cdc director. follow your own cdc 2016 ""guidelines"".",2020-05-11 11:07:27+00:00,,,1259802295598006272,,https://twitter.com/nogoddogs/status/1259802295598006272,0,0,Shasta_Rayne,https://twitter.com/Shasta_Rayne/status/1259228058889773057
,2020-05-09 21:50:54+00:00,,,1259239448405041158,,https://twitter.com/nogoddogs/status/1259239448405041158,0,0,,
cdc = create deploy control...,2020-05-09 21:49:41+00:00,,,1259239143009398785,,https://twitter.com/nogoddogs/status/1259239143009398785,0,0,,
i'm not a person who has the ability to construct a well understood and condensed version of what the chronic pain patients and million plus community have been going thru .... i want to contribute in the best way i can to help in any way,2020-05-09 19:49:06+00:00,,,1259208796792131584,,https://twitter.com/nogoddogs/status/1259208796792131584,0,0,nogoddogs,
agree. those naive must be aware of how mess affect driving. i'd had been consistently rx'd for 14 yrs prior.,2020-05-09 00:06:02+00:00,,,1258911066064592896,,https://twitter.com/nogoddogs/status/1258911066064592896,0,0,UInhumane,
please let me know. much appreciated ,2020-05-09 00:02:56+00:00,,,1258910288369287171,,https://twitter.com/nogoddogs/status/1258910288369287171,0,0,,
"thank you for your veiws. my son is autistic and it is many times necessary to drive... food, doctors, medications... so no my situation is regarding my 20 yr old driving suspension. please keep me informed about your progress! and if your attorneys bhqve any sug. for pa lawyer",2020-05-09 00:01:11+00:00,,,1258909847917035530,,https://twitter.com/nogoddogs/status/1258909847917035530,0,0,UInhumane,
we all know he reality of this torture and the wh just denounced cdc guidelines for handling the current covid19 pandemic. this is exactly the opportunity cpp's need to call bs on what we've been silenced about for over 4 years.,2020-05-08 21:14:36+00:00,,,1258867926129618945,,https://twitter.com/nogoddogs/status/1258867926129618945,1,4,nogoddogs,
"... and the cdc 'guidelines' are exactly that. guidelines. for some political gain for who knows why, those 2016 cd guidelines ended millions of legal rx's written by educated professional healthcare providers to patients who were never the cause of the opiate hyteria froml prop,",2020-05-08 21:12:10+00:00,,,1258867311546679300,,https://twitter.com/nogoddogs/status/1258867311546679300,0,0,nogoddogs,
please dm me is you wasn't to talk. proud of you for pushing this unjust 'legal' system ,2020-05-08 13:56:39+00:00,,,1258757712621514752,,https://twitter.com/nogoddogs/status/1258757712621514752,0,0,UInhumane,
3 different lawyers who threw me under the bus. i have no support from my at ex for our autistic adult. i'm so happy to know your lawyer is taking this thru the system. i'm in pa and currently retain a philly lawyer.. would your attorney have any suggestions for a pa attorney?,2020-05-08 13:55:22+00:00,,,1258757387890102272,,https://twitter.com/nogoddogs/status/1258757387890102272,1,0,UInhumane,
continued... would not allow ambulance transportation to hospital. the police officer waived the ambulance driver away saying 'i'm giving her a personal escort.' no x-rays just blood draw.. no x-rays but a dui on my directed rx'd pain analgesics. i've been thru all cc'd paying 3,2020-05-08 13:51:05+00:00,,,1258756308498632709,,https://twitter.com/nogoddogs/status/1258756308498632709,1,0,UInhumane,
ok ! you go girl. on top of being in an underride tractor trailer accident 22 yrs ago... local (rural) township civil service le have illegally dui 'd me once in 2004 again after being in a rollover wreck . police knew i had been on opiate analgesics since the tractor trailer mva,2020-05-08 13:47:16+00:00,,,1258755347717685248,,https://twitter.com/nogoddogs/status/1258755347717685248,1,0,UInhumane,
the pdmp is a direct assult upon our civil rights. the pdmp needs abolished. policing patients. incredible ignorance.,2020-05-07 22:24:01+00:00,,,1258523005174509569,,https://twitter.com/nogoddogs/status/1258523005174509569,0,6,ravensspirit68,
 hi. what's your situation? i haven't been online frequently bc of burnout. i too am a 22 yr cpp currently w/o a prescriber. so glad to hear that you've got an attorney and court date... thanks,2020-05-07 22:18:34+00:00,,,1258521636271124482,@UInhumane,https://twitter.com/nogoddogs/status/1258521636271124482,2,0,,
"white house refuses to follow cdc pandemic opening business ""guidelines""... the chronic pain patients who have suffered needlessly for years must take this refusal of ""opiate usage for pain"" straight to the courts. this is a platform the fed opened up and we need to stand up!",2020-05-07 22:14:03+00:00,,,1258520499195310087,,https://twitter.com/nogoddogs/status/1258520499195310087,0,0,,
chronic intractable pain needs to be attended to. millions are unnecessary being purposely made to remain suffering without the proven help of pain moderaton by prescribed opiate analgesics.,2020-05-06 00:34:28+00:00,,,1257831056943853568,,https://twitter.com/nogoddogs/status/1257831056943853568,0,0,,
". thank you for your knowledge and professional life concerning whistle blowing of the ineptness of the fed could you please speak to her toture chronic pain patients have been agonizingly living with bc of the cronyism of the cdc, prop and other ignorant agencies. ty.",2020-05-06 00:30:21+00:00,,,1257830024004153344,@drbright,https://twitter.com/nogoddogs/status/1257830024004153344,0,0,,
"yes. exactly. perfect example are the covid19v 'guidelines'... because they are only guidelines not lawful mandates, each governor is tweaking them for best use in their state.",2020-05-03 17:38:28+00:00,,,1257001595365179396,,https://twitter.com/nogoddogs/status/1257001595365179396,2,0,MichaelNey19,
cricket allows you to use a got spot if you agree to unlimited plan of $60/month.,2020-05-03 17:32:35+00:00,,,1257000112603254784,,https://twitter.com/nogoddogs/status/1257000112603254784,1,0,UInhumane,
across this nation a very real issue of denial using opiates as aa therapy for chronic documented pain continues. this is an epidemic. it's torturous malpractice to allow this to continue as it applies to the human condition of millions. it's epidemic in proportion.,2020-05-03 17:28:10+00:00,,,1256999003163688961,,https://twitter.com/nogoddogs/status/1256999003163688961,0,0,,
 :: years and unnecessary pain conditions continue when specific opiate analgesics have been formulated and synthesized exactly 4 therapy which greatly moderats chronic pain issues this continues year after year. opiates are formulated specifically for pain control.,2020-05-03 17:28:10+00:00,,,1256999001322409985,@UInhumane,https://twitter.com/nogoddogs/status/1256999001322409985,1,0,,
"askagbarr::when is this country, cdc, dea, prop ( based on opinions of non experts) and other substandard reviews and unconstitutional deliberately mis-stated facts end as they are purposely causing unnecessary pain issues to continue unaddressed, to those in chronic pain?",2020-05-03 17:15:19+00:00,,#AskAGBarr,1256995769548247040,,https://twitter.com/nogoddogs/status/1256995769548247040,0,0,,
steve mnuchin:: the xhollywoodproducer now acting as the usa's secretary of treasury. wipedia bio hasbqll the goods on this conman appointmented by 45 because he's a mastermind at manipulation and getting $$. he's produced numerous big draw movies. he's embellished covid19...,2020-05-02 23:03:08+00:00,,#xHollywoodproducer,1256720908611444737,,https://twitter.com/nogoddogs/status/1256720908611444737,0,0,,
how do you document pallative care? what qualifies as a palliative care disability or condition??,2020-05-02 15:19:30+00:00,,,1256604232691712002,,https://twitter.com/nogoddogs/status/1256604232691712002,0,0,ThomasKlineMD,
always listen to the way language is spoken. especially when directing the public towards generating and continuing to advance a specific directive... knowingly manipulating language construction is key.,2020-05-02 11:11:11+00:00,,,1256541743153102854,,https://twitter.com/nogoddogs/status/1256541743153102854,1,0,reversechapter,
 ,2020-05-02 10:56:55+00:00,,,1256538153869029376,,https://twitter.com/nogoddogs/status/1256538153869029376,0,0,reversechapter,
the who defines pain and not treating chronic pain using correct analgesics as torture. i believe that americans have the right to jot be tortured. 8nrelenting chronic pain w/o analgesics to moderate is torture. it has been a staple to use opiate analgesics treat pain,2020-04-30 12:10:35+00:00,,,1255831915418042368,,https://twitter.com/nogoddogs/status/1255831915418042368,0,1,nogoddogs,
"trump may have accidentally let very important (know only to specific group knowing individuals) information out... ""magically disappear"". covid19 is real but was not, imo, a natural occurring viral particulate.",2020-04-30 11:46:08+00:00,,,1255825763359752193,,https://twitter.com/nogoddogs/status/1255825763359752193,0,0,,
should have done what sweden practiced... build herd immunity. or maybe it makes no difference being that personally i believe this was engeniered genetically in lab and has a 'turn off' mechanism of 6 months... i stand by my own opinions and i am a certified medical assistant.,2020-04-30 11:41:02+00:00,,,1255824478711549958,,https://twitter.com/nogoddogs/status/1255824478711549958,0,0,TheMilt1000,
this is fact. because street drugs polyusubstance abuse cause death should have no bearing on patients who need rx'd opiate analgesics for their chronic pain issues. cdc also 2 blame 4 covid19 testing failures... stop this torture of persons needing rx'd opiate analgesics.,2020-04-30 00:23:12+00:00,,,1255653896653017096,,https://twitter.com/nogoddogs/status/1255653896653017096,0,0,nogoddogs,https://twitter.com/nogoddogs/status/1255402059609919493
"but these 2 medications dysregulate other systemic functions because they are not pain and specifics opiate analgesics. i've taken gabapentin bc it's the next best thing 4 pain. bs. i sleepwalk, and almost fell down stairs. misplaced items bc of gabapentin. opiates proven 4 pain",2020-04-30 00:18:27+00:00,,,1255652700370481154,,https://twitter.com/nogoddogs/status/1255652700370481154,0,0,PainNewsNetwork,
opiate prescribing has and is the scapegoat for the 'causative' and deliberate manipulated reason for the ignorance of dening persons their opiate pain therapies. it's draconian torture.,2020-04-29 07:42:29+00:00,,,1255402059609919493,,https://twitter.com/nogoddogs/status/1255402059609919493,0,1,MichaelNey19,
valid patient rights to correct health care re:: documented chronic pain. but doctors and insurances co's have personally chosen to ignore this very individual right.,2020-04-29 07:37:53+00:00,,,1255400899540914176,,https://twitter.com/nogoddogs/status/1255400899540914176,1,0,MichaelNey19,
 ,2020-04-25 00:31:06+00:00,,,1253843945525776392,,https://twitter.com/nogoddogs/status/1253843945525776392,0,0,reversechapter,
always great truth and respect in your comments...a side of humor. nasal swabs are now the shortage re: ' inability to test.' also have a 92 yr old father high risk; copd. chf... maybe an unexpected implosion of trump on podium. hahahaha.,2020-04-25 00:30:32+00:00,,,1253843804475592705,,https://twitter.com/nogoddogs/status/1253843804475592705,0,0,reversechapter,
thin sliced pears made into cream cheese pie. mmmmm.,2020-04-24 14:35:27+00:00,,,1253694044431097859,,https://twitter.com/nogoddogs/status/1253694044431097859,0,0,Safe_Haven0419,
"also pure manipulative exploitation of mismanaged state governors ""phasing""... end goal imo restructure of social norms. trump pushed this and fauci brix and he dufuss cdc head are just playing along.",2020-04-24 05:33:11+00:00,,,1253557580909219840,,https://twitter.com/nogoddogs/status/1253557580909219840,0,0,reversechapter,
it's quite the predicament but predictable.... i like the fake utopia snag!!!,2020-04-24 05:25:48+00:00,,,1253555721553055744,,https://twitter.com/nogoddogs/status/1253555721553055744,0,0,reversechapter,
agree. but this posed too much of an excellent diversion...,2020-04-24 05:21:36+00:00,,,1253554663628181504,,https://twitter.com/nogoddogs/status/1253554663628181504,1,0,CJ_freethinkr,
and most importantly independent doctors... now doctors are left to choose which 'med group' will be salary paying them and providing health care. the landscape had changed for future health care.,2020-04-23 14:29:48+00:00,,,1253330233257652226,,https://twitter.com/nogoddogs/status/1253330233257652226,0,0,ThomasKlineMD,
building databases to create algorithms for absolute surveillance and possible containment of non productive human being... this is leading into future have and have nots...,2020-04-23 14:26:30+00:00,,,1253329405943767046,,https://twitter.com/nogoddogs/status/1253329405943767046,0,0,tjomac,
with you on that very clear and dangerously possible statement.,2020-04-23 14:22:30+00:00,,,1253328398899744769,,https://twitter.com/nogoddogs/status/1253328398899744769,0,0,tjomac,https://twitter.com/tjomac/status/1252456292372733953
"i believe this virus was engeniered/designed for population control aka genocide; over 60, blacks, and now 'cats'? all to create a chaotic ability to trace and contain. this is imo how america will over a few yrs become (already becoming) a federal/state/local policed nation.",2020-04-23 14:13:57+00:00,,,1253326245904830464,,https://twitter.com/nogoddogs/status/1253326245904830464,1,0,,
hilarious ,2020-04-20 00:59:56+00:00,,,1252039260099825665,,https://twitter.com/nogoddogs/status/1252039260099825665,0,0,reversechapter,
retweet and let's see if dr. knut wattkowski is heard... his interview does a most explanatory epiological reason for virus spread and optimally better preventative strategies.,2020-04-19 22:32:41+00:00,,,1252002206301040640,,https://twitter.com/nogoddogs/status/1252002206301040640,0,0,nogoddogs,
please read and re-tweet. excellent professional explaining what and why of what should have been the global approach to initially knowing about covid19 outbreak in december 2019 and january 2020.,2020-04-19 22:27:38+00:00,,,1252000935884152832,,https://twitter.com/nogoddogs/status/1252000935884152832,0,0,ChristineNeuen,https://twitter.com/ChristineNeuen/status/1251319113118552073
christine n. thank you for reading and agreeing with his perspective. i'm sorry for spelling errors. 'herd immunity' i spelled heard.. oops. but he must be so frustrated. his name needs to be put out into the twitter verse. the government probably doesn't want to hear anything,2020-04-18 18:27:50+00:00,,,1251578200028839939,,https://twitter.com/nogoddogs/status/1251578200028839939,0,0,nogoddogs,
"yes. this covid19 is like a flu on steroid's... if the government had not made everyone shelter in place from their 'late' reactions. took action especially with nursing homes, elder care facilities and the elderly in general as well as immune deficiency persons, thiis may not b",2020-04-18 18:15:52+00:00,,,1251575189130948608,,https://twitter.com/nogoddogs/status/1251575189130948608,0,0,ChristineNeuen,
rogue wolf needs your help. please do what you can. imperative,2020-04-18 00:24:14+00:00,,,1251305503399043072,,https://twitter.com/nogoddogs/status/1251305503399043072,0,0,RogueWolf2001,https://twitter.com/RogueWolf2001/status/1250895641036959745
i feel you. can you borrow any $from family? i'm on disability w/o a provider after 12 yrs on rx'd opiate analgesics... ibuprofen is tearing up my kidneys. im going to try the methadone clinic. i gotta get opiate analgesics. and now this virus... close to insanity. ,2020-04-17 07:23:06+00:00,,,1251048525787430912,,https://twitter.com/nogoddogs/status/1251048525787430912,3,0,RogueWolf2001,
google knut wittkowski... i hope i spelled it right... heard immunity basis of his article/interview. omg. truly makes so much factual sense re: covid19. fear and skewed numbers of deaths. sounds very similar to the tactics used to ramp up cdc guidelines 2016 . opiate hysteria.,2020-04-17 07:05:03+00:00,,,1251043981334544384,,https://twitter.com/nogoddogs/status/1251043981334544384,4,2,nogoddogs,
"standing standing standing. arthritis starts flaring, migraine begins... this is all backwards in approach. i'm talking from the delayed start of 2+ months available to ""prepare"".",2020-04-17 00:52:02+00:00,,,1250950111049461760,,https://twitter.com/nogoddogs/status/1250950111049461760,0,0,DanLairdMD,
"woke up singing queen's don't stop me now... hmmm. been feeling alot of anger lately and i believe this is subsequently telling me to walk. even though i can't walk for l lengths of time. cpp numerous reasons, so i'm going to get a game plan started. stay calm stay safe ",2020-04-17 00:48:01+00:00,,,1250949099970494470,,https://twitter.com/nogoddogs/status/1250949099970494470,1,0,manneb2015,
can't wait to get into this article... thanks ,2020-04-17 00:37:54+00:00,,,1250946552459407363,,https://twitter.com/nogoddogs/status/1250946552459407363,1,0,PainNewsNetwork,
hi. i just found this org. physicians for human rights. also a dr. joia mukherjee. just putting this out there. haven't done any in-depth research yet but she is involved with this organization...could be a ++ for cpp's. stay calm stay safe everyone ,2020-04-17 00:36:51+00:00,,,1250946289891753984,,https://twitter.com/nogoddogs/status/1250946289891753984,1,1,,
"just as the current president of the usa sis in wisconsin... older person s' are count on voters... with covid restricting closeness to people, long lines and no vote by mail option, he hopes they won't vote or (this is very disgusting but...)die teying. pure narcissist. mwmeme",2020-04-15 22:57:55+00:00,,,1250559004570464258,,https://twitter.com/nogoddogs/status/1250559004570464258,0,0,,
it's always something causing is more pain... we have had enough. i feel for your situation carol. ,2020-04-15 22:51:44+00:00,,,1250557446034198531,,https://twitter.com/nogoddogs/status/1250557446034198531,0,0,PainNewsNetwork,
exactly why the cdc guidelines (not mandates) were pushed to the point that doctors are afraid to rx opiate analgesics to patients that need them as therapy to moderate chronic intractable documented pain. too many and some quite affluent white/caucasians were od'ing. smfh.,2020-04-14 17:34:40+00:00,,,1250115268078178304,,https://twitter.com/nogoddogs/status/1250115268078178304,0,0,linsod,
"life liberty and pursuit of moderated pain, ",2020-04-14 17:27:11+00:00,,,1250113385108307969,,https://twitter.com/nogoddogs/status/1250113385108307969,0,0,malus_k,
so sorry for spelling errors... my laptop is finally a goner... so texting with my pos phone (truly horrible cheap acatel). sorry.,2020-04-14 17:22:29+00:00,,,1250112201886744585,,https://twitter.com/nogoddogs/status/1250112201886744585,0,0,nogoddogs,
exactly 22 years of documented chronic intra7 pain... opiate analgesic worked fine as a therapudic modality for pain moderation/reduction.,2020-04-14 16:14:00+00:00,,,1250094966501715972,,https://twitter.com/nogoddogs/status/1250094966501715972,0,0,nogoddogs,
hi kitty. i've been dealing with my pain issues and all the bs that has come about over the previous 4-5 yrs. i had a qol before opiate prescribing became a political agenda involving people who are not licenced doctors/healthcare professionals. pain should never be politicized.,2020-04-14 16:12:05+00:00,,,1250094484735627264,,https://twitter.com/nogoddogs/status/1250094484735627264,2,0,Nashkitty66,
corona virus are varies. o believe there are 5 or more corona viruses. in fact he common cold is classified as corona virus. this covid19 is a 'new' or 'novel' (unknown); structured corona virus. i hope this helps explain. ,2020-04-14 15:28:59+00:00,,,1250083637489479682,,https://twitter.com/nogoddogs/status/1250083637489479682,2,0,painadvocateAR,
"good to find another or at least one organization willing to possibly get this ""don't punishing pain""... thanks leah. i'm going to check it out.",2020-04-14 15:23:26+00:00,,,1250082240123543557,,https://twitter.com/nogoddogs/status/1250082240123543557,0,1,Angelsgal02,https://twitter.com/Angelsgal02/status/1250072208183083008
"dea should be deregulated, disassembled. police state has and is becoming fully operational. look out.",2020-04-10 15:28:51+00:00,,,1248634054691487749,,https://twitter.com/nogoddogs/status/1248634054691487749,0,1,CMerandi,
key word... quietly. hmmm?,2020-04-10 15:26:27+00:00,,,1248633447654010882,,https://twitter.com/nogoddogs/status/1248633447654010882,0,0,PainNewsNetwork,
"this is out of control.... pharmacies are partnering with pharma corporate. illegal. pharmacists have no medical licensing. this should be a prosecutorial nationwide event... oh i forget, we have no rights. bull shit. disgusting. raw illegal audacity.",2020-04-10 13:13:37+00:00,,,1248600021630672897,,https://twitter.com/nogoddogs/status/1248600021630672897,0,0,djwilliams35,
dismantleevilas*h9les. these ignorant ambivalent group of legally prescribed medications (pdr) policing educated doctors should not exist. i'd love to say more but afraid of being 'targeted' because of the truthful ugliness represented by them.,2020-04-10 00:22:37+00:00,,,1248405990669615110,,https://twitter.com/nogoddogs/status/1248405990669615110,0,0,KarenOien,https://twitter.com/KarenOien/status/1247915174108860416
neither was i . but i totally agree with you!!!!,2020-04-08 17:26:09+00:00,,,1247938798920630273,,https://twitter.com/nogoddogs/status/1247938798920630273,0,0,D321Debbie,
do you believe this will loosen 2016 'guidelines' which have caused those with documented chronic pain forced tapers or totally dropped by their healthcare provider?,2020-04-08 17:23:25+00:00,,,1247938111151190016,,https://twitter.com/nogoddogs/status/1247938111151190016,0,0,PainNewsNetwork,
sorry. the military presence is ramping up... this is not positive for maintaining societal cooperation.,2020-04-06 14:05:51+00:00,,,1247163614613700609,,https://twitter.com/nogoddogs/status/1247163614613700609,0,0,nogoddogs,
agreed. these confused wh briefings and no facts to bcak6 up. panic/fear is eat,2020-04-06 14:02:53+00:00,,,1247162867801100289,,https://twitter.com/nogoddogs/status/1247162867801100289,1,0,wdavidarmstr0ng,
giveusliberty,2020-04-06 13:58:54+00:00,,#GiveUsLiberty,1247161864980697089,,https://twitter.com/nogoddogs/status/1247161864980697089,0,0,,
giveusliberty steveg mnuchin has no experience except manipulative tricks advantage taking,2020-04-06 13:58:40+00:00,,#GiveUsLiberty,1247161807682355200,,https://twitter.com/nogoddogs/status/1247161807682355200,0,0,,
notice trump always has he same group of people surroundings him during his bs updates... more confusing than informative ... i respect doctors but dr facci/wh virla spokesperson. he speaks facts but dares not cross trumpian dictlrates... watch 12 monkeys. 1996 movie... mnuchin,2020-04-06 13:55:57+00:00,,,1247161121523597312,,https://twitter.com/nogoddogs/status/1247161121523597312,0,0,techdino,
"this is dictatorship... trump has made one wrong and inappropriate 'national' guidance statement after another ... "" da.. 'mask isn't for me'. excellent response from this contributor and president (remember, half + of the voting population placed him as president) . safer. jokr",2020-04-06 13:49:41+00:00,,,1247159544687611905,,https://twitter.com/nogoddogs/status/1247159544687611905,0,0,techdino,
a virus needs a host to survive... its a parasite as well as a highly mutatable diabolical virus.,2020-04-06 13:29:44+00:00,,,1247154525347229697,,https://twitter.com/nogoddogs/status/1247154525347229697,0,0,Wanita1,https://twitter.com/Wanita1/status/1247017889951092736
