text,date,geo,hashtags,tweet_id,mentions,permalink,replies,retweets,replies_to,mentioned_urls
freddie mercury:: https://www.instagram.com/p/cdpkjtkmxxc/?igshid=ev0jpedc9wl1 simply adore him and his attitude. i've listened to queen since the late 1970's. all ofnthe members are brilliant ,2020-07-30 20:32:34+00:00,,,1288935537634693128,,https://twitter.com/nogoddogs/status/1288935537634693128,0,0,,https://www.instagram.com/p/CDPKJtKMxxc/?igshid=ev0jpedc9wl1
"lauren, i was banned by my high risk 92 yr old father (copd chf) and respected his wishes. he passed on the 19 in hospital from chf and lung cancer. first time i visited him in 4 months was in hospital then he died. never made it out. also tested neg. for covid.",2020-07-23 09:34:47+00:00,,,1286233289628450820,,https://twitter.com/nogoddogs/status/1286233289628450820,0,0,CIAAG_Lauren,
cop's are an experiment. we were and still are being used and stored in a data base...the oligarchs have been influencing every agency esp fed. idiocracy has overtaken democrazy.,2020-07-23 02:32:12+00:00,,,1286126941440016385,,https://twitter.com/nogoddogs/status/1286126941440016385,0,0,ThomasKlineMD,
research what and how a virus is and 'survives'. basic. then put everything that's been done in its right place. this is a global reset.,2020-07-18 09:27:37+00:00,,,1284419545751531521,,https://twitter.com/nogoddogs/status/1284419545751531521,0,0,,
please people...use critical thinking and deduction. engineered bio weapon covid. goes to reset and control of the citizenry. virus has mutated. please question all the irrational guidelines that do not work. ? all reasons no-one is on the same page.,2020-07-18 09:23:13+00:00,,,1284418439545856002,,https://twitter.com/nogoddogs/status/1284418439545856002,0,0,TimRunsHisMouth,https://twitter.com/TimRunsHisMouth/status/1284251151005818883
society in disarray. mankind?,2020-07-15 02:03:34+00:00,,,1283220632998752256,,https://twitter.com/nogoddogs/status/1283220632998752256,0,0,ravensspirit68,
on exact point. agree.,2020-07-14 18:23:07+00:00,,,1283104755917770759,,https://twitter.com/nogoddogs/status/1283104755917770759,0,0,ravensspirit68,https://twitter.com/ravensspirit68/status/1283043915491430401
no. sorry. i wish i could be of help. i also purchased a new laptop but not what i wanted as 'kids at home' parents 'ran the laptops'. windows 10 took time to adjust. no idea about apple devices.,2020-07-14 18:20:58+00:00,,,1283104213778739204,,https://twitter.com/nogoddogs/status/1283104213778739204,1,0,PaulMiller1313,
a measurement comparing the milligram dosage of any prescribed opiate to be below or = to 90 milligrams of morphine...thus mme (morphine milligram equivalent),2020-07-14 14:46:06+00:00,,,1283050143361703940,,https://twitter.com/nogoddogs/status/1283050143361703940,0,0,MajorlyMost,
truth. and i refuse to utilize pt now for 22 years of chronic pain. just keeps pulling $$from cms and paying therapists. who has validated pt as the go-to replacing opiates for pain management anyway?,2020-07-14 14:38:38+00:00,,,1283048264678477830,,https://twitter.com/nogoddogs/status/1283048264678477830,0,0,CIAAG_Lauren,https://twitter.com/CIAAG_Lauren/status/1281268129822322694
thank you lauren.,2020-07-14 14:33:36+00:00,,,1283046998292258818,,https://twitter.com/nogoddogs/status/1283046998292258818,0,0,CIAAG_Lauren,
"agree. i had to make that decision in 2017... after my prescriber for benzos became qualified to rx suboxone. i actually was rx'd both for about a year. suboxone is a monster. no pain relieving quality. if you have been cut off opiates, subs stave off withdraw. for pain??? bs.",2020-07-14 14:33:10+00:00,,,1283046889361940480,,https://twitter.com/nogoddogs/status/1283046889361940480,0,0,Deeenst,
and the then operational government will have redefined pain. this is so wrong.,2020-07-14 14:23:46+00:00,,,1283044521773862914,,https://twitter.com/nogoddogs/status/1283044521773862914,0,0,ThomasKlineMD,https://twitter.com/ThomasKlineMD/status/1282525390368538624
that is absurd and unjustifiable...this is definitely part of a plan for the globalist society. how to commit genocide of a specific cohort group by denial of needed treatment. that group is us. those with documented chronic pain issues/medical conditions or pain related diseases,2020-07-14 14:21:55+00:00,,,1283044058173181959,,https://twitter.com/nogoddogs/status/1283044058173181959,0,0,ThomasKlineMD,
blm ,2020-07-12 20:41:35+00:00,,,1282414828385120258,@saytheirnames,https://twitter.com/nogoddogs/status/1282414828385120258,0,2,_SJPeace_,https://twitter.com/_SJPeace_/status/1282192300651806720
manipulative lies all the time. le are only public servants....why do they have guns in the first place? right?,2020-07-11 23:20:07+00:00,,,1282092334637817856,,https://twitter.com/nogoddogs/status/1282092334637817856,1,0,brent_kellogg,
opiate synthetic analgesics are more bio-adaptive to we humans opiate receptors .. this dependence not addiction usually occurs. msm spins and interchanges wording to cause the fake fact of 'opiate addiction' esp in chronic pain issues.,2020-07-05 10:59:54+00:00,,,1279731726961577984,,https://twitter.com/nogoddogs/status/1279731726961577984,0,0,Ledhedd,
"all suboxone does is prevent the horror of withdraw....after an abrupt cut off from 12 yrs opiate analgesic therapy, i was in 'blackout' mode due to withdraw... landed in a psych fac ... psychiatrist arrives w/o checking my med hx gives 8 mg suboxone... tada. withdraw gone ...",2020-07-05 10:51:42+00:00,,,1279729663665897473,,https://twitter.com/nogoddogs/status/1279729663665897473,0,0,,
yes protests allowed. xivil rights ... also it's this group who protests shoulder to shoulder who the government could care less about them contracting the 'virus'...,2020-07-05 10:41:07+00:00,,,1279726999599304710,,https://twitter.com/nogoddogs/status/1279726999599304710,0,0,TONYxTWO,
 2/ have no validity to state the amount of pain we are experiencing. the docs are playing the game bc it's rhwie6 life income. is there any way out of this horror show?,2020-07-05 09:28:39+00:00,,,1279708763021344768,@ravensspirit68,https://twitter.com/nogoddogs/status/1279708763021344768,0,0,,
 your comment lays out the end game in this bs campaign for the push for suboxone ... the one size fits all pain moderating analgesic. no pain relief bc of the naloxone which has such tight affinity to mu receptors ... we know what's up but as usual we (cpp's),2020-07-05 09:26:44+00:00,,,1279708282131808257,@ravensspirit68,https://twitter.com/nogoddogs/status/1279708282131808257,1,0,,
"i have, as many others, been told of the 'pain relieving abilities of suboxone... it's a lie. also told the naloxone in suboxone is useless? so why add it to the buprenorphine at all?. tried to get only buprenorphine. nope it's only advised if allergic, pregnant or specified???",2020-07-05 09:22:57+00:00,,,1279707330163150854,,https://twitter.com/nogoddogs/status/1279707330163150854,0,0,ravensspirit68,
"2/throwing this rough draft of an idea onto the mix. i have near 0 skill set on how to set this up and broadcast using zoom or a similar platform. as a cohesive group, cpp's need to be seen and heard. this is as close to group exposure i could rationally come up with. anyone?",2020-07-05 09:18:54+00:00,,,1279706308548136961,,https://twitter.com/nogoddogs/status/1279706308548136961,0,0,ravensspirit68,
"q possible plan. specific day all dont punish pain rallies have duo, zoom set up. connecting to state governors offices and broadcast every person who is able to state their chronic pain issue and lack of opiate analgesics treatment. i really am just throwing this out",2020-07-05 09:13:54+00:00,,,1279705049623597056,,https://twitter.com/nogoddogs/status/1279705049623597056,0,0,ravensspirit68,https://twitter.com/ravensspirit68/status/1279456813134430208
oops suboxone.. above statement,2020-07-04 16:27:46+00:00,,,1279451850438258690,,https://twitter.com/nogoddogs/status/1279451850438258690,0,0,MaaShealth,
i unfortunately was placed on subordinate and the amt of pain control is nixed by the added naloxone... is definitely be willing to try straight buprenorphine but no doc will rx it unless 1/ allergic 2/pregnant 3/ docs note that it's ok... how hypocritical is that ill reasoning,2020-07-04 16:27:03+00:00,,,1279451668841672707,,https://twitter.com/nogoddogs/status/1279451668841672707,0,0,MaaShealth,
i'm a ccp w/o. a prescriber... 12 yrs on opiates with moderated pain control... i'm in the same position as your friend... ssdi and car is falling apart. tried go fund me... unsuccessful. best to your friend and thanks you for standing with those of us needing legislation 3 pain,2020-07-04 16:23:04+00:00,,,1279450665836838914,,https://twitter.com/nogoddogs/status/1279450665836838914,0,0,MaaShealth,
"go dez. could you explain your field studies ,.. what they entailed ?",2020-07-04 14:58:24+00:00,,,1279429359095472129,,https://twitter.com/nogoddogs/status/1279429359095472129,1,0,MaaShealth,
criticality think this planned fear campaign through... the dots are bottomless pits of irrationality.,2020-07-02 23:58:34+00:00,,,1278840520819777538,,https://twitter.com/nogoddogs/status/1278840520819777538,0,0,Jali_Cat,
yes they've known it covid19 to be of the covid viral family since it's 'discovery'... to your point exactly.,2020-07-02 23:56:08+00:00,,,1278839906345852928,,https://twitter.com/nogoddogs/status/1278839906345852928,0,0,Jali_Cat,
"agreed ..."" baby you've been had""",2020-07-02 23:53:51+00:00,,,1278839333953429510,,https://twitter.com/nogoddogs/status/1278839333953429510,0,0,Jali_Cat,
queen and freddie mercury are the only performers i have ever respected. they achieved $and balance within the cutthroat arena of true artists.,2020-07-02 23:52:02+00:00,,,1278838878372315142,,https://twitter.com/nogoddogs/status/1278838878372315142,0,0,EveryDoggoKnows,
 i do like your location! i'm from down in a hole!,2020-07-02 23:47:01+00:00,,,1278837612619403267,@BrigidCovey,https://twitter.com/nogoddogs/status/1278837612619403267,0,0,,
i love your statement... it falls on greedy imbeciles who became self appointed ignorant tyrannical sell-outs.... and that's saying what i know quite nicely.,2020-07-02 23:45:13+00:00,,,1278837162293764098,,https://twitter.com/nogoddogs/status/1278837162293764098,0,0,cathy_kean,
excuse the hopelessness and blunt statement : being humans and not of wealth and privilege are fucked ,2020-07-02 23:41:48+00:00,,,1278836299705864194,,https://twitter.com/nogoddogs/status/1278836299705864194,2,1,NickCarlin6,
very cool. all of them! ,2020-07-02 17:17:23+00:00,,,1278739557555544065,,https://twitter.com/nogoddogs/status/1278739557555544065,1,0,reversechapter,
"bull shi*. cops kill inocent humans... is that ok, mary????",2020-07-02 17:15:37+00:00,,,1278739115920576512,,https://twitter.com/nogoddogs/status/1278739115920576512,0,0,reversechapter,
that cop... jumping at the dude with the plastic toy whistle... omfg. the police need to back the fuck off. you go. use your rightz ,2020-07-02 17:14:10+00:00,,,1278738749204189186,,https://twitter.com/nogoddogs/status/1278738749204189186,0,0,ShelbyTalcott,
ouch to say the least ,2020-07-02 17:09:38+00:00,,,1278737610622545920,,https://twitter.com/nogoddogs/status/1278737610622545920,0,0,Katamac1967,
"papaver somniferum has propegated upon the earth, just like 'weed'. they are both naturally found as plants. the poppy alkaloids definitely contributing to pain relief. humans continue to *uck with nature, genetics and look at the horror show that's being broadcast. talk that msm",2020-07-02 17:07:41+00:00,,,1278737116822986753,,https://twitter.com/nogoddogs/status/1278737116822986753,0,0,ThomasKlineMD,
100% agree. which is in a word a genocidal strategy. why. other humans would do this horrible torture to others ...,2020-07-02 17:01:25+00:00,,,1278735542352576512,,https://twitter.com/nogoddogs/status/1278735542352576512,0,1,Txsconstitution,
great strategy! this could be a reality and expose the horror that chronic pain is causing across all environments; to millions of those suffering needlessly. thanks.,2020-07-01 03:01:00+00:00,,,1278161655021678592,,https://twitter.com/nogoddogs/status/1278161655021678592,0,0,ravensspirit68,
real real. the big picture is shrouded in lies and political manuvers. pushme pullyou. bs,2020-07-01 02:51:40+00:00,,,1278159308224712704,,https://twitter.com/nogoddogs/status/1278159308224712704,1,0,brianrounsavall,
so sorry. it seems that there is always distraction of some sort... not that chronic pain isn't enough. we are trying to survive in very very strange and inhumane times. thank you lauren for staying focused. i don't post/ read often but always a tweet that pulls me back to now.,2020-07-01 02:47:23+00:00,,,1278158230041120769,,https://twitter.com/nogoddogs/status/1278158230041120769,0,1,CIAAG_Lauren,
"so right. those making the 'rules'... (no other human can rule over another, society must realize our power) these people make rules that apply to all but themselves. gaining power at others' expense is cowardly. all is connected ",2020-07-01 02:41:21+00:00,,,1278156712525139969,,https://twitter.com/nogoddogs/status/1278156712525139969,0,0,KarenOien,
doctors/preacribers of opiate analgesics must stop acting as victims... we their patients suffering from chronic documented pain issues are victims of illegal non- actions of our doctors. stop playing into dea threats and unite as one group for the health of your pain patients.,2020-06-29 10:48:08+00:00,,,1277554439121969153,,https://twitter.com/nogoddogs/status/1277554439121969153,0,0,fightpaindaily,
it's just wrong for other humans to be as ignorant to allow this mis-treatment to happen . i feel for you. im in a similar situation but the facts are... we should be treated not ignored ,2020-06-28 21:24:33+00:00,,,1277352211035627520,,https://twitter.com/nogoddogs/status/1277352211035627520,0,0,CIAAG_Lauren,
more be delays .. pain doesn't take vacations. oh ummm unless legally having a prescription opiate analgesic written/sent to pharmacy for moderating pain issues. then there's the know it all pharmacist who over rides/?'s the doctors ethical reason of said script. torture.,2020-06-28 07:04:49+00:00,,,1277135852280348672,,https://twitter.com/nogoddogs/status/1277135852280348672,0,0,Tootwisted40,
"also... as fact, secretary appointed steve mnuchin made his $$thru corporate hollywood. pruducwd numerous well know movies. hmmmm. what a set up for the direction of the new future american (?) /global blueprint.",2020-06-27 12:58:56+00:00,,,1276862578925481985,,https://twitter.com/nogoddogs/status/1276862578925481985,0,0,reversechapter,
"and sadly, the general march in lockstep population are clueless.",2020-06-27 12:52:17+00:00,,,1276860904366395393,,https://twitter.com/nogoddogs/status/1276860904366395393,0,0,nogoddogs,https://twitter.com/nogoddogs/status/1261665791348486147
"disagree completely. wattf does this opinion have as it relates to my pain, my body, my metabolism. i was taking a very limited amount of percocet (3/d) and carisoprodol with the percocet for over 2 years after botched plate and retraining screws (8). this after serious mva. bs",2020-06-27 10:35:13+00:00,,,1276826410645159936,,https://twitter.com/nogoddogs/status/1276826410645159936,0,0,PainNewsNetwork,
treatment 9f unresolved chronic pain. it's all about profit. an rx from a doctor costs pennies compared to the bs numerous modalities of treatment which seems to be all doctors do... generating lots of $$$$.,2020-06-26 14:35:31+00:00,,,1276524496627916803,,https://twitter.com/nogoddogs/status/1276524496627916803,0,0,brent_kellogg,
"do some research, i suppose. the who plainly and concisely states that allowing persons to remain in unresolved pain is torturous. this is paraphrased but this statement by who makes the usa (healthcare) responsible for the treatment, using opiate analgesics, valid.",2020-06-26 14:32:12+00:00,,,1276523663118999552,,https://twitter.com/nogoddogs/status/1276523663118999552,1,0,brent_kellogg,
experiment in controlling the masses. what else could it be? why would an advanced nation do this to other humans?,2020-06-26 13:20:57+00:00,,,1276505733463498753,,https://twitter.com/nogoddogs/status/1276505733463498753,1,0,ThomasKlineMD,
snatch... great flick ,2020-06-26 13:18:19+00:00,,,1276505068142039052,,https://twitter.com/nogoddogs/status/1276505068142039052,0,0,DeathByGeek,
"i agree. we as the millions who unnecessarily suffer chronic pain day to day, have been screaming for years... no one listens or they twist the stats. this has to b reversed from the fed down. who should be all over the usa's bs guidelines condemning it as torture.",2020-06-26 13:16:20+00:00,,,1276504570320105472,,https://twitter.com/nogoddogs/status/1276504570320105472,0,1,BrandensLove365,
"ok so unless a mobile unit is available, using frozen shoulder? as an alternative to taking decades old opiate analgesics ... just stop this already.",2020-06-19 21:25:42+00:00,,,1274091007269888000,,https://twitter.com/nogoddogs/status/1274091007269888000,0,0,PainNewsNetwork,
thank you joe.,2020-06-19 09:38:04+00:00,,,1273912925091254273,,https://twitter.com/nogoddogs/status/1273912925091254273,0,0,JoeAllenNewman,https://twitter.com/JoeAllenNewman/status/1273515099286839296
money prop and other agencies have a sick torturous agenda. and all these older senate reps... i'm sure as i live and breathe have no problem having their pain issues treated without the hoop-jumping every other pain patient is required to participate.,2020-06-19 09:36:31+00:00,,,1273912534383374336,,https://twitter.com/nogoddogs/status/1273912534383374336,0,0,CContrarus,
you: prop cannot control my individual pain by politicizing your hollow and baseless 'urges' to the cdc.,2020-06-19 09:29:01+00:00,,,1273910649400197121,,https://twitter.com/nogoddogs/status/1273910649400197121,0,2,supportprop,
"yes. i agree... my son and his health are important but this system of erroneous health care in the us is a battlefield and it's a human right to have, in our current society, trusted healthcare. sending best outcomes for your daughter.",2020-06-17 13:40:20+00:00,,,1273249118639599617,,https://twitter.com/nogoddogs/status/1273249118639599617,1,0,purplemamabear,
wonderful time for your son and you! he looks so happy and pleased. thank you for sharing this moment. my only son is on the autism spectrum and lost language. i know how wonderful these moments truely are. ,2020-06-14 04:14:49+00:00,,,1272019638214447109,,https://twitter.com/nogoddogs/status/1272019638214447109,0,0,MandyAUtiger19,
"freddie mercury... yeah, not really a good photo. his face is not visible. i'm just an obcessed follower of queen and finding especially older photos and facts about them. i've listened to queen since 1974... reintroduced by watching movie bohemian rhapsody. sparked many memories",2020-06-14 03:30:10+00:00,,,1272008401346859014,,https://twitter.com/nogoddogs/status/1272008401346859014,0,0,,
thanks,2020-06-09 02:04:23+00:00,,,1270174876008165377,,https://twitter.com/nogoddogs/status/1270174876008165377,0,0,Txsconstitution,
there's no right there's no wrong only popular (''psychiatric' ) opinion... slightly paraphrased line from twelve monkeys.. great movie terry gilliam.,2020-06-04 16:55:16+00:00,,,1268587135390691330,,https://twitter.com/nogoddogs/status/1268587135390691330,0,0,reversechapter,
"respiratory infiltrate and other protiens which may cause mutations when aquires thru lungs and dispersed systemically. i'm confused as to why it's been classified as a member of the covid viral family... imo, this was engeniered on a specialized research facility. what do i know",2020-06-04 16:48:05+00:00,,,1268585327716958211,,https://twitter.com/nogoddogs/status/1268585327716958211,0,0,PainNewsNetwork,
it's an illogical directive. seriously we have 'rxperts' who try to validate compilations of scattered non published opiate research. best experts are the persons themselves...,2020-06-04 08:43:54+00:00,,,1268463478433554433,,https://twitter.com/nogoddogs/status/1268463478433554433,0,0,LdBleete,
thanks.,2020-06-04 08:34:59+00:00,,,1268461233038131201,,https://twitter.com/nogoddogs/status/1268461233038131201,0,0,Txsconstitution,
hi. what is dba? i'm with you... take back our legal rights for opiate pain analgesics. big pharma is 5he motivator causing unnecessary suffering... i believe that's the biggest issue. papavar somniferum is a plant found within the natural eco system on this planet.,2020-06-03 16:49:32+00:00,,,1268223302297886725,,https://twitter.com/nogoddogs/status/1268223302297886725,1,0,Txsconstitution,
agree docs. pain is subjective. people who 'study' observe reactions to the 'study' can not know how my pain is directly affecting my daily life. i know opiate analgesics work for my pain to moderate what the receptors or sending thru-out my body. the restricting neg.effects.,2020-06-03 15:38:24+00:00,,,1268205400505176067,,https://twitter.com/nogoddogs/status/1268205400505176067,1,0,Chronic_FLKeys,https://twitter.com/Chronic_FLKeys/status/1267714216456314880
"in my experience smoking weed, recreationally, i never enjoyed being stoned. either extremely self conscious or couch lock. on occasion, very rarely did i get the giggles. so i for one would not want to use marijuana for pain. it may take your mind off pain intensity. opiates wrk",2020-06-03 15:30:57+00:00,,,1268203525013635086,,https://twitter.com/nogoddogs/status/1268203525013635086,1,0,PainNewsNetwork,
his wartime strategy needs revamped. haha...,2020-05-30 01:57:29+00:00,,,1266549260780273667,,https://twitter.com/nogoddogs/status/1266549260780273667,0,0,reversechapter,
"it's a doctor's legal right to rx opiate analgesics for pain, acute or chronic. there's no reason for this torture to be contributing. it's illegal.",2020-05-24 23:10:10+00:00,,,1264695212733018112,,https://twitter.com/nogoddogs/status/1264695212733018112,0,1,JosephAFalzone1,
total ignorance on part of doctors also. cdc o a public health fed agency. they are so into overreach into personal doctor/patient relationships as they thru pdmp monitoring continue this insanity....yes disgusting. pdmp is a policing tool w/o any privacy. thinly veiled spy force,2020-05-21 14:07:32+00:00,,,1263471493641617408,,https://twitter.com/nogoddogs/status/1263471493641617408,0,1,Kevinmfilms,
"nationwide mandated (by who, which agencies) pdmp definitely needs to be shut down... agree completely.",2020-05-21 01:33:42+00:00,,,1263281783346475010,,https://twitter.com/nogoddogs/status/1263281783346475010,0,0,nogoddogs,https://twitter.com/nogoddogs/status/1258523005174509569
typical. regan's lie and it's been on its way to the current covid19 situation we are experiencing.,2020-05-20 20:49:53+00:00,,,1263210359323754497,,https://twitter.com/nogoddogs/status/1263210359323754497,0,0,DavidpStein,
"act now bc trump is in total violation of cdc guidelines relative to covid19. he refused to distance and wear a mask... ffs, he quarentined the nation due to covid19.",2020-05-20 20:40:36+00:00,,,1263208024606466050,,https://twitter.com/nogoddogs/status/1263208024606466050,1,0,UInhumane,
"happened all over nation. very few doctors are prescribing opiate analgesics for chronic pain pts. if rx'ing, a titered dosage of opiates and other bs meds like gabapentin which is primarily a seizure medication. itvand other opiate substitutes are powerless over chronic pain.",2020-05-20 20:37:21+00:00,,,1263207203420418048,,https://twitter.com/nogoddogs/status/1263207203420418048,0,0,BluenotesBb,
"yes and now with the wh and president 45 not following cdc guidelines on covid19, perfect time to speak to this crisis millions have suffered due to cdc guidelines in 2016 abruptly reducing/stopping cpp's opiate prescribers from continuing to prescribe. it's time this is fixed ",2020-05-20 20:32:48+00:00,,,1263206058576809990,,https://twitter.com/nogoddogs/status/1263206058576809990,0,2,painadvocateAR,
some persons may actually think it a novel about an animal farm. 1984. true to the times.,2020-05-20 20:27:53+00:00,,,1263204821059985408,,https://twitter.com/nogoddogs/status/1263204821059985408,0,1,headdock,
i no longer get my chronic pain medication. i'm angry and in pain...approach with caution and a sense of concern.,2020-05-20 20:24:50+00:00,,,1263204054240559105,,https://twitter.com/nogoddogs/status/1263204054240559105,1,0,purplemamabear,
exactly... time to take the cdc to task and all doctors possibly who followed guidelines not mandates creating millions who suffer w/o opiate analgesics. class action ls could work. how can this be done with corrections across board to have opiates be prescribed again to cpp's. 1,2020-05-20 20:21:27+00:00,,,1263203203191095298,,https://twitter.com/nogoddogs/status/1263203203191095298,0,0,Kevinmfilms,
really.,2020-05-20 20:17:38+00:00,,,1263202242691244032,,https://twitter.com/nogoddogs/status/1263202242691244032,0,0,Txsconstitution,
all cpp's forced by guidelines to be tapered and/or cut off their documented chronic pain opiate analgesics i've past 4-? years needs to do something. right? what other suggestions r an option to bring attention to these devisively cruel and iillegal actions.,2020-05-20 20:17:05+00:00,,,1263202103117348869,,https://twitter.com/nogoddogs/status/1263202103117348869,0,0,,
since the wh isn't following cdc 'guidelines' re: covid19; sir. redfield on way out... perfect time to readdress 2016 bs opiate guidelines. doctors need to jump at this but it may seem to risky to their 'secure' portfolios. possibly everyone should message the aclu. now. replies,2020-05-20 20:17:04+00:00,,,1263202101385199621,,https://twitter.com/nogoddogs/status/1263202101385199621,1,4,,
