text,date,geo,hashtags,tweet_id,mentions,permalink,replies,retweets,replies_to,mentioned_urls
‘one of the judges who signed off on a large portion of those warrants is currently running for higher judicial office.’ as tom jones would say ‘it’s not unusual but it’s a bit sh1t.’,2020-06-04 02:14:08+00:00,,,1268365388422750208,,https://twitter.com/p3t3rmcd/status/1268365388422750208,0,0,maiasz,https://twitter.com/maiasz/status/1268354226608123907
"the frequency of a cricket's chirps is consistent with air temperature, so you simply need to count how many chirps there are over 25 seconds then divide by 3 and add 4 to tell you the temperature in celsius.",2020-06-04 01:41:29+00:00,,,1268357172645318656,,https://twitter.com/p3t3rmcd/status/1268357172645318656,0,0,,https://www.metoffice.gov.uk/weather/learn-about/weather/seasons/summer/10-facts-about-summer
revealed: serco under fire over fresh £90m covid-19 contract,2020-06-03 23:37:04+00:00,,,1268325859858935809,,https://twitter.com/p3t3rmcd/status/1268325859858935809,0,0,,https://www.opendemocracy.net/en/dark-money-investigations/revealed-serco-under-fire-over-fresh-90m-covid-19-contract/
who ? is cilla hiding somewhere ?,2020-06-03 23:35:13+00:00,,,1268325397223149568,,https://twitter.com/p3t3rmcd/status/1268325397223149568,0,0,Kokomothegreat,
you honestly think boris would be where he is today if he was brought up in a council house ?,2020-06-03 23:33:06+00:00,,,1268324862642266112,,https://twitter.com/p3t3rmcd/status/1268324862642266112,0,0,Sentinelibertas,
that house has doubled glazendness windows. a fvcking palace he was brought up in so he was.,2020-06-03 23:31:12+00:00,,,1268324385938685953,,https://twitter.com/p3t3rmcd/status/1268324385938685953,0,0,_ScreamingSkull,
his mum was a nurse and old man was a tradesman. so aye he is from a working class background. he’s not my first choice as leader but there you go.,2020-06-03 23:27:21+00:00,,,1268323418556022790,,https://twitter.com/p3t3rmcd/status/1268323418556022790,0,0,Sentinelibertas,
he’s got a maj of 80 4.5 years of this shit then most likely a second term. scotland needs to fvck right off.,2020-06-03 23:23:54+00:00,,,1268322550154747905,,https://twitter.com/p3t3rmcd/status/1268322550154747905,0,0,caitlinmoran,
all the struggles are linked. unions need to step up - just saying from my own experience.,2020-06-03 23:14:07+00:00,,,1268320085527138307,,https://twitter.com/p3t3rmcd/status/1268320085527138307,0,0,markgall7,
starmer’s in murdoch’s pocket too.,2020-06-03 23:08:22+00:00,,,1268318639997894657,,https://twitter.com/p3t3rmcd/status/1268318639997894657,0,0,JohnDivney,
‘when i look up to the stars and ponder the vastness of the universe. it dawns on me just how significant i am.’ paraphrasing arnold brown.,2020-06-03 23:02:37+00:00,,,1268317191654576130,,https://twitter.com/p3t3rmcd/status/1268317191654576130,0,0,JohnDivney,
as far as i’m aware they never outsourced their information services like rest of u.k. which possibly led to more cohesive communication regarding naloxone availability in wales. also the partnership between police and wedinos seems to work. great example for scotland ,2020-06-03 22:06:37+00:00,,#naloxone,1268303099724288001,,https://twitter.com/p3t3rmcd/status/1268303099724288001,0,1,Tommy_HR_NPT,
i’m not violent by any means but pr1cks like that are potential triggers. they’re the kind of people that make you kick fvck out of big metal bins.,2020-06-03 21:10:17+00:00,,,1268288924704821248,,https://twitter.com/p3t3rmcd/status/1268288924704821248,0,0,JohnDivney,
a few years back i exposed bad public health practices and nobody gave a flying fvck. just maybe we would have been on a different situation today if the smaller battles were fought through the years ? i know i’m not the only one.,2020-06-03 21:07:39+00:00,,,1268288259202994176,,https://twitter.com/p3t3rmcd/status/1268288259202994176,0,0,libdemdaisy,
dose *,2020-06-03 20:56:51+00:00,,,1268285543449853959,,https://twitter.com/p3t3rmcd/status/1268285543449853959,0,0,p3t3rmcd,
there’s no excuse for not getting people on to fast therapeutic does scripts and getting naloxone out to everyone who needs it. i’m up for volunteering to go round police stations and hospitals with naloxone as a volunteer as part of a pool. we do have a team set up for this?,2020-06-03 20:56:11+00:00,,,1268285375820247041,,https://twitter.com/p3t3rmcd/status/1268285375820247041,1,0,hamilton_viv,
total restraint shown by the driver. key worker also. thank you ,2020-06-03 20:50:08+00:00,,,1268283851257925633,,https://twitter.com/p3t3rmcd/status/1268283851257925633,0,1,BenJolly9,
scotland's shame !,2020-06-03 18:11:55+00:00,,,1268244037309542409,,https://twitter.com/p3t3rmcd/status/1268244037309542409,0,0,mmusJu,
risk assessment measures are now in place ? wtf !,2020-06-03 18:10:30+00:00,,,1268243678365126663,,https://twitter.com/p3t3rmcd/status/1268243678365126663,0,0,FAVORUK,
iain duncan smith - that pr1ck disguised as a pencil and cummings have more influence in scotland than any msp. i've given up now just laughing at the sh1tshow.,2020-06-03 17:57:02+00:00,,,1268240291670233088,,https://twitter.com/p3t3rmcd/status/1268240291670233088,0,0,Legalisecanabo,
sit back - enjoy the sh1t show - relinquish any franchise in the circus. it's not getting any better any time soon. 80 maj 1st past the post and an opposition also in the pocket of murdoch and the state of israel. fvck it all sideways.,2020-06-03 17:53:34+00:00,,,1268239419192066048,,https://twitter.com/p3t3rmcd/status/1268239419192066048,0,0,SteveTransform,
enough to deal with at present with this particular virus never mind influenzas.,2020-06-03 13:30:47+00:00,,,1268173287797993474,,https://twitter.com/p3t3rmcd/status/1268173287797993474,0,0,SaintLaruntz,
mostly white guys who keep many black guys warehoused for corporate profit are now protecting the whitehouse?,2020-06-03 13:24:24+00:00,,,1268171680461062144,,https://twitter.com/p3t3rmcd/status/1268171680461062144,0,0,JProskowGlobal,
being force fed cold salmonella vomit in a union flag cup by a blind folded serf with a gun held to his head using a fork who keeps missing your mouth and stabbing your eyes.,2020-06-03 13:00:42+00:00,,,1268165715154042880,,https://twitter.com/p3t3rmcd/status/1268165715154042880,0,0,LilBadGurll,
it’s driving me bonkers.,2020-06-03 12:49:52+00:00,,,1268162990488027138,,https://twitter.com/p3t3rmcd/status/1268162990488027138,0,0,skwawkbox,
if anyone needs volunteers for police station hospital drop offs etc. ,2020-06-03 12:45:19+00:00,,,1268161844901969920,,https://twitter.com/p3t3rmcd/status/1268161844901969920,0,0,cuppawithK,
tennessee national guard members lay down shields at protester's request,2020-06-02 21:28:59+00:00,,,1267931238771372039,,https://twitter.com/p3t3rmcd/status/1267931238771372039,0,0,,https://thehill.com/homenews/state-watch/500612-tennessee-national-guard-members-lay-down-shields-at-protesters-request
milton jones would be a better choice.,2020-06-02 19:19:47+00:00,,,1267898725885771778,,https://twitter.com/p3t3rmcd/status/1267898725885771778,0,1,paulhutcheon,
"i was following your (though not agreeing with it) argument, right up until that tweet there.",2020-06-02 17:46:24+00:00,,,1267875226496499713,,https://twitter.com/p3t3rmcd/status/1267875226496499713,0,0,JMcintosh91,
hail hail,2020-06-02 14:41:39+00:00,,,1267828734012186624,,https://twitter.com/p3t3rmcd/status/1267828734012186624,0,0,Joey7Barton,
new ebola outbreak detected in northwest democratic republic of the congo; who surge team supporting the response,2020-06-02 14:34:03+00:00,,,1267826821342494721,,https://twitter.com/p3t3rmcd/status/1267826821342494721,0,0,,https://www.who.int/news-room/detail/01-06-2020-new-ebola-outbreak-detected-in-northwest-democratic-republic-of-the-congo-who-surge-team-supporting-the-response#.XtZjTh4RKKs.twitter
there may be as many if not more than 2468 tr’s ,2020-06-02 13:44:00+00:00,,,1267814224094363649,,https://twitter.com/p3t3rmcd/status/1267814224094363649,0,0,MisterUnkn0wn,
apparently he smokes roll ups down to the cardboard and drinks super lager on the clyde now listening to jacques brel hard core techno mixes on a ghetto blaster really sad ,2020-06-01 19:13:33+00:00,,,1267534771363762179,,https://twitter.com/p3t3rmcd/status/1267534771363762179,0,0,EuropaLeague,
why are dutch police able to wear face masks and also give them to detainees ? when u.k seems to be unable to organise this at a comprehensive health care level ? sorry for the caps but we're really fvcked here.,2020-06-01 14:40:54+00:00,,,1267466155083608064,,https://twitter.com/p3t3rmcd/status/1267466155083608064,0,0,,
those red dragons are strong eh ?,2020-06-01 13:01:31+00:00,,,1267441144390172673,,https://twitter.com/p3t3rmcd/status/1267441144390172673,0,0,Kkaiserrr,
lost me sense of smell but can still smell sh1te a mile off.,2020-05-30 18:42:20+00:00,,,1266802136622313472,,https://twitter.com/p3t3rmcd/status/1266802136622313472,0,0,GOVUK,
come to durham.,2020-05-30 18:40:39+00:00,,,1266801715329880070,,https://twitter.com/p3t3rmcd/status/1266801715329880070,0,0,GOVUK,https://twitter.com/GOVUK/status/1262658110260498432
the irony was i’d just completed nurse training and was thinking about joining. no fvcking way after that happened. i’ve worked with some of the most potentially violent people and never once had to use force in 2 decades. fvck these animals.,2020-05-30 18:35:48+00:00,,,1266800493717860355,,https://twitter.com/p3t3rmcd/status/1266800493717860355,0,0,Scf65Forbes,
thanks for posting this scott. people need to see this stuff. police nearly killed me 25 yrs ago. you’re told to move on and put it behind you etc. but these animals carry on regardless & get to lead the dynamics of engaging with the public and get a fvck off pension to boot,2020-05-30 18:28:28+00:00,,,1266798649075351553,,https://twitter.com/p3t3rmcd/status/1266798649075351553,1,1,Scf65Forbes,
some people may also have used as part of a routine also. but i get what you’re saying being in isolation with no support and with the massive changes and sudden onset - not good.,2020-05-30 11:28:55+00:00,,,1266693063868645376,,https://twitter.com/p3t3rmcd/status/1266693063868645376,1,0,McBuddah,
"'hold my blunt, i'm taking the pizza with me'.",2020-05-30 01:15:57+00:00,,,1266538806410444807,,https://twitter.com/p3t3rmcd/status/1266538806410444807,0,0,scarlettrabe,
it’s not incompetence- public health in u.k. is corrupt.,2020-05-29 22:26:02+00:00,,,1266496044449386499,,https://twitter.com/p3t3rmcd/status/1266496044449386499,0,0,carolecadwalla,
it’s more about what he can offer the murdochs.,2020-05-29 22:07:49+00:00,,,1266491461106905097,,https://twitter.com/p3t3rmcd/status/1266491461106905097,0,0,AnnJohn30914404,
.. the first officers on scene escalated the situation instead of trying to defuse it..,2020-05-29 14:14:57+00:00,,,1266372460556857345,,https://twitter.com/p3t3rmcd/status/1266372460556857345,0,0,,https://www.bbc.co.uk/news/uk-scotland-46591551
mucka !,2020-05-29 13:53:54+00:00,,,1266367165357146112,,https://twitter.com/p3t3rmcd/status/1266367165357146112,0,0,realDonaldTrump,
it's not just racial profiling. police engage differently (not all) with people they suspect of being of lower socio economic status. especially younger ones. i've seen a guy burst into tears after being stabbed because the cop was talking to him like he was a piece of shit.,2020-05-29 13:03:55+00:00,,,1266354585846849536,,https://twitter.com/p3t3rmcd/status/1266354585846849536,1,1,ysbryd1,
cue the flying monkeys. the ig fans coming through any minute.,2020-05-29 12:54:16+00:00,,,1266352156950638593,,https://twitter.com/p3t3rmcd/status/1266352156950638593,0,1,niamhrelease,
do they have a track and trace ape.,2020-05-29 12:44:57+00:00,,,1266349810833068034,,https://twitter.com/p3t3rmcd/status/1266349810833068034,0,0,caitlinmoran,
they are immersed in our day to day life. as salient as salt in the sea.,2020-05-29 12:02:39+00:00,,,1266339168252317697,,https://twitter.com/p3t3rmcd/status/1266339168252317697,0,0,chrismcg21,
"if icantbreathe doesn't work shout ""i take seizures"" if you are able to.",2020-05-29 11:56:19+00:00,,#Icantbreathe,1266337572462231553,,https://twitter.com/p3t3rmcd/status/1266337572462231553,0,0,,
it's the supply teachers.,2020-05-29 11:24:53+00:00,,,1266329662298480646,,https://twitter.com/p3t3rmcd/status/1266329662298480646,0,0,JohnDivney,
insurance industry run the show.,2020-05-29 10:36:45+00:00,,,1266317548670398464,,https://twitter.com/p3t3rmcd/status/1266317548670398464,0,0,hilaryprice777,
i do regularly. thanks for the advice. snp are not the independence movement.,2020-05-29 10:02:42+00:00,,,1266308981489836034,,https://twitter.com/p3t3rmcd/status/1266308981489836034,0,0,dawncam2_dawn,
what a fud.,2020-05-29 00:45:15+00:00,,,1266168693689667584,,https://twitter.com/p3t3rmcd/status/1266168693689667584,0,0,anisalrh,
too many bleating cheyne stoking cvnts out there innit?,2020-05-29 00:40:26+00:00,,,1266167482806665217,,https://twitter.com/p3t3rmcd/status/1266167482806665217,0,0,Paul_Robinson01,
"maybe serco will save the day, country, world and humanity?",2020-05-29 00:37:03+00:00,,,1266166630054350849,,https://twitter.com/p3t3rmcd/status/1266166630054350849,2,0,Channel4News,
absolutely and we need to be looking at fast track.,2020-05-29 00:30:41+00:00,,,1266165026013970437,,https://twitter.com/p3t3rmcd/status/1266165026013970437,1,0,dawncam2_dawn,
"i know you and nicola are probably chat buddies. could you ask her to just take over all public health policy, including substance use. westminster has no mandate.",2020-05-29 00:08:46+00:00,,,1266159511703818240,,https://twitter.com/p3t3rmcd/status/1266159511703818240,0,0,LeanneWood,
i hope a person living in scotland finds a vaccine for covid19 and the international community backs a unilateral declaration of independence. proclaimers get to do the soundtrack.,2020-05-29 00:05:33+00:00,,,1266158700881948679,,https://twitter.com/p3t3rmcd/status/1266158700881948679,0,0,,
many things are not right up here and for me it’s mostly public health related. it’s ironic that i can’t really criticise the scottish government on their guidelines regarding corona. now let’s gtf away fae westminster & run our own public health services - substance use esp,2020-05-28 23:34:16+00:00,,,1266150831889551360,,https://twitter.com/p3t3rmcd/status/1266150831889551360,0,0,ChrisDuzTweets,
seeeeriously. better together though !,2020-05-28 22:11:31+00:00,,,1266130005677019138,,https://twitter.com/p3t3rmcd/status/1266130005677019138,1,2,Swanswan0307,https://twitter.com/Swanswan0307/status/1266024908599017472
i decarb the fucker then inject it into my arse muscle. it lasts 14 days micro dose. no it diznae stop talking shite.,2020-05-28 21:06:46+00:00,,,1266113711879708675,,https://twitter.com/p3t3rmcd/status/1266113711879708675,0,0,gettingtoohigh,
labour should support scottish independence.,2020-05-28 20:43:56+00:00,,,1266107966308171776,,https://twitter.com/p3t3rmcd/status/1266107966308171776,0,0,Keir_Starmer,
getscotlandout i don’t give a fvck about cummings.,2020-05-28 20:38:07+00:00,,#getscotlandout,1266106500130451458,,https://twitter.com/p3t3rmcd/status/1266106500130451458,0,0,,
cummings will eventually go and tories will prob lose 20 seats in just under 5 yrs. scottish labour voters will brush themselves down and fight to keep the union intact despite the fact that it’s a dead duck. this could go on for decades yet. cake stalls and platitudes.,2020-05-28 20:30:29+00:00,,,1266104580741509120,,https://twitter.com/p3t3rmcd/status/1266104580741509120,0,0,PeterStefanovi2,
 flying,2020-05-28 20:23:00+00:00,,,1266102696651763712,,https://twitter.com/p3t3rmcd/status/1266102696651763712,0,0,VinzClortho_,
thanks but what i don’t get is. why does the cop with the worst practices often get to take the lead unchallenged by their colleagues?,2020-05-28 20:21:52+00:00,,,1266102412949032961,,https://twitter.com/p3t3rmcd/status/1266102412949032961,1,0,ChiefDavidRoddy,
"are there enough people with legal knowledge, clout and integrity to begin seriously investigating options under international law the process of unilateral declaration of independence for scotland? ",2020-05-28 20:12:18+00:00,,,1266100003208138756,,https://twitter.com/p3t3rmcd/status/1266100003208138756,0,0,,
waters gilmour and mason see if there’s any chance of them doing something together socially distant and aloof.,2020-05-28 18:06:47+00:00,,,1266068417653719040,,https://twitter.com/p3t3rmcd/status/1266068417653719040,0,0,bbcglasto,
her last glastonbury performance wasn’t very good. what a talented artist she was though.,2020-05-28 18:02:50+00:00,,,1266067421347135490,,https://twitter.com/p3t3rmcd/status/1266067421347135490,1,0,glenw1411,
announce shved.,2020-05-28 17:58:55+00:00,,,1266066435085869056,,https://twitter.com/p3t3rmcd/status/1266066435085869056,0,0,bbcglasto,
power is only what we give away of our own. unfortunately u.k has many donors.,2020-05-28 17:34:40+00:00,,,1266060335301214209,,https://twitter.com/p3t3rmcd/status/1266060335301214209,0,0,CormacRussell,
is it better to live in a world where things are addressed with cake stall set ups and sponsored walks with post it note days on the wall ? or is it better being a bit cynical now and calling the sh1t out for what it is. how long can it go on ?,2020-05-28 17:24:43+00:00,,,1266057830802522114,,https://twitter.com/p3t3rmcd/status/1266057830802522114,0,0,,
"we can be different but only with a different political system. first past the post is not the way forward for scotland. hopefully this will resonate more, otherwise we’ll be eternally franchised into having unelected dodgy bastards like cummings acting as quasi monarchs.",2020-05-28 16:16:33+00:00,,,1266040673918242817,,https://twitter.com/p3t3rmcd/status/1266040673918242817,0,0,hamilton_viv,
who’s running it in scotland?,2020-05-28 15:32:11+00:00,,,1266029508668375041,,https://twitter.com/p3t3rmcd/status/1266029508668375041,1,0,glasgowswestend,
public health is outsourced & the public are not being covered with the best public health care. it’s been a shambles for quite a few yrs but only getting noticed now because the virus has exposed the inequality in this country. covid19 has done quite a lot of damage too.,2020-05-28 15:30:31+00:00,,,1266029088512278529,,https://twitter.com/p3t3rmcd/status/1266029088512278529,0,0,Peston,
try and always have pre made snacks at the ready if you’re going out of your normal routine.,2020-05-28 13:00:18+00:00,,,1265991288559730691,,https://twitter.com/p3t3rmcd/status/1265991288559730691,0,1,,
of course he is. public health is full of lies and money for scoundrels.,2020-05-28 11:48:18+00:00,,,1265973168956735490,,https://twitter.com/p3t3rmcd/status/1265973168956735490,0,0,Rozkez67,
flying monkeys ,2020-05-27 16:18:56+00:00,,,1265678886626643969,,https://twitter.com/p3t3rmcd/status/1265678886626643969,0,0,welham_philip,
"been there, had to shout that i take seizures before they let me breathe again. with just enough force applied to the head with a boot afterwards to feel the sting. i’m over it but many don’t get that opportunity.",2020-05-27 14:31:06+00:00,,,1265651748468936704,,https://twitter.com/p3t3rmcd/status/1265651748468936704,1,0,welham_philip,
backing corbyn would have been the simplest and most ethical. or at least calling out the bullshit against him.,2020-05-27 14:18:43+00:00,,,1265648633661272064,,https://twitter.com/p3t3rmcd/status/1265648633661272064,0,0,jessphillips,
i can see the tories losing 20 seats next election. cummings king of scotland ,2020-05-25 19:54:50+00:00,,,1265008445931077635,,https://twitter.com/p3t3rmcd/status/1265008445931077635,0,0,,
who the fvck jumps in a car when they start vomiting ? before phoning the nhs ? serioulsy who ?????,2020-05-25 18:58:20+00:00,,,1264994225826955264,,https://twitter.com/p3t3rmcd/status/1264994225826955264,0,0,MattHancock,
wife is sick during a pandemic but didn't appear to phone nhs help line ? just jumps in a car to durham ? there would be a record of a call and it would be in public interest to confirm if call was made to nhs.,2020-05-25 17:45:20+00:00,,,1264975856079962112,,https://twitter.com/p3t3rmcd/status/1264975856079962112,0,0,DominicRaab,
every day’s a fvcking surprise.,2020-05-25 14:35:33+00:00,,,1264928094709825536,,https://twitter.com/p3t3rmcd/status/1264928094709825536,0,0,ABridgen,
don’t worry i’m sure their maj will be cut to 60 next election ,2020-05-25 13:19:39+00:00,,,1264908992935051265,,https://twitter.com/p3t3rmcd/status/1264908992935051265,0,0,Freedland,
jeez that’s quite bad isn’t it?,2020-05-25 13:18:14+00:00,,,1264908634770857985,,https://twitter.com/p3t3rmcd/status/1264908634770857985,0,1,Freedland,https://twitter.com/Freedland/status/1264895458373242880
this isn’t north korea - a phrase often heard. so who the fvck elected cummings to run scotland ,2020-05-25 13:16:40+00:00,,,1264908244075626498,,https://twitter.com/p3t3rmcd/status/1264908244075626498,0,0,,
polemics,2020-05-25 13:14:03+00:00,,,1264907582965194756,,https://twitter.com/p3t3rmcd/status/1264907582965194756,0,0,nothingtoseekk,
if cummings was fined £60 everything would have been ok. innit togetherness ,2020-05-25 13:09:17+00:00,,,1264906383754919936,,https://twitter.com/p3t3rmcd/status/1264906383754919936,0,0,JolyonMaugham,
getting a bit annoyed with the on the individual philosophy. some cunts need to be fvcking told in no uncertain terms. when it comes to public health there must be state leadership.,2020-05-25 13:06:07+00:00,,,1264905586459791361,,https://twitter.com/p3t3rmcd/status/1264905586459791361,0,0,nothingtoseekk,
never knew george was a jock.,2020-05-25 06:37:17+00:00,,,1264807735142559755,,https://twitter.com/p3t3rmcd/status/1264807735142559755,0,0,GeorgeMonbiot,https://twitter.com/GeorgeMonbiot/status/1264792236966973441
cummings is king of scotland ,2020-05-25 05:54:33+00:00,,,1264796978313080834,,https://twitter.com/p3t3rmcd/status/1264796978313080834,0,0,georgegalloway,
would that make him a refrigerator grandfather ?,2020-05-24 22:23:41+00:00,,,1264683514370424834,,https://twitter.com/p3t3rmcd/status/1264683514370424834,0,0,missbarton,
i doubt if they even did their own course work.,2020-05-23 11:59:49+00:00,,,1264164127464972290,,https://twitter.com/p3t3rmcd/status/1264164127464972290,0,0,markoftheD,
sickeningly puzzled,2020-05-22 17:42:25+00:00,,,1263887955166363649,,https://twitter.com/p3t3rmcd/status/1263887955166363649,0,0,mhdksafa,
sometimes running into a shop with lots of fridges can help to gauge the social distances- take a photo. tell the other customers to fvck off and stay safe. buy a mask and fridge magnets are also cool for mnemonics. never open an outside fridge door - you never know what’s inside,2020-05-22 17:04:33+00:00,,,1263878429570711554,,https://twitter.com/p3t3rmcd/status/1263878429570711554,0,0,Scientits,
,2020-05-22 14:24:56+00:00,,,1263838258036867080,,https://twitter.com/p3t3rmcd/status/1263838258036867080,0,0,JohnDivney,https://www.youtube.com/watch?v=zz9bn24rxrI
https://www.youtube.com/watch?v=zz9bn24rxri,2020-05-22 14:23:56+00:00,,,1263838006919794690,,https://twitter.com/p3t3rmcd/status/1263838006919794690,0,0,,https://www.youtube.com/watch?v=zz9bn24rxrI
,2020-05-22 14:19:48+00:00,,,1263836966006775816,,https://twitter.com/p3t3rmcd/status/1263836966006775816,1,0,JohnDivney,https://www.youtube.com/watch?v=Deb-LFMu9so
really miss working the lines. i was good at it and worked with some good people too.,2020-05-22 13:37:34+00:00,,,1263826338902937600,,https://twitter.com/p3t3rmcd/status/1263826338902937600,0,0,DavidPaisley,
source  a new york housing first programme: retention in methadone maintenance treatment and housing years later https://findings.org.uk/php/dl.php?file=appel_pw_4.txt&amp;s=eb&amp;sf=tw,2020-05-22 13:13:10+00:00,,,1263820199125331968,@DrugAlcFindings,https://twitter.com/p3t3rmcd/status/1263820199125331968,0,0,,https://findings.org.uk/PHP/dl.php?file=Appel_PW_4.txt&s=eb&sf=tw
social distance gig,2020-05-22 12:54:59+00:00,,,1263815619960586240,,https://twitter.com/p3t3rmcd/status/1263815619960586240,0,0,,https://www.youtube.com/watch?v=y-E7_VHLvkE
"all things considered - it’s fairly quiet for a belter of a day. i support ‘lockdown’ but all i can do is follow the advice. as long as enough people are following the advice, then we should be in with a shout. stay safe, unprecedented times.",2020-05-21 12:28:24+00:00,,,1263446543962705920,,https://twitter.com/p3t3rmcd/status/1263446543962705920,0,0,STVNews,
there will be ‘more’ blood. the blood of the innocents is easily sourced and bountiful in a land of machiavellian smiling handshaking butchers.,2020-05-21 12:13:50+00:00,,,1263442878375890944,,https://twitter.com/p3t3rmcd/status/1263442878375890944,0,0,trevken,
aye - aren’t we all right now ?,2020-05-21 12:05:58+00:00,,,1263440899419385857,,https://twitter.com/p3t3rmcd/status/1263440899419385857,1,0,trevken,
"sweden is a baffling country. sound egalitarian values but when it comes to looking after vulnerabilities in society, there’s a blind spot. they have a complicated history with eugenics.",2020-05-21 12:02:03+00:00,,,1263439914248687616,,https://twitter.com/p3t3rmcd/status/1263439914248687616,0,0,mrjamesob,https://twitter.com/mrjamesob/status/1263371939420176385
csa were supposed to world leaders in track and trace too.,2020-05-20 22:04:29+00:00,,,1263229132294496256,,https://twitter.com/p3t3rmcd/status/1263229132294496256,0,0,Blazespage,
