text,date,geo,hashtags,tweet_id,mentions,permalink,replies,retweets,replies_to,mentioned_urls
thank fvck for modern studies- it should be compulsory.,2020-06-28 19:22:32+00:00,,,1277321503713959944,,https://twitter.com/p3t3rmcd/status/1277321503713959944,0,0,,
87.1 percent white british from 2011 census.,2020-06-28 19:20:34+00:00,,,1277321009591443456,,https://twitter.com/p3t3rmcd/status/1277321009591443456,1,0,Dan_1884,
how can almost a quarter be proportional ,2020-06-28 19:13:00+00:00,,,1277319103074783234,,https://twitter.com/p3t3rmcd/status/1277319103074783234,1,0,Dan_1884,
it’s not going to happen in westminster any time soon though paul. now we have cummings and iain duncan smith and co running the show. i wish mark thomas would do a presentation on the career of these 2. i tend to start crying when trying to explain it.,2020-06-28 19:11:25+00:00,,,1277318706180349952,,https://twitter.com/p3t3rmcd/status/1277318706180349952,0,0,PaulJSweeney,
we’re unserved by first past the post electoral system and westminster.,2020-06-28 19:02:19+00:00,,,1277316414265835522,,https://twitter.com/p3t3rmcd/status/1277316414265835522,1,0,PaulJSweeney,
sounds dead calvinist that does - ‘sunday drinkers’,2020-06-28 18:58:09+00:00,,,1277315367992524800,,https://twitter.com/p3t3rmcd/status/1277315367992524800,0,0,Phoebejoy1611,
that’s still not acceptable. no one should feel scared to state what they have taken. there is also a programme in place to get people assessed and given naloxone on release/ glasgow and tayside appear to have been pretty poor at this. i’ll try and find the stats later.,2020-06-28 18:55:47+00:00,,#naloxone,1277314771902246912,,https://twitter.com/p3t3rmcd/status/1277314771902246912,2,0,FUBSatBIRTH,
20 people a year is high.,2020-06-28 18:52:30+00:00,,,1277313944147955715,,https://twitter.com/p3t3rmcd/status/1277313944147955715,0,0,Adam_cocker1986,
that’s a high percentage though.,2020-06-28 18:51:54+00:00,,,1277313795459878912,,https://twitter.com/p3t3rmcd/status/1277313795459878912,1,0,Dan_1884,
is the glasgow effect down to bad feng shui ?,2020-06-28 18:49:01+00:00,,#Glasgow,1277313069383892993,,https://twitter.com/p3t3rmcd/status/1277313069383892993,0,0,,
love is love and is a rare find. age happens regardless.,2020-06-28 18:45:26+00:00,,,1277312164940976128,,https://twitter.com/p3t3rmcd/status/1277312164940976128,0,0,SoniaRiv71,
he makes truth funny. i try that and end up having a melt down. ,2020-06-28 18:42:21+00:00,,,1277311389749649409,,https://twitter.com/p3t3rmcd/status/1277311389749649409,0,0,zei_squirrel,
not sure how limited her cognitive fine/gross motor skills are.,2020-06-28 18:21:11+00:00,,,1277306063939948549,,https://twitter.com/p3t3rmcd/status/1277306063939948549,0,0,NotYourLilWh0r,
 ,2020-06-28 18:16:25+00:00,,,1277304862875750401,,https://twitter.com/p3t3rmcd/status/1277304862875750401,0,0,knit28,
only recently realised he does wee kisses during kiss.,2020-06-28 18:14:46+00:00,,,1277304451129315328,,https://twitter.com/p3t3rmcd/status/1277304451129315328,0,0,DaftLimmy,
,2020-06-28 18:11:18+00:00,,,1277303578420543489,,https://twitter.com/p3t3rmcd/status/1277303578420543489,0,0,Rubberbandits,https://youtu.be/H6EZkIaJcCI
are buds getting sprayed ?,2020-06-28 18:00:09+00:00,,,1277300769675513857,,https://twitter.com/p3t3rmcd/status/1277300769675513857,1,0,InvisibleJim1,
you coming across any cbd buds sprayed with synthetic thc ? i’m guessing it wouldn’t be profitable but just curious.,2020-06-28 17:54:14+00:00,,,1277299283121844225,,https://twitter.com/p3t3rmcd/status/1277299283121844225,1,0,sutcliffeob,
it’s a good point.,2020-06-28 17:51:29+00:00,,,1277298589925101575,,https://twitter.com/p3t3rmcd/status/1277298589925101575,0,0,HANNAHSTORM6,
"i’m ignoring it, difficult though but just keeping my own side of the street clear.",2020-06-28 17:49:52+00:00,,,1277298184201609216,,https://twitter.com/p3t3rmcd/status/1277298184201609216,0,0,HANNAHSTORM6,
she’s waiting on the ice cream van and it’s running late ?,2020-06-28 17:35:32+00:00,,,1277294573858013184,,https://twitter.com/p3t3rmcd/status/1277294573858013184,1,0,NotYourLilWh0r,
ice cream van late again ?,2020-06-28 17:34:44+00:00,,,1277294374725058562,,https://twitter.com/p3t3rmcd/status/1277294374725058562,0,0,conspiracylife,
over the counter (not all) yes but prescribed no.,2020-06-28 17:21:26+00:00,,,1277291026588348419,,https://twitter.com/p3t3rmcd/status/1277291026588348419,0,0,davidthekick,
it all makes perfect sense expressed in dollars and cents pounds shillings and pence can’t you see it all makes perfect sense ? roger waters,2020-06-28 17:07:50+00:00,,,1277287606452211713,,https://twitter.com/p3t3rmcd/status/1277287606452211713,0,0,SteveTransform,
"going into a bubble learning about the universe, wildlife film and music. spanish and improve my dutch. fvck this sh1t",2020-06-28 17:03:56+00:00,,,1277286624435613697,,https://twitter.com/p3t3rmcd/status/1277286624435613697,0,0,JohnHirst7,
amazing post brexit opportunity for selling the u.s toast ?,2020-06-28 14:22:24+00:00,,,1277245971072790531,,https://twitter.com/p3t3rmcd/status/1277245971072790531,0,0,DaftLimmy,
like semolina ?,2020-06-28 00:35:22+00:00,,,1277037842926051333,,https://twitter.com/p3t3rmcd/status/1277037842926051333,0,0,TheNewImpostor,
i can't go for any sun article.,2020-06-27 20:52:22+00:00,,,1276981723226689536,,https://twitter.com/p3t3rmcd/status/1276981723226689536,0,0,Scf65Forbes,
2017 i had hopes for him to be a progressive successor to jeremy corbyn. i had no idea he was such a puppet.,2020-06-27 20:50:56+00:00,,,1276981362411569153,,https://twitter.com/p3t3rmcd/status/1276981362411569153,1,2,zei_squirrel,
i'm not clicking that. obviously don't trust their numbers without original sources.,2020-06-27 20:47:01+00:00,,,1276980376926388229,,https://twitter.com/p3t3rmcd/status/1276980376926388229,0,0,Scf65Forbes,
is there a source for this ?,2020-06-27 20:43:25+00:00,,,1276979470403080192,,https://twitter.com/p3t3rmcd/status/1276979470403080192,2,0,Scf65Forbes,
thanks for that fantastic discovery.,2020-06-27 19:28:58+00:00,,,1276960733872480257,,https://twitter.com/p3t3rmcd/status/1276960733872480257,0,0,ks_1968,
loved this programme and strangers too. it took a bit of getting used to after the sweeney and professionals but really nicely paced stories with top acting.,2020-06-27 19:21:42+00:00,,,1276958905684369409,,https://twitter.com/p3t3rmcd/status/1276958905684369409,2,0,FloellaBenjamin,
could see it coming - no joy in it none what so ever. it's a shite way to live - seeing this stuff coming a mile off ! bad for mental health,2020-06-27 19:17:29+00:00,,,1276957844525518854,,https://twitter.com/p3t3rmcd/status/1276957844525518854,0,0,LuckyHeronSay,
finally we can reverse the polarity of the neutron flow,2020-06-27 18:48:35+00:00,,,1276950570289463298,,https://twitter.com/p3t3rmcd/status/1276950570289463298,0,0,disclosetv,
keep guarding those statues ,2020-06-27 18:21:23+00:00,,,1276943727328714755,,https://twitter.com/p3t3rmcd/status/1276943727328714755,0,0,AllanGPaterson,https://twitter.com/AllanGPaterson/status/1276923354868600833
helemaal niet normal needs to get away pronto ! al gauw weg wezen,2020-06-27 18:17:23+00:00,,,1276942719848308736,,https://twitter.com/p3t3rmcd/status/1276942719848308736,0,0,Firesnakious,
scrub pot ?,2020-06-27 18:07:23+00:00,,,1276940204528611328,,https://twitter.com/p3t3rmcd/status/1276940204528611328,0,0,UKCIA,
the government love using 'statue tory instruments',2020-06-27 18:04:33+00:00,,,1276939488149856257,,https://twitter.com/p3t3rmcd/status/1276939488149856257,0,0,jamesdoleman,https://twitter.com/jamesdoleman/status/1276891559238283264
you don't know the first thing about the context. you've jumped on a bandwagon for a cheap laugh. this was a fvcking tragedy.,2020-06-27 17:55:00+00:00,,,1276937088634675202,,https://twitter.com/p3t3rmcd/status/1276937088634675202,0,0,Holbornlolz,
,2020-06-27 17:17:01+00:00,,,1276927528020652034,,https://twitter.com/p3t3rmcd/status/1276927528020652034,0,0,,https://www.youtube.com/watch?v=Vr8TZWwPs4g
the hindshite effect. ,2020-06-27 16:07:48+00:00,,,1276910107155144704,,https://twitter.com/p3t3rmcd/status/1276910107155144704,0,0,SubvertC,
shelter usually do second hand items. is this safe ? ,2020-06-27 15:55:18+00:00,,,1276906963545346051,,https://twitter.com/p3t3rmcd/status/1276906963545346051,0,0,NicolaSturgeon,
was a bit long but a few good tunes.,2020-06-27 15:45:11+00:00,,,1276904418118639617,,https://twitter.com/p3t3rmcd/status/1276904418118639617,1,0,theshad4,
senser were good.,2020-06-27 15:40:08+00:00,,,1276903147135516675,,https://twitter.com/p3t3rmcd/status/1276903147135516675,3,0,SubvertC,
has more potential. much more !,2020-06-27 15:37:24+00:00,,,1276902459236114432,,https://twitter.com/p3t3rmcd/status/1276902459236114432,0,0,IanLaveryMP,
it’s going to move in doors as the weather deteriorates. little clusters of alcohol fuelled vector portals everywhere.,2020-06-27 15:21:14+00:00,,,1276898390111117313,,https://twitter.com/p3t3rmcd/status/1276898390111117313,0,0,afterprohibends,
"anyone got a mate that nips your head about a subject you’re already in agreement but they keep going on about the same stuff. then when you try and have a discussion with someone else who might not be of the same opinion, the same mate just sits there and says fvck all ?",2020-06-27 15:15:42+00:00,,,1276896999196033025,,https://twitter.com/p3t3rmcd/status/1276896999196033025,0,0,,
"i saw that because of similar production processes to other substances, it’s a no brainier if you’re already in production.",2020-06-27 15:11:22+00:00,,,1276895907108327425,,https://twitter.com/p3t3rmcd/status/1276895907108327425,0,0,DIMSinfo,
naw - give cummings a chance ffs he’s only been in charge for 6 months.,2020-06-27 15:09:26+00:00,,,1276895419554041857,,https://twitter.com/p3t3rmcd/status/1276895419554041857,0,0,80_mcswan,
still quite a niche market in netherlands ?,2020-06-27 15:04:26+00:00,,,1276894162072285184,,https://twitter.com/p3t3rmcd/status/1276894162072285184,1,0,DIMSinfo,
did you know iain duncan smith has had more influence in u.k. policy direction than any tory leader since thatcher. his achievements should be curated and recorded with a narrative along with the effects.,2020-06-27 14:53:22+00:00,,,1276891376903507969,,https://twitter.com/p3t3rmcd/status/1276891376903507969,0,0,,
ian duncan smith too. might not be too smart but he makes up for it with motivation. universal credit benefit sanction increases constant assessments conditionality just to eat brexit drug service cuts 1 meter distancing helped get boris elected as leader tax credit cuts,2020-06-27 14:47:43+00:00,,,1276889956577882115,,https://twitter.com/p3t3rmcd/status/1276889956577882115,0,0,DalbidEU,
sound of the sirens christy moore.,2020-06-27 14:26:48+00:00,,,1276884691552010240,,https://twitter.com/p3t3rmcd/status/1276884691552010240,0,0,AnneEstellaRock,
 ,2020-06-27 13:47:10+00:00,,,1276874717274746882,,https://twitter.com/p3t3rmcd/status/1276874717274746882,1,0,Neo10116,
,2020-06-27 13:35:44+00:00,,,1276871842049949696,@NaloxoneMan,https://twitter.com/p3t3rmcd/status/1276871842049949696,0,0,frec4medic,
every substance use service should be able to provide training and take home. there are also peer naloxone trainers springing up in uk you should be able to find a service here. https://www.changegrowlive.org/local-support/find-a-service,2020-06-27 13:32:15+00:00,,,1276870964047945728,,https://twitter.com/p3t3rmcd/status/1276870964047945728,0,0,frec4medic,https://www.changegrowlive.org/local-support/find-a-service
monographs ,2020-06-27 13:05:12+00:00,,,1276864156239609862,,https://twitter.com/p3t3rmcd/status/1276864156239609862,0,0,p3t3rmcd,
i wish they ‘signposted’ us to monograms - they can be really used for consolidating and critique. i ended up down rabbit holes. but it’s a lifetime of learning ,2020-06-27 13:04:25+00:00,,,1276863957219905536,,https://twitter.com/p3t3rmcd/status/1276863957219905536,3,0,AlisonHoneybone,
i got a comet and day zero. next one will prob be a battery one when the knees go.,2020-06-27 12:51:38+00:00,,,1276860741488959491,,https://twitter.com/p3t3rmcd/status/1276860741488959491,0,0,JohnHirst7,
totally agree. they are built to last and very good quality for the budget. commuter bikes are so comfortable too.,2020-06-27 12:42:39+00:00,,,1276858479945318402,,https://twitter.com/p3t3rmcd/status/1276858479945318402,1,0,JohnHirst7,
are you going for an assessment ?,2020-06-27 12:31:52+00:00,,,1276855765790265345,,https://twitter.com/p3t3rmcd/status/1276855765790265345,1,0,Neo10116,
flagwanker flegwanker,2020-06-27 12:19:07+00:00,,#flagwanker #flegwanker,1276852557822992393,,https://twitter.com/p3t3rmcd/status/1276852557822992393,0,0,Scientits,
check out and spread the word of wedinos https://www.wedinos.org/db/samples/,2020-06-27 12:15:48+00:00,,,1276851724993671174,,https://twitter.com/p3t3rmcd/status/1276851724993671174,1,1,Neo10116,https://www.wedinos.org/db/samples/
if people aren’t being diagnosed with autism early enough - what is being treated ?,2020-06-27 12:14:06+00:00,,,1276851296746770433,,https://twitter.com/p3t3rmcd/status/1276851296746770433,1,0,Neo10116,https://twitter.com/Neo10116/status/1276848542800392196
skull deep in bawduggery.,2020-06-27 12:10:52+00:00,,,1276850484830142464,,https://twitter.com/p3t3rmcd/status/1276850484830142464,0,0,MichaelRosenYes,
have you completed your first module in the pg ? i struggled to put it altogether.,2020-06-27 12:07:47+00:00,,,1276849707667644416,,https://twitter.com/p3t3rmcd/status/1276849707667644416,1,0,AlisonHoneybone,
the attitude eh ? the attitude unbelievable innit ? anyway susan powell’s doing the weather - i think she’s brilliant ! she sounds pissed off when doing the shipping forecast at times but in her element doing brief weather reports.,2020-06-27 12:00:03+00:00,,,1276847762659774469,,https://twitter.com/p3t3rmcd/status/1276847762659774469,0,0,SPimpernel1,
pack lunches to take out in the morning? some places offer this as part of service.,2020-06-27 11:25:26+00:00,,,1276839048963919872,,https://twitter.com/p3t3rmcd/status/1276839048963919872,1,0,SPimpernel1,
maybe everyone’s going a bit off beam just now? it’s been the best part of 5 months of mayhem. having said that - tell them to go and ...... ,2020-06-27 04:43:46+00:00,,,1276737965176348674,,https://twitter.com/p3t3rmcd/status/1276737965176348674,0,0,j3nnylynnn,
 ,2020-06-27 04:29:02+00:00,,,1276734260121042944,,https://twitter.com/p3t3rmcd/status/1276734260121042944,1,0,ATInfluencer,
good luck with what ever the fvck it is your on about. i sincerely wish you all the best.,2020-06-27 04:19:41+00:00,,,1276731906172825600,,https://twitter.com/p3t3rmcd/status/1276731906172825600,1,0,ATInfluencer,
your blowing me away here - please stop ,2020-06-27 04:14:22+00:00,,,1276730567707500544,,https://twitter.com/p3t3rmcd/status/1276730567707500544,1,0,ATInfluencer,
,2020-06-27 04:12:35+00:00,,,1276730120477331456,,https://twitter.com/p3t3rmcd/status/1276730120477331456,1,0,ATInfluencer,
"it’s going to be fine m8 take a puff , stick some music on and chill the fvck out.",2020-06-27 02:50:17+00:00,,,1276709408832139265,,https://twitter.com/p3t3rmcd/status/1276709408832139265,0,0,BBCandrewkerr,
you need policing of some sort. it’s a vocation or at least should be. differences aside on the realities of what it entails and what goes on in practice. we need some form of policing service by and for the people.,2020-06-27 02:38:09+00:00,,,1276706352514183168,,https://twitter.com/p3t3rmcd/status/1276706352514183168,1,0,ATInfluencer,
wrong feed mate. just this once - hopefully ,2020-06-27 02:33:18+00:00,,,1276705132835733504,,https://twitter.com/p3t3rmcd/status/1276705132835733504,1,0,ATInfluencer,
things have moved on google maps ,2020-06-27 01:53:22+00:00,,,1276695085745348616,,https://twitter.com/p3t3rmcd/status/1276695085745348616,0,0,Neo10116,
glasgow pubs are pretty friendly to be honest. most likely to be full of people from everywhere. of course there’s problems with violence and alcohol but pubs are pretty safe. it’s the transitions between pubs/nightclubs/taxi/kebab shops etc.,2020-06-27 01:46:49+00:00,,,1276693434464641028,,https://twitter.com/p3t3rmcd/status/1276693434464641028,1,0,Neo10116,
no matter how mixed up feelings are about police- i think the vast majority respect that they can be expected to perform selfless acts to keep people safe. this gets forgotten sometimes. but most do respect the role of a police officer in this context.,2020-06-27 01:22:42+00:00,,,1276687365839425537,,https://twitter.com/p3t3rmcd/status/1276687365839425537,0,0,MichelleDewbs,
don’t fvcking start - yir scarin the weans now.,2020-06-27 01:09:23+00:00,,,1276684013743341573,,https://twitter.com/p3t3rmcd/status/1276684013743341573,0,0,IBM_UK_news,
 ,2020-06-27 01:07:23+00:00,,,1276683510724640770,,https://twitter.com/p3t3rmcd/status/1276683510724640770,0,0,ayealright,
2020 wasps.,2020-06-27 00:58:01+00:00,,,1276681152905056256,,https://twitter.com/p3t3rmcd/status/1276681152905056256,0,0,MerielMyers,
good celtic rangers man,2020-06-27 00:49:03+00:00,,,1276678899339059200,,https://twitter.com/p3t3rmcd/status/1276678899339059200,0,0,rubot,
add a trinity to the power of ten including pentecostal and ....... no fvcking way. too many.,2020-06-27 00:44:43+00:00,,,1276677807297396737,,https://twitter.com/p3t3rmcd/status/1276677807297396737,0,0,alfaguru,
maybe because english was their most competent language? did every plane/train/boat/lorry/car/bustop off at a different country and offer a drop off service ?,2020-06-27 00:41:44+00:00,,,1276677055070056448,,https://twitter.com/p3t3rmcd/status/1276677055070056448,0,0,frantruth,
out the back door with the speedos getting dive bombed by seagulls fvck aye ! https://vasatrainer.com/,2020-06-27 00:28:29+00:00,,,1276673721420468224,,https://twitter.com/p3t3rmcd/status/1276673721420468224,0,0,,https://vasatrainer.com/
get everyone of shite benzos and the option of some bespoke clinical grade weed/hash/shatter/oil/edibles/ coffee and table games.,2020-06-27 00:13:21+00:00,,,1276669914280058881,,https://twitter.com/p3t3rmcd/status/1276669914280058881,0,0,C4MC_UK,
sorry you feel this way but don’t you agree that it’s fvcking interesting being alive right now if nothing else ?,2020-06-27 00:07:14+00:00,,,1276668372927856641,,https://twitter.com/p3t3rmcd/status/1276668372927856641,0,0,LostlnSauce,
nice shade of red ,2020-06-26 23:49:10+00:00,,,1276663827862618113,,https://twitter.com/p3t3rmcd/status/1276663827862618113,0,0,johnefc83,
fandabytory,2020-06-26 23:41:52+00:00,,,1276661990048571392,,https://twitter.com/p3t3rmcd/status/1276661990048571392,1,0,atforsyth,
donald findlay was a skilled barrister but still a ‘pr1ck’ allegedly.,2020-06-26 23:30:19+00:00,,,1276659083546963968,,https://twitter.com/p3t3rmcd/status/1276659083546963968,0,0,jacmcquade2,
keir * see that i before e rule. ,2020-06-26 23:27:39+00:00,,,1276658414249283585,,https://twitter.com/p3t3rmcd/status/1276658414249283585,0,0,p3t3rmcd,
back in 2017 such high hopes for kier being a good successor to jeremy c i think it was the name tbh more than anything.,2020-06-26 23:25:37+00:00,,,1276657900816080901,,https://twitter.com/p3t3rmcd/status/1276657900816080901,1,0,jazzblogz,
now here’s tom with the weather.,2020-06-26 22:55:17+00:00,,,1276650266562121730,,https://twitter.com/p3t3rmcd/status/1276650266562121730,0,0,CarlitoVonMises,
my uncle says you spat on the platform floor in 1978 glasgow central when he said helllo. was this your punk phase or is my uncle talking shite or am i talking shite ? happy birthday liverpool fav english city always. ,2020-06-26 22:38:59+00:00,,,1276646166625767424,,https://twitter.com/p3t3rmcd/status/1276646166625767424,0,0,PaulMcCartney,
thank you j.m barrie for peter pan and road runner cartoons ?,2020-06-26 22:33:15+00:00,,,1276644722300325889,,https://twitter.com/p3t3rmcd/status/1276644722300325889,0,0,darkedinburgh,https://twitter.com/darkedinburgh/status/1276583323909918721
went out and took some deep breaths. thing are going to get better but the upheaval and realignment of what is relevant in life is quite disconcerting just now. hope you’re good ,2020-06-26 22:23:41+00:00,,,1276642316925710338,,https://twitter.com/p3t3rmcd/status/1276642316925710338,0,0,IanDKinsey,
glasgow west,2020-06-26 19:58:55+00:00,,,1276605883741585410,,https://twitter.com/p3t3rmcd/status/1276605883741585410,0,0,,
that’s a good point,2020-06-26 19:33:18+00:00,,,1276599436140072961,,https://twitter.com/p3t3rmcd/status/1276599436140072961,0,0,mhound5,
always think he made metropolis. i’ll get a wee look at one of his films cheers ,2020-06-26 19:32:25+00:00,,,1276599213057548295,,https://twitter.com/p3t3rmcd/status/1276599213057548295,0,0,JohnDivney,
it’s a cash cow for law enforcement/prisons and insurance companies - poor working class white and poor black people. then charging premium insurance to protect the ‘innocent’ it’s a scam.,2020-06-26 19:30:45+00:00,,,1276598795720167425,,https://twitter.com/p3t3rmcd/status/1276598795720167425,0,0,mhound5,
you’ve read the history of prohibition as i have and it’s steeped in explicit racism. billie holiday - harry ainslinger the xenophobic bullshit behind substances other than alcohol. even the dutch still fall for it with initiatives targeting coffee shops to appease racists.,2020-06-26 19:23:09+00:00,,,1276596884522532866,,https://twitter.com/p3t3rmcd/status/1276596884522532866,0,0,mhound5,
packham must commend ,2020-06-26 19:16:42+00:00,,,1276595257740865537,,https://twitter.com/p3t3rmcd/status/1276595257740865537,0,0,afterprohibends,
i can’t understand anyone who knows the history of slavery and prohibition that can’t get the fact that it’s all built around being a racist cvnt. i also get into it over treatment of white people being treated like sh1t. it’s not unconnected.,2020-06-26 19:15:31+00:00,,,1276594959664271361,,https://twitter.com/p3t3rmcd/status/1276594959664271361,0,0,mhound5,
i like the sensation when you close your hand over them to release them. must be mad for them too - being in the dark with gap light finger gap light that they can’t get to for those few seconds.,2020-06-26 19:10:31+00:00,,,1276593704959127554,,https://twitter.com/p3t3rmcd/status/1276593704959127554,1,0,afterprohibends,
i’m struggling with the face to face to face people. it’s best for purposes of serenity to ignore them and tune into something positive but it’s difficult.,2020-06-26 19:07:41+00:00,,,1276592990073618432,,https://twitter.com/p3t3rmcd/status/1276592990073618432,0,0,c_cannabiscafe,
mammoth for a moth,2020-06-26 18:56:41+00:00,,,1276590223074430978,,https://twitter.com/p3t3rmcd/status/1276590223074430978,0,0,afterprohibends,
going out for a cycle i get a bit agitated with stuff should i phone a friend have a shower and change my clothes in case i end up on a weekender ? custody for having another john cleese meltdown stay in and get wasted talking to myself - no need to respond.,2020-06-26 18:37:52+00:00,,,1276585487155769350,,https://twitter.com/p3t3rmcd/status/1276585487155769350,3,0,,
you write like a shittier version walter scott. have a nice weekend. don’t worry my poetry is worse than william topaz william mcgonagall ,2020-06-26 18:25:43+00:00,,,1276582430225379330,,https://twitter.com/p3t3rmcd/status/1276582430225379330,1,0,B3Englishman,
wiznae talking ‘to’ you.,2020-06-26 18:21:01+00:00,,,1276581244684374017,,https://twitter.com/p3t3rmcd/status/1276581244684374017,1,0,B3Englishman,
laughing inappropriately at this but losing all perception of appropriateness at the same time.,2020-06-26 18:17:52+00:00,,,1276580451902242822,,https://twitter.com/p3t3rmcd/status/1276580451902242822,1,0,Balmalocha,
it’s sickening - we have to show a better example. the combination of alcohol heat stress added to the usual british madness is quite concerning.,2020-06-26 18:00:56+00:00,,,1276576193026940929,,https://twitter.com/p3t3rmcd/status/1276576193026940929,0,0,carolecadwalla,
just wondering very close to tilburg. really like brabant zone. can’t wait till it’s safe to get back. netherlands is my wee chill out zone. prettige weekend.,2020-06-26 16:52:15+00:00,,,1276558907373223936,,https://twitter.com/p3t3rmcd/status/1276558907373223936,1,0,S51981,
you ever go to eindhoven?,2020-06-26 16:49:21+00:00,,,1276558179422396416,,https://twitter.com/p3t3rmcd/status/1276558179422396416,1,0,S51981,
"on the way back a dog harassed me on the beach, wearing one of those hmv things round it’s neck. i was getting paranoid and took it off. i couldn’t see the owner anywhere. as soon as i took it off the dog fvcked off and also got off the mark.",2020-06-26 16:48:03+00:00,,,1276557852186947585,,https://twitter.com/p3t3rmcd/status/1276557852186947585,1,0,S51981,
another *,2020-06-26 16:43:04+00:00,,,1276556596005556229,,https://twitter.com/p3t3rmcd/status/1276556596005556229,0,0,p3t3rmcd,
"on a rowing boat on the north sea - heading out to a fishing trawler in friesian islands. it was pitch black & stormy high waves. i was shitting myself like never before. i heard a distant voice, thinking it’s from another saw a guy walking in the water knee-deep.",2020-06-26 16:42:10+00:00,,,1276556369496342533,,https://twitter.com/p3t3rmcd/status/1276556369496342533,2,0,S51981,
lived through a lot and read a lot and these times are fvcking mental. we need to make positive changes.,2020-06-26 16:28:48+00:00,,,1276553004985049089,,https://twitter.com/p3t3rmcd/status/1276553004985049089,0,0,,
