text,date,geo,hashtags,tweet_id,mentions,permalink,replies,retweets,replies_to,mentioned_urls
remember wedinos are still testing by post keep up to date timetotest https://www.wedinos.org/db/samples/,2020-04-09 12:17:21+00:00,,#timetotest,1248223474188984320,,https://twitter.com/p3t3rmcd/status/1248223474188984320,0,0,,https://www.wedinos.org/db/samples/
would have been a very moment for the journalist to have asked exactly who is blocking life saving initiatives. the article has also quoted the ‘task force’ head as supporting access to regulated supply.,2020-04-09 12:12:54+00:00,,,1248222353647165441,,https://twitter.com/p3t3rmcd/status/1248222353647165441,0,0,JohnDivney,
when we get to the other side - never using air b and b again !,2020-04-09 12:07:49+00:00,,,1248221075172986880,,https://twitter.com/p3t3rmcd/status/1248221075172986880,0,0,,
‘we are trying to persuade our addiction specialist colleagues to do likewise but there seems to be a resistance to that’ who’s resisting ? calls to help drug users access services in covid-19 crisis https://theferret.scot/drug-users-services-covid-19-crisis/ via ,2020-04-08 19:36:41+00:00,,,1247971646465589250,@FerretScot,https://twitter.com/p3t3rmcd/status/1247971646465589250,1,1,,https://theferret.scot/drug-users-services-covid-19-crisis/
move over to fm and i’ll tell you.,2020-04-08 18:38:27+00:00,,,1247956992049795073,,https://twitter.com/p3t3rmcd/status/1247956992049795073,0,0,BBC6Music,
"aye , yir right enough.",2020-04-08 18:16:11+00:00,,,1247951389420109825,,https://twitter.com/p3t3rmcd/status/1247951389420109825,0,0,UKCIA,
another problem with excessive prohibition less options available for people to chose how to consume.,2020-04-08 18:00:10+00:00,,,1247947358454853632,,https://twitter.com/p3t3rmcd/status/1247947358454853632,1,0,UKCIA,
hou je bek en bef me,2020-04-08 14:22:18+00:00,,,1247892529585897472,,https://twitter.com/p3t3rmcd/status/1247892529585897472,0,0,thelaceylondon,
rose street ?,2020-04-08 14:06:08+00:00,,,1247888460641230858,,https://twitter.com/p3t3rmcd/status/1247888460641230858,1,0,jamesdoleman,
"'in our view nice also acted unlawfully by failing to consult with disabled people or their representative organisations at all in developing the guideline, even though the effects on such people were potentially devastating'.",2020-04-08 13:43:16+00:00,,,1247882705745768450,,https://twitter.com/p3t3rmcd/status/1247882705745768450,0,0,,https://www.hja.net/press-releases/nice-amends-covid-19-critical-care-guideline-after-judicial-review-challenge/
walking along the street is much quieter than the park now.,2020-04-08 12:53:27+00:00,,,1247870172100202496,,https://twitter.com/p3t3rmcd/status/1247870172100202496,0,0,EdinOldTownCC,
'increased capacity within the know the score helpline and webchat service'. in november the scot gov was looking for a contracter to run this service. it would have been wise to have kept this whole service provision in public sector. https://www.publiccontractsscotland.gov.uk/search/show/search_view.aspx?id=nov371594,2020-04-07 13:32:18+00:00,,,1247517558866989057,,https://twitter.com/p3t3rmcd/status/1247517558866989057,0,0,garthmullins,https://www.publiccontractsscotland.gov.uk/search/show/search_view.aspx?ID=NOV371594
was 2019 also mad ? i can't remember any more.,2020-04-06 22:09:16+00:00,,,1247285269201551361,,https://twitter.com/p3t3rmcd/status/1247285269201551361,0,0,PoliticusSarah,
wouldn’t wish this on any sentient being.,2020-04-06 19:21:05+00:00,,,1247242947306893312,,https://twitter.com/p3t3rmcd/status/1247242947306893312,0,0,bbclaurak,
one of my earliest vhs memory triggers.,2020-04-06 14:39:54+00:00,,,1247172183266295812,,https://twitter.com/p3t3rmcd/status/1247172183266295812,0,0,Justbwc,https://www.youtube.com/watch?reload=9&v=jQwgjBv3N8k
,2020-04-06 14:10:55+00:00,,,1247164889677742083,,https://twitter.com/p3t3rmcd/status/1247164889677742083,0,1,thom_galvin,
fair point well made.,2020-04-06 11:41:08+00:00,,,1247127193525895168,,https://twitter.com/p3t3rmcd/status/1247127193525895168,0,0,MalcolmChishol1,
scottish public health is quite an interesting wee sector in itself. the minister  didn’t even realise that some of it was outsourced when i spoke to him last summer. he has the right to respond as always.,2020-04-06 11:34:08+00:00,,,1247125434900365313,@JoeFitzSNP,https://twitter.com/p3t3rmcd/status/1247125434900365313,0,0,pblancka,
i noticed a few bluebells yesterday in the during my exercise break/walk round the yard. i’ll see them again today. ,2020-04-06 11:02:04+00:00,,,1247117365185335297,,https://twitter.com/p3t3rmcd/status/1247117365185335297,0,0,mgreenaw,
bring family fortunes back and get this guy.,2020-04-05 21:44:21+00:00,,,1246916612109852672,,https://twitter.com/p3t3rmcd/status/1246916612109852672,0,0,Bill_Maxwell_,https://twitter.com/Bill_Maxwell_/status/1246516670429974529
to be honest - not sure who is trust-worthy. hubris seems to be part of the deal with many people who get into positions of authority.,2020-04-05 16:21:01+00:00,,,1246835244004769794,,https://twitter.com/p3t3rmcd/status/1246835244004769794,0,0,afterprohibends,
"dr's are reluctant to do home visits, which is understandable just now. but dr calderwood go to great lengths for a second home visit.",2020-04-05 13:10:36+00:00,,,1246787321598533635,,https://twitter.com/p3t3rmcd/status/1246787321598533635,1,0,StewartMcDonald,
police visited ? wouldn't skype have been a better option ? serioulsy folks - think - think - think.,2020-04-05 13:01:55+00:00,,,1246785136303247361,,https://twitter.com/p3t3rmcd/status/1246785136303247361,0,0,policescotland,https://twitter.com/policescotland/status/1246770834154405888
could have possibly used skype ?,2020-04-05 12:56:46+00:00,,,1246783843027296258,,https://twitter.com/p3t3rmcd/status/1246783843027296258,0,0,policescotland,
,2020-04-05 12:32:12+00:00,,,1246777658014412800,,https://twitter.com/p3t3rmcd/status/1246777658014412800,0,0,,https://www.youtube.com/watch?v=3NbQkyvbw18&src=Linkfire&lId=9d27e518-0bbf-4773-99a0-31f49f7c8a0c&cId=d3e1053b-4c47-11e6-9fd0-066c3e7a8751
"there's a natural rhythm to his patter, which is rare with politicians at that level.",2020-04-05 12:08:25+00:00,,,1246771672704856064,,https://twitter.com/p3t3rmcd/status/1246771672704856064,0,0,SalmaYaqoob,
"niki said: “if sex workers’ contribution to the survival and welfare of people was more visible, our status would rise, and our demands would be seen to be more valid.”",2020-04-05 12:02:52+00:00,,,1246770274953056258,,https://twitter.com/p3t3rmcd/status/1246770274953056258,1,0,,https://www.hamhigh.co.uk/news/coronavirus-kentish-town-prostitutes-sex-workers-covid-19-crisis-1-6586904
they always were reb. this just pushes people even further down the line.,2020-04-05 11:44:32+00:00,,,1246765663353528325,,https://twitter.com/p3t3rmcd/status/1246765663353528325,0,1,RebJ19,
you only need 1 reference now ?,2020-04-05 11:28:10+00:00,,,1246761542206525441,,https://twitter.com/p3t3rmcd/status/1246761542206525441,2,0,mmusJu,
how to stay alive each day. stuck for a tune to go with it though.,2020-04-03 18:24:17+00:00,,,1246141486497964038,,https://twitter.com/p3t3rmcd/status/1246141486497964038,1,0,BBC6Music,
line managers of supermarkets tend not to have expertise in health purchasing logistics. i think that's the basis of the argument.,2020-04-03 12:30:33+00:00,,,1246052467135123457,,https://twitter.com/p3t3rmcd/status/1246052467135123457,1,0,golden_jade1,
,2020-04-03 12:19:57+00:00,,,1246049801180979201,,https://twitter.com/p3t3rmcd/status/1246049801180979201,1,0,JohnDivney,https://www.youtube.com/watch?v=AbMG1v7qDqs
 forgot how sweet fm sounds. get on to it ,2020-04-03 12:15:49+00:00,,,1246048760494542849,@BBC6Music,https://twitter.com/p3t3rmcd/status/1246048760494542849,1,0,,
source  addressing cannabis use problems among older people: what canadian guidelines recommend based on the evidence https://findings.org.uk/php/dl.php?file=ccmsh_3.txt&amp;s=eb&amp;sf=tw,2020-04-03 09:20:39+00:00,,,1246004678170759168,@DrugAlcFindings,https://twitter.com/p3t3rmcd/status/1246004678170759168,0,0,,https://findings.org.uk/PHP/dl.php?file=CCMSH_3.txt&s=eb&sf=tw
praying for warm and soapy weather.,2020-04-02 21:47:31+00:00,,,1245830245237702657,,https://twitter.com/p3t3rmcd/status/1245830245237702657,0,0,Grouse_Beater,
matching tracksuit tops and bottoms.,2020-04-02 20:47:18+00:00,,,1245815093037805569,,https://twitter.com/p3t3rmcd/status/1245815093037805569,0,0,dtaylor5633,
it’s for the workers. the people who’re being kept in but still have to do stuff to keep things going. i get what you mean regarding the bullsh1t that’s coming from a higher level ,2020-04-02 20:43:35+00:00,,,1245814156235804672,,https://twitter.com/p3t3rmcd/status/1245814156235804672,1,0,mickando1,
source  addressing drinking problems among older people: what canadian guidelines recommend based on the evidence https://findings.org.uk/php/dl.php?file=ccmsh_1.txt&amp;s=eb&amp;sf=tw,2020-04-02 15:51:10+00:00,,,1245740565653852168,@DrugAlcFindings,https://twitter.com/p3t3rmcd/status/1245740565653852168,0,2,,https://findings.org.uk/PHP/dl.php?file=CCMSH_1.txt&s=eb&sf=tw
for about a year or so. never made any of the box set lists.,2020-04-02 15:09:39+00:00,,,1245730120775671808,,https://twitter.com/p3t3rmcd/status/1245730120775671808,0,0,Soupelina,
i feel more like a gazelle taking an essential drink in crocodile infested waters.,2020-04-02 13:54:06+00:00,,,1245711105147707392,,https://twitter.com/p3t3rmcd/status/1245711105147707392,3,1,smartass_moms,
"collective power on the work floor is limited. that’s why we delegate to unions. there has to be a change on practice. when members provide evidence of public interest concerns, they have to back them all the way. not just going through employment legislation processes.",2020-04-01 09:04:21+00:00,,,1245275798564679680,,https://twitter.com/p3t3rmcd/status/1245275798564679680,0,0,JoeBlob123,
unions have got case files going back decades of appalling negligence in public health management. the only outcomes fought for were on individual cases. there was rarely any support given to people who wanted to expose and try and remedy dire situations beyond tribunals.,2020-04-01 08:54:30+00:00,,,1245273319382888451,,https://twitter.com/p3t3rmcd/status/1245273319382888451,1,0,JoeBlob123,
unions know about the skullduggery that goes on in public health. they need to step the fvck right up to this.,2020-04-01 08:44:32+00:00,,,1245270811705061376,,https://twitter.com/p3t3rmcd/status/1245270811705061376,1,1,JoeBlob123,
how long before anyone notices. there is no government!,2020-04-01 08:19:50+00:00,,,1245264595314491392,,https://twitter.com/p3t3rmcd/status/1245264595314491392,0,0,DrRosena,
,2020-03-31 10:35:18+00:00,,,1244936299666190337,,https://twitter.com/p3t3rmcd/status/1244936299666190337,0,0,,https://www.theguardian.com/education/2020/mar/31/uk-students-union-calls-on-universities-to-cancel-summer-exams
,2020-03-31 10:07:24+00:00,,,1244929277843423232,,https://twitter.com/p3t3rmcd/status/1244929277843423232,0,0,ADAWnews,https://www.bbc.co.uk/programmes/b006qpmv
thunder can happen without rain. this was the deal breaker for me - tusk wins !,2020-03-29 12:47:24+00:00,,,1244244767061487621,,https://twitter.com/p3t3rmcd/status/1244244767061487621,0,0,DawnHFoster,
possibly better safety net also. people would have stayed off work much sooner. so many different strands to this.,2020-03-29 09:09:05+00:00,,,1244189828222275584,,https://twitter.com/p3t3rmcd/status/1244189828222275584,0,1,davidtphillips,
they probably have a well funded minimally outsourced public health system?,2020-03-29 09:00:23+00:00,,,1244187636748648448,,https://twitter.com/p3t3rmcd/status/1244187636748648448,1,0,davidtphillips,
hazmat celebrity snooker?,2020-03-29 08:47:03+00:00,,,1244184282605780992,,https://twitter.com/p3t3rmcd/status/1244184282605780992,0,0,,
8.3/10,2020-03-29 05:42:25+00:00,,,1244137820136124417,,https://twitter.com/p3t3rmcd/status/1244137820136124417,0,0,32watto_,
"'if an overdose occurs it is likely an ambulance will take longer to arrive, so you need to have naloxone with you at all times.' https://www.nhsggc.org.uk/your-health/health-issues/covid-19-coronavirus/for-the-public-patients/alcohol-and-drug-recovery-services-update/",2020-03-28 09:06:40+00:00,,,1243826832664924161,,https://twitter.com/p3t3rmcd/status/1243826832664924161,0,3,,https://www.nhsggc.org.uk/your-health/health-issues/covid-19-coronavirus/for-the-public-patients/alcohol-and-drug-recovery-services-update/#
give us kush on the nhs.,2020-03-27 15:26:26+00:00,,,1243560014255656960,,https://twitter.com/p3t3rmcd/status/1243560014255656960,0,0,scotgov,
far less concerned about that than the amount of people being forced to work right now when it isn’t essential. also the lack of testing is insane.,2020-03-27 12:08:56+00:00,,,1243510313678503936,,https://twitter.com/p3t3rmcd/status/1243510313678503936,0,0,IanDunt,
source  from potential bystanders of overdoses to ‘public health collaborators’ – danish programme trains over 500 including police officers and people who use opioids https://findings.org.uk/php/dl.php?file=thylstrup_b_4.txt&amp;s=eb&amp;sf=tw,2020-03-27 09:51:02+00:00,,,1243475610913181698,@DrugAlcFindings,https://twitter.com/p3t3rmcd/status/1243475610913181698,0,2,,https://findings.org.uk/PHP/dl.php?file=Thylstrup_B_4.txt&s=eb&sf=tw
i’ve got a few - sorry we lost emails from my time working in public health the union shat it as did my local mp to go to town on them. but it was only people who were using substances that were at risk of death back then because of public health incompetence.,2020-03-27 08:13:58+00:00,,,1243451181340508160,,https://twitter.com/p3t3rmcd/status/1243451181340508160,0,0,ks_1968,
the old email confusion story. ,2020-03-27 08:08:14+00:00,,,1243449740320288769,,https://twitter.com/p3t3rmcd/status/1243449740320288769,2,0,KevinPascoe,
floyd/roses/marley/cocteau twins,2020-03-27 07:58:10+00:00,,,1243447204431486977,,https://twitter.com/p3t3rmcd/status/1243447204431486977,0,0,LondonLady70,
they privatised nhs logistics.,2020-03-27 07:45:16+00:00,,,1243443958283415552,,https://twitter.com/p3t3rmcd/status/1243443958283415552,0,1,anoldbaglady,
coronavirus (covid-19): advice for employers and employees acas https://www.acas.org.uk/coronavirus,2020-03-27 07:22:12+00:00,,,1243438153131798529,,https://twitter.com/p3t3rmcd/status/1243438153131798529,0,0,,https://www.acas.org.uk/coronavirus
no,2020-03-27 07:09:51+00:00,,,1243435045269970944,,https://twitter.com/p3t3rmcd/status/1243435045269970944,0,0,CkMavri,
staying alive.,2020-03-27 07:02:39+00:00,,,1243433232135225344,,https://twitter.com/p3t3rmcd/status/1243433232135225344,0,0,TheHubbuk,
"‘documents also show nhs supply chain ""hasn't been able to manage"" delivery of the items, such as masks, to them.’ ‘corporate quarreling now truly “disrupts” every layer of the once-public service nhs’",2020-03-27 06:53:11+00:00,,,1243430851297316864,,https://twitter.com/p3t3rmcd/status/1243430851297316864,0,0,doctor_oxford,https://www.google.co.uk/amp/s/calderdaleandkirklees999callforthenhs.wordpress.com/2018/08/16/corporate-fight-breaks-out-with-dept-of-health-over-new-nhs-supply-chain-contracts/amp/
stay home - work in non essential services sector - volunteer/work in care without having been tested. bit of a mixed message ?,2020-03-26 20:04:27+00:00,,,1243267594041339907,,https://twitter.com/p3t3rmcd/status/1243267594041339907,0,0,cabinetofficeuk,
it’s insane!,2020-03-26 17:21:35+00:00,,,1243226606996504580,,https://twitter.com/p3t3rmcd/status/1243226606996504580,0,0,IgHawthorne,
definitely less concerned about wee groups of people than about ‘non essential’ workers being forced to work. i’m really worried about this. as many people as possible should be at home.,2020-03-26 17:10:04+00:00,,,1243223706798825476,,https://twitter.com/p3t3rmcd/status/1243223706798825476,0,0,DawnHFoster,
chilling photo.,2020-03-26 16:49:51+00:00,,,1243218618839597056,,https://twitter.com/p3t3rmcd/status/1243218618839597056,1,0,afterprohibends,
best with some couch-lock kush after chores are finished. tripping in this current climate probably isn’t the best idea drug set setting,2020-03-26 16:20:11+00:00,,,1243211155855867904,,https://twitter.com/p3t3rmcd/status/1243211155855867904,0,0,Narcomania,
 ,2020-03-26 14:36:20+00:00,,,1243185019759321088,,https://twitter.com/p3t3rmcd/status/1243185019759321088,0,0,susangoodwill4,
also untested. it’s madness.,2020-03-26 14:19:22+00:00,,,1243180747567050757,,https://twitter.com/p3t3rmcd/status/1243180747567050757,0,0,mhound5,
"such wasted opportunities over the past few years, to already have a system in place to get people into safe isolation, support and medication or supervised consumption/both linked in.",2020-03-26 13:23:28+00:00,,,1243166680529985539,,https://twitter.com/p3t3rmcd/status/1243166680529985539,0,0,PeterKrykant,
glad the weather's still pretty crap. spring 2020 stayin in !,2020-03-26 13:18:26+00:00,,,1243165416740073472,,https://twitter.com/p3t3rmcd/status/1243165416740073472,0,0,,
first i wish your family well. pity it takes a global pandemic to get some people to pipe up about inequality.,2020-03-26 13:11:49+00:00,,,1243163748929503232,,https://twitter.com/p3t3rmcd/status/1243163748929503232,0,0,JuliaHB1,
coronavirus (covid-19): what people with asthma need to know https://community.aafa.org/blog/coronavirus-2019-ncov-flu-what-people-with-asthma-need-to-know.xnw0yrdjryc.twitter,2020-03-26 04:51:29+00:00,,,1243037837655773184,,https://twitter.com/p3t3rmcd/status/1243037837655773184,0,0,,https://community.aafa.org/blog/coronavirus-2019-ncov-flu-what-people-with-asthma-need-to-know#.Xnw0yRDJRYc.twitter
i’d use the mouth barrier with hand sanitizer around my face and the person’s mouth before and after. makeshift but i can understand anyone’s reluctance.,2020-03-26 03:33:41+00:00,,,1243018257436721152,,https://twitter.com/p3t3rmcd/status/1243018257436721152,0,0,SwolleSpirit,
"anyone’s life can turn so fast. it doesn’t matter how ‘worthy’ they are. by law of averages, it happens to people in dribs and drabs, so there’s no collective experience. they feel isolated and deflated. now the numbers have changed and it will be different hopefully",2020-03-26 03:27:45+00:00,,,1243016763991785473,,https://twitter.com/p3t3rmcd/status/1243016763991785473,0,0,Methadone_Cat,
he’s still very significant. he’s prob second in command after cummings.,2020-03-26 03:19:15+00:00,,,1243014624406114307,,https://twitter.com/p3t3rmcd/status/1243014624406114307,1,0,notstoppingat,
he’s been dabbling in public health policy since 2010. omnipotent as a virus in a breakout.,2020-03-26 03:16:45+00:00,,,1243013994425786375,,https://twitter.com/p3t3rmcd/status/1243013994425786375,0,0,Hephaestus7,
 ,2020-03-26 03:01:15+00:00,,,1243010097829330944,,https://twitter.com/p3t3rmcd/status/1243010097829330944,0,0,alexhkral,
sweden has a great system in many ways but some are a bit bonkers also.,2020-03-25 11:35:46+00:00,,,1242777189961129984,,https://twitter.com/p3t3rmcd/status/1242777189961129984,0,0,trevorw1953,
guessing there was alcohol involved too.,2020-03-25 09:39:15+00:00,,,1242747865920876544,,https://twitter.com/p3t3rmcd/status/1242747865920876544,0,0,mhdksafa,
peter green.,2020-03-25 09:11:15+00:00,,,1242740820601712640,,https://twitter.com/p3t3rmcd/status/1242740820601712640,1,0,DaftLimmy,
so many overlaps with the government’s refusal to ...... fvck i don’t have the energy anymore. john ashton is a good guy who has hopefully helped to get a few people indoors in the nick of time. his background is preventing substance use harms too. full circle .,2020-03-25 08:41:05+00:00,,,1242733229301473289,,https://twitter.com/p3t3rmcd/status/1242733229301473289,0,0,ScrtDrugAddict,
"i’m telling no one nothing. the last time i did that, avocado prices erupted. ",2020-03-25 08:28:22+00:00,,,1242730028632244224,,https://twitter.com/p3t3rmcd/status/1242730028632244224,0,0,Blattdes,
i might forfeit the crisps for 5 squares of toilet roll.,2020-03-24 18:39:40+00:00,,,1242521479931199488,,https://twitter.com/p3t3rmcd/status/1242521479931199488,1,0,,
club biscuit cuppa extra walk time. booked in for tomorrow!,2020-03-24 18:34:37+00:00,,,1242520210038374400,,https://twitter.com/p3t3rmcd/status/1242520210038374400,0,0,RobBarkerW,
'your nhs needs you’ – nhs call for volunteer army' great idea - once you know that no one has the fvcking virus. you don't just put a quarter of a million people out there blindly. https://www.england.nhs.uk/2020/03/your-nhs-needs-you-nhs-call-for-volunteer-army/,2020-03-24 18:12:03+00:00,,,1242514528321048576,,https://twitter.com/p3t3rmcd/status/1242514528321048576,0,0,,https://www.england.nhs.uk/2020/03/your-nhs-needs-you-nhs-call-for-volunteer-army/
do you still get a biscuit and a cup of tea ?,2020-03-24 18:07:47+00:00,,,1242513454919028738,,https://twitter.com/p3t3rmcd/status/1242513454919028738,1,0,RobBarkerW,
"same bits of the brain connected with anxiety and connecting with a 'deity' limbic system ? if it helps someone be less anxious ,then that's always a good thing.",2020-03-24 18:07:01+00:00,,,1242513265483304961,,https://twitter.com/p3t3rmcd/status/1242513265483304961,0,0,TheNewImpostor,
"essential but people will need to be tested though - otherwise, there will be a risk of more infections. it's a no brainer timetotest https://www.england.nhs.uk/2020/03/your-nhs-needs-you-nhs-call-for-volunteer-army/",2020-03-24 18:01:04+00:00,,#timetotest,1242511764539019264,,https://twitter.com/p3t3rmcd/status/1242511764539019264,0,0,,https://www.england.nhs.uk/2020/03/your-nhs-needs-you-nhs-call-for-volunteer-army/
best wishes,2020-03-24 16:40:34+00:00,,,1242491509812887553,,https://twitter.com/p3t3rmcd/status/1242491509812887553,0,0,83XDev,https://www.gov.uk/government/publications/the-health-and-care-system-explained/the-health-and-care-system-explained
there's a difference between the health service and public health services. i worked in both and public health is an absolute shambles.,2020-03-24 16:22:12+00:00,,,1242486885231906829,,https://twitter.com/p3t3rmcd/status/1242486885231906829,1,0,83XDev,
time someone looked into the outsourced shambles that public health services are in uk - yes i'm including scotland.,2020-03-24 15:01:51+00:00,,,1242466663166959625,,https://twitter.com/p3t3rmcd/status/1242466663166959625,0,0,PaulJSweeney,
"any hash/weed smokers. wash hands try not to smoke with tobacco vaping is best economical. pipes and bongs are better than tobacco joints. lasts longer you only need to inhale a little, law of diminishing returns applies after first inhalation. don't share appliances.",2020-03-24 14:25:14+00:00,,,1242457450873262080,,https://twitter.com/p3t3rmcd/status/1242457450873262080,2,0,,
the amount of people who aren't getting this is terrifying. our public health service is a shambles.,2020-03-24 14:18:33+00:00,,,1242455767258673153,,https://twitter.com/p3t3rmcd/status/1242455767258673153,1,1,afterprohibends,
there’s bonkers of the benign kind and down right fvcking mental. woops there goes my return to practice chances. but seriously ,2020-03-24 13:14:48+00:00,,,1242439725815861250,,https://twitter.com/p3t3rmcd/status/1242439725815861250,1,0,SaurusGeorge,
trying to as much as possible. brief exercise and shop. i can identify with those animals that get eaten by predators when they come out in search of food. clean hands and never touch face while out. chntf - to the tune of disco.,2020-03-24 13:06:36+00:00,,,1242437659571769344,,https://twitter.com/p3t3rmcd/status/1242437659571769344,0,0,ahmedhankir,
this is really concerning. it also demands testing and early intervention if it it the case.,2020-03-24 12:21:57+00:00,,,1242426424688095232,,https://twitter.com/p3t3rmcd/status/1242426424688095232,1,0,stonewall007,https://onlinelibrary.wiley.com/doi/full/10.1002/jmv.25728
it certainly does and is killing people too. ,2020-03-24 12:14:18+00:00,,,1242424499624173570,,https://twitter.com/p3t3rmcd/status/1242424499624173570,0,0,saoirsefanclub,
probably a wee rota system or just common sense/courtesy turn taking. small amount of households should be able to rotate.,2020-03-24 12:09:27+00:00,,,1242423278809100289,,https://twitter.com/p3t3rmcd/status/1242423278809100289,1,0,saoirsefanclub,
i was hoping this myself. but i will obviously do what i'm telt.,2020-03-24 12:04:28+00:00,,,1242422024506494977,,https://twitter.com/p3t3rmcd/status/1242422024506494977,1,0,saoirsefanclub,
"if we had a public health service, that wasn't outsourced and splintered over the last 10 years or so, then maybe this would never have needed to be written up.",2020-03-24 12:02:05+00:00,,,1242421425304190981,,https://twitter.com/p3t3rmcd/status/1242421425304190981,0,0,niamhrelease,
"ok, i was just thinking that being out and doing a bit of gardening if no one was about would be ok. if someone appears maintaining a good distance. quite a big space and not many too many people live in block.",2020-03-24 11:54:55+00:00,,,1242419621300449285,,https://twitter.com/p3t3rmcd/status/1242419621300449285,0,0,jduebsirb,
what's the rules for being out in the garden for shared back courts ?,2020-03-24 11:35:14+00:00,,,1242414666170671106,,https://twitter.com/p3t3rmcd/status/1242414666170671106,1,0,,
"bonkers, we're self isolating to try and protect the people most at risk of dying. ok, also i don't fancy my chances too much with a fvcking cross species transmitting respiratory system targeting virus. possibly also central nervous system respiratory regulating areas too.",2020-03-24 11:24:53+00:00,,,1242412065173749760,,https://twitter.com/p3t3rmcd/status/1242412065173749760,1,0,RemainiacsCast,
