text,date,geo,hashtags,tweet_id,mentions,permalink,replies,retweets,replies_to,mentioned_urls
"theyve been fined a billion dollars for wrongdoing already. this isnt hypothetical- they scammed to get patent renewed several times. i never used free and dont think it should be, they scammed to keep out competition thats drives price down",2020-01-10 21:22:30+00:00,,,1215745756189134849,,https://twitter.com/icmyserenity/status/1215745756189134849,0,0,thescottjwatson,
our inability to see how shady  &amp; rbg (makers of suboxone) are bc we advocate for buprenorphine is maddening. we can advocate for bupe and also be vocal about how many ppl died bc they played games w patents n single handedly blocking generics from hitting market,2020-01-10 18:34:02+00:00,,,1215703360797659141,@Indivior,https://twitter.com/icmyserenity/status/1215703360797659141,1,0,Arnold_Ventures,https://twitter.com/Arnold_Ventures/status/1215389210468921344
"doug huntsinger may just have been appointed as , but he's been working diligently on some big initiatives! grateful to see what this year holds for indiana nextlevelrecovery 2020visions",2020-01-10 17:59:10+00:00,,#nextlevelrecovery #2020visions,1215694585017532418,@INDrugCzar,https://twitter.com/icmyserenity/status/1215694585017532418,0,0,INDrugCzar,https://twitter.com/INDrugCzar/status/1215681225085607936
"a lot of good work has been done, but i'm even more excited about all the stuff coming in 2020! looking forward to continued collaboration",2020-01-10 17:55:50+00:00,,,1215693745640919040,,https://twitter.com/icmyserenity/status/1215693745640919040,0,0,INDrugCzar,
this leadership inspires me to work even harder. thanks for sharing these behind the scenes conversations. and thank you  for everything,2020-01-06 15:08:31+00:00,,,1214202090366685184,@INDrugCzar,https://twitter.com/icmyserenity/status/1214202090366685184,0,1,confectionsmd,https://twitter.com/confectionsmd/status/1214196644180348929
"for me personally, it was all so interconnected i didnt even know if my anger was hitting the right target. definitely warped my view, i was far from objective after about 9 inpatient stays",2020-01-06 02:36:50+00:00,,,1214012920834723852,,https://twitter.com/icmyserenity/status/1214012920834723852,0,0,billkinkle,
"eek, . should just be a tool to help therapists figure out what approaches will be effective. if it's used in combo with motivational interviewing it should never have a ""gotcha"" impact. terrible, but i've experienced something similar, bit not as harsh it diesnt seem",2020-01-06 02:18:32+00:00,,,1214008315828719616,,https://twitter.com/icmyserenity/status/1214008315828719616,1,0,billkinkle,
"pay attention to this. when those new treatment centers come into the neighborhood, who are they going into serve? most likely the privileged with private insurance or ability to self pay. lots of new places in indiana but nobody new is taking medicaid patients.",2020-01-06 01:55:45+00:00,,,1214002583033065472,,https://twitter.com/icmyserenity/status/1214002583033065472,0,0,BaDorfman,https://twitter.com/BaDorfman/status/1213952993411903490
"unfortunately it doesn't always get used great, but it's a great tool 4 a variety of change (not just sud) - one of the few things that are in this area w mi and cbt. once i realized it was fluid & ppl could be in different stages for different substances i found great use",2020-01-06 00:03:04+00:00,,,1213974226274803717,,https://twitter.com/icmyserenity/status/1213974226274803717,1,0,billkinkle,
you think you could label what stage if change you were in?,2020-01-05 23:47:50+00:00,,,1213970390072143872,,https://twitter.com/icmyserenity/status/1213970390072143872,1,0,billkinkle,
"thanks, couldnt agree more. focus on growing solutions that work- not on fault. complete waste of time that countless ppl participate in daily - which is what started the thread",2020-01-05 19:24:48+00:00,,,1213904195406958592,,https://twitter.com/icmyserenity/status/1213904195406958592,1,0,Lb_Sterling,
"kicking ppl out of tx for using is disgraceful. that's bc of the attachment to abstinence, not ts. sending ppl to jail for simply using is ineffective and causes harm, losing jobs for using hurts fam biz. but, i digress, just showing this is about ideology, not ts specifically",2020-01-05 18:23:05+00:00,,,1213888663786053633,,https://twitter.com/icmyserenity/status/1213888663786053633,0,0,icmyserenity,
"its wild to look within context of times. ts was seen as a huge win, way to keep ppl w aud out of jails/asylums. now, abstinence focus(i emphasis abstinence, not ts) is the hurdle to delivering quality care. also, abstinence /= ts. tx system is built around abstinence, not ts",2020-01-05 18:18:34+00:00,,,1213887530380206080,,https://twitter.com/icmyserenity/status/1213887530380206080,1,0,ZoeDodd,
correct. blaming ts b/c other 3rd parties (like minnesota) used it as tx (which its not) is misdirected. be upset that orgs used what should be a free community based support and used it to make $$.,2020-01-05 18:07:32+00:00,,,1213884753721593858,,https://twitter.com/icmyserenity/status/1213884753721593858,0,0,billkinkle,
"recovery advocates have all the resources? wish that were the case - recovery advocates, hr (hopefully the same) all fight for scraps.",2020-01-05 17:26:33+00:00,,,1213874438539743233,,https://twitter.com/icmyserenity/status/1213874438539743233,0,0,Lb_Sterling,
"valid point, but i dont accept that broken tx system =12 step. all the money goes to broken tx systems, not ts. yes, there's some overlap but its the the broken tx that deserves ire, not ts, its just one small piece. nor sur i'm conveying properly",2020-01-05 17:18:58+00:00,,,1213872529128988675,,https://twitter.com/icmyserenity/status/1213872529128988675,1,0,Lb_Sterling,
"i think that's natural, but hard to overcome. often ppl view their pathway as ""live saving"" or a ""miracle"" - and often bc it has been. so, i can understand feeling to need to be protective. also, can understand anger if a pathway didnt work. hard to be objective",2020-01-05 15:38:11+00:00,,,1213847166118191106,,https://twitter.com/icmyserenity/status/1213847166118191106,2,0,billkinkle,
"i agree totally. but i think most who deal in this space would have to honestly say we focus more criticism more on ts than say smarts lack of access, or naltrexone more than bupe, etc.. theres pros &cons of all 4 sure, curious how we highlight cons of some but not others.",2020-01-05 15:34:46+00:00,,,1213846307422507009,,https://twitter.com/icmyserenity/status/1213846307422507009,8,0,billkinkle,
"i believe in multiple pathways, i believe most tx is broken, & efficacy around methadone and bupe. it also makes my blood boil that many in recovery community tear down recovery options that work just in order to prove points about another. short sighted, we need to promote all",2020-01-05 15:28:22+00:00,,,1213844695094300672,,https://twitter.com/icmyserenity/status/1213844695094300672,3,0,icmyserenity,
"how about when ppl use ts negatively to promote all pathways, what do we call that? tx system is broken, inapproproately uses ts as tx, but we blame ts often instead of system? we see this w naltrexone 2 - use its deficit to build other meds. cant we promote w/o tearing down?",2020-01-05 15:24:21+00:00,,,1213843687475679233,,https://twitter.com/icmyserenity/status/1213843687475679233,2,0,billkinkle,
sounds like recovery to me! indiana recovery council helping put a face to recovery with their http://stigmaneverhelps.com campaign,2020-01-04 17:37:08+00:00,,,1213514712522072065,,https://twitter.com/icmyserenity/status/1213514712522072065,0,0,b_dreiman,"http://stigmaneverhelps.com,https://twitter.com/b_dreiman/status/1213494323221868544"
"shocking that this is still ther minority. people relapse with health conditions all the time oh, but this is the only one i'm aware of that we stop treating people because they get sick",2020-01-04 14:27:04+00:00,,,1213466882805776386,,https://twitter.com/icmyserenity/status/1213466882805776386,0,1,DrEmilyBrunner,https://twitter.com/DrEmilyBrunner/status/1213147490272325632
great to see the teamwork between the business community and our state efforts around mental health. heres a column from new dmha director jay chaudhary. theres a reason holcomb and dr. sullivan added him...he gets it,2020-01-03 16:06:47+00:00,,,1213129589427523584,,https://twitter.com/icmyserenity/status/1213129589427523584,0,0,FSSAIndiana,https://twitter.com/FSSAIndiana/status/1213114459222360064
it has to be as easy to get medication as it is dope. the window to get ppl help is so small. any delay can result in failure. this will result in missing that window for many in need,2020-01-02 16:34:59+00:00,,,1212774296327786502,,https://twitter.com/icmyserenity/status/1212774296327786502,0,0,BrookeM_Feldman,https://twitter.com/BrookeM_Feldman/status/1212754071528071168
"yes, that's it! memory isnt always great, so couldnt remember. thought it was catch all for other support",2020-01-01 23:56:51+00:00,,,1212523110597050378,,https://twitter.com/icmyserenity/status/1212523110597050378,1,0,billkinkle,
"many places will allow ppl to sub 12 step with other support groups. problem is availability of those other groups. so, they are allowed to attend smart, but if there's not one around then what's it matter",2020-01-01 23:55:22+00:00,,,1212522734850318337,,https://twitter.com/icmyserenity/status/1212522734850318337,0,0,icmyserenity,
"yes, that old belief that any questioning of tx/recovery recommendations is denial or insubordinate. unfortunately, that doesnt surprise me. not allowing you to go to other support groups really does though",2020-01-01 23:53:08+00:00,,,1212522172251545600,,https://twitter.com/icmyserenity/status/1212522172251545600,1,0,billkinkle,
"change isnt about standing back throwing rocks, its hard work “in many ways, the work of a critic is easy. we risk very little yet enjoy a position over those who offer up their work & their selves to our judgment. we thrive on negative criticism, which is fun to write & read""",2020-01-01 23:35:26+00:00,,,1212517720996098048,,https://twitter.com/icmyserenity/status/1212517720996098048,1,0,RecoveryReview,https://twitter.com/RecoveryReview/status/1212515417270505472
"i know that medication or moderation isnt an option, but i thought type of recovery group was",2020-01-01 22:56:27+00:00,,,1212507907444658177,,https://twitter.com/icmyserenity/status/1212507907444658177,0,0,icmyserenity,
"??? can cant go to smart, celebrate recovery, or refuge, etc? could've swore we had this convo when you posted pic of drop down options and ""other recovery mtgs"" was an option, no? there's 1000 problems w this program, i just thought this wasnt one.",2020-01-01 22:55:00+00:00,,,1212507546243731457,,https://twitter.com/icmyserenity/status/1212507546243731457,4,0,billkinkle,
"congrats  taylor! this is a leader who cares about his community- even those with substance use disorder. he knows that we cannot keep doing what we have been. it's been great to work with impd on officer training, looking forward to the future!",2019-12-31 17:53:13+00:00,,,1212069211322900481,@IMPD_Chief,https://twitter.com/icmyserenity/status/1212069211322900481,0,1,IMPD_Chief,https://twitter.com/IMPD_Chief/status/1212038786613465088
i'm in!,2019-12-31 14:07:22+00:00,,,1212012372346507265,,https://twitter.com/icmyserenity/status/1212012372346507265,1,0,vgwilburn,
"i see this effectively used in several settings. unfortunately it's still new to many, hope it doesn't die before more widely used",2019-12-31 14:06:37+00:00,,,1212012183434993669,,https://twitter.com/icmyserenity/status/1212012183434993669,1,0,ADAWnews,
for patients/clients/ etc? this is a proven effective method for retention on tx isnt it? especially among youth if i remember correctly,2019-12-31 14:01:07+00:00,,,1212010801151787008,,https://twitter.com/icmyserenity/status/1212010801151787008,1,0,ADAWnews,
shocking: institutions that turn a blind eye to children being abused dont want abuse discussed in public,2019-12-30 13:43:55+00:00,,,1211644085469143041,,https://twitter.com/icmyserenity/status/1211644085469143041,0,0,SNAPNetwork,https://twitter.com/SNAPNetwork/status/1211503457653280768
. w have hail this morning in fishers apparently?,2019-12-30 12:48:58+00:00,,,1211630255473119233,@SeanAshWX,https://twitter.com/icmyserenity/status/1211630255473119233,0,0,,
"that's the point of my tweet, that is why they're going back. your apparent disbelief should be the reason you should be upset as well",2019-12-29 19:11:02+00:00,,,1211364016439910400,,https://twitter.com/icmyserenity/status/1211364016439910400,0,0,thescottjwatson,
"cutting off a device is an escape charge, not a tech violation. if someone breaks the law again they should pay those consequences. but not being able to get a babysitter or a ride that results in missing appointments is not worth putting someone in a cage. wheres the compassion",2019-12-29 19:10:23+00:00,,,1211363854476861444,,https://twitter.com/icmyserenity/status/1211363854476861444,0,0,thescottjwatson,
complete lack of understanding that we set ppl up for failure. some people deserve to be in jail bc they've a threat to society...but the ppl out on probation clearly aren't a threat. throwing someone in jail bc they cannot find a babysitter 3 nights a week for iop is ridiculous,2019-12-29 19:06:24+00:00,,,1211362851354554369,,https://twitter.com/icmyserenity/status/1211362851354554369,1,0,thescottjwatson,
comment makes me want to puke. when's the last time you had to run your life w/o transportation? how about no family support? record that wont get you a job that pays enough to cover court fees? let me guess- they should just go to jail?,2019-12-29 18:54:02+00:00,,,1211359738241388544,,https://twitter.com/icmyserenity/status/1211359738241388544,1,0,thescottjwatson,
correct. the information is important but the personal connection and humanizing that comes from the interaction with those who have lived exp is vital also. i do this cpl times a year to 3rd yr pharm students - feedback says they like more focus on my personal journey,2019-12-29 02:14:29+00:00,,,1211108192949866496,,https://twitter.com/icmyserenity/status/1211108192949866496,0,1,DanVentricelli,
only so much time in the week,2019-12-29 01:53:30+00:00,,,1211102913805856771,,https://twitter.com/icmyserenity/status/1211102913805856771,1,0,billkinkle,
what are you waiting for? i know you have to attend support meetings like aa/na for snap(or equivalent nurse program) but why does that prevent you from doing what you want?,2019-12-29 01:48:23+00:00,,,1211101626146131968,,https://twitter.com/icmyserenity/status/1211101626146131968,1,0,billkinkle,
education*,2019-12-29 01:45:39+00:00,,,1211100939219808256,,https://twitter.com/icmyserenity/status/1211100939219808256,0,0,icmyserenity,
"i think lack of educatin has ppl leaning on personal beliefs and anecdotal info versus formal ed./training. some of our major universities here, such as purdue and iu have ppl with lived experience come in and guest lecture on harm reduction, recovery support services, etc",2019-12-29 01:45:23+00:00,,,1211100871284711430,,https://twitter.com/icmyserenity/status/1211100871284711430,2,2,DanVentricelli,
for those in northern indiana  is an recovery organization in their community,2019-12-28 15:18:09+00:00,,,1210943023733002242,@PortageRecovery,https://twitter.com/icmyserenity/status/1210943023733002242,2,1,PortageRecovery,https://twitter.com/PortageRecovery/status/1210813074698989571
"housing, insurance, jobs...many have discriminatory policy for those who use drugs and those in recovery- tell me i'm wrong",2019-12-28 13:22:56+00:00,,,1210914027477577728,,https://twitter.com/icmyserenity/status/1210914027477577728,0,0,thescottjwatson,
"lol! you specifically are the one who made me question whether stigma was the right word. after a nice debate it was apparent that discrimination was the better descriptor. lol, this is your doing ",2019-12-28 13:21:37+00:00,,,1210913696358289408,@thescottjwatson,https://twitter.com/icmyserenity/status/1210913696358289408,0,0,thescottjwatson,
"yes, i'm feeling this.",2019-12-28 05:10:39+00:00,,,1210790138504040450,,https://twitter.com/icmyserenity/status/1210790138504040450,2,0,ZoeDodd,https://twitter.com/ZoeDodd/status/1210554954055901185
good point!,2019-12-28 00:34:44+00:00,,,1210720702262693888,,https://twitter.com/icmyserenity/status/1210720702262693888,1,0,HillPharmD,https://twitter.com/HillPharmD/status/1210720402105716737
"correct - unfortunately, in these types of cases, they dont want call predcriber bc it's about flexing on patient, not just getting clarifying info. i've been treated amazing by pharmacists and treated so poorly i left crying out of rage",2019-12-27 20:03:59+00:00,,,1210652565118976000,,https://twitter.com/icmyserenity/status/1210652565118976000,0,0,EricMoffitt6,
"lol. i was thinking more of dsm 5 mild, moderate, severe but point taken",2019-12-27 19:27:56+00:00,,,1210643493292564480,,https://twitter.com/icmyserenity/status/1210643493292564480,0,0,bcuban,
"even though vast majority have tried to moderate countless times. most are just jealous that moderation doesnt work for them. i spent a few years being jealous of those that can moderate. it does also begs the question, how severe is aud if moderation is a viable option",2019-12-27 19:24:00+00:00,,,1210642505240317952,,https://twitter.com/icmyserenity/status/1210642505240317952,0,0,bcuban,
truth,2019-12-24 14:05:16+00:00,,#truth,1209475130235260928,,https://twitter.com/icmyserenity/status/1209475130235260928,0,0,HorsePowerEv,https://twitter.com/HorsePowerEv/status/1209471455588749312
"could be, but its overwhelmingly not. most of our jails/prisons are heinous- i wish more ppl could see. most who defend have never stepped foot in. anyone who plays role in incarceration should have first hand knowledge of what the environment is like that they are recommending",2019-12-24 03:55:48+00:00,,,1209321752641384448,,https://twitter.com/icmyserenity/status/1209321752641384448,0,0,thescottjwatson,
does u.s focus on punishment or rehabilitation? i'm okay with vengeance but lets call it what it is and not pretend like we try to rehabilitate,2019-12-24 03:29:49+00:00,,,1209315215109693440,,https://twitter.com/icmyserenity/status/1209315215109693440,1,0,CAPUDofficial,https://twitter.com/CAPUDofficial/status/1209170094074597378
like a wave starting to crest. we had multiple rulings in favor of clients needing meds for oud and now they are falling g like dominos,2019-12-24 02:01:48+00:00,,,1209293063732023297,,https://twitter.com/icmyserenity/status/1209293063732023297,0,0,ACLU_Mass,https://twitter.com/ACLU_Mass/status/1209243055234129925
the true pill is trauma or aces....,2019-12-24 01:59:20+00:00,,,1209292440483586048,,https://twitter.com/icmyserenity/status/1209292440483586048,1,0,abgutman,
"if they are talking about your program it would make sense to have the different parties there. again, not sure uds has big enough role unless its educational on how to read, etc",2019-12-24 01:58:01+00:00,,,1209292112509984769,,https://twitter.com/icmyserenity/status/1209292112509984769,0,0,billkinkle,
it's a huge scam mostly. uds makes up a small percentage of how a patient presents. 95% of places dont use uds correctly. nearly all are punitive vs just a tool (small at that) that helps direct tx plan intensity,2019-12-24 01:55:59+00:00,,,1209291600045715456,,https://twitter.com/icmyserenity/status/1209291600045715456,0,0,billkinkle,
i'm confused what a testing agency would be doing on a panel period lol.,2019-12-24 01:52:40+00:00,,,1209290765748391936,,https://twitter.com/icmyserenity/status/1209290765748391936,1,0,billkinkle,
that because they are a sponsor of an event that they control policy? that doesn't make sense to me. one definitely is the other one probably not,2019-12-24 01:48:30+00:00,,,1209289714307604480,,https://twitter.com/icmyserenity/status/1209289714307604480,1,0,icmyserenity,
"i'm having a hard time following, are you asking two separate questions. i don't see sponsoring the event as a conflict, however, the ceo of a testing agency having control over policy of a treatment centers testing clearly is. are you asking two separate things or inferring....",2019-12-24 01:47:45+00:00,,,1209289529078755329,,https://twitter.com/icmyserenity/status/1209289529078755329,1,0,billkinkle,
recoverygoals love these glimpses resilience and change...,2019-12-23 00:46:40+00:00,,#recoverygoals,1208911768736731141,,https://twitter.com/icmyserenity/status/1208911768736731141,0,0,traceyh415,https://twitter.com/traceyh415/status/1208878270713749504
facts. everytime i was arrested on opioid w/d i said that i drank a fifth of alcohol everyday & i took multiple mg of benzodiazepines. i knew this would give me a week taper that would help with my other withdrawal. this manipulation? or me looking out for myhealth?,2019-12-22 17:04:23+00:00,,,1208795430475227136,,https://twitter.com/icmyserenity/status/1208795430475227136,1,0,ZachWritesStuff,
 dad goals - unconditional love for my children,2019-12-20 16:05:46+00:00,,,1208055902202404866,,https://twitter.com/icmyserenity/status/1208055902202404866,0,0,evanrosskatz,https://twitter.com/evanrosskatz/status/1207805217611362304
"it includes full throated support of medication, addressing trauma, and more. it's a great place to start",2019-12-20 15:06:15+00:00,,,1208040925647253504,,https://twitter.com/icmyserenity/status/1208040925647253504,0,0,bcuban,
"via the national judicial opioid task force and three years of work. as much as we want people to get help in community, the courts need education immediately so they can respond",2019-12-20 14:59:06+00:00,,,1208039124684410880,,https://twitter.com/icmyserenity/status/1208039124684410880,0,0,icmyserenity,
"brand spanking new recommendations going out to chief justices (and their judges). trauma, medication, peer support, language, giving leo more tools than arrest, avoiding fentanyl hysteria and more! https://www.ncsc.org/opioidtaskforce",2019-12-20 14:58:13+00:00,,,1208038902923218944,,https://twitter.com/icmyserenity/status/1208038902923218944,1,0,bcuban,https://www.ncsc.org/opioidtaskforce
 very nice!,2019-12-20 03:25:59+00:00,,,1207864698655432704,,https://twitter.com/icmyserenity/status/1207864698655432704,0,0,confectionsmd,
"recoverygoals i remember standing outside dc talking about you possibly running- here you are, time to finish strong!",2019-12-19 16:03:26+00:00,,#recoverygoals,1207692926442262530,,https://twitter.com/icmyserenity/status/1207692926442262530,0,0,TarraSimmons5,
"long overdue. unfortunately, the recklessness in which they shut down some prescribers w/o any plans for the patients has cause much more harm than any good. i'm glad this is out, bc their actions have had a chilling effect on prescribers https://www.deadiversion.usdoj.gov/pubs/docs/mat.htm",2019-12-19 13:41:11+00:00,,,1207657129059999744,,https://twitter.com/icmyserenity/status/1207657129059999744,0,0,,https://www.deadiversion.usdoj.gov/pubs/docs/mat.htm
"??? many ppl w sever oud's lives are centered around avoiding w/d. often having little to do w anything other than avoiding w/d. no ""high"", no ""escape"", just avoiding vomiting and shatting oneself",2019-12-19 02:56:02+00:00,,,1207494771402575875,,https://twitter.com/icmyserenity/status/1207494771402575875,1,0,DrJeffreyBone,
"i'm experiencing this unusual wave of excitement and happiness for you that has a chaser of sadness and sorrow that you wont be here anymore! congrats, they are lucky to have you!",2019-12-19 02:41:30+00:00,,,1207491114636398592,,https://twitter.com/icmyserenity/status/1207491114636398592,1,0,ailahoss,
"keep putting your energy into saving lives, it's more important than dinner attire...",2019-12-18 22:31:27+00:00,,,1207428185547247617,,https://twitter.com/icmyserenity/status/1207428185547247617,0,0,,
"agreed, i enjoyed all flavors. not to mention, it never went anywhere, we were just hyperfocused on opioids. meth has been the primary drug in many counties throughout, higher number of possession arrests too",2019-12-18 21:05:49+00:00,,,1207406638832979976,,https://twitter.com/icmyserenity/status/1207406638832979976,0,0,traceyh415,
"some amazing leadership in this pic, thank you both!",2019-12-18 20:48:25+00:00,,,1207402256527699968,,https://twitter.com/icmyserenity/status/1207402256527699968,0,0,FairbanksCD,https://twitter.com/FairbanksCD/status/1207399225866227714
"this needs to be shared far and wide. this was the story that git ppl parroting about fentanyl in weed. there are zero documented cases of fentanyl laced weed. it's not a real thing. it's a scare tactic, not to mention it wouldn't even work",2019-12-17 21:37:33+00:00,,,1207052236775444482,,https://twitter.com/icmyserenity/status/1207052236775444482,1,8,,https://apnews.com/7c710c4e1fc846149c14179d1405764c
"this was true in schools to re drug use because of the ""just say no"" campaign and the ""this is your brain on drugs "". i knew they weren't telling me truth pretty early on. no trust",2019-12-17 18:11:46+00:00,,,1207000448428912650,,https://twitter.com/icmyserenity/status/1207000448428912650,0,1,coreysdavis,
this gives me hope for our systems,2019-12-17 00:36:32+00:00,,,1206734890135371776,,https://twitter.com/icmyserenity/status/1206734890135371776,0,0,MorganGodvin,https://twitter.com/MorganGodvin/status/1206713116714618880
