text,date,geo,hashtags,tweet_id,mentions,permalink,replies,retweets,replies_to,mentioned_urls
"garbage garbage garbage. nobody should be able to force someone off medication, especially those not medically trained. yes, especially judges, its outside their scope of expertise. new recommendations to judiciary highlight methadone/bupe effectiveness https://www.ncsc.org/opioidtaskforce",2019-12-15 21:49:12+00:00,,,1206330391256354819,,https://twitter.com/icmyserenity/status/1206330391256354819,0,0,Lb_Sterling,https://www.ncsc.org/opioidtaskforce
"sorry, just posted the other about patent stuff too.",2019-12-14 20:53:05+00:00,,,1205953880607088641,,https://twitter.com/icmyserenity/status/1205953880607088641,0,0,EricMoffitt6,
"that's just one, heres the over 1b from the previous owner shadiness.",2019-12-14 20:52:40+00:00,,,1205953775967653888,,https://twitter.com/icmyserenity/status/1205953775967653888,1,0,EricMoffitt6,https://www.justice.gov/opa/pr/justice-department-obtains-14-billion-reckitt-benckiser-group-largest-recovery-case
i wonder how many people died bc they kept re- patenting the same medication (3 x i think) over and over forcing ppl off bc they couldn't afford $6-700 a month cash and no generic. they arent innocent,2019-12-14 20:50:14+00:00,,,1205953165184643079,,https://twitter.com/icmyserenity/status/1205953165184643079,1,0,icmyserenity,
that's the point though. people believe so deeply in bupe that they completely give a pass to their company shady behavior. i work daily to increase access but am appalled how they've strategically monopolized their formula by illegal practices...,2019-12-14 20:46:32+00:00,,,1205952232618901504,,https://twitter.com/icmyserenity/status/1205952232618901504,3,0,EricMoffitt6,
i think the conversation just kind of further exacerbates the point of with one we can see no wrong and with other it's all wrong,2019-12-14 20:42:13+00:00,,,1205951144863903751,,https://twitter.com/icmyserenity/status/1205951144863903751,0,0,EricMoffitt6,
"wow, not sure that i've ever heard anyone defend pharma marketing",2019-12-14 20:41:37+00:00,,,1205950994024214533,,https://twitter.com/icmyserenity/status/1205950994024214533,1,0,EricMoffitt6,
"agree but we're not talking efficacy, right? convo is about shady marketing ahy do we give one company (we dont like as much) hell for everything & completely give bupe drug maker a pass. we're allowed to advocate for bupe and still call out their garbage marketing same as others",2019-12-14 20:34:02+00:00,,,1205949086744100864,,https://twitter.com/icmyserenity/status/1205949086744100864,1,0,EricMoffitt6,
 ,2019-12-14 20:18:29+00:00,,,1205945175949893633,,https://twitter.com/icmyserenity/status/1205945175949893633,0,0,DMcDRecovery,
"shirt, yes.  is a supporter of recovery orgs in indiana. this was from a 3rd party vendor and they fixed/took quickly as they were alerted. sure, they get some blame for screening products but this isnt their creation and they addressed swiftly",2019-12-14 19:13:47+00:00,,,1205928891765923844,@Walmart,https://twitter.com/icmyserenity/status/1205928891765923844,0,0,behinton,
"theres enough to go around, its not just them. indivior is facing criminal charges. regarding the op, i too am confused as to why we advocates give others a pass for same/worse behavior",2019-12-14 18:01:56+00:00,,,1205910809551003648,,https://twitter.com/icmyserenity/status/1205910809551003648,1,0,EricMoffitt6,https://www.justice.gov/opa/pr/indivior-inc-indicted-fraudulently-marketing-prescription-opioid
"correct, whats prevalence of alcohol in dv cases? what do we do w those? i can promise the justice system isn't just going to start letting people off and not arresting ppl. they still need help right? to me this is perfect candidate for supervision via court and aud services",2019-12-14 14:05:48+00:00,,,1205851386753290241,,https://twitter.com/icmyserenity/status/1205851386753290241,0,0,tenuredaddict,
"so much nuance. agreed, i work towards decriminalization a lot. but it gets talked about as if it is the solution to criminal justice issues 4 drug users and it's not far more complex and still need options at each intercept",2019-12-14 13:56:04+00:00,,,1205848936038178817,,https://twitter.com/icmyserenity/status/1205848936038178817,0,0,tenuredaddict,
ppl w multiple duis? let them go? what about robbing ppl? or break into houses? i want every pwud to get help in community but what about ppl w more serious crimes? we still need options such as drug courts and tx in facilities for our brothers/ sisters w these behaviors? complex,2019-12-14 13:52:53+00:00,,,1205848133319696386,,https://twitter.com/icmyserenity/status/1205848133319696386,1,1,icmyserenity,
"this is where i think a lot of my well-meaning advocate friends missed the mark. i have been involved in justice system my entire life, mainly as a resident and now professionally. most people are incarcerated for more than drug use. we need changes for users but what about...",2019-12-14 13:49:01+00:00,,,1205847159498846216,,https://twitter.com/icmyserenity/status/1205847159498846216,2,1,tenuredaddict,
"someone made a great comment when i was talking about dcs: if you've seen a drug court, you've seen exactly that, a drug court. they all operate rather independently w no supervision oversight. so what's true for one doesn't equal all",2019-12-14 13:46:02+00:00,,,1205846410614247432,,https://twitter.com/icmyserenity/status/1205846410614247432,1,0,EricMoffitt6,
of course you did!  and their leadership provide a model for how to help women around the state of indiana. thanks for all you do!,2019-12-13 20:22:32+00:00,,,1205583806436130821,@doverecovery,https://twitter.com/icmyserenity/status/1205583806436130821,2,2,doverecovery,https://twitter.com/doverecovery/status/1205571869904195585
this is amazing,2019-12-13 01:54:07+00:00,,,1205304862654836736,,https://twitter.com/icmyserenity/status/1205304862654836736,0,0,BleacherReport,https://twitter.com/BleacherReport/status/1205254341654913029
acute care short tx will always miss underlying trauma bc their not designed for long term engagement that it takes to address core issue. i've had similar experience. lot of short tx that never addressed underlying issues,2019-12-12 22:38:38+00:00,,,1205255666950180864,,https://twitter.com/icmyserenity/status/1205255666950180864,0,0,billkinkle,
"just another area w crazy nuance. bdm impacts indvls and systems much differently - it impacts pwud dif than rest of society 2. sometimes making pwud feel helpless while it makes rest of society understand it's not a moral issue. way to much complexity, have to access all impact",2019-12-12 22:36:50+00:00,,,1205255216645443587,,https://twitter.com/icmyserenity/status/1205255216645443587,0,0,billkinkle,
"we cannot rewind the clock and start all over again. we have to work with what we got. i want doctors, insurance company, judges, everybody to look at this as the long-term issue it is. chronic describes long-term issue",2019-12-12 18:53:24+00:00,,,1205198985075535872,,https://twitter.com/icmyserenity/status/1205198985075535872,0,0,billkinkle,
exactly. people and systems are not going to pay for 5 years worth of contact if it's not deemed a chronic condition.,2019-12-12 18:51:02+00:00,,,1205198391204044802,,https://twitter.com/icmyserenity/status/1205198391204044802,0,0,tenuredaddict,
how about so everybody's okay with people taking medication as long as possible? that sounds reasonable right? a chronic condition may require long-term medication,2019-12-12 18:49:40+00:00,,,1205198045308170240,,https://twitter.com/icmyserenity/status/1205198045308170240,1,0,billkinkle,
so you've had 10 years of continuous treatment? or you've had 10 years worth of dozens of acute interventions?,2019-12-12 18:47:23+00:00,,,1205197470633996289,,https://twitter.com/icmyserenity/status/1205197470633996289,1,0,billkinkle,
it's kind of moving the goalposts talking about abstinence versus disease theory. i think treating it like a chronic condition has opened many people up to the idea of medication. i think it's helped tremendously,2019-12-12 18:46:28+00:00,,,1205197242317062144,,https://twitter.com/icmyserenity/status/1205197242317062144,0,0,billkinkle,
really? our current broken system was around way before we started treating this like a chronic condition. all acute intervention no longterm options,2019-12-12 18:44:14+00:00,,,1205196679844114436,,https://twitter.com/icmyserenity/status/1205196679844114436,0,0,billkinkle,
"where are docs at? my understanding is bupe is a tiny bit better because is keeps up an opioid tolerance bc its partial; therefore, a person has a small tolerance vs 0. doesnt matter ince out of system for couple days though, right? that may help 1-2 days after discontinuing max",2019-12-12 14:31:08+00:00,,,1205132983860158464,,https://twitter.com/icmyserenity/status/1205132983860158464,0,0,ZachWritesStuff,
"but by announcing it a relapsing disease helps curb punitive response as well because it takes it away from a deliberate action. so we have a balance here, much nuance of course",2019-12-12 13:35:39+00:00,,,1205119023333171200,,https://twitter.com/icmyserenity/status/1205119023333171200,1,0,JessLynnMoreno,
my life,2019-12-12 13:13:59+00:00,,,1205113567562915841,,https://twitter.com/icmyserenity/status/1205113567562915841,0,0,lacymjohnson,https://twitter.com/lacymjohnson/status/1204963358266593280
"judges are finally being taught to expect relapse now bc it's a ""chronic relapsing condition"" - an effort to get away from punitive. that new training goes bye bye w getting rid of that theory. just a cpl thghts",2019-12-12 13:12:38+00:00,,,1205113230999326726,,https://twitter.com/icmyserenity/status/1205113230999326726,4,0,icmyserenity,
"how will systems be setup if we don't viewing as chronic condition? hard to get ins to treat as chronic. we know acute services dont work, so we really want to live there? medication for 7-10 days, maybe 1 mo? lot more to think about w that statement. how we label effects system",2019-12-12 13:10:57+00:00,,,1205112807064317952,,https://twitter.com/icmyserenity/status/1205112807064317952,1,0,billkinkle,
"right! and that's the old stuff that they have had to pay fines and state settlements over 1b total. the big/new one is still happening. and involves lying to dr to push product. criminal charges possible too, which is a way bigger deal than fines",2019-12-12 03:19:54+00:00,,,1204964064281186304,,https://twitter.com/icmyserenity/status/1204964064281186304,1,0,ZachWritesStuff,https://www.justice.gov/opa/pr/indivior-inc-indicted-fraudulently-marketing-prescription-opioid
"lol, wth was that?",2019-12-12 03:06:16+00:00,,,1204960632208068608,,https://twitter.com/icmyserenity/status/1204960632208068608,1,0,ZachWritesStuff,
seems to be the case w everyone ,2019-12-12 00:54:30+00:00,,,1204927470652264448,,https://twitter.com/icmyserenity/status/1204927470652264448,0,0,Mike_Selick,
"wow, this is great news from chief justice of . chief bivins is a bug recovery advocate, so i'm excited to see ehats coming",2019-12-11 23:14:59+00:00,,,1204902428711309312,@TNCourts,https://twitter.com/icmyserenity/status/1204902428711309312,0,0,momatate,https://twitter.com/momatate/status/1204838278647685120
"bupe is amazing, nothing re that med. this is more about shady marketing they (indivior) and previous producer of suboxone (rbg) both have super shady marketing. rbg has paid enormous settlements and fines to date and indivior has a trial coming up next year",2019-12-11 22:14:29+00:00,,,1204887201596747777,,https://twitter.com/icmyserenity/status/1204887201596747777,1,0,Mike_Selick,
"appreciate u & ur work immensely-i really wish u gave similar attention to indivior shady marketing as u do alkermes. i promote bupe daily, but we let them off hook in this area while we circle wagons on alkermes regularly. we can promote bupe &highlight shady bhvr simultaneously",2019-12-11 21:00:45+00:00,,,1204868647828762625,,https://twitter.com/icmyserenity/status/1204868647828762625,0,0,ZachWritesStuff,
alkermes has to bear there cross but its an industry issue. advocates gladly point out alkermes but not the massive trouble suboxone maker got in. you agree right?,2019-12-11 20:48:37+00:00,,,1204865594723651587,,https://twitter.com/icmyserenity/status/1204865594723651587,1,0,ZachWritesStuff,
i know what that was about. i'm talking about the next one. if we're going to talk about shady marketing let's talk about it,2019-12-11 20:47:16+00:00,,,1204865254775296000,,https://twitter.com/icmyserenity/status/1204865254775296000,0,0,ZachWritesStuff,
can we get the next on on indivior and their 500 million dollar fine for shady marketing please? seems they are company doing some shady marketing- half a billion worth,2019-12-11 20:44:29+00:00,,,1204864552946589697,,https://twitter.com/icmyserenity/status/1204864552946589697,1,0,HiJAction,
"for me, i just feel like we spend so much time on this specific topic, anger is unevenly applied, and it doesnt get us any closer to getting all options in jails, justice, etc. everyone knows bupe is easier to get on, has better mortality data, etc. but w alkermes, why are we...",2019-12-11 20:32:34+00:00,,,1204861553603993600,,https://twitter.com/icmyserenity/status/1204861553603993600,0,0,icmyserenity,
"yes, yes. maybe it's a little misleading, not that much and it's peanuts compared to otp and bupe taking up roughly 70%",2019-12-11 20:27:52+00:00,,,1204860372773154822,,https://twitter.com/icmyserenity/status/1204860372773154822,1,0,LeoBeletsky,
"i may need to save this thread, are we actually having a real conversation that's nuanced on twitter? maybe this should be the new topic ",2019-12-11 20:24:27+00:00,,,1204859513570025472,,https://twitter.com/icmyserenity/status/1204859513570025472,0,0,keithbrownmph,
fhaving only one option means that people some ppl who would have not been on it will be deemed appropriate when perhaps otherwise wouldn't have,2019-12-11 20:23:16+00:00,,,1204859212121223170,,https://twitter.com/icmyserenity/status/1204859212121223170,0,0,keithbrownmph,
"but coercion/punitive systems are a systemic issue, like pharma marketing u mentioned. alkermes isnt to blame for our punitive/coercive approach to sud. just feels like we are giving a whole system worth of blame to one tiny piece also, success? 2% market share is success?",2019-12-11 20:19:43+00:00,,,1204858320194023435,,https://twitter.com/icmyserenity/status/1204858320194023435,1,0,LeoBeletsky,
"i work relentlessly to get bupe in jail. unpopular opinion, we have to meet some organizations where they're at. some orgs would never go straight to bupe and i'm glad we had an option to get meds for oud/aud in quicker. or, we'd still be waiting w zero",2019-12-11 20:11:14+00:00,,,1204856185054208002,,https://twitter.com/icmyserenity/status/1204856185054208002,1,0,keithbrownmph,
"1. it may be for many, but it's not approp for all. need all options including naltrexone/vivitrol 2. everybody kills alkermes - nobody highlights indivior gross marketing. so much time dedicated to alkermes, barely a peep when that massive 500 million fine handed to indivior",2019-12-11 20:08:51+00:00,,,1204855586501877761,,https://twitter.com/icmyserenity/status/1204855586501877761,1,0,LeoBeletsky,
"all valid concerns. you can honestly say it feels like we have? i have literally never heard one national advocate highlight indivivior they way they crush alkermes. just feels crazy hypocritical. i spend every day advocating for bupe, but this really frustrates me",2019-12-11 20:01:49+00:00,,,1204853816690167813,,https://twitter.com/icmyserenity/status/1204853816690167813,2,0,keithbrownmph,
"it's an issue and it sgouldnt happen. but, many advocates in an effort to promote bupe dont give indivior same criticism on shady practice",2019-12-11 19:59:14+00:00,,,1204853166455570433,,https://twitter.com/icmyserenity/status/1204853166455570433,0,0,Ericmoss,
"in other news, indivior also just paid 500 million for shady marketing, so let's not act like it's one company. advocates have done a terrible job of acting like it's a alkermes issue when its rampant- but nobody mentions the golden child indivior, ever.",2019-12-11 19:52:13+00:00,,,1204851401077272586,,https://twitter.com/icmyserenity/status/1204851401077272586,2,1,keithbrownmph,
"i hear the concerns, but vivitrol's market share is small to begin. in in its <2% of meds prescribed for oud. also, i never hear advocates talk about indivior who just paid over $500 million for their marketing malpractice! let's talk about all shady marketing not 1 company",2019-12-11 19:44:56+00:00,,,1204849568715812864,,https://twitter.com/icmyserenity/status/1204849568715812864,2,0,LeoBeletsky,
devastating but not terribly surprising,2019-12-11 00:36:07+00:00,,,1204560457106890752,,https://twitter.com/icmyserenity/status/1204560457106890752,1,0,shonhopwood,https://twitter.com/shonhopwood/status/1204489634744590341
recoverygoals,2019-12-09 23:44:06+00:00,,#recoverygoals,1204184980194242560,,https://twitter.com/icmyserenity/status/1204184980194242560,0,0,ShellyWeizman,
"no blame, restricting access to clean needles increases both. sorry, not *you*, restrictions as a whole. also, i'm talking about communicable disease not addiction",2019-12-09 20:28:08+00:00,,,1204135664683495434,,https://twitter.com/icmyserenity/status/1204135664683495434,0,0,CrazyRxMan,
your helping spread hiv/aids and hep c if you dont.,2019-12-09 18:02:25+00:00,,,1204098992209969152,,https://twitter.com/icmyserenity/status/1204098992209969152,1,0,CrazyRxMan,
https://twitter.com/rdashford/status/1203825571232399365,2019-12-09 02:24:44+00:00,,,1203863015478747136,,https://twitter.com/icmyserenity/status/1203863015478747136,0,0,,https://twitter.com/RDashford/status/1203825571232399365
wonder if those 200k ppl know how much time and $$he gives to the  and speaking to kids about this topic across the country. he's been giving back for over a decade. hate and resentment will corrode your soul - forgiveness,2019-12-09 02:22:55+00:00,,#forgiveness,1203862559771832320,@HumaneSociety,https://twitter.com/icmyserenity/status/1203862559771832320,0,0,SInow,
"that's how you bring the heat  ! indiana just ended pa in the last couple years- as is mentioned, support from major state health agencies was key",2019-12-09 02:14:07+00:00,,,1203860343304413184,@Gail_G_Scott,https://twitter.com/icmyserenity/status/1203860343304413184,0,0,Gail_G_Scott,
"big big differences between possession and dui. i can't imagine a scenario that i would support less consequence for dui, but simple possession is another story. we shld funnel to tx with a summons to appear to verify. simple possession and paraphernalia needs an adjustment",2019-12-07 22:13:01+00:00,,,1203437281606025216,,https://twitter.com/icmyserenity/status/1203437281606025216,0,0,thescottjwatson,
"great insight here. i agree. i have advocated for addxn as disease bc is was a way to get away from moral. also, at a macro level, disease theory helps put system in place for chronic care vs acute that we know doesnt work. it's about systems for me moreso than classification",2019-12-07 21:28:30+00:00,,,1203426079270150144,,https://twitter.com/icmyserenity/status/1203426079270150144,0,1,PatrickDoyle_35,
"this is amazing, congrats!",2019-12-07 16:52:13+00:00,,,1203356551504957441,,https://twitter.com/icmyserenity/status/1203356551504957441,0,0,Recovery_ABrown,
 ,2019-12-06 21:48:47+00:00,,,1203068794626818050,,https://twitter.com/icmyserenity/status/1203068794626818050,0,0,Lb_Sterling,
stop giving job titles. why do we have accountants or marketers or anything else,2019-12-06 21:46:51+00:00,,,1203068308897124353,,https://twitter.com/icmyserenity/status/1203068308897124353,0,0,Lb_Sterling,
we dont.,2019-12-06 21:44:20+00:00,,,1203067674240135171,,https://twitter.com/icmyserenity/status/1203067674240135171,1,0,Lb_Sterling,
"exactly my point (mostly, but i did learn some of it in college. learned to be timely cause my grades slipped). all ppl need them, so why is it a bad thing to teach peers? it's not always about making ppl conform, sometimes just providing some skills",2019-12-06 21:41:01+00:00,,,1203066842471903233,,https://twitter.com/icmyserenity/status/1203066842471903233,1,0,Lb_Sterling,
i didnt need re educated....i needed educated. i had a 9 grade education and never learned the basics,2019-12-06 21:32:02+00:00,,,1203064579737174016,,https://twitter.com/icmyserenity/status/1203064579737174016,0,0,Lb_Sterling,
"...of this as i got my hse and some education in my 30s. but it didnt just happen naturally, i needed help",2019-12-06 21:30:55+00:00,,,1203064298731429888,,https://twitter.com/icmyserenity/status/1203064298731429888,1,0,icmyserenity,
"i (as a peer) didnt have great communication, i wasnt timely, and needed some overall basics. i see it a lot as people start operating within a world that sets meetings and things are done on schedules. i (and many others) just need some basics. i did end up learning a bunch of",2019-12-06 21:29:54+00:00,,,1203064042274852866,,https://twitter.com/icmyserenity/status/1203064042274852866,1,0,Lb_Sterling,
"i hear you about not wanting to professionalize peers and stick them into existing systems vs. community based where they belong, however, many peers lack basic soft skills and need this type of training to operate. assimilating to bh or just learning skills to operate in world?",2019-12-06 21:14:17+00:00,,,1203060114783113217,,https://twitter.com/icmyserenity/status/1203060114783113217,1,0,BrookeM_Feldman,
great group that's using innovative ways to teach our future professionals. thanks  for all you do and especially for getting the recovery voice engaged,2019-12-06 17:42:31+00:00,,,1203006821117702145,@ipectr,https://twitter.com/icmyserenity/status/1203006821117702145,0,0,ipectr,https://twitter.com/ipectr/status/1202991590169464833
"so excited to be involved in the 's upcoming fix exhibit. humbling that they would ask me to write something, here it is...",2019-12-05 16:44:10+00:00,,,1202629747207000064,@IndianaMuseum,https://twitter.com/icmyserenity/status/1202629747207000064,0,1,IndianaMuseum,https://twitter.com/IndianaMuseum/status/1202373265781428227
our community and our state are a better and healthier place because of your leadership. thanks  and  for all you do and will continue to do!,2019-12-05 15:57:34+00:00,,,1202618019320651776,@CHNw @millschnw,https://twitter.com/icmyserenity/status/1202618019320651776,0,0,millschnw,https://twitter.com/millschnw/status/1202611419784646656
"thanks  for helping those incarcerated get help. while we would like everyone to get help in the community, we have to help those in the justice system also as they transition to the community.  was instrumental in getting this in motion, thank you! https://twitter.com/agcurtishill/status/1202334214198304769",2019-12-05 15:55:30+00:00,,,1202617499260456961,@AGCurtisHill @Loricroasdell,https://twitter.com/icmyserenity/status/1202617499260456961,0,0,,https://twitter.com/AGCurtisHill/status/1202334214198304769
this should be the case across the country. people in withdrawal be able to seek help at hospitals and safely go through detox,2019-12-05 14:56:21+00:00,,,1202602616779358208,,https://twitter.com/icmyserenity/status/1202602616779358208,0,0,Rak61Kent,https://twitter.com/Rak61Kent/status/1202395880952934400
. submitting letter to congress to xthexwaiver by removing federal requirements for waiver to prescribe life saving medicine,2019-12-04 03:29:02+00:00,,#xthexwaiver,1202067257192570880,@pewtrusts,https://twitter.com/icmyserenity/status/1202067257192570880,0,0,bethconnolly20,https://twitter.com/bethconnolly20/status/1201952990841704450
"i dont care much about pc...what i do care about is use of certain language resulting in more punitive actions. when clinicians and phd use abuse/abuser in charts, that client is more likely to get punitive interventions.",2019-12-03 23:14:42+00:00,,,1202003251845042178,,https://twitter.com/icmyserenity/status/1202003251845042178,0,0,thescottjwatson,
people can chew gum and walk at the same time.,2019-12-03 23:12:03+00:00,,,1202002587303784448,,https://twitter.com/icmyserenity/status/1202002587303784448,1,0,thescottjwatson,
peersupportservices matter,2019-12-03 22:30:06+00:00,,#peersupportservices,1201992029921796097,,https://twitter.com/icmyserenity/status/1201992029921796097,0,0,DrSarahWakeman,https://twitter.com/DrSarahWakeman/status/1201887167380779008
great stuff especially for my advocacy groups...,2019-12-03 22:09:09+00:00,,,1201986756700246016,,https://twitter.com/icmyserenity/status/1201986756700246016,1,0,UnityRCO,https://twitter.com/UnityRCO/status/1201865531474755584
"and theres one in austin, indiana where this happened at. also a rec6org called thrive that helps folks w hr and recovery resources. https://facebook.com/events/886858801687268/?ti=cl",2019-12-03 16:45:39+00:00,,,1201905345754468352,,https://twitter.com/icmyserenity/status/1201905345754468352,0,0,ZachWritesStuff,https://facebook.com/events/886858801687268/?ti=cl
law enforcement diversion...pushing ppl w possession straight into treatment instead of jail helps everyone. still have option for charges if they refuse treatment. this is putting public health first,2019-12-03 13:28:30+00:00,,,1201855731827462144,,https://twitter.com/icmyserenity/status/1201855731827462144,0,0,BrookeM_Feldman,https://twitter.com/BrookeM_Feldman/status/1201851702456045569
congrats! i can only imagine the number of lives that you are going to positively impact.,2019-12-02 23:36:37+00:00,,,1201646382437797888,,https://twitter.com/icmyserenity/status/1201646382437797888,0,0,JonGiftosMD,
