text,date,geo,hashtags,tweet_id,mentions,permalink,replies,retweets,replies_to,mentioned_urls
"yes, what's considered violent pretty broad now. fleeing is considered violent and so is resisting law enforcement. you're probably not going to see a bunch of strong-armed robbery get approved unless it's plugged to something else",2020-02-27 22:52:56+00:00,,,1233163130739527680,,https://twitter.com/icmyserenity/status/1233163130739527680,1,0,davidewlucas,
they're at*,2020-02-27 21:37:07+00:00,,,1233144053539143682,,https://twitter.com/icmyserenity/status/1233144053539143682,1,0,icmyserenity,
"we need folks to beat the drum about ideals, goals, & inadequacies of current systems. we also need people working w current systems who use motivational interviewing for organizations and meet them where their at. big change doesnt happen overnight, its incremental - like w ppl",2020-02-27 21:36:17+00:00,,,1233143842364383232,,https://twitter.com/icmyserenity/status/1233143842364383232,1,0,icmyserenity,
"moud is an example- every federal funded dc has to do meds, yet ppl say regularly dc dont do meds. the new njotf is amazing - meds, peers, interdisciplinary teams, trauma informed care, etc. massive changes in judicial training. i'll focus on these great improvements/solutions",2020-02-27 21:25:10+00:00,,,1233141046537859072,,https://twitter.com/icmyserenity/status/1233141046537859072,1,0,icmyserenity,
to operate in current climate. drug courts are especially useful for violent offenders that would for sure be in prison otherwise. clearly low level drug offenses should be in community. everyone that's seen a couple dcs uses that as how all operate. bad info spreads like fire,2020-02-27 21:22:22+00:00,,,1233140340032516098,,https://twitter.com/icmyserenity/status/1233140340032516098,2,0,icmyserenity,
".  says it best, if you've seen one drug court, you've seen one drug court. also, have you looked at the new recommendations from national judicial opioid task force? easy to oversimplify a complex issue. criminalization isnt going away anytime soon, so we still have",2020-02-27 21:17:54+00:00,,,1233139215636090881,@jeff_deeney,https://twitter.com/icmyserenity/status/1233139215636090881,2,0,billkinkle,
thanks  and . this is why we need an expansion of the good samaritan law to protect those who overdose. arresting people for medical emergencies is inappropriate on so many levels.,2020-02-27 16:15:12+00:00,,,1233063039219458048,@indystar @nicolasterry,https://twitter.com/icmyserenity/status/1233063039219458048,1,2,nicolasterry,
"“are we enabling? yes,” yazel said, addressing senator concerns. “we are enabling access to a health care system that this population wouldn’t normally access.” https://twitter.com/phlu/status/1232735198242123778",2020-02-26 20:48:34+00:00,,,1232769446642622482,,https://twitter.com/icmyserenity/status/1232769446642622482,0,0,,https://twitter.com/phlu/status/1232735198242123778
hb 1182 passed out of senate health 11-0. on more hurdle,2020-02-26 15:00:58+00:00,,,1232681970070642690,,https://twitter.com/icmyserenity/status/1232681970070642690,1,0,,
"and the strong line up continues,  and  are making the case- stigma prevents syringe services. ""we are enabling- enabling people to access health care and recovery services"" ",2020-02-26 14:46:35+00:00,,,1232678349614518273,@bethkeeney @eyazel,https://twitter.com/icmyserenity/status/1232678349614518273,1,3,,
. testifying currently on hb 1182. bringing that to help improve systems,2020-02-26 14:39:26+00:00,,,1232676552342679554,@phlu,https://twitter.com/icmyserenity/status/1232676552342679554,1,1,,
. dr. box testifying on hb 1182 ammendment that extends syringe services in indiana. state really stepping up to remove any uncertainty going into last year. thank you!,2020-02-26 14:29:10+00:00,,,1232673967300907008,@StateHealthIN,https://twitter.com/icmyserenity/status/1232673967300907008,1,2,,
you should try it when there is reason to worry a it gets really intense,2020-02-25 20:12:28+00:00,,,1232397973457424387,,https://twitter.com/icmyserenity/status/1232397973457424387,0,0,bcuban,
excited to share some experience on how stigma impacts people getting into treatment and the ongoing barriers it creates in recovery,2020-02-24 16:34:10+00:00,,,1231980650158227460,,https://twitter.com/icmyserenity/status/1231980650158227460,0,0,IUImpact,https://twitter.com/IUImpact/status/1231580765923790849
"we were told to try to limit the other change. we were recommended to keep same toys, blankets, soothing items at the forefront. this helped limit the change to just the physical location. it seemed to work, she didnt have any issues w move",2020-02-24 14:00:13+00:00,,,1231941906701148171,,https://twitter.com/icmyserenity/status/1231941906701148171,0,0,RDashford,
next thursday courageous conversations at the indianamuseum! love anytime i get to hangout with with trailblazer justin.phillips.37201  state museum https://www.instagram.com/p/b816vukgnxx/?igshid=1ag40dkfspryq,2020-02-21 20:33:01+00:00,,,1230953593576054785,,https://twitter.com/icmyserenity/status/1230953593576054785,0,0,,https://www.instagram.com/p/B816vuKgnXX/?igshid=1ag40dkfspryq
inconsistency is part of issue - i know many who have paid severe consequences (prison) for unscheduled stop at walmart. certainly theres something on middle of no consequence and prison,2020-02-19 21:33:01+00:00,,,1230243916210982912,,https://twitter.com/icmyserenity/status/1230243916210982912,0,0,thescottjwatson,
not much if any,2020-02-18 01:03:23+00:00,,,1229572083245604864,,https://twitter.com/icmyserenity/status/1229572083245604864,0,1,nicolasterry,
i've been in a couple settings with director carroll and he most definitely will. my thoughts heading into the meeting of what it would be like were wildly off - probably from places like twitter. ,2020-02-18 00:59:31+00:00,,,1229571110821400578,,https://twitter.com/icmyserenity/status/1229571110821400578,0,0,missourinetwork,
 ,2020-02-14 20:09:14+00:00,,,1228410895145062407,@ailahoss @nicolasterry,https://twitter.com/icmyserenity/status/1228410895145062407,0,0,prof_goldberg,
"so...epinephrine, the band aid of anaphylaxis. maybe we should get rid of epi pens so people take their peanut allergies more serious - thatll teach em",2020-02-14 15:51:10+00:00,,,1228345948780351488,,https://twitter.com/icmyserenity/status/1228345948780351488,0,0,wesxmichaels,
". cares. their leadership, , is always hyperfocused on making sure we are healthy. this is not an us or them issue, we need a healthy state. thank you!",2020-02-14 15:35:39+00:00,,,1228342045024104449,@FSSAIndiana @confectionsmd,https://twitter.com/icmyserenity/status/1228342045024104449,0,0,FSSAIndiana,https://twitter.com/FSSAIndiana/status/1228318811608186883
flex! congrats,2020-02-14 15:13:07+00:00,,,1228336373041631233,,https://twitter.com/icmyserenity/status/1228336373041631233,0,0,traceyh415,
welcome ! follow  and  to round out  and  when it comes to policy. not to mention  for recovery science and  to learn how to use privilege in a positive manner.,2020-02-12 21:00:09+00:00,,,1227698929971712001,@dr_aviv @nicolasterry @ailahoss @LeoBeletsky @coreysdavis @RDashford @BrookeM_Feldman,https://twitter.com/icmyserenity/status/1227698929971712001,2,1,billkinkle,
simple- people will stop calling 911 if they are going to go to jail = more overdose deaths,2020-02-12 19:45:14+00:00,,,1227680078034866177,,https://twitter.com/icmyserenity/status/1227680078034866177,0,2,Ericmoss,https://twitter.com/Ericmoss/status/1227679498759524353
"turn that frown upside down....helping provide continuing ed to physicians so they learn about recovery residences, recovery orgs, support groups, and peers is a tremendous thing!",2020-02-12 00:58:41+00:00,,,1227396571672842240,,https://twitter.com/icmyserenity/status/1227396571672842240,0,0,thescottjwatson,
"the inchamberday being kicked off by , getting ready for general john kelly! https://twitter.com/indianachamber/status/1227375382170624001",2020-02-12 00:13:26+00:00,,#INChamberDay,1227385184267505664,@GovHolcomb,https://twitter.com/icmyserenity/status/1227385184267505664,0,0,,https://twitter.com/IndianaChamber/status/1227375382170624001
lot of work to be done but this is a good sign...,2020-02-11 23:54:42+00:00,,,1227380472201785345,,https://twitter.com/icmyserenity/status/1227380472201785345,0,0,INDrugCzar,https://twitter.com/INDrugCzar/status/1227338313767538690
come hang out....,2020-02-11 15:54:55+00:00,,,1227259728654454784,,https://twitter.com/icmyserenity/status/1227259728654454784,1,1,IndianaOUDecho,https://twitter.com/IndianaOUDecho/status/1227244411756646400
archie... there's no good to offset the terrible,2020-02-11 13:14:12+00:00,,,1227219283916267523,,https://twitter.com/icmyserenity/status/1227219283916267523,0,0,thescottjwatson,
you're more in middle than i - i just saw 35 billion (largest i've ever seen) that was split 18 b for treatment related stuff and 17 b for leo - also first time that it's not going all to leo. i'll have to dig in more,2020-02-10 19:23:35+00:00,,,1226949854569652224,,https://twitter.com/icmyserenity/status/1226949854569652224,1,0,SlingshotDC,
"isnt this the budget the largest ever? also, i thought it was first time more money was spent on prevention, treatment, and recovery compared to law enforcement. what am i missing? thought this was good - more money and better distribution. help",2020-02-10 19:05:36+00:00,,,1226945329926492162,,https://twitter.com/icmyserenity/status/1226945329926492162,1,0,SlingshotDC,
"theres no one strategy. some ppl may need just for w/d but others may need for extended periods. physical dependence 1 small piece of addxn. it can take yrs time resolve housing, job, relationships, etc. giving ppl med that reduces craving/relapse/death is vital during this time",2020-02-09 19:23:22+00:00,,,1226587411758690305,,https://twitter.com/icmyserenity/status/1226587411758690305,0,0,HeartburnDrew,
"""although small and not conclusive"" took me all of 2 seconds to read - i guess we disagree what should be promoting. again, agree w overall point of reliance in archaic tx, but would never promote ""small and not conclusive""",2020-02-09 14:23:56+00:00,,,1226512058373607424,,https://twitter.com/icmyserenity/status/1226512058373607424,0,0,BaDorfman,
"i agree with your larger point that would get stuck in outdated treatments for addiction and we need to think outside the box - specifically med intervention. maybe it's our different roles, but i could never want to promote something that we know there's not substantial evidence",2020-02-09 14:18:36+00:00,,,1226510713507794944,,https://twitter.com/icmyserenity/status/1226510713507794944,0,0,BaDorfman,
"i really enjoy what you bring - but using this as evidence base is well, you know, not",2020-02-09 14:16:32+00:00,,,1226510192893988865,,https://twitter.com/icmyserenity/status/1226510192893988865,0,0,BaDorfman,
thanks  - friendly reminder for just tweet readers - the withdrawal from just benzodiazepines can kill you too. love the highlight on how mixing is dangerous but benzodiazepines can be high risk alone too,2020-02-09 14:15:43+00:00,,,1226509988182528000,@ADAWnews,https://twitter.com/icmyserenity/status/1226509988182528000,0,1,ADAWnews,
"theres not a bunch of science and facts around topomax though? i'm all for you pointing out limitations of groups, but we're not saying topomax is the solution are we? i don't want you to be quiet, just share all that science",2020-02-09 03:18:40+00:00,,,1226344636106539008,,https://twitter.com/icmyserenity/status/1226344636106539008,0,0,BaDorfman,
"ur consigning topomax as a ""best treatment"" 4 methamphetamine ud? glad  found something that worked, but theres no solid evidence base for it, or anything else for methamphetamine. i'm all about criticizing throwing ppl in a room to fix addxn but pump breaks on the med",2020-02-09 03:11:39+00:00,,,1226342870799523840,@BaDorfman,https://twitter.com/icmyserenity/status/1226342870799523840,0,0,ZachWritesStuff,
"great night with my love, ! lod_yat was amazing- amazing job!  indy https://www.instagram.com/p/b8vgaqeaz9l/?igshid=1t4txskmli46w",2020-02-09 02:40:04+00:00,,,1226334923100954625,@jsexton76,https://twitter.com/icmyserenity/status/1226334923100954625,0,1,,https://www.instagram.com/p/B8VGaqEAz9L/?igshid=1t4txskmli46w
"i fight for med access daily but they but moud far from the only meaningful pathway to recovery. to reduce mortality for oud- yes but there are a bunch if ways that people find recovery. meds are vital, but this is not just a medical issue",2020-02-08 17:14:33+00:00,,,1226192606805266432,,https://twitter.com/icmyserenity/status/1226192606805266432,1,0,jameslbakermd,
"i agree, there is a massive need for legal aid and have been working with  for last couple years to increase access for those with sud - this is a big endorsement of that.  - bout time for us to get busy",2020-02-07 16:26:36+00:00,,,1225818150274506752,@LSCtweets @shannonmace,https://twitter.com/icmyserenity/status/1225818150274506752,0,1,Andrew_Perlman,https://twitter.com/Andrew_Perlman/status/1225542458232254466
"hard to get help when people are too ashamed to talk about it! grateful to talk about sud, how we handled crack cocaine epidemic, media, plight of chronic pain patients & recovery on  w/  ceo . fix exhibit touches on all this-amazing job!",2020-02-07 15:12:26+00:00,,,1225799485512724510,@AllinIndiana @IndianaMuseum @cathryn_ferree,https://twitter.com/icmyserenity/status/1225799485512724510,0,0,AllinIndiana,https://twitter.com/AllinIndiana/status/1225521727268098049
the advisory board that was put together for strategy with  also had good recommendations but none were executed,2020-02-06 13:54:58+00:00,,,1225417604375904257,@GovChristie,https://twitter.com/icmyserenity/status/1225417604375904257,0,0,LeoBeletsky,
i'm sure it was a huge success! sometimes not blurting anything is a win!,2020-02-06 02:29:32+00:00,,,1225245108217487360,,https://twitter.com/icmyserenity/status/1225245108217487360,0,0,MoenchKelly,
"has nothing to do with recovery, public health intervention that is being stymied because of stigma",2020-02-04 18:28:02+00:00,,,1224761546053693444,,https://twitter.com/icmyserenity/status/1224761546053693444,0,0,thescottjwatson,
"it's never been the problem, but this is stigma at its finest and is literally a life-and-death topic as it relates to hiv and hep c.",2020-02-04 18:13:58+00:00,,,1224758008347070468,,https://twitter.com/icmyserenity/status/1224758008347070468,1,0,thescottjwatson,
looks like we have 27 meetings to have with senators this summer,2020-02-04 18:09:27+00:00,,,1224756872332398595,,https://twitter.com/icmyserenity/status/1224756872332398595,0,0,nicolasterry,
 - stigma is not a problem right?,2020-02-04 18:08:57+00:00,,,1224756744771031040,@thescottjwatson,https://twitter.com/icmyserenity/status/1224756744771031040,1,0,,
it's quite clear that we don't value drug users health as much as a general public. syringe services are a proven method to reduce hiv and hep c. disappointing to say least. indiana is better than this - don't tell me stigma isn't alive and well,2020-02-04 18:08:23+00:00,,,1224756600344403969,,https://twitter.com/icmyserenity/status/1224756600344403969,1,0,nicolasterry,https://twitter.com/nicolasterry/status/1224752848451391489
"even *if he had* smoked, why are we kicking kids out of school for it? how about some help/resources? is it really a public health issue? bc we sure seem to take the punitive approach still. we may *talk* about treatment more but punishment is still the primary response",2020-02-03 01:50:54+00:00,,,1224148221297074176,,https://twitter.com/icmyserenity/status/1224148221297074176,2,2,DrRJKavanagh,https://twitter.com/DrRJKavanagh/status/1224081923745767427
"not much bothers me anymore, i assume some people will have a negative view of drug users, but the level of hate in this leaves even me with disbelief, wth is wrong with people.",2020-02-02 19:15:29+00:00,,,1224048712256819201,,https://twitter.com/icmyserenity/status/1224048712256819201,0,0,,
"you're too kind, thank you for all you do!",2020-02-02 01:43:18+00:00,,,1223783921667715074,,https://twitter.com/icmyserenity/status/1223783921667715074,0,0,b_dreiman,
great! cant wait to see you,2020-01-31 22:29:44+00:00,,,1223372822229241857,,https://twitter.com/icmyserenity/status/1223372822229241857,0,0,b_dreiman,
"great collaboration for this tremendous exhibit. thanks , justin phillips, and cathy ferree for your support and leadership.  fix exhibit is a must see. nothing else like it in the country, bravo https://twitter.com/iuimpact/status/1223263617753255937",2020-01-31 17:28:53+00:00,,,1223297108918329344,@GovHolcomb @IndianaMuseum,https://twitter.com/icmyserenity/status/1223297108918329344,1,2,,https://twitter.com/IUImpact/status/1223263617753255937
looks like we had the state covered between the two of us!,2020-01-31 02:54:21+00:00,,,1223077028024463362,,https://twitter.com/icmyserenity/status/1223077028024463362,0,0,bcuban,
3 days and counting...,2020-01-30 03:27:10+00:00,,,1222722897128689664,,https://twitter.com/icmyserenity/status/1222722897128689664,2,2,IndianaMuseum,https://twitter.com/IndianaMuseum/status/1222500924456947719
,2020-01-30 01:21:16+00:00,,,1222691215323344897,,https://twitter.com/icmyserenity/status/1222691215323344897,0,0,LeoBeletsky,
" that would be me - discussed needing more avenues away from incarceration &amp; off ramps at each intercept, especially 1/2. promoting moud in corrections /= promoting incarcerating ppl for tx. about giving access to those who will be in there either way so inmates dont have to",2020-01-30 01:17:31+00:00,,,1222690269713313792,,https://twitter.com/icmyserenity/status/1222690269713313792,1,1,LeoBeletsky,
preach something we can agree on,2020-01-29 03:36:19+00:00,,#preach,1222362812258844672,,https://twitter.com/icmyserenity/status/1222362812258844672,0,0,thescottjwatson,
,2020-01-28 20:14:50+00:00,,,1222251709583568919,,https://twitter.com/icmyserenity/status/1222251709583568919,1,0,jeff_deeney,
got an email last week about shield and to say i'm excited would be an understand ,2020-01-28 20:13:16+00:00,,,1222251314593353728,,https://twitter.com/icmyserenity/status/1222251314593353728,0,0,LeoBeletsky,
dont get caught on the menu! the first person/group to get sacrificed is the one w/o representation. thank you for helping speak for those most in need,2020-01-28 19:27:24+00:00,,,1222239771306741761,,https://twitter.com/icmyserenity/status/1222239771306741761,1,0,HorsePowerEv,
"flattered to be involved to help provide edu to officials from around country for tx in jail. 11 yrs ago, i waited 6 days for aspirin while going through opioid w/d in jail. that's now considered cruel & unusual punishment by courts, yet many places still do it. wearehumanbeings",2020-01-28 19:08:08+00:00,,#wearehumanbeings,1222234925002383360,,https://twitter.com/icmyserenity/status/1222234925002383360,0,5,shannonmace,https://twitter.com/shannonmace/status/1222195544015212544
i was much more active in this area until i realized much i was promoting paths was not readily available (specifically smart and refuge - even peer supports in some areas). i had to be more specific about what was available based on geography. what is available vs what ought 2b,2020-01-27 19:26:44+00:00,,,1221877214729375745,,https://twitter.com/icmyserenity/status/1221877214729375745,3,0,billkinkle,
countdown until the fix exhibit at the  on february 1st! recovery recoveryispossible wedorecover substanceusedisorders,2020-01-27 17:30:36+00:00,,#recovery #recoveryispossible #wedorecover #substanceusedisorders,1221847989809033219,@IndianaMuseum,https://twitter.com/icmyserenity/status/1221847989809033219,0,0,overdoselifelin,https://twitter.com/overdoselifelin/status/1221819347385102336
". was correcting a false narrative that ppl can overdose from simply touching fentanyl. a couple media falsly published that this was occurring which caused hysteria. problem is, its not possible. brandon hysteria ",2020-01-27 04:13:44+00:00,,,1221647454187200512,@b_dreiman,https://twitter.com/icmyserenity/status/1221647454187200512,1,0,EddieDubois,
" clearly you knew what i meant, but it was supposed to say "" thx for stopping spreading of bad info""",2020-01-27 04:10:33+00:00,,,1221646651548405765,,https://twitter.com/icmyserenity/status/1221646651548405765,0,0,b_dreiman,
"thanks for helping spread this false info brandon. its rampant, especially in your area unfortunately",2020-01-26 22:03:08+00:00,,,1221554189131767811,,https://twitter.com/icmyserenity/status/1221554189131767811,2,0,b_dreiman,
i was wondering - ,2020-01-26 16:10:18+00:00,,,1221465395594395648,,https://twitter.com/icmyserenity/status/1221465395594395648,0,0,ShellyWeizman,
"getting fired up to present on this! medications for oud in correctional settings with  via opioid response network . not an area i'm more passionate about! plus, i get to hang with  sally friedman (and try not to fanboy )",2020-01-26 02:35:56+00:00,,,1221260453160136711,@RhodeIslandDOC @AAAP1985 @lac_news,https://twitter.com/icmyserenity/status/1221260453160136711,3,0,,
"most of what is done(or not done) would be considered malpractice in other areas of health. not providing medication that reduces death by >50%, not sending/rx'ing od reversal drug w everyone who presents. sending od patients back out within hours of od with no plan or follow up",2020-01-26 02:13:57+00:00,,,1221254921388949505,,https://twitter.com/icmyserenity/status/1221254921388949505,0,2,billkinkle,
looking forward to it!,2020-01-25 19:05:22+00:00,,,1221147063204925440,,https://twitter.com/icmyserenity/status/1221147063204925440,0,0,IUImpact,https://twitter.com/IUImpact/status/1221081870059888640
thanks  for the update!,2020-01-23 16:43:24+00:00,,,1220386562615189506,@nicolasterry,https://twitter.com/icmyserenity/status/1220386562615189506,0,0,nicolasterry,https://twitter.com/nicolasterry/status/1220384981324828673
great microcosm of criminalizing simple possession. clearly this is not worth it? people are so fearful that they risk killing themselves to avoid arrest. who does this help?,2020-01-23 14:34:47+00:00,,,1220354193615151104,,https://twitter.com/icmyserenity/status/1220354193615151104,1,0,ZachWritesStuff,
"mj w fentanyl isnt a thing for several reasons. it doesnt make sense (ppl don't give away things worth value) and it literally wont work- too hot, the fentanyl degrades at 180 degrees.",2020-01-21 18:15:43+00:00,,,1219685016256630784,,https://twitter.com/icmyserenity/status/1219685016256630784,0,0,obsteve1,https://twitter.com/obsteve1/status/1219357258351546369
love the addition of recovery cafe model to indiana recovery ecosystem. thanks  for supporting these initiatives. we bloom has been a huge asset to out communities,2020-01-21 16:52:49+00:00,,,1219664155160072202,@INDrugCzar,https://twitter.com/icmyserenity/status/1219664155160072202,0,0,INDrugCzar,https://twitter.com/INDrugCzar/status/1219657325872590848
sending you a dm,2020-01-20 01:02:10+00:00,,,1219062527067291649,,https://twitter.com/icmyserenity/status/1219062527067291649,0,0,RebelEclectic,
"alternative? pretty sure you dont think we should not expose students to different social supports. i hear you, but what's solution that improves current practice? i think students should experience all types of supports - aa, rcos, peer supports and syringe services, first hand",2020-01-18 17:28:17+00:00,,,1218585915871899649,,https://twitter.com/icmyserenity/status/1218585915871899649,3,0,billkinkle,
the lack of self awareness for those going into a line of airk to help others,2020-01-18 15:08:27+00:00,,,1218550727179755526,,https://twitter.com/icmyserenity/status/1218550727179755526,0,0,bcuban,
"i know that, you know that. but, the fiscal impact is more important for some (if not many)",2020-01-17 18:25:24+00:00,,,1218237903446429697,,https://twitter.com/icmyserenity/status/1218237903446429697,1,0,thescottjwatson,
"healthy people are in workforce, pay taxes, etc. that's way more important to some people than just helping bc it's the right thing to do. sad",2020-01-17 18:21:57+00:00,,,1218237035992973312,,https://twitter.com/icmyserenity/status/1218237035992973312,1,0,thescottjwatson,
messaging sad that it's this way but very true from . we need to message in a way that's effective and economic benefits are just that,2020-01-17 15:19:14+00:00,,#messaging,1218191051531476993,@Surgeon_General,https://twitter.com/icmyserenity/status/1218191051531476993,1,0,UnhealthyAlcDrg,https://twitter.com/UnhealthyAlcDrg/status/1218189143894872065
"this, like amy healthcare issue ",2020-01-16 02:30:10+00:00,,,1217635121572012034,,https://twitter.com/icmyserenity/status/1217635121572012034,0,0,sholtsford,https://twitter.com/sholtsford/status/1217560036341428229
everyone mark your calendar!,2020-01-15 14:01:56+00:00,,,1217446823398387714,,https://twitter.com/icmyserenity/status/1217446823398387714,0,0,INDrugCzar,https://twitter.com/INDrugCzar/status/1217212728097550342
"yes, at systems/macro level. this is main reason i will at times refer to as a disease or chronic condition. pushes systems and policy to offer tx that aligns w chronic instead of acute. doesnt always happen. also, this is prob more discriminating than stigma i guess",2020-01-14 03:08:38+00:00,,,1216920027837976577,,https://twitter.com/icmyserenity/status/1216920027837976577,1,0,billkinkle,
p.s...this isn't just shady tactics - they are indicted on criminal charges. this isnt about free market - its about criminal activity,2020-01-10 21:25:32+00:00,,,1215746520206790661,,https://twitter.com/icmyserenity/status/1215746520206790661,0,0,thescottjwatson,https://www.justice.gov/opa/pr/indivior-inc-indicted-fraudulently-marketing-prescription-opioid
