text,date,geo,hashtags,tweet_id,mentions,permalink,replies,retweets,replies_to,mentioned_urls
"that my back surgeon and new neurologist have requested so i can rebuild my muscles, i can still only walk a few feet before collapsing, that’s socialized heath care , wake up  and  and in the 1500 antarctica was lush and green yet england was not underwater",2019-12-01 17:20:20+00:00,,,1201189300806782977,@JoyAnnReid @AOC,https://twitter.com/larryrstreet/status/1201189300806782977,1,0,,
"socialism i health care st va hospital, i have been bedridden for two years solely because they gave me parkinson’s medicine that first destroyed my back muscles then my legs, i had zero strength left in my legs for a year and they refused to give me pain medicine",2019-12-01 17:20:20+00:00,,,1201189297443000320,,https://twitter.com/larryrstreet/status/1201189297443000320,1,0,,
"more black american babies than ever before, open borders brings in gang control like they have in mexico, california cities, are breeding the plague sickness and disease, all for votes ? when we are not taking care of americans or fixing roads or electric systems, and i have",2019-12-01 17:20:19+00:00,,,1201189294611816450,,https://twitter.com/larryrstreet/status/1201189294611816450,1,0,,
"son and whitey buldgers nephew made huge deals for nothing, tex’s and written darta prove corruption during elections on  china makes meth, and fentinal sells it to mexico that kills more americans that the last 3 wars, while democratic party wants to abort",2019-12-01 17:20:18+00:00,,,1201189292032352256,@realDonaldTrump,https://twitter.com/larryrstreet/status/1201189292032352256,1,0,,
"  look at obama att generals how one extend visa of russia woman so she could meet  , where did all our donations go to hatti, not one usable home was built, not one public drinking well, millions to clinton found biden son and joh kerry",2019-12-01 17:20:17+00:00,,,1201189284134342656,@JoyAnnReid @foxnewspolitics @DonaldJTrumpJr,https://twitter.com/larryrstreet/status/1201189284134342656,1,0,,
"  you seem to forget the irish slaves of barbados, irish slaves came before the blacks to america used as prostitution, and free labor , a roman slaves life span was 3 months, learn you history  white spaces were be headed for simple things",2019-12-01 17:02:43+00:00,,,1201184865955307523,@JoyAnnReid @foxnewspolitics @AOC,https://twitter.com/larryrstreet/status/1201184865955307523,0,0,,
" i grew up when we had real racism, when the democratic party was the kkk , we who listened to martin luther king us republicans agreed with him and we had a huge war to end slavery god dam it us founders on the union side loved america indian and our black brothers",2019-12-01 16:59:04+00:00,,,1201183947960569857,@JoyAnnReid,https://twitter.com/larryrstreet/status/1201183947960569857,0,0,,
"you on the left and cnn use opinion as facts you do not show the good or both sides , and when you try too you cut the right off you mute what they say or cut off there feed",2019-12-01 16:55:48+00:00,,,1201183124610306049,,https://twitter.com/larryrstreet/status/1201183124610306049,0,0,,
"  too bad you and  can’t open a history book and just like the new muslim who want the ottoman empire back , you all want history destroyed, that’s how we learn to not repeat mistakes of the past , or fall into a tyrannical socialism, nanny state",2019-12-01 16:55:47+00:00,,,1201183119317049344,@JoyAnnReid @foxnewspolitics @AOC,https://twitter.com/larryrstreet/status/1201183119317049344,1,0,,
" what i snd black friend tell me is who are the racist today are the blscks and race brokers, and dem party, and all of us were slaved, in history try opening a dam book, usa and england were first to stop muslim who were slaving blacks in africa spain last one !!",2019-12-01 16:50:15+00:00,,,1201181726229307397,@JoyAnnReid,https://twitter.com/larryrstreet/status/1201181726229307397,0,0,,
"    what democratics dont realize is free tax payer health care will be the exact same care we get st the va hospital, after being mistreated for two years and ginseng medicine that destroyed my back then leg muscles, hell n",2019-12-01 16:46:22+00:00,,,1201180749552115714,@JoyAnnReid @foxnewspolitics @DonaldJTrumpJr @GeraldoRivera,https://twitter.com/larryrstreet/status/1201180749552115714,0,0,,
"at least  shows one person from the left , main stream media makes up shit and presents it as fact, and never mention the good that has been done or all the corruption in the obama administration, clinton, obama, both att generals ,uranium, hatti bengazi",2019-12-01 16:36:59+00:00,,,1201178387395547140,@foxnewspolitics,https://twitter.com/larryrstreet/status/1201178387395547140,0,0,,
"and the democratic party is run by a communist who wants open borders they want to abort america children and kill us off with drugs , all to gain votes open borders and gangs and drugs are destroying america",2019-12-01 16:32:30+00:00,,,1201177263041069059,,https://twitter.com/larryrstreet/status/1201177263041069059,0,0,NWhawks25,
"you and the socialist run democratic party are the true threat to america, to jobs to our rights to live as free as possible in this world, you dems want total control of lives and a nanny state",2019-12-01 16:29:19+00:00,,,1201176459097911296,,https://twitter.com/larryrstreet/status/1201176459097911296,0,0,JoeBiden,
"your son and john kerrys son and whitey bulgers nephew, along with the clinton foundation and all our donations to hatti, then obamas att gen and fbi gave complete immunity to all staff, extended visa for russia women to meet  democratic are corrupt",2019-12-01 16:27:11+00:00,,,1201175923913043970,@DonaldJTrumpJr,https://twitter.com/larryrstreet/status/1201175923913043970,0,0,JoeBiden,
"wow i guess you people on the left just refuse to learn or see actual facts in writing, real written or cell phone tex prof of the facts because you listen to conspiracy theory media like rachell mad cow",2019-12-01 16:23:31+00:00,,,1201175001770135552,,https://twitter.com/larryrstreet/status/1201175001770135552,0,0,AndyOstroy,
" we who lived through real racism know it was over mostly, it is the democratic party that and media that’s brought it back .cheryl barnes - easy to be hard (hq sound) https://youtu.be/sfz26rhiqbu via ",2019-12-01 16:20:12+00:00,,,1201174166440939520,@GeraldoRivera @YouTube,https://twitter.com/larryrstreet/status/1201174166440939520,0,0,,https://youtu.be/SFz26RhIqbU
 it’s you and the socialist democratic party who brought back racism.cheryl barnes - easy to be hard (hq sound) https://youtu.be/sfz26rhiqbu via ,2019-12-01 16:17:54+00:00,,,1201173587417292801,@JoyAnnReid @YouTube,https://twitter.com/larryrstreet/status/1201173587417292801,0,0,,https://youtu.be/SFz26RhIqbU
"actually she does report the facts, what most of these people on the left if you noticed repeat what cnn says and the opinion of rachell madcow who makes everything up, just like each and every mainstream media have extract same tag lines or democratic talking points",2019-11-30 22:23:06+00:00,,,1200903105619124225,,https://twitter.com/larryrstreet/status/1200903105619124225,0,0,MichelleGlavan,
show me,2019-11-29 21:38:52+00:00,,,1200529583386382338,,https://twitter.com/larryrstreet/status/1200529583386382338,0,0,Angelin45393874,
dam your friend on the left is stacked,2019-11-29 21:38:30+00:00,,,1200529492265054209,,https://twitter.com/larryrstreet/status/1200529492265054209,0,0,THmurova,
wish it had your voice on it,2019-11-29 21:37:04+00:00,,,1200529132519641090,,https://twitter.com/larryrstreet/status/1200529132519641090,0,0,Bigbootyvanessa,
"a lot st girls just can’t ride they give out way too soon , but how come i see one dark haired girl with tiny tits and amthe main one with blonde with big tits",2019-11-29 21:36:10+00:00,,,1200528906731823106,,https://twitter.com/larryrstreet/status/1200528906731823106,0,0,Bigbootyvanessa,
you got s perfect body love,2019-11-29 21:03:27+00:00,,,1200520673644490752,,https://twitter.com/larryrstreet/status/1200520673644490752,0,0,naughty_babe015,
does this mean ur not single,2019-11-29 20:58:35+00:00,,,1200519448345661441,,https://twitter.com/larryrstreet/status/1200519448345661441,0,0,http_daddyy,
now that’s fore play baby,2019-11-29 20:56:51+00:00,,,1200519010313547776,,https://twitter.com/larryrstreet/status/1200519010313547776,0,0,SexualDaiIy,
see no neighbor here,2019-11-29 20:55:55+00:00,,,1200518775898025984,,https://twitter.com/larryrstreet/status/1200518775898025984,0,0,naughty_babe015,
"well i have 30 acres you can take as many selfys out in my woods u want too , i have hunting stands to hunt or just watch wildlife and 4 wheelers and trails",2019-11-29 20:55:16+00:00,,,1200518613641449474,,https://twitter.com/larryrstreet/status/1200518613641449474,0,0,naughty_babe015,
hey i sent u a few messages i guess u don’t check them much like me too lol,2019-11-29 20:52:21+00:00,,,1200517876983255041,,https://twitter.com/larryrstreet/status/1200517876983255041,0,0,secretfrs,
you leave her alone too long you need a stay at home man like me lol,2019-11-29 17:24:42+00:00,,,1200465623232458752,,https://twitter.com/larryrstreet/status/1200465623232458752,0,0,krwwbwb33,
yea guess what they all fit one or another automatic rifle,2019-11-29 17:22:45+00:00,,,1200465131521675264,,https://twitter.com/larryrstreet/status/1200465131521675264,0,0,krwwbwb33,
"both looks are beautiful, but i like the less in more one",2019-11-29 17:21:10+00:00,,,1200464731863224320,,https://twitter.com/larryrstreet/status/1200464731863224320,0,0,krwwbwb33,
you look so much like my twitter buddy kristy swanson the actress,2019-11-29 15:30:56+00:00,,,1200436991558660096,,https://twitter.com/larryrstreet/status/1200436991558660096,0,0,secretfrs,
love your perfect skin too beautiful body and face,2019-11-29 15:29:00+00:00,,,1200436505086480387,,https://twitter.com/larryrstreet/status/1200436505086480387,0,0,secretfrs,
yea but i live for that shake,2019-11-29 15:28:22+00:00,,,1200436345115680771,,https://twitter.com/larryrstreet/status/1200436345115680771,0,0,secretfrs,
"of course i would, i’d eat that ass up",2019-11-29 15:27:29+00:00,,,1200436122834415616,,https://twitter.com/larryrstreet/status/1200436122834415616,0,0,secretfrs,
i would let u have the spare room if you want to keep doing what your doing,2019-11-29 15:26:29+00:00,,,1200435872539299841,,https://twitter.com/larryrstreet/status/1200435872539299841,0,0,secretfrs,
"love that tiny waist and tight butt girl , and how beautiful you are wish i could wake up with ya",2019-11-29 15:25:42+00:00,,,1200435674366849026,,https://twitter.com/larryrstreet/status/1200435674366849026,0,0,secretfrs,
i love a woman with nice breasts and a normal sized butt i have never been a huge ass kinda guy,2019-11-29 15:24:39+00:00,,,1200435412449316864,,https://twitter.com/larryrstreet/status/1200435412449316864,0,0,secretfrs,
i love that sexy hot body and amazing face u got baby doll,2019-11-29 15:23:20+00:00,,,1200435080675635201,,https://twitter.com/larryrstreet/status/1200435080675635201,0,0,secretfrs,
i would much rather have you to wake up with every day and make love too,2019-11-29 15:21:38+00:00,,,1200434651782897664,,https://twitter.com/larryrstreet/status/1200434651782897664,0,0,secretfrs,
any time u like love ,2019-11-29 15:21:00+00:00,,,1200434491568861191,,https://twitter.com/larryrstreet/status/1200434491568861191,0,0,secretfrs,
"i definitely would love to move you in and have amazing sex every day , it would be wild making you squirt lol",2019-11-29 15:20:12+00:00,,,1200434288803688449,,https://twitter.com/larryrstreet/status/1200434288803688449,0,0,secretfrs,
your so beautiful,2019-11-29 08:35:47+00:00,,,1200332514600136705,,https://twitter.com/larryrstreet/status/1200332514600136705,0,0,secretfrs,
you know i love those,2019-11-29 08:34:09+00:00,,,1200332103591833600,,https://twitter.com/larryrstreet/status/1200332103591833600,0,0,secretfrs,
hey gorgeous,2019-11-29 07:56:01+00:00,,,1200322509750624257,,https://twitter.com/larryrstreet/status/1200322509750624257,0,0,alice61235188,
"wow it’s chins who make it and ships it to mexico that’s the stupidest thing i have ever heard anyone say in my entire life ,how does a dealer work they get you hooked tasing you sell beg borrow or steal or kill for it dumb ass , the meth and herione use was minor before, we",2019-11-29 07:41:34+00:00,,,1200318871313506304,,https://twitter.com/larryrstreet/status/1200318871313506304,0,0,warrentr,
yea i’m like that with just the cheap ass jello cheese cake only i put appel or blueberry on it or a extra can of cherry and spread it out in a bigger pans and just have one oice a day or it eats up my stomach,2019-11-29 07:29:31+00:00,,,1200315839284699138,,https://twitter.com/larryrstreet/status/1200315839284699138,0,0,,
"what part where hollywood lives with armed guard in gatted community and have lived sheltered lives , had the best medical and best protection while more have died from china meth and fentinal that in all 3 wars",2019-11-29 07:21:46+00:00,,,1200313889541500928,,https://twitter.com/larryrstreet/status/1200313889541500928,1,0,warrentr,
i think you would look better in her outfit,2019-11-29 07:18:15+00:00,,,1200313005688446976,,https://twitter.com/larryrstreet/status/1200313005688446976,0,0,Emily51044815,
are you in mexico or america,2019-11-29 05:54:41+00:00,,,1200291975125241856,,https://twitter.com/larryrstreet/status/1200291975125241856,1,0,An_geliii,
i like your dark hair more,2019-11-29 05:53:49+00:00,,,1200291757507956736,,https://twitter.com/larryrstreet/status/1200291757507956736,1,0,Miki_Michelle_,
so happy,2019-11-29 05:53:18+00:00,,,1200291624602996737,,https://twitter.com/larryrstreet/status/1200291624602996737,0,0,jec_98,
too bad your not still in tennessee baby doll,2019-11-29 05:52:21+00:00,,,1200291387591278592,,https://twitter.com/larryrstreet/status/1200291387591278592,0,0,Eden85677418,
great enough to marry,2019-11-29 05:51:05+00:00,,,1200291065900740609,,https://twitter.com/larryrstreet/status/1200291065900740609,0,0,jessica_bonomi,
   easy to be hard https://youtu.be/acs1rkaxz9o via  our race problems were over years ago and us who were there during that time as children know the truth,2019-11-29 05:42:14+00:00,,,1200288841665568768,@songbirdwannabe @Alyssa_Milano @AOC @YouTube,https://twitter.com/larryrstreet/status/1200288841665568768,0,0,,https://youtu.be/aCs1rkAXZ9o
"   pledge of allegiance, word-by-word meaning explained by red skelton (he ... https://youtu.be/hjnl_rhgdq4 via ",2019-11-29 05:40:12+00:00,,,1200288329276776448,@songbirdwannabe @Alyssa_Milano @AOC @YouTube,https://twitter.com/larryrstreet/status/1200288329276776448,0,0,,https://youtu.be/hJNL_rhGDq4
,2019-11-29 05:38:48+00:00,,,1200287978419052544,,https://twitter.com/larryrstreet/status/1200287978419052544,0,0,,https://youtu.be/UfiCvakz3NI
"what kills me is how bruce jenner’s kid who manufactures nothing who provides zero real jobs is worth a billion dollars , why because while underage she walked around in see through tops always, and got huge contracts while those like burt reynolds and stalione made tons movies",2019-11-29 05:32:32+00:00,,,1200286398626054144,,https://twitter.com/larryrstreet/status/1200286398626054144,0,0,songbirdwannabe,
"yea it says he didn’t kill his self , she is some actress i believe, and many would fall if he went to trial i believe clinton had the dnc staffer killed as well for leaking password",2019-11-29 05:25:22+00:00,,,1200284597529071617,,https://twitter.com/larryrstreet/status/1200284597529071617,1,0,songbirdwannabe,
"so who is that , and what’s the point of her breasts hanging out to him",2019-11-29 05:22:28+00:00,,,1200283866222739456,,https://twitter.com/larryrstreet/status/1200283866222739456,1,0,songbirdwannabe,
global warming is true but it’s not man made and when the earth was warm and antarctica was green it was mapped in the 1500s england was not underwater no was florida where the calossa indian still survived until the seminole brought sickness that killed most of them,2019-11-29 05:20:13+00:00,,,1200283301468090369,,https://twitter.com/larryrstreet/status/1200283301468090369,0,0,songbirdwannabe,
yes that’s exactly how her brain works,2019-11-29 05:16:43+00:00,,,1200282418495807488,,https://twitter.com/larryrstreet/status/1200282418495807488,0,0,songbirdwannabe,
is that you jazz,2019-11-29 05:15:05+00:00,,,1200282008305438721,,https://twitter.com/larryrstreet/status/1200282008305438721,1,0,songbirdwannabe,
thanks gorgeous,2019-11-29 05:13:23+00:00,,,1200281581165973504,,https://twitter.com/larryrstreet/status/1200281581165973504,1,0,songbirdwannabe,
"she is beautiful , and sexy and a ok actress but i made a movie with sean connery and that’s the easiest job ever, say three words and go back in a trailer for 3 hours until the next shot is set up , they get that gift and want us to live with open borders gangs drugs, radicals",2019-11-29 04:58:25+00:00,,,1200277813858844673,,https://twitter.com/larryrstreet/status/1200277813858844673,0,0,songbirdwannabe,
"yes most all of hollywood is because they are now way over paid and live protect lives, they don’t get it why we have a right to arms it’s not to hunt , it’s to fight our own government, those who say a war of this nature couldn’t be won don’t remember viet nam",2019-11-29 04:55:03+00:00,,,1200276964558422018,,https://twitter.com/larryrstreet/status/1200276964558422018,0,0,songbirdwannabe,
" these left wing freaks who have not learned history, don’t understand our right to bear arms military weapons is to fight against a nanny state a government of safe spaces , a tyrannical gov those that kill its people one way or another",2019-11-29 04:51:58+00:00,,,1200276192449978368,@KristySwansonXO,https://twitter.com/larryrstreet/status/1200276192449978368,0,0,,
"yes it’s one set of rules for democratic party and another for the party of the free man , the democratic pit one against another they create race problems, they don’t fix them , they seem to want drugs poring in usa that’s killed more people than 3 wars have or gun laws",2019-11-29 04:48:54+00:00,,,1200275416956710912,,https://twitter.com/larryrstreet/status/1200275416956710912,0,0,KristySwansonXO,
"she has grown up with armed guards all her life and tutors for teacher and the best health care ever , as a vet i guarantee you we have what social medicine is it would be it is the worst i was given parkinson’s medicine that destroyed my back then leg muscles over a year",2019-11-29 04:40:55+00:00,,,1200273409046921216,,https://twitter.com/larryrstreet/status/1200273409046921216,1,0,songbirdwannabe,
i’m just digging at her a little when she did those semi porns to ummm change the direction of her career lol,2019-11-29 04:38:12+00:00,,,1200272724792401920,,https://twitter.com/larryrstreet/status/1200272724792401920,1,0,songbirdwannabe,
"i will guarantee you they do not have two sets of books , it they can have added value via other items or improvements, actually there are probably 1 million reasons two things are not the same you morons",2019-11-29 04:05:42+00:00,,,1200264546415460352,,https://twitter.com/larryrstreet/status/1200264546415460352,1,0,Tomleegun,
when you go to h and r block and they find ways to save you 500$dies that mean you committed tax evasion,2019-11-29 04:02:57+00:00,,,1200263853403193344,,https://twitter.com/larryrstreet/status/1200263853403193344,0,0,leslies63961109,
"and what about equal representation under the constitution, so only the democratic party gets fair treatment or being let off completely by the obama administration, really is that how it works",2019-11-29 04:01:17+00:00,,,1200263433511428096,,https://twitter.com/larryrstreet/status/1200263433511428096,1,0,lars10_lc,
"that’s 100% wrong because each branch has this privilege, can you call in the supreme court judges law clerks to ask them how the judges make there decision , no just as you can’t do this to congress or senate unless ac2/3 majority votes to do so that’s the kaw ",2019-11-29 03:59:43+00:00,,,1200263043046879233,,https://twitter.com/larryrstreet/status/1200263043046879233,0,0,lars10_lc,
"at that time property rise to more than twice it real value , i saw this first hand in florida everyday, cheap property would go from 3 grand to 10 or 20 grand in days",2019-11-29 03:55:32+00:00,,,1200261989647474688,,https://twitter.com/larryrstreet/status/1200261989647474688,1,0,otto_maddoxx,
"we the other states not new york or california, wanted a real ball. buster who was not one of the swamp who would stand up to china killing our people with meth and fentinal and democratic did want a fence before, stop following freaks like ",2019-11-29 03:52:04+00:00,,,1200261117500633088,@AOC,https://twitter.com/larryrstreet/status/1200261117500633088,2,0,RockyMountViews,
we never saw transparency with obama what so ever and all of his staff and all clinton staff either had immunity or claimed the 5th or president privilege your memory’s remains very short and limited,2019-11-29 03:48:16+00:00,,,1200260159911669760,,https://twitter.com/larryrstreet/status/1200260159911669760,0,0,old_politik_exp,
a man that lies and was ripping off new york who was just as much a liar as the porn stars attorney yet you people choose to be brainwashed,2019-11-29 03:46:01+00:00,,,1200259591642198016,,https://twitter.com/larryrstreet/status/1200259591642198016,0,0,ClassicMP,
"not one person conferred with that but case woman who was pushed by dnc attorneys to believe her own fantasies, not one didn’t you watch , is it ok to ruin his life over a nut case , yet let off all off clinton staff with immunity,",2019-11-29 03:42:44+00:00,,,1200258767679561729,,https://twitter.com/larryrstreet/status/1200258767679561729,0,0,Durelle522,
"that is not why at all , the real truth is his taxes are done by accounts, who are responsible to the law, and his returns pass muster , he has to manage the trumo to brand and knowing his preal net worth is bad he is property rich not cash rich",2019-11-29 03:38:57+00:00,,,1200257813504765953,,https://twitter.com/larryrstreet/status/1200257813504765953,0,0,WHSCI,
"yes i have to agree, i am afraid too many with psd and other problems just go on disability, i am struggling with a severe brain injury but i had psd when i got out because i was cut from ear to ear by a bunk mate , by working i sorted it out",2019-11-29 03:25:29+00:00,,,1200254425002106886,,https://twitter.com/larryrstreet/status/1200254425002106886,0,0,HillaryClinton,
"you hollywood want socialism you don’t realize how crappy social medicine is us st the vs know they ignored me for a year then put me in parkinson’s medicine that destroyed my back then leg muscles for over a year , i still can’t barely walk , no choice, no one to tell on too",2019-11-29 03:21:55+00:00,,,1200253526603173894,,https://twitter.com/larryrstreet/status/1200253526603173894,0,0,GeorgeTakei,
"why do you on the left come up with these wild crazy thoughts, it is like crazy rachell madow who makes up nutty stories that you on the left believe as real , it only make the left look nuts like  who nod no history or how bad socialism is or how terrible social med is",2019-11-29 03:19:04+00:00,,,1200252809666531328,@AOC,https://twitter.com/larryrstreet/status/1200252809666531328,0,0,GeorgeTakei,
"thank you and your a husband he had been a light for many and so have you , god bless",2019-11-29 03:13:57+00:00,,,1200251522732449792,,https://twitter.com/larryrstreet/status/1200251522732449792,0,0,KimKardashian,
"you just have to understand more people have died from china drugs than guns or 3 wars , we do need a wall, and we don’t have security guards or gated community what so ever ok , and once gun right are gone all our rights are gone  read history and you understand",2019-11-29 03:12:17+00:00,,,1200251103918592000,@Alyssa_Milano,https://twitter.com/larryrstreet/status/1200251103918592000,0,0,Alyssa_Milano,
"when you drive through america in these country areas a cop may not make it to a home in say 45 minutes maybe a hour they run very limited staffing and only one person at night, we had murder even here, drug addicts who killed for 20$those who can’t defend themselves ok",2019-11-29 03:09:32+00:00,,,1200250412768645121,,https://twitter.com/larryrstreet/status/1200250412768645121,0,0,Alyssa_Milano,
" we do love you , i love you we just don’t want that america the new socialist democratic party has in store for us and america did need someone who strong or bull headed enough to stand up to china , who brings meth, fentinal , to kill our people , we need wall",2019-11-29 03:06:33+00:00,,,1200249661006778369,@Alyssa_Milano,https://twitter.com/larryrstreet/status/1200249661006778369,1,0,Alyssa_Milano,
you don’t need to get sick trying to tuff it out,2019-11-26 00:19:14+00:00,,,1199120390892785665,,https://twitter.com/larryrstreet/status/1199120390892785665,0,0,kay_may1,
"yea and she loves the socialist george soros, who has destroyed many life’s",2019-11-22 14:43:29+00:00,,,1197888333965332481,,https://twitter.com/larryrstreet/status/1197888333965332481,0,0,Alyssa_Milano,
"your right about this woman who was ambassador, and susan rice who has sooooo much love for socialist george soros",2019-11-22 08:21:10+00:00,,,1197792120331014144,,https://twitter.com/larryrstreet/status/1197792120331014144,0,0,realDonaldTrump,
"yea he will not ever admit any democratic has ever done anything wrong or illegal, he protects corruption by backing clinton and obama who double the debt that took 500 years",2019-11-20 14:29:04+00:00,,,1197159931851481088,,https://twitter.com/larryrstreet/status/1197159931851481088,0,0,WayneDupreeShow,
