text,date,geo,hashtags,tweet_id,mentions,permalink,replies,retweets,replies_to,mentioned_urls
 watching you in summer school again on pluto tv yeaaa your still that beautiful woman,2020-02-22 12:45:18+00:00,,,1231198277334425600,@kirstiealley,https://twitter.com/larryrstreet/status/1231198277334425600,0,0,,
yea i’m ready to move back to florida myself if i can get my house done,2020-02-22 12:41:28+00:00,,,1231197311621095424,,https://twitter.com/larryrstreet/status/1231197311621095424,0,0,MadisonMayX,
"i grade school we learned that planting more trees and wild grass is the best way to maintain that balance , because they breath in co2 and give us oxygen , why aren’t these activists planting wild grass",2020-02-22 09:46:03+00:00,,,1231153168672751616,,https://twitter.com/larryrstreet/status/1231153168672751616,0,0,Millerita,
"totally gross and disgusting she was once gorgeous and now a idiot, and a tattoo on your face is next to impossible to remove too and very painful, oh she can plaster makeup on to cover it but that’s plain dumb",2020-02-22 09:43:08+00:00,,,1231152434992513024,,https://twitter.com/larryrstreet/status/1231152434992513024,0,0,WayneDupreeShow,
"you need to make sure your getting every dime you can out if  and getting  full support, push them hard to end this tragedy now",2020-02-22 09:39:50+00:00,,,1231151604478496768,@senatemajldr @POTUS,https://twitter.com/larryrstreet/status/1231151604478496768,0,1,DeAnna4Congress,
"if anyone really cares they would be planting more wild grasses that’s what breathes in co2 and provides us with oxygen the most , we learned this in grade school",2020-02-22 09:36:35+00:00,,,1231150783103741952,,https://twitter.com/larryrstreet/status/1231150783103741952,0,0,bartholomewtali,
"yep and in the 15th century they mapped antarctica when it was lush and green , mnnn yet england and florida were not underwater and we had zero man made co2 global warming is the earths cycle to the sun co2 is what plants breath stop putting additives in gasoline",2020-02-22 09:33:46+00:00,,,1231150078355759111,,https://twitter.com/larryrstreet/status/1231150078355759111,0,0,Millerita,
god i love your crazy hair and everything about you i wish you could come to america,2020-02-17 12:00:31+00:00,,,1229375067370532865,,https://twitter.com/larryrstreet/status/1229375067370532865,0,0,naughtyclarkt,
clinton only gave out 7% of the foundation money to charity the rest went to payroll to her daughter to bill and george soros son who married clinton daughter and to staff who actually worked on her campaign,2020-02-14 02:45:53+00:00,,,1228148326006218753,,https://twitter.com/larryrstreet/status/1228148326006218753,0,0,UmaSaysWhat,
"you people amaze me when obama gave immunity to all of clinton’s staff whine going after all of trumps on bull crap charges, to get them to make shit up . it didn’t work when it was clinton’s and dnc who were involved with russia, just as she took in a few billion as sec of state",2020-02-14 02:43:19+00:00,,,1228147681232662528,,https://twitter.com/larryrstreet/status/1228147681232662528,0,0,UmaSaysWhat,
" could not see that if a star chamber trial that took place in the house of representatives, took place and to further that crime by voting for impeachment, any senator who did , was not following the law or the oath of office or the constitution whatsoever",2020-02-14 02:39:33+00:00,,,1228146733772832768,@SenatorRomney,https://twitter.com/larryrstreet/status/1228146733772832768,0,1,senatemajldr,
 debunking white privilege: the economic reality https://youtu.be/aohag9ufaki via ,2020-02-14 02:36:15+00:00,,,1228145902025674752,@TonopahDee @YouTube,https://twitter.com/larryrstreet/status/1228145902025674752,0,0,,https://youtu.be/AoHAG9UFaKI
debunking white privilege: the economic reality https://youtu.be/aohag9ufaki via ,2020-02-14 02:35:51+00:00,,,1228145799097389057,@YouTube,https://twitter.com/larryrstreet/status/1228145799097389057,0,0,,https://youtu.be/AoHAG9UFaKI
larry elder debunks michelle obama on white flight and racism | larry el... https://youtu.be/to8a6yae63c via ,2020-02-14 02:30:34+00:00,,,1228144470111260672,@YouTube,https://twitter.com/larryrstreet/status/1228144470111260672,0,0,,https://youtu.be/tO8a6yAE63c
white people bad (the media says so) https://youtu.be/7bbhymzvula via ,2020-02-14 02:27:55+00:00,,,1228143805892833280,@YouTube,https://twitter.com/larryrstreet/status/1228143805892833280,0,0,,https://youtu.be/7bbHymZVuLA
" black lives matter, racism a conservative perspective (pt. 2)| larry eld... https://youtu.be/piwabo6u43u via ",2020-02-14 02:22:59+00:00,,,1228142561556094976,@TonopahDee @YouTube,https://twitter.com/larryrstreet/status/1228142561556094976,0,0,,https://youtu.be/piwaBO6U43U
 david webb accused of 'white privilege' by cnn legal analyst https://youtu.be/balig2jw7sa via ,2020-02-14 02:20:12+00:00,,,1228141862172725248,@TonopahDee @YouTube,https://twitter.com/larryrstreet/status/1228141862172725248,0,0,,https://youtu.be/BAlig2jW7SA
 red skelton's pledge of allegiance https://youtu.be/ndnxcw6euie via ,2020-02-14 02:17:09+00:00,,,1228141094006935552,@TonopahDee @YouTube,https://twitter.com/larryrstreet/status/1228141094006935552,0,0,,https://youtu.be/nDnXcw6euIE
 easy to be hard https://youtu.be/acs1rkaxz9o via ,2020-02-14 02:16:16+00:00,,,1228140872052756480,@TonopahDee @YouTube,https://twitter.com/larryrstreet/status/1228140872052756480,0,0,,https://youtu.be/aCs1rkAXZ9o
   pastor kim clement prophesies that trump will win the 2020 elections https://youtu.be/r6niv0fn6ie via ,2020-02-14 02:15:17+00:00,,,1228140623481446400,@TonopahDee @SecretaryCarson @tedcruz @YouTube,https://twitter.com/larryrstreet/status/1228140623481446400,0,0,,https://youtu.be/r6niv0FN6iE
yea scary,2020-02-14 02:13:10+00:00,,,1228140093430550528,,https://twitter.com/larryrstreet/status/1228140093430550528,0,0,TonopahDee,
"obama was in the loop with the fbi lovers , this is bad, his attorney general personally extended the visa of the russia woman who met  to help set up the fake russia scam , all of  people had immunity while all of  were charged, made up crimes",2020-02-14 02:12:27+00:00,,,1228139910567276546,@DonaldJTrumpJr @HillaryClinton @POTUS,https://twitter.com/larryrstreet/status/1228139910567276546,0,0,TonopahDee,
"obama has the news media working for him as many in his staff were married to heads of mainstream news , and he and  connected and clinton daughter married soros son , now  has a  show of his own , he has not been silent he has been very busy",2020-02-14 02:08:35+00:00,,,1228138941112627201,@georgesoros @BarackObama @netflix,https://twitter.com/larryrstreet/status/1228138941112627201,0,0,TonopahDee,
i have.noticed lots of things i’ll state have been blocked or erased,2020-02-14 02:03:26+00:00,,,1228137644573577216,,https://twitter.com/larryrstreet/status/1228137644573577216,0,0,TonopahDee,
"wouldn’t let me attend these classes in jr high. and trade school was a good opportunity anyway i lost as well , so i struggled fir a life until i found environmental services thank god lol , life’s funny, but i had crazy parents too ha ha",2020-02-14 01:57:55+00:00,,,1228136255214510081,,https://twitter.com/larryrstreet/status/1228136255214510081,0,0,,
"blacks have more opportunities now than we did as poor whites , because of more government programs, not available for us, or my parents wouldn’t take them maybe who knows,  is proof anyone can make it, i was offered help for my learning problems only mom",2020-02-14 01:57:55+00:00,,,1228136253708816385,@SecretaryCarson,https://twitter.com/larryrstreet/status/1228136253708816385,1,0,,
" once again thank you for spreading the true words of doctor martin luther king , as a child growing up in those times and of course listening to him and we were no racist family, the 70s and 80s were about free love it’s races broker who keep this going on,",2020-02-14 01:57:55+00:00,,,1228136252932788224,@TonopahDee,https://twitter.com/larryrstreet/status/1228136252932788224,1,0,,
"how much money does each state and each democratic make by having the stare be the drug dealer via the rehab clinic, when you have so dam much meth and fentinal on the street, no ones getting well , they only save more because of narcan being in the cop and ambulance cars",2020-02-10 21:40:23+00:00,,,1226984279936262145,,https://twitter.com/larryrstreet/status/1226984279936262145,0,0,SpeakerPelosi,
"why is it you democratics can’t deal up our borders when you all seem to be ok with chinas meth and fentinal being sold to mexico and crossing the southern border and killing real natural born americans, yet you let illegals get immunity from laws we must abide by ?",2020-02-10 21:37:51+00:00,,,1226983642297225218,,https://twitter.com/larryrstreet/status/1226983642297225218,1,0,SpeakerPelosi,
so many more need to be in jail,2020-02-10 14:22:02+00:00,,,1226873966637219842,,https://twitter.com/larryrstreet/status/1226873966637219842,0,0,SaraCarterDC,
oh and they can legally steal a certain few minutes of any publication i think i,2020-02-10 14:18:55+00:00,,,1226873183212576768,,https://twitter.com/larryrstreet/status/1226873183212576768,0,0,IPOT1776,
"ha change you photo to a hot woman i’ll guarantee it will not happen again, or a child just look at greta who lies about climate change so her daddy can get rich",2020-02-10 14:17:33+00:00,,,1226872836951859200,,https://twitter.com/larryrstreet/status/1226872836951859200,0,0,IPOT1776,
"it just that we had trade imbalances to help europe rebuild yet once they did , anyone try to fix it or repay us or say thanks by letting us get back what we lost , no",2020-02-10 14:15:38+00:00,,,1226872357056323584,,https://twitter.com/larryrstreet/status/1226872357056323584,0,1,BarryRChapman,
"some of us born in the 60s know all too well how close we came to being a german country, or being taken over by japan , we lived through the end i say end of the kkk and democratics ruling that way , oops i was wrong sorry they still doing it master",2020-02-10 14:14:15+00:00,,,1226872009428217856,,https://twitter.com/larryrstreet/status/1226872009428217856,0,0,MillerStream,
communist party propaganda,2020-02-10 14:10:53+00:00,,,1226871159855239169,,https://twitter.com/larryrstreet/status/1226871159855239169,0,0,MillerStream,
he seems to be unaware if the entire process and the  star chamber trial in the white house bunker the master leaker and loser n liar who had helped write the blowed statements,2020-02-10 14:10:11+00:00,,,1226870983891570689,@RepAdamSchiff,https://twitter.com/larryrstreet/status/1226870983891570689,0,0,larryelder,
they got these fir what . him to have a place in hollywood and he got it . when he should be in prison,2020-02-10 14:07:26+00:00,,,1226870291323854850,,https://twitter.com/larryrstreet/status/1226870291323854850,0,0,skb_sara,
"that’s exactly the problem he ask his staff or assistant to do something like this and they give him the one sided angie answer because he screwed up talking to his x , the staff is one sided and gives him the hollywood version that gets him more work . after all he isn’t rich",2020-02-10 14:05:59+00:00,,,1226869928038408193,,https://twitter.com/larryrstreet/status/1226869928038408193,0,0,greggutfeld,
"yea except you had the obama administration pushing a america state of the world , devaluation of currency and a total service industry, all gay waiters n waitress to serve hollywood elite and democratic socialist",2020-02-10 14:02:08+00:00,,,1226868959154180096,,https://twitter.com/larryrstreet/status/1226868959154180096,0,0,ruggiere_l,
"why can’t they stick to acting they lost touch with real life long ago they think all illegal are like the illegal gardeners and maids and cooks , we can’t afford anyway. we also can’t afford armed guards like they have and that’s out of touch. arm guards at studio on sets n home",2020-02-10 13:59:12+00:00,,,1226868219346116608,,https://twitter.com/larryrstreet/status/1226868219346116608,0,0,JennaEllisEsq,
we know twitter is doing it still big time,2020-02-10 13:56:39+00:00,,,1226867578959736833,,https://twitter.com/larryrstreet/status/1226867578959736833,0,0,LTWoodCDMedia,
she lost it when a decent man and his family were out on trial because he was nominated to be a judge wow and the democratic attorney yes clinton attorney put a cray cray woman on the stand in public that only embarrassing her family,2020-02-10 12:16:42+00:00,,,1226842426565898241,,https://twitter.com/larryrstreet/status/1226842426565898241,0,0,Tabbatc,
"when are you gonna make another movie showing your boobs , i mean cristina richi did that one where she is dead in a morge , stick to acting alyssa – at bp",2020-02-10 12:13:28+00:00,,,1226841610555723778,,https://twitter.com/larryrstreet/status/1226841610555723778,0,0,Alyssa_Milano,
killmeade is not that smart i’m sure u have noticed that his co hosts have to explain things to him frequently,2020-02-10 12:06:40+00:00,,,1226839900496048128,,https://twitter.com/larryrstreet/status/1226839900496048128,0,0,thesonx,
so that’s why it has so much support and is sold out ok,2020-02-10 12:03:48+00:00,,,1226839178056536065,,https://twitter.com/larryrstreet/status/1226839178056536065,0,0,Debb719,
killmeade is not the sharpest tool in the box,2020-02-10 12:02:44+00:00,,,1226838910183071744,,https://twitter.com/larryrstreet/status/1226838910183071744,0,0,MrCrimateClisis,
to actually read the real true words of those who conspired a fraud against america and set up a president and put his family through living hell,2020-02-10 11:59:14+00:00,,,1226838029924474880,,https://twitter.com/larryrstreet/status/1226838029924474880,0,0,RealDeanCain,
"this is to show and create controversy, as it has but it is the actual words of these who committed the biggest fraud against american voter ever that we know of in this nation",2020-02-10 11:57:20+00:00,,,1226837552495300608,,https://twitter.com/larryrstreet/status/1226837552495300608,0,0,revrrlewis,
 wrote the dick blowers paper work for him and the dude they tossed out if the white house who was working fir the communist as one of our military members is probably the blower,2020-02-10 11:37:19+00:00,,,1226832514796466176,@RepAdamSchiff,https://twitter.com/larryrstreet/status/1226832514796466176,0,0,FancyBitch_Here,
fact is where the chinese outbreaks were is where the labs are that make bio chemical warfare !!!!,2020-02-10 11:33:31+00:00,,,1226831559489134595,,https://twitter.com/larryrstreet/status/1226831559489134595,0,0,FancyBitch_Here,
bolton is a war broker we have always known this he swore to stick by the  adjective yet he choose to follow his own path,2020-02-10 11:32:03+00:00,,,1226831188150583296,@POTUS,https://twitter.com/larryrstreet/status/1226831188150583296,0,0,FancyBitch_Here,
"my blueberry nights, blade runner, naked lunch if you can find it it has iron man in it and robo cop lol",2020-02-10 11:30:21+00:00,,,1226830762462318592,,https://twitter.com/larryrstreet/status/1226830762462318592,0,0,FancyBitch_Here,
"yet the main stream media that is still under  control as well as  , now do you know why  is so quite after all he is getting paid by hollywood and netflix",2020-02-10 11:27:49+00:00,,,1226830121748901888,@BarackObama @georgesoros @BarackObama,https://twitter.com/larryrstreet/status/1226830121748901888,0,0,FancyBitch_Here,
,2020-02-10 11:25:15+00:00,,,1226829476295847936,@PittOfficial,https://twitter.com/larryrstreet/status/1226829476295847936,0,0,JrMousseaucharl,
"why the hell did u stop when we needed you it used to be hollywood actually made movies that taught people about our history, some still do didn’t you see mathew mconahey in the movie where the democratic the kkk try’s to stop rep from registering blacks to vote ",2020-02-10 11:23:41+00:00,,,1226829083272794113,@PittOfficial,https://twitter.com/larryrstreet/status/1226829083272794113,0,0,FancyBitch_Here,
"even if it were a man and woman kissing , but i guess then making fools of themselves is ok in the gay world, it’s just the dumbest add ever and  is not the enemy it’s the democratic socialist party it’s screwed up hollywood who’s lost it and don’t even go by basic facts",2020-02-10 11:18:28+00:00,,,1226827771973898240,@POTUS,https://twitter.com/larryrstreet/status/1226827771973898240,0,0,FancyBitch_Here,
ha ha ha,2020-02-10 11:15:46+00:00,,,1226827090143694850,,https://twitter.com/larryrstreet/status/1226827090143694850,0,0,stclairashley,
 read this brad pitt,2020-02-10 11:12:31+00:00,,,1226826274150256640,@PittOfficial,https://twitter.com/larryrstreet/status/1226826274150256640,0,0,FancyBitch_Here,
" and it’s time we go after bad hollywood actors who live behind walls with gates and armed guards, who hire illegal to clean and cook and cut grass , and think that’s the illegal we have to deal with , no we have the bombers, drug dealers and ms13 ",2020-02-10 11:11:43+00:00,,,1226826070592229377,@KristySwansonXO @PittOfficial,https://twitter.com/larryrstreet/status/1226826070592229377,0,0,FancyBitch_Here,
this is who were letting in to america this is your open borders ,2020-02-10 11:06:54+00:00,,,1226824861152051200,@PittOfficial,https://twitter.com/larryrstreet/status/1226824861152051200,0,5,canneyoung1,
" hey brad pitt socialism is great so more democratic can rip off taxpayers and get rich, like obama, kerry biden, pelosi, clinton all criminals, but yea hollywood politics went hand in hand under the nazi government rule too",2020-02-10 10:59:48+00:00,,,1226823072344395776,@PittOfficial,https://twitter.com/larryrstreet/status/1226823072344395776,0,0,,
 hey brad so your ok with being a socialist killing america people and letting others with criminal interests take over america,2020-02-10 10:53:47+00:00,,,1226821558972354566,@PittOfficial,https://twitter.com/larryrstreet/status/1226821558972354566,0,0,,
 hey dick pitt,2020-02-10 10:51:38+00:00,,,1226821017273880576,@PittOfficial,https://twitter.com/larryrstreet/status/1226821017273880576,0,0,,
"so  you forgot growing up with guns and that freedom, so brad pitt you forget that even  deserve fair trials , it seems your ok with this socialist take over of our government and open borders that’s bringing in china meth and fentinal, so killing america ok",2020-02-10 10:49:38+00:00,,,1226820513525358592,@PittOfficial @POTUS,https://twitter.com/larryrstreet/status/1226820513525358592,0,0,,
"time the trash  since he can’t comprehend the house does the trial. and  was not given a fair hearing there, where witnesses give depos and both sides are allowed council and  ran a socialist star chamber, like in china. brad pitt stupid",2020-02-10 10:45:04+00:00,,,1226819367079481345,@PittOfficial @POTUS @RepAdamSchiff,https://twitter.com/larryrstreet/status/1226819367079481345,0,0,,
"for once the obama administration and the clinton and biden’s and kerry’s , who by the way kerry violated the hatch act too by going to iran with out permission, all of these including pelosi who’s son was in on the government scams too are finally on notice no more ripping us",2020-02-09 02:40:20+00:00,,,1226334991912751105,,https://twitter.com/larryrstreet/status/1226334991912751105,0,0,brhodes,
"how is it more people are killed from our borders being open because of the chinese meth and fentinal, more than guns more than the last 3 wars and it’s not a problem, yet legal gun ownership is because of a left wing socialist take over of america trying to take place",2020-02-09 02:37:43+00:00,,,1226334329606955009,,https://twitter.com/larryrstreet/status/1226334329606955009,0,0,tedcruz,
see how obvious the ripping off of our government is happening so easy with the democratic party and those like the clinton,2020-02-09 02:35:15+00:00,,,1226333711513333760,,https://twitter.com/larryrstreet/status/1226333711513333760,0,0,tedcruz,
" hey my great friend and fellow texan , i used to live in corpus cristi building homes on ocean drive , why is twitter cutting out my tweets when i use certain words of certain groups like cair trying to take over america",2020-02-09 02:34:04+00:00,,,1226333414913122306,@tedcruz,https://twitter.com/larryrstreet/status/1226333414913122306,0,0,,
"yes we need her  and i wish  and    all would run for office   , and get both trump boys as well as his daughter or son in law were begging you ",2020-02-09 02:30:09+00:00,,,1226332429390143490,@RealCandaceO @KristySwansonXO @genesimmons @MZHemingway @RealDeanCain @senatemajldr @foxnewspolitics @realDonaldTrump,https://twitter.com/larryrstreet/status/1226332429390143490,0,0,bluestein,
"we don’t loose , if we used the popular vote we would have a totalitarian government, we would have socialist government where the nanny state like  and  and  want to lie and force on us",2020-02-09 02:20:43+00:00,,,1226330052775862272,@MikeBloomberg @SenSanders @AOC,https://twitter.com/larryrstreet/status/1226330052775862272,0,1,DarqFry,
"tell us why mixed people identify as black, growing up poor white our family trying to look normal, we were far from that, xmas was orange and nuts n underwear, but blacks get much more benefits than do poor whites and many poor whites wouldnt take a hand out",2020-02-09 02:14:26+00:00,,,1226328472991272962,,https://twitter.com/larryrstreet/status/1226328472991272962,0,0,PrisonPlanet,
share this,2020-02-09 02:11:08+00:00,,,1226327643425005569,,https://twitter.com/larryrstreet/status/1226327643425005569,0,0,DanCrenshawTX,
please share everyone,2020-02-09 02:10:48+00:00,,,1226327558754533377,,https://twitter.com/larryrstreet/status/1226327558754533377,0,0,DailyCaller,
"thank god the left is rebelling, it’s about time because these who have no idea about history our history, or the horrors of a socialist country, seem to have not been taught to our youth",2020-02-09 02:10:24+00:00,,,1226327458531729410,,https://twitter.com/larryrstreet/status/1226327458531729410,0,0,DailyCaller,
i know nothing of football i do know you learn from mistakes and you learn other people tricks that’s screwed you over,2020-02-09 02:06:12+00:00,,,1226326398832435205,,https://twitter.com/larryrstreet/status/1226326398832435205,0,0,ESPNCFB,
well we should because we should be doing the same to antifa,2020-02-09 02:03:10+00:00,,,1226325636513435648,,https://twitter.com/larryrstreet/status/1226325636513435648,0,0,ParisianGirlAmy,
"well all the democratics call us republicans and independents racist to get black vote and promise tons of free stuff america can’t not deliver on ayer obama raised the nations debut from 10 to 21 trillion $and the housing crises paid fir before, was a democratic screw up !!",2020-02-09 02:02:27+00:00,,,1226325457529909248,,https://twitter.com/larryrstreet/status/1226325457529909248,0,0,nytimes,
he is a germ a fobe,2020-02-08 20:05:56+00:00,,,1226235737781260289,,https://twitter.com/larryrstreet/status/1226235737781260289,0,0,JackPosobiec,
these democratics are crazy as hell,2020-02-08 20:04:55+00:00,,,1226235478170624000,,https://twitter.com/larryrstreet/status/1226235478170624000,0,0,TheRISEofROD,
illegal in new york are immune from being in a data base like everyone else in america who has committed a crime as there new laws stand now,2020-02-08 20:03:07+00:00,,,1226235029010993160,,https://twitter.com/larryrstreet/status/1226235029010993160,0,0,TheRISEofROD,
who cares u know they wasted millions on the federal building in huntington wv and they remodeled the va hospital every 3 or 4 years ????? screw that,2020-02-08 19:34:59+00:00,,,1226227949008977921,,https://twitter.com/larryrstreet/status/1226227949008977921,0,0,TomFitton,
this is a huge problem,2020-02-08 19:27:43+00:00,,,1226226120124780546,,https://twitter.com/larryrstreet/status/1226226120124780546,0,0,JulieReichwein1,
no he does not lie in fact he is way too honest and open,2020-02-08 19:25:59+00:00,,,1226225681379536896,,https://twitter.com/larryrstreet/status/1226225681379536896,0,0,AIIAmericanGirI,
yea i’m tired of seeing how great a huge ass is the bomb well it’s going to get bigger as women age until they can’t walk,2020-02-08 19:23:49+00:00,,,1226225136149422081,,https://twitter.com/larryrstreet/status/1226225136149422081,0,0,SKYRIDER4538,
"i want everyone to remember this man  has said all women want to be raped ok , that’s twisted as him wanting mother russia to take us over or cuba or maybe islam",2020-02-08 19:22:25+00:00,,,1226224783874052096,@SenSanders,https://twitter.com/larryrstreet/status/1226224783874052096,0,0,KristySwansonXO,
"who knows because they all claimed were all racist lordy , funny it was republicans who registered blacks to vote, funny our forefathers died to end black slavery, but no one mentions how many nations slaved whites , roman slaves lasted 3 months barbados slaves didn’t do well",2020-02-08 19:20:10+00:00,,,1226224220201508866,,https://twitter.com/larryrstreet/status/1226224220201508866,0,0,RealJamesWoods,
yea and too many hands scared it off from its rewards of being petted because people don’t think,2020-02-08 19:11:30+00:00,,,1226222037246582784,,https://twitter.com/larryrstreet/status/1226222037246582784,0,0,gunsnrosesgirl3,
"you make me sick you promised everything to everybody things that you can’t deliver, your talking about killing people who commit crimes like china does , like cuba does like islam does , you have no idea what is real",2020-02-08 19:08:00+00:00,,,1226221158581886976,,https://twitter.com/larryrstreet/status/1226221158581886976,0,0,Breaking911,
you can’t stop the drug problem until you close the dam borders,2020-02-08 19:05:51+00:00,,,1226220616799465473,,https://twitter.com/larryrstreet/status/1226220616799465473,0,0,Breaking911,
