text,date,geo,hashtags,tweet_id,mentions,permalink,replies,retweets,replies_to,mentioned_urls
 can kiss his ass good by he voted with democratics in a totally republican state by by joe,2019-12-19 01:39:10+00:00,,,1207475426483937281,@Sen_JoeManchin,https://twitter.com/larryrstreet/status/1207475426483937281,0,0,,
"time to heal his wife and young child, need our support , too ",2019-12-19 01:27:03+00:00,,,1207472377786982402,@FLOTUS,https://twitter.com/larryrstreet/status/1207472377786982402,0,0,GOPLeader,
"i can’t imagine how hard this is in his wife and young child, i feel so sad for him ",2019-12-19 01:25:15+00:00,,,1207471924143697920,@FLOTUS,https://twitter.com/larryrstreet/status/1207471924143697920,0,0,senatemajldr,
why because he is just like us he wants the truth and is like us he makes mistakes but is no way corrupt like the democratic socialist party,2019-12-19 01:22:36+00:00,,,1207471256842522624,,https://twitter.com/larryrstreet/status/1207471256842522624,0,0,RepDLesko,
they hate him because his is a lot like us to be honest,2019-12-19 01:18:41+00:00,,,1207470272531578880,,https://twitter.com/larryrstreet/status/1207470272531578880,0,0,RepDLamborn,
thanks for being a real america hero,2019-12-19 01:17:11+00:00,,,1207469893802692608,,https://twitter.com/larryrstreet/status/1207469893802692608,0,0,RepDLamborn,
god blessed,2019-12-19 01:16:05+00:00,,,1207469617364586497,,https://twitter.com/larryrstreet/status/1207469617364586497,0,0,RepTrentKelly,
they had begun stating that extract fact from day one,2019-12-19 01:12:17+00:00,,,1207468664104062976,,https://twitter.com/larryrstreet/status/1207468664104062976,0,0,KristySwansonXO,
why is this lier speaking like 10 times i hear,2019-12-19 01:10:21+00:00,,,1207468178022043657,,https://twitter.com/larryrstreet/status/1207468178022043657,0,0,WayneDupreeShow,
hey aundre try google for kids,2019-12-19 01:09:15+00:00,,,1207467899843207168,,https://twitter.com/larryrstreet/status/1207467899843207168,0,0,mindful_me2,
yea it’s funny how democratic party takes a oath only to want to completely destroy our constitution,2019-12-19 01:07:57+00:00,,,1207467573236916225,,https://twitter.com/larryrstreet/status/1207467573236916225,0,0,Alyssa_Milano,
you have not been listening all week have you they have been asked that question directly,2019-12-19 01:06:52+00:00,,,1207467300053499904,,https://twitter.com/larryrstreet/status/1207467300053499904,0,0,Alyssa_Milano,
"how can you of all talk who got away with moving around campaign money, and being from the total corruption smell on the democratic party",2019-12-19 01:05:43+00:00,,,1207467010512297985,,https://twitter.com/larryrstreet/status/1207467010512297985,0,0,AOC,
"try the rest of the country is backing up trump and the gop and as more comes out on the corruption of the obama administration, it’s gonna get worse , yet you refuse to see the truth vs the real corruption even the fisa judges have spoken out against the fbi ",2019-12-19 00:08:50+00:00,,,1207452696644636672,@Alyssa_Milano,https://twitter.com/larryrstreet/status/1207452696644636672,0,0,Alyssa_Milano,
"that’s your problem you still believe the judge and not the crazy woman that no one else could back up her story , no one else remember any of her accounts  are you that uneducated or just really stupid",2019-12-19 00:06:03+00:00,,,1207451992932700161,@Alyssa_Milano,https://twitter.com/larryrstreet/status/1207451992932700161,0,0,Alyssa_Milano,
" by the way how much money did we pay for those gold and ruby pins you all wear , how much money do waist taking private jets , like obama dept of fraud waste and abuse, was the one dept that was abusing more money fir nothing than any other , how many u got rich",2019-12-18 17:43:02+00:00,,,1207355603464720384,@SpeakerPelosi,https://twitter.com/larryrstreet/status/1207355603464720384,0,0,,
"where were you all when clinton, obama, fbi , two att general for obama lied and were doing such illegal things, enough ok old lady enough with your socialism cram it",2019-12-18 17:23:11+00:00,,,1207350611274084352,,https://twitter.com/larryrstreet/status/1207350611274084352,0,0,,
" to listen to your old tired bags , lying to america, i hear obsessive democratics who just hate not being able to socialize america, that’s what this is about only your path is one of our demise, we don’t want your corruption old bag who slurs like a drunk",2019-12-18 17:23:11+00:00,,,1207350608996585472,@SpeakerPelosi,https://twitter.com/larryrstreet/status/1207350608996585472,1,0,,
"   listen no mater how or what a republican does from now on you can’t have a shred of what might look bad because first it’s too much to go through. and it’s our constitution that’s really at risk dems lie as they speak of there oath , lies",2019-12-18 13:05:38+00:00,,,1207285793733120000,@realDonaldTrump @SenateGOP @senatemajldr,https://twitter.com/larryrstreet/status/1207285793733120000,0,0,,
"try clinton, obama and his att general who extends the visual of the russia woman so she can meet din trump jr",2019-12-18 12:59:25+00:00,,,1207284229337440259,,https://twitter.com/larryrstreet/status/1207284229337440259,0,0,CCM1956,
yea go live there and when your kids are held for ransom you will know why more don’t,2019-12-18 11:48:33+00:00,,,1207266397241389056,,https://twitter.com/larryrstreet/status/1207266397241389056,0,0,AMANDAZUCKERMAN,
" and millions of our for fathers who settled this nation died to end slavery , it was spain who was last to end it who financed the south or there wouldn’t had been a war",2019-12-18 11:35:14+00:00,,,1207263043987673089,@rdwhiskey,https://twitter.com/larryrstreet/status/1207263043987673089,0,0,,
" about slavery first all nations were slaving humans ,a roman slave lasted 3 months, white slaves who were tricked by claiming enduring servants , the same trick the south play on blacks in usa and england and usa were first to end it , while spain the bro if black last",2019-12-18 11:33:23+00:00,,,1207262577916596225,@rdwhiskey,https://twitter.com/larryrstreet/status/1207262577916596225,0,0,,
 nigeria scammers,2019-12-18 11:23:30+00:00,,,1207260092111953922,@LindaCatchings4,https://twitter.com/larryrstreet/status/1207260092111953922,0,0,,
 nigeria scammers,2019-12-18 11:17:03+00:00,,,1207258468454981633,@LaiceyLinda,https://twitter.com/larryrstreet/status/1207258468454981633,0,0,,
 another nigeria scammers,2019-12-18 11:16:42+00:00,,,1207258380001271808,@vanessa_marcus,https://twitter.com/larryrstreet/status/1207258380001271808,0,0,,
 i am sure just another nigeria scammers,2019-12-18 11:16:15+00:00,,,1207258269410091008,@carolin00099374,https://twitter.com/larryrstreet/status/1207258269410091008,0,0,,
 nigeria scammers,2019-12-18 11:15:22+00:00,,,1207258046675800065,@sandrahoppman,https://twitter.com/larryrstreet/status/1207258046675800065,0,0,,
 nigeria scammers,2019-12-18 11:15:01+00:00,,,1207257959501377537,@alene_lisa,https://twitter.com/larryrstreet/status/1207257959501377537,0,0,,
 no your a nigeria or south africa scammer,2019-12-18 11:14:23+00:00,,,1207257798452625411,@MaryJon99314666,https://twitter.com/larryrstreet/status/1207257798452625411,0,0,,
"i am sick of america islamic groups who are behind, black lives matter as they were funding them , they keep pushing the destruction of our national monuments historical statues , they must stay as it seems professors and teacher don’t teach history, we must not repeat past",2019-12-18 11:00:21+00:00,,,1207254267775668225,,https://twitter.com/larryrstreet/status/1207254267775668225,0,0,,
"actually i think if each person except juan had there own 15 min quick show, i think we would get more from it and i’d like to see the new girl get her own show , she use always spot on !!",2019-12-18 10:54:37+00:00,,,1207252824087810053,,https://twitter.com/larryrstreet/status/1207252824087810053,0,0,DennisOesch,
"simple man facts are  is crazy as a looney bird, obsessed, has lied and committed crimes, like talking to russians to get dirt on trump he thought , of this golden shower shit, and illegal phone records and published them. when is this freak going to jail two tiers",2019-12-18 10:52:01+00:00,,,1207252168690032640,@RepAdamSchiff,https://twitter.com/larryrstreet/status/1207252168690032640,0,0,greggutfeld,
"i never imagined that trump could make a joke about corupt clinton , who should had been put in jail , he jokes off the cuff about russia getting her 30,000 emails and democratic socialists believe that was so me secrete code to russia ? really",2019-12-18 10:43:57+00:00,,,1207250137791320065,,https://twitter.com/larryrstreet/status/1207250137791320065,0,0,replouiegohmert,
"wallace gets pissed because trump jumps into his shit because wallace has been a never trumper , many times taking the side of the elite, because he grew up a treasure life",2019-12-18 10:40:53+00:00,,,1207249367402516480,,https://twitter.com/larryrstreet/status/1207249367402516480,0,0,KamVTV,
,2019-12-18 10:38:27+00:00,,,1207248757215158277,@SpeakerPelosi,https://twitter.com/larryrstreet/status/1207248757215158277,0,0,idawhannadoyou,
"what’s wrong with tilling the soil to ride the ground of weeds and old plants that used old plant material as fertilizer, ??? what the hell are you talking about",2019-12-18 10:37:02+00:00,,,1207248400074334210,,https://twitter.com/larryrstreet/status/1207248400074334210,0,0,terraton_,
"your insane, to call twitter child molesters web sight , that’s says to me what’s going on in your head to even think that way",2019-12-18 10:34:28+00:00,,,1207247753463705600,,https://twitter.com/larryrstreet/status/1207247753463705600,2,0,KessenaO,
" how can you sit there and blatantly lie to the america people while you slowed the crimes of obama, clinton, biden there administrations and fbi who lied and made deals for billions",2019-12-17 16:47:52+00:00,,,1206979332121473024,@RepRaskin,https://twitter.com/larryrstreet/status/1206979332121473024,0,0,,
those people were at the va hosp and were intentional given insulin by a sic nurse who did kill the vets,2019-12-17 16:31:23+00:00,,,1206975185942982656,,https://twitter.com/larryrstreet/status/1206975185942982656,0,0,krwwbwb33,
" you really have balls calling out trump after the. crimes committed by the democratic and obama administration, everything you have said you have done to  a fact as well as more on top of crimes by biden, clinton all of her staff fbi ect",2019-12-17 16:27:38+00:00,,,1206974241603751936,@RepMcGovern @realDonaldTrump,https://twitter.com/larryrstreet/status/1206974241603751936,0,0,,
that’s the left,2019-12-17 12:01:13+00:00,,,1206907194333179905,,https://twitter.com/larryrstreet/status/1206907194333179905,0,0,iheartmindy,
"this is so they can vote the same goes with open borders they don’t care how many die from drugs, it die from gangs , because democratic have no problem aborting millions of black babies that are already americans don’t you find this odd , democratic only go after those who $$$",2019-12-17 11:59:20+00:00,,,1206906722553679872,,https://twitter.com/larryrstreet/status/1206906722553679872,0,0,iheartmindy,
"and yet how is it he can wear black face and still be in office, oh he is democratic",2019-12-17 11:54:52+00:00,,,1206905598429876224,,https://twitter.com/larryrstreet/status/1206905598429876224,0,0,storm_paglia,
don’t you see how hollywood has changed these young kids where most feel they have to have kids not family with black guys and then after being used like 30 times they might be with a white guy who raises the children,2019-12-17 11:53:14+00:00,,,1206905186444333057,,https://twitter.com/larryrstreet/status/1206905186444333057,0,0,iheartmindy,
she had been programmed by hollywood of course so did alisa silverstone she has done exact same thing and her son is growing up tiny and weak,2019-12-17 11:50:57+00:00,,,1206904614227992576,,https://twitter.com/larryrstreet/status/1206904614227992576,0,0,iheartmindy,
why is it each and every democratic has such crappy districts and yet they blow money like its water and seem to get richer each day ??,2019-12-17 11:40:17+00:00,,,1206901929953124353,,https://twitter.com/larryrstreet/status/1206901929953124353,0,0,DeAnna4Congress,
"don’t you know the democratic socialist party is still all about putting people in there place , blacks in plantation, american indian into reservation, and whites are not supposed to have any children, only mixed couples allowed in america , and illegals running free",2019-12-17 11:39:02+00:00,,,1206901613190885376,,https://twitter.com/larryrstreet/status/1206901613190885376,0,0,DeAnna4Congress,
"because of liberals that give illegals drivers license so they can vote, and ignore many are connected to the drug trade or stealing our social security, that our folks pain into for generations",2019-12-17 11:34:36+00:00,,,1206900497623519233,,https://twitter.com/larryrstreet/status/1206900497623519233,0,0,DeAnna4Congress,
"i won’t take the flu vaccine though, i haven’t for about 8 years and haven’t got the flu yet it did seem i did when i took the shot",2019-12-17 11:32:27+00:00,,,1206899955132223488,,https://twitter.com/larryrstreet/status/1206899955132223488,0,0,krwwbwb33,
"hey i had to have hep b vaccine i think it was the best thing working in waste water around needles , i’d swear it kept me from getting hep c actually",2019-12-17 11:30:06+00:00,,,1206899365203320833,,https://twitter.com/larryrstreet/status/1206899365203320833,0,0,krwwbwb33,
"blacks originally registered republican, it was us who fought and died for them yet hollywood seems to forget these things , most of the country was the dam north",2019-12-17 10:43:09+00:00,,,1206887550843006976,,https://twitter.com/larryrstreet/status/1206887550843006976,0,0,MeghanMcCain,
 walk out of the show and flip that racist bitch whoopi off,2019-12-17 10:41:12+00:00,,,1206887057756499968,@MeghanMcCain,https://twitter.com/larryrstreet/status/1206887057756499968,0,0,,
" yes our dude the side that freed the slaves, that died for our black friends , do deserve to be heard but whoopi goldberg is a racist bitch , who hates whites and loves corrupt democratic who put blacks in plantations and abort there children while letting in crime",2019-12-17 10:40:22+00:00,,,1206886849337315328,@MeghanMcCain,https://twitter.com/larryrstreet/status/1206886849337315328,0,0,,
"i am sick of whites who fought and died for black being shit on by blacks and hollywood, hollywood has made it like a sickness to date a white man , they blane us for all there problems, yet i grew up white poor, and saw blacks get much more than poor whites ever did , stop it",2019-12-17 10:34:24+00:00,,,1206885347273117696,,https://twitter.com/larryrstreet/status/1206885347273117696,0,0,justinbaragona,
"megan walk off the god dam show what is wrong with you do you enjoy being belittled by nasty racist whoopi smells a lot who didn’t take showers for weeks goldberg , and what is her problem with white rep who freed slaves and died in masses in civil war for them , sick",2019-12-17 10:30:52+00:00,,,1206884458219147264,,https://twitter.com/larryrstreet/status/1206884458219147264,0,0,justinbaragona,
"what’s the fucking point in having a right wing view on the view if it can’t ever be heard , if  who has been shadowed banned, can’t be heard , i know megan you were trying to help , but no one needs belittling dear, besides you already rich so what’s the point",2019-12-17 10:24:27+00:00,,,1206882845542797312,@MeganMCain,https://twitter.com/larryrstreet/status/1206882845542797312,0,0,justinbaragona,
who made whoopi god,2019-12-17 10:18:01+00:00,,,1206881227174793216,,https://twitter.com/larryrstreet/status/1206881227174793216,0,0,justinbaragona,
"woopie goldburg is the most racist black woman ever she acts like every one was a slave owner , only all of us were slaved at one time in history, ass holes and she seems to forget, just how god dam many white and black died to free the then slaves, or her spanish last too free",2019-12-17 10:15:35+00:00,,,1206880612449173504,,https://twitter.com/larryrstreet/status/1206880612449173504,0,0,Mediaite,
some of us remember the stories of the infamous j. edgar hoover absolote power corrupts absolutely he was pure evil,2019-12-17 10:06:29+00:00,,,1206878320937320449,,https://twitter.com/larryrstreet/status/1206878320937320449,0,0,realDonaldTrump,
"fact is  bought up american manufacturing companies and stole the workers pensions, to send those jobs over to china , as we see now nothing is really cheap anymore from china. the shipping is the problem, as many usa manufacturers have found",2019-12-17 10:01:13+00:00,,,1206876996116111360,@MittRomney,https://twitter.com/larryrstreet/status/1206876996116111360,0,0,realDonaldTrump,
"fact is america needed a disruption, a president who could shake it up and be rude crude , high energy, one who would correct mistakes with europe since the war, they have taken this advantage way too long and know why usa gave it to them temp, no one else to take on china",2019-12-17 09:58:05+00:00,,,1206876208966840320,,https://twitter.com/larryrstreet/status/1206876208966840320,0,0,realDonaldTrump,
"every time  speaks he has sat and thought in his twisted way , solely to twist the illegal crimes of the democratic party made to look like some how to blame the republicans, this is exactly what  meant about fighting back !!!",2019-12-17 09:54:33+00:00,,,1206875318788788226,@SenSchumer @realDonaldTrump,https://twitter.com/larryrstreet/status/1206875318788788226,0,0,LindseyGrahamSC,
"just remember blacks voted republican, registered as republican, why because democratics tried to continue slavery through indentured servant laws. and democratics were the kkk and still think this way but putting blacks in reservation like america indians that have failed",2019-12-17 09:51:48+00:00,,,1206874628058238977,,https://twitter.com/larryrstreet/status/1206874628058238977,0,0,LindseyGrahamSC,
"how much bull shit can  shovel , they run a totally unfair trial for all intents , and now want the senate to hold another unfair trail in the democratic advantage, the democratic socialist party is the party of corruption, this goes back to why blacks voted repub",2019-12-17 09:46:48+00:00,,,1206873367153905664,@SenSchumer,https://twitter.com/larryrstreet/status/1206873367153905664,0,0,LindseyGrahamSC,
"from the people’s white house , the secret service had to go to clinton home to retrieve those stolen goods who does this but her !!! a person who deleted emails destroy laptops, took in millions as secretary of state !!!",2019-12-15 15:53:02+00:00,,,1206240758807830530,,https://twitter.com/larryrstreet/status/1206240758807830530,0,0,,
"will be facing charges. the fbi, cia, nsa, obama attorney general, obama his self who was aware of these crimes, those who worked for clinton who were given immunity, as well as clinton herself who was once again given a pass, like when she stole 2 million in art and antiques",2019-12-15 15:53:01+00:00,,,1206240754382917632,,https://twitter.com/larryrstreet/status/1206240754382917632,1,0,,
"    we the american people of this republic, the true protecters of the constitution, are glad to see that two justice system are not going to ext, many democrats will be facing charges, those in obama administration",2019-12-15 15:53:00+00:00,,,1206240750700249088,@foxnewspolitics @realDonaldTrump @DonaldJTrumpJr @Alyssa_Milano,https://twitter.com/larryrstreet/status/1206240750700249088,1,0,,
maybe it’s time to find a good man and marry him lol,2019-12-15 11:27:46+00:00,,,1206174001745334272,,https://twitter.com/larryrstreet/status/1206174001745334272,0,0,Hawker881_Promo,
sexy little tits love them,2019-12-15 11:26:41+00:00,,,1206173729228820481,,https://twitter.com/larryrstreet/status/1206173729228820481,0,0,sqvert_you,
"this is the way to a true and honest america, because the democratic socialist party has become the party of corruption, and lies and deceit",2019-12-15 11:22:55+00:00,,,1206172780259168256,,https://twitter.com/larryrstreet/status/1206172780259168256,0,0,buzzman888,
"as long as today’s muslim who’s goal is still to take over the world , as in cair wanting our statues and monuments removed, this is to replace our history, we have these still to remind us and teach children what was bad in our past and not to repeat the past ,",2019-12-15 11:21:06+00:00,,,1206172326410309632,,https://twitter.com/larryrstreet/status/1206172326410309632,0,3,pressrecalling1,
"a long time ago in the 1970s iran was just like us they dressed like us and we were friends, women dressed as they wanted, then religious leaders too over , wanting to bring back the ottoman empire, buy forcing there religion on the world or be beheaded !!",2019-12-15 11:17:40+00:00,,,1206171459963510786,,https://twitter.com/larryrstreet/status/1206171459963510786,1,2,pressrecalling1,
i don’t think they make quality shows,2019-12-15 11:12:58+00:00,,,1206170277157261312,,https://twitter.com/larryrstreet/status/1206170277157261312,0,0,nytimes,
"thank you for your honesty, you are a true american mam",2019-12-15 11:11:27+00:00,,,1206169897065160704,,https://twitter.com/larryrstreet/status/1206169897065160704,0,0,jofortrump,
"some people can’t deal with college it’s not for everyone and if  thinks it’s ok for us to pay for college of some young punk who might be our boss , having our taxes pay his. college while we work our asses off is completely wrong, do you give me 40k for a home ?",2019-12-15 11:10:25+00:00,,,1206169635856506880,@BernieSanders,https://twitter.com/larryrstreet/status/1206169635856506880,0,0,caroljsroth,
"back then men and women talked that way i tended bar then believe me woman were worse, what he was say was so many women throw themselves at him it like all he has to do is reach out and barb him some pussy , any guy who says they don’t remember this back then are lying",2019-12-15 11:05:11+00:00,,,1206168320480862208,,https://twitter.com/larryrstreet/status/1206168320480862208,0,0,just8anapple,
yes a green eyed girl is a rare thing you know,2019-12-15 10:58:41+00:00,,,1206166685142663168,,https://twitter.com/larryrstreet/status/1206166685142663168,0,0,AbiRatchford,
green contacts lol or natural ??,2019-12-15 10:57:53+00:00,,,1206166482553638912,,https://twitter.com/larryrstreet/status/1206166482553638912,0,0,AbiRatchford,
"that’s not the point if they are happy on there own land and choose to want to re invent the ottoman empire, when in the 70s they were just like us and our friends and didn’t come to america to take us over or blow us us or remove our statues of history, we want to not forget",2019-12-15 05:08:05+00:00,,,1206078450479579139,,https://twitter.com/larryrstreet/status/1206078450479579139,0,0,Taz_Devil_666,
go for it,2019-12-15 05:04:58+00:00,,,1206077665909903360,,https://twitter.com/larryrstreet/status/1206077665909903360,0,0,Taz_Devil_666,
"kids stepped working and joined gangs and began call us who lived in florida cracker as we go shopping to the groceries store and we lull out our pistol and they run like babies, because we felt threatened, but no reason for them to be that way",2019-12-14 18:39:15+00:00,,,1205920202631917568,,https://twitter.com/larryrstreet/status/1205920202631917568,1,0,,
 i know this i was engaged to a girl a cuban who came over on muriel boat lift as a little girl and those one lived america and had lots of respect and worked hard but the catholic charity got involved with refugees and gave the free houses and the,2019-12-14 18:39:10+00:00,,,1205920181480050688,@PeopleareCraCra,https://twitter.com/larryrstreet/status/1205920181480050688,1,0,,
"because america gave europe a huge trade imbalances to help them rebuild of which they had rebuild long ago and don’t pay their share of nato that’s for europe not us , your way past due on fair trade sorry our wages have put us and families in a hole , when wall down enough !",2019-12-14 17:25:06+00:00,,,1205901538507599873,,https://twitter.com/larryrstreet/status/1205901538507599873,1,0,dwarftrouble,
"listen we or most of us preferred us paying half and our employer paying half and then it was a hell of a lot more adorable and america has all the blues tech that benefits you because of our system, ok and your rich come here for treatment, as will always be case , rich n polit",2019-12-14 17:20:42+00:00,,,1205900432821932033,,https://twitter.com/larryrstreet/status/1205900432821932033,0,0,davekenyon01,
"well child all there facts have been backed up by attorneys and constitutional attorneysas well , so far i have not seen any lies coming from them and as a reporter you can check there sources",2019-12-14 17:17:15+00:00,,,1205899566706515970,,https://twitter.com/larryrstreet/status/1205899566706515970,1,0,ClaudiaWheatley,
"in florida when i brought up this method i was read the riot act they were lime stabilization on the brain only it rains a lot in florida and that mess turns into a bigger mess and it washes into brackish water , but i was the dumb one there . i taught other because i understood",2019-12-14 15:34:54+00:00,,,1205873806495113216,,https://twitter.com/larryrstreet/status/1205873806495113216,0,0,larryrstreet,
"i was trained in georgia by the best waste water treatment and water authorities in the world clayton c in microbiology and waste water treatment and some water, as well as pathogen reductions by drum dryers, making human waste into fertilizer, that lykes agri paid for yet in fla",2019-12-14 15:32:06+00:00,,,1205873101688516608,,https://twitter.com/larryrstreet/status/1205873101688516608,1,0,larryrstreet,
