text,date,geo,hashtags,tweet_id,mentions,permalink,replies,retweets,replies_to,mentioned_urls
"clinton steals 2 million in today money in art and antiques from our white house , she and bill steal from hatti , only friends of clinton made out while no public water well drilled , like border more people die from china drugs sold to mexico than guns yet it our guns they want",2020-01-15 23:31:01+00:00,,,1217590040039170049,,https://twitter.com/larryrstreet/status/1217590040039170049,0,0,senatemajldr,
"look at all the money taken in by clinton foundation while she was secretary of state , and they paid daughter millions each month in wages and bill too as well as election staff, obama gave orders to let her off her crimes while trumps people set up for real,",2020-01-15 23:28:10+00:00,,,1217589321257095169,,https://twitter.com/larryrstreet/status/1217589321257095169,0,0,senatemajldr,
" clinton was the one who was with russia yet  keeps lying to america that trump got elected by them, obama was in loop with love birds , fact , combey begins insurance policy, not to mention the hell these lies have put rep and trump family through",2020-01-15 23:25:04+00:00,,,1217588540529430528,@senatemajldr @SpeakerPelosi,https://twitter.com/larryrstreet/status/1217588540529430528,0,0,senatemajldr,
"hey no matter what the last administration was 109% corrupt, and all this evidence coming out  needed to say something to begin a investigation,  bragged about quid pro co clinton was with russia, obama involved with fbi lovers , that’s why we voted for t",2020-01-15 23:20:48+00:00,,,1217587468393951232,@realDonaldTrump @JoeBiden,https://twitter.com/larryrstreet/status/1217587468393951232,0,0,Jim_Jordan,
"yea i agree your a bit short tempered lol but some times we all are , don’t let that bother you st least you healthy and have a beautiful young wife and kids and a great life , you ok none of us have to agree all the time lol",2020-01-15 23:16:33+00:00,,,1217586399374979073,,https://twitter.com/larryrstreet/status/1217586399374979073,0,0,GeraldoRivera,
"he is a criminal, yet the left says oh all if  people were arrested on russia collusion , when none were , they were screwed , even manaford had been investigated over his deal over seas , yet  had broken same laws, so has bill clinton, many others ??",2020-01-15 23:13:45+00:00,,,1217585694169804800,@realDonaldTrump @JohnKerry,https://twitter.com/larryrstreet/status/1217585694169804800,0,0,RealDeanCain,
"your soooooooo dam right to be pissed when the crimes  accused  of were committed by clinton , combey, obama, realize obama att gen extends visa of russian woman so she can meet  to further the insurance policy ,  corrupt",2020-01-15 23:09:31+00:00,,,1217584625683443712,@SpeakerPelosi @realDonaldTrump @DonaldJTrumpJr @RepAdamSchiff,https://twitter.com/larryrstreet/status/1217584625683443712,0,0,greggutfeld,
"republican can call in hunter biden, he committed pay for play and his dad bragging about it how he held up the billion dollars until his son was left alone, you ran a illegal trial by  and known liar and leaker , those ambassadors were corrupt too in bed with soros",2020-01-15 23:02:53+00:00,,,1217582957239640064,@RepAdamSchiff,https://twitter.com/larryrstreet/status/1217582957239640064,0,0,SpeakerPelosi,
"those ambassadors had decided they were smarter than americans and one was in bed with  it is the job of a president to begin a investigation of a corrupt administration when so many things that’s been exposed , yet because obama lets criminal off scott free !!",2020-01-15 22:55:58+00:00,,,1217581219283709953,@georgesoros,https://twitter.com/larryrstreet/status/1217581219283709953,0,0,KristySwansonXO,
" keeps repeating lies to the public saying he was elected by russia when it was clinton working with russia , and getting rich as secretary of state , the corruption in democratic party is beyond belief",2020-01-15 22:47:45+00:00,,,1217579149432410112,@SpeakerPelosi,https://twitter.com/larryrstreet/status/1217579149432410112,0,0,KristySwansonXO,
"some times i just wish the democratic party would just listen to mlks words and stop using him as a weapon when they don’t seem to get it , republican were the ones who register blacks to vote , and stopped indentured servitude , and many died to stop slavery, whites slaved too",2020-01-15 22:45:19+00:00,,,1217578539312205827,,https://twitter.com/larryrstreet/status/1217578539312205827,0,0,KristySwansonXO,
"that’s just how hitlars brown shirts and nazi were , more people die from drugs crossing our borders than guns yet democratic socialism party is ok with those deaths as well as aborted children",2020-01-15 22:42:00+00:00,,,1217577701193801728,,https://twitter.com/larryrstreet/status/1217577701193801728,0,0,AtlMSL,
right on bella,2020-01-15 22:40:02+00:00,,,1217577206412726274,,https://twitter.com/larryrstreet/status/1217577206412726274,0,0,BeIlaWolf,
"because they don’t have the facts on there side and they the democratic party are seriously corrupt yet demand republican to follow rules that they don’t and they allow clinton, obama, fbi,to cost americans millions in fake insurance policies to remove him because he stirred up",2020-01-15 22:39:27+00:00,,,1217577061046521856,,https://twitter.com/larryrstreet/status/1217577061046521856,0,0,CodysMom129,
"yes i was kicked out of my family because my niece wanting my share of moms money, and she tricked mom into buying a house so mom had to raise her kids in pvt school and get her n her hubby made over 100k s year, i am disabled from injury, i worked since 10,i’m house rich lol",2020-01-15 22:35:38+00:00,,,1217576102157307904,,https://twitter.com/larryrstreet/status/1217576102157307904,0,0,HinkleNation,
"yep gun toting bible thumping trash who live in trailers only we know how to build the house and fix the car, i had two uncles who had to crawl into bear caves to have food in winter , in pa , they both became rich, building homes, ones wife’s dad built the valuable fern rifles",2020-01-15 22:31:03+00:00,,,1217574948937654272,,https://twitter.com/larryrstreet/status/1217574948937654272,0,0,KristySwansonXO,
" it is  job to begin a investigation on a corrupt part administration, as we seem to know as the facts bare out, and  states that trump used russia to win a election , when it was proven he did not, the fraud was by the dnc,clinton, obama",2020-01-15 20:31:54+00:00,,,1217544963967328256,@BillOReilly @realDonaldTrump @SpeakerPelosi,https://twitter.com/larryrstreet/status/1217544963967328256,0,0,BillOReilly,
"it is the job of  to begin a investigation on past administration that we know committed crimes , democrats still say  used russia to win a election, while it was proven he did not , they just said he was guilty before the senate had even met ??",2020-01-15 20:28:35+00:00,,,1217544125454655490,@realDonaldTrump @SenateGOP,https://twitter.com/larryrstreet/status/1217544125454655490,0,0,DennisBrunk3,
"and yet the a democratic socialist party says they are defending the constitution but had unfair hearings in the congress and charged the president with exercise his right to president privilege, he can’t have all his conversations be public, none of obama were",2020-01-15 20:25:15+00:00,,,1217543288389017600,,https://twitter.com/larryrstreet/status/1217543288389017600,0,0,DennisBrunk3,
"hell i can’t keep my house clean after me being on crutches for s year i am still rebuilding my back and leg muscles , and trying to keep working on the house to get it done",2020-01-15 20:20:35+00:00,,,1217542114554318848,,https://twitter.com/larryrstreet/status/1217542114554318848,0,0,,
"climate change and greta explains to her in the 15th century antarctica was lush and green as those who mapped it then and had been proven to be green , that england and florida everglades were not underwater, and we had no man made carbon machines",2020-01-14 16:44:08+00:00,,,1217125253098414081,,https://twitter.com/larryrstreet/status/1217125253098414081,0,0,TimConstantine1,
explain to him on climate change al gores theroy was completely debunked because thousands of years passed between each high carbon phase and low carbon phase of the planet ,2020-01-14 16:40:36+00:00,,,1217124366548447233,,https://twitter.com/larryrstreet/status/1217124366548447233,0,0,TimConstantine1,
"married, and my fiancé left me lol , as well as the second one who’s dad hated americans lol yubey herrera she was beautiful, that’s always my luck from being born to two crazy parents i guess thanks always for your friendship ",2020-01-14 16:17:36+00:00,,,1217118575665852418,@TimConstantine1,https://twitter.com/larryrstreet/status/1217118575665852418,0,0,,
"back muscles and then they increased it and then it took my legs from me a year i am still rebuilding my legs and back while still trying to finish a house i built, very slowly, i wanted to sell and get a home on one level, so life if good how about you i remember you just",2020-01-14 16:17:35+00:00,,,1217118571723218945,,https://twitter.com/larryrstreet/status/1217118571723218945,1,0,,
"until my left side began to not work i went to dr lamatta he sent me in for a mri and saved my life with emergency surgery, i had petty mall seizure i couldn’t work this i hated but the va hospital gave me parkinson’s medicine for a pinch nerve i. my back that was destroying my",2020-01-14 16:17:34+00:00,,,1217118568548126723,,https://twitter.com/larryrstreet/status/1217118568548126723,1,0,,
" hello tim it’s larry street who you helped as much as you could in collier county , i had left and came back working st city of sanibel island and walking under a building i hit my head and got knocked out and i had 3 subdural hematoma in my brain , it was not",2020-01-14 16:17:31+00:00,,,1217118554878881792,@TimConstantine1,https://twitter.com/larryrstreet/status/1217118554878881792,1,0,,
the l,2020-01-14 15:58:59+00:00,,,1217113890519158784,,https://twitter.com/larryrstreet/status/1217113890519158784,0,0,Alyssa_Milano,
"this has been proven and reporters run off, so can how foreign immigrate and can own weapons, i thought trumo would shut the terrorist camps in america. yet we still have them here, the camps are filled with illegals who have come across the southern borders",2020-01-14 15:57:03+00:00,,,1217113404571295744,,https://twitter.com/larryrstreet/status/1217113404571295744,0,0,YuH8TM3,
   george carlin - saving the planet https://youtu.be/7w33hrc1a6c via ,2020-01-14 15:56:38+00:00,,,1217113299181101062,@AOC @Jim_Jordan @realDonaldTrump @YouTube,https://twitter.com/larryrstreet/status/1217113299181101062,0,0,,https://youtu.be/7W33HRc1A6c
"millions a month in wages to there daughter, who is married to  son don’t you and  see the problem america faces get more republicans elected stand with    we america have had enough of this total corruption by dnc !",2020-01-14 15:37:35+00:00,,,1217108507582967812,@GorgeSoros @lisamurkowski @realDonaldTrump @senatemajldr @SenateGOP,https://twitter.com/larryrstreet/status/1217108507582967812,0,0,,
"people, let  take the heat and get jobs back he should had been able to work with russia and get them to stop helping iran and norh korea he could had worked with them while  made desks that pumped millions into there foundation that paid out",2020-01-14 15:37:35+00:00,,,1217108505058009090,@realDonaldTrump @HillaryClinton,https://twitter.com/larryrstreet/status/1217108505058009090,1,0,,
addicts and criminals it takes o etca hour for cops to get to our homes in rural americans have seen unarmed folk get killed by drug addicts over 20$do you and  understand this or do you like the democratic socialist party believe you know better than us we the,2020-01-14 15:37:34+00:00,,,1217108502314917889,@lisamurkowski,https://twitter.com/larryrstreet/status/1217108502314917889,1,0,,
"it’s time for    to stick together and get the house and senate back , the people want a america as it was written under the constitution dam it  we will not give up our guns because we law abiding americans been protected from drug",2020-01-14 15:37:33+00:00,,,1217108499068542977,@senatemajldr @SenateGOP @HouseGOP @MittRomney,https://twitter.com/larryrstreet/status/1217108499068542977,1,0,,
"all of trumps people were punished harshly while  was let off and all of her people given immunity, ? don’t you see a problem there ,  stole 2 million in art and antiques from the people’s house the white house they secret service had to get back",2020-01-14 15:37:33+00:00,,,1217108496749121537,@HillaryClinton @HillaryClinton,https://twitter.com/larryrstreet/status/1217108496749121537,1,0,,
"because of the fake russia conspiracy, yes the insurance policy by james combey and the top brass in fbi and cia as well as obama’s art general who extends the visa of the a russian woman so she can meet  , to further the insurance policy ,  was set up",2020-01-14 15:37:31+00:00,,,1217108489362903041,@DonaldJTrumpJr @GenFlynn,https://twitter.com/larryrstreet/status/1217108489362903041,1,0,,
"still gave away 10 trillion to third world countries, let trump take the pressure he can handle it and go after the real threats china who sends drugs to mexico, that kill more americans than the last 3 wars how can anyone with any humanity not want that border secure ",2020-01-14 15:17:20+00:00,,,1217103409234567169,@MittRomney,https://twitter.com/larryrstreet/status/1217103409234567169,1,0,,
"the crimes of clinton, obama and his administration and how somehow he gave away 10 trillion dollars, even after the housing crisis we bailed out the banks not the people, and still our national debt was still only 10 trillion ???? yet in 8 years he spent nothing on america and",2020-01-14 15:17:19+00:00,,,1217103406667616256,,https://twitter.com/larryrstreet/status/1217103406667616256,1,0,,
"    mitt you were responsible for closing down manufacturing jobs and stealing pensions , the entire constitution and our way of life is at stake here , democratic party commits crimes and try’s to blame republicans, ignoring",2020-01-14 15:17:18+00:00,,,1217103400803938309,@MittRomney @realDonaldTrump @senatemajldr @seanhannity,https://twitter.com/larryrstreet/status/1217103400803938309,1,0,,
"they want to take our guns yet , not controll our borders when more americans die from massive amounts on meth and heroine coming into america from china",2020-01-14 14:29:42+00:00,,,1217091425172709376,,https://twitter.com/larryrstreet/status/1217091425172709376,0,0,DonaldJTrumpJr,
yes we are  ,2020-01-14 14:27:47+00:00,,,1217090942429093890,@realDonaldTrump @DonaldJTrumpJr,https://twitter.com/larryrstreet/status/1217090942429093890,0,0,DonaldJTrumpJr,
yea because the other guys said she was so controlling over john,2020-01-12 02:35:48+00:00,,,1216186990581944327,,https://twitter.com/larryrstreet/status/1216186990581944327,0,0,DisturbedPride,
correct,2020-01-12 02:34:39+00:00,,,1216186698125672449,,https://twitter.com/larryrstreet/status/1216186698125672449,0,0,TheAnaBraga,
one thing about trump he is mean to anyone who is unfair to him it’s not a racist thing,2020-01-12 02:34:16+00:00,,,1216186602499776512,,https://twitter.com/larryrstreet/status/1216186602499776512,0,0,TheAnaBraga,
those on the left seem to want to resort to name calling and correct our spelling or even punctuation,2020-01-12 02:32:34+00:00,,,1216186175578308608,,https://twitter.com/larryrstreet/status/1216186175578308608,0,0,TheAnaBraga,
yes your absolutely gorgeous ana i’m glad you came to america,2020-01-12 02:29:39+00:00,,,1216185441923358721,,https://twitter.com/larryrstreet/status/1216185441923358721,1,0,TheAnaBraga,
it was arson too,2020-01-12 02:28:14+00:00,,,1216185084224602112,,https://twitter.com/larryrstreet/status/1216185084224602112,0,0,ROHLL5,
this breaks my heart ,2020-01-12 02:27:57+00:00,,,1216185012992839686,,https://twitter.com/larryrstreet/status/1216185012992839686,0,0,ROHLL5,
u live in two states lol,2020-01-12 02:25:34+00:00,,,1216184415245799425,,https://twitter.com/larryrstreet/status/1216184415245799425,0,0,LindaWi12436890,
are u rich lol just kidding ha ha,2020-01-12 02:25:09+00:00,,,1216184307393404929,,https://twitter.com/larryrstreet/status/1216184307393404929,0,0,LindaWi12436890,
wow sexy and classy,2020-01-12 02:24:37+00:00,,,1216184175264522240,,https://twitter.com/larryrstreet/status/1216184175264522240,0,0,LindaWi12436890,
"i actually have lost a lot of weight too being crippled, what worries me it was mostly mussel mass it even attacking my arm muscles, they should had been strong being on crutches but that parkinson’s med can dissolve muscles to nothing yet they have not replied to my claim",2020-01-12 02:23:04+00:00,,,1216183782857940992,,https://twitter.com/larryrstreet/status/1216183782857940992,1,0,TheAnaBraga,
"i’m try so hard to rebuild my legs n back from the va hosp damage that medicine did to me , to go from a very strong man to not being able to get off a toilet zero leg strength i had to slide down stairs and crawl up a year the va and social healthcare, one indian doc over all",2020-01-12 02:20:20+00:00,,,1216183095898071042,,https://twitter.com/larryrstreet/status/1216183095898071042,0,0,TheAnaBraga,
"not my side i was 150 lbs at 6 ft 3 in the navy and still had them i can’t get rid of them , nothing has ever even changed them , but sorry if u hadn’t it seems so common today, i wish i could afford it i know i’d feel better but yea i am trying my hardest to get my legs n back",2020-01-12 02:17:45+00:00,,,1216182444795289602,,https://twitter.com/larryrstreet/status/1216182444795289602,1,0,TheAnaBraga,
but u can afford liposuction i have wanted it forever because i have had huge spare tire that don’t go away no matter how skinny i am it’s embarrassing i look ok straight on but turn a tiny bit and i see huge fat humps on my hips,2020-01-12 02:02:48+00:00,,,1216178685960695808,,https://twitter.com/larryrstreet/status/1216178685960695808,2,0,TheAnaBraga,
hey the va hosp gave me parkinson’s med it happens i am one of those it completely destroyed my back then legs muscles i had not walked in a year i still can’t stand straight or walk very far i went in over n again begging for help yet nothing they should had tried dif medicine,2020-01-12 02:00:08+00:00,,,1216178014872113152,,https://twitter.com/larryrstreet/status/1216178014872113152,1,0,TheAnaBraga,
his eyes need washed out i’ll bet from smoke in them,2020-01-12 01:53:47+00:00,,,1216176415239999488,,https://twitter.com/larryrstreet/status/1216176415239999488,0,1,ROHLL5,
well well well looks like we have a threesome,2020-01-11 20:47:05+00:00,,,1216099229527089153,,https://twitter.com/larryrstreet/status/1216099229527089153,0,0,underthebigw,
ewwww that’s gross and nasty,2020-01-11 12:29:00+00:00,,,1215973886791168001,,https://twitter.com/larryrstreet/status/1215973886791168001,0,0,kay_may1,
i have had that problem ever since i was a baby,2020-01-11 12:28:32+00:00,,,1215973765496090624,,https://twitter.com/larryrstreet/status/1215973765496090624,0,0,kay_may1,
hot a mommy lol,2020-01-11 12:27:32+00:00,,,1215973513703632897,,https://twitter.com/larryrstreet/status/1215973513703632897,0,0,KristySwansonXO,
yea to get roads and bridges built because so many laws have been added they are super redundant and have sooo many departments to go through to even get started that’s why if you ever know the facts u might understand shit,2020-01-11 12:26:47+00:00,,,1215973325509402625,,https://twitter.com/larryrstreet/status/1215973325509402625,0,0,Alyssa_Milano,
"god i just want to touch you all over just to know your real , and i am glad you came to usa",2020-01-10 11:32:39+00:00,,,1215597314783567872,,https://twitter.com/larryrstreet/status/1215597314783567872,0,0,TheAnaBraga,
why he just got 4 bill approved to build a wall,2020-01-10 11:29:02+00:00,,,1215596404003024896,,https://twitter.com/larryrstreet/status/1215596404003024896,0,0,Antfer22,
wow you blame automatic weapons for drug o er doses on heroine really did you say that,2020-01-10 11:27:08+00:00,,,1215595926242414592,,https://twitter.com/larryrstreet/status/1215595926242414592,0,0,burkrobert,
it’s quite odd democratic don’t care how many americans are killed each year and only blaming it all on gun violence. it’s who is getting in the country and pulling the triggers man,2020-01-10 11:25:25+00:00,,,1215595493880999936,,https://twitter.com/larryrstreet/status/1215595493880999936,0,0,AnnCoulter,
he just found out he gets 4 billion for the wall,2020-01-10 11:23:38+00:00,,,1215595048643047424,,https://twitter.com/larryrstreet/status/1215595048643047424,0,0,AnnCoulter,
" is talking about running to take away  place and . we know  carries a hell of a lot of weight , and    amount many others who see throug the madness that’s actually working for the best of this nation",2020-01-10 10:57:43+00:00,,,1215588523631431681,@drdrew @RepAdamSchiff @jonvoight @KristySwansonXO @RealDeanCain @KevinSORBO5,https://twitter.com/larryrstreet/status/1215588523631431681,0,0,KristySwansonXO,
"   america is calling you to save u from a socialist islamic state with open borders, we need to get these changes into law , change the laws on immigration we want them who love us but want , ru, gr, en, fr, sco, this may be our last chance",2020-01-10 10:50:19+00:00,,,1215586663646232576,@KristySwansonXO @jonvoight @RealDeanCain,https://twitter.com/larryrstreet/status/1215586663646232576,0,0,KristySwansonXO,
"ok we know your still gorgeous as hell you beautiful girl you should be making more movies probably , but we need you,and   and  and others , and hey they get paid 250k a year, all your stuff and family stuff is paid for, n perks , save usa ok",2020-01-10 10:44:55+00:00,,,1215585303731281920,@RealDeanCain @KEVINSORBO1 @jonvoight,https://twitter.com/larryrstreet/status/1215585303731281920,0,0,KristySwansonXO,
"this open borders and china meth and fentinal sold to mexico cartels killing more americans than anything, why to keep open borders , why ???? we have sheria law now in michigan ",2020-01-10 04:04:51+00:00,,,1215484622949224449,@drdrew,https://twitter.com/larryrstreet/status/1215484622949224449,0,0,,
" please help save america to us in the midwest this truly is about loosing america to a socialist islamic state to become like london england because ever since the shaw of iran was removed because usa did not help him jimmy carter , as they used to live just as we do,",2020-01-10 04:04:50+00:00,,,1215484618041962497,@drdrew,https://twitter.com/larryrstreet/status/1215484618041962497,1,0,,
"only to stay in a war or go into a world war or something that can be debated on , most things can’t be even george washington agree with this and it had been this way since the beginning",2020-01-10 01:22:56+00:00,,,1215443875403268097,,https://twitter.com/larryrstreet/status/1215443875403268097,0,0,RepThomasMassie,
"do you think  can keep a secret dude if he could then our presidents could tell certain members of congress before taking such actions, and taking out war criminals who have been directing attacks on our bases from irac , taking him out outside of iran was best",2020-01-10 01:20:40+00:00,,,1215443307284901889,@RepAdamSchiff,https://twitter.com/larryrstreet/status/1215443307284901889,0,0,RepMattGaetz,
wake up !!!!,2020-01-10 01:16:40+00:00,,,1215442297053204480,,https://twitter.com/larryrstreet/status/1215442297053204480,0,0,,
"through your head ever since the fall because usa didn’t back the shaw of iran religious fanatics have wanted to take over the world, the second ottoman empire , look at london england, france germany and now scotland, look at our own michigan thar is already under shreia law",2020-01-10 01:16:39+00:00,,,1215442296214257666,,https://twitter.com/larryrstreet/status/1215442296214257666,1,0,,
" you and  are wrong for one a president may only have minutes to decide to do anything to take our a terrorist or save a base , and iran will use nukes once they can because they live in 200 ad where they can marry 9 years old children, get this",2020-01-10 01:16:39+00:00,,,1215442292456280064,@RepMattGaetz @SenatorTimKain1,https://twitter.com/larryrstreet/status/1215442292456280064,1,0,,
why is he not being charged for going to iran and negotiating with them with out our permission,2020-01-10 00:44:44+00:00,,,1215434261869867015,,https://twitter.com/larryrstreet/status/1215434261869867015,0,0,seanhannity,
tell this but case from 200 ad who married her brother if they quit making nukes and stoped paying for terror all over the world they would not have any sanctions,2020-01-10 00:43:08+00:00,,,1215433860042936320,,https://twitter.com/larryrstreet/status/1215433860042936320,0,0,seanhannity,
"the iran buffoons blew off the cockpit first and caught the plane on fire it was in pices before it hit ground, iran has manlipulated the black boxes and refused anyone according to international law to see the crash site they shot it down thinking it was our bomber",2020-01-10 00:41:22+00:00,,,1215433414863736832,,https://twitter.com/larryrstreet/status/1215433414863736832,0,0,seanhannity,
"he has listened to his military advisers and won the war on isis and removing these very bad war criminals is absolutely fine ,",2020-01-10 00:37:34+00:00,,,1215432457773879298,,https://twitter.com/larryrstreet/status/1215432457773879298,0,0,seanhannity,
agree fir a long time she makes little sense,2020-01-10 00:35:30+00:00,,,1215431938783293442,,https://twitter.com/larryrstreet/status/1215431938783293442,0,1,ChuckCallesto,
