text,date,geo,hashtags,tweet_id,mentions,permalink,replies,retweets,replies_to,mentioned_urls
"there needs to be a recognition that naloxone is relevant for people using opioids at therapeutic levels. ""they don't take drugs"" is a common response to the question when i have asked many colleagues (prescribers & dispensers) if they provide to people taking 100mgeq morphine",2019-11-13 04:40:54+00:00,,,1194475199179083777,,https://twitter.com/pharmerfour/status/1194475199179083777,0,0,JacintaAdelaide,
read it this morning..... the article is really well balanced. good job,2019-11-13 01:21:25+00:00,,,1194424996472311809,,https://twitter.com/pharmerfour/status/1194424996472311809,0,0,geirorourke,
someone uses linkedin to chat you up? they must be awesome* to work with *sarcasm does not always translate through to text.,2019-11-12 19:18:49+00:00,,,1194333747480367104,,https://twitter.com/pharmerfour/status/1194333747480367104,1,0,Cleverestcookie,
"if anything, they be less dangerous if they weren't illegal.",2019-11-11 10:17:44+00:00,,,1193835189039878146,,https://twitter.com/pharmerfour/status/1193835189039878146,0,0,pharmerfour,
"this perspective is odd that quote *should* have said: ""all substances carry the risk of harming, or ultimately killing, the user.”... including blood pressure medicine, antidepressants, your alcohol (especially alcohol), just about everything. illegal drugs aren't unique",2019-11-11 10:17:09+00:00,,,1193835044416000000,,https://twitter.com/pharmerfour/status/1193835044416000000,1,0,JarrydBartle,
"it would be very short sighted to think of a facility pharmacists role as just being ""more of the same, but employed by the facility"" that won't end in better care....",2019-11-11 00:03:12+00:00,,,1193680537677750272,,https://twitter.com/pharmerfour/status/1193680537677750272,0,0,pharmerfour,
rmmr needs to be separate from the facility pharmacist in my mind... otherwise they will be funneled in to this role and do nothing else. but part of the facility pharmacists role should be to flag those residents in need of rmmr.,2019-11-11 00:02:21+00:00,,,1193680323369811968,,https://twitter.com/pharmerfour/status/1193680323369811968,1,0,WestburyJuanita,
"qum contract woefully underfunded to provide an onsite pharmacist service. there is value in having an external party evaluate qum, while an onsite pharmacists implements it.....",2019-11-11 00:00:58+00:00,,,1193679975213236224,,https://twitter.com/pharmerfour/status/1193679975213236224,0,0,WestburyJuanita,
agreed... at a population level. there are facilities & qum providers who have made a huge difference in isolation,2019-11-10 23:59:43+00:00,,,1193679660279746560,,https://twitter.com/pharmerfour/status/1193679660279746560,0,0,WestburyJuanita,
any facility that tries to address their policies & procedures using the qum funding (ie no new investment) isn't interested in quality improvement & will just end up in front of the next royal commission. it requires a true investment in time & expertise,2019-11-10 23:44:37+00:00,,,1193675863075635201,,https://twitter.com/pharmerfour/status/1193675863075635201,2,0,pharmerfour,
"i would also point out that many facilities need to have a complete overhaul of their policies & procedures. there have been suggestions that qum contracts could be used to do this, but the funding for this is woefully inadequate.",2019-11-10 23:42:26+00:00,,,1193675313693118464,,https://twitter.com/pharmerfour/status/1193675313693118464,1,0,pharmerfour,
the role is needed to address what isn't being done now.... not to do the small number of recognised roles pharmacists already provide in rcfs,2019-11-10 23:40:13+00:00,,,1193674755045384193,,https://twitter.com/pharmerfour/status/1193674755045384193,1,0,pharmerfour,
"same goes for rmmr - if an onsite pharmacist spends all their day doing rmmr (especially when a contract was already in place) then we've failed in establishing the role, & failed to have an impact.",2019-11-10 23:37:24+00:00,,,1193674043766890496,,https://twitter.com/pharmerfour/status/1193674043766890496,1,0,pharmerfour,
"so no, a pharmacist on site will already have plenty to do (including implementation of the qum rcommendations) to take over the existing qum contracts that are already being provided.",2019-11-10 23:36:20+00:00,,,1193673775025283074,,https://twitter.com/pharmerfour/status/1193673775025283074,1,0,pharmerfour,
"there's a few things that go in to my answer. 1st - many facilities utilise qum services now. would not want this to stand in the way of a pharmacist joining the staff. 2nd even with qum services provided now, there is so much more that a pharmacist would do on site.",2019-11-10 23:35:21+00:00,,,1193673529226432512,,https://twitter.com/pharmerfour/status/1193673529226432512,1,0,WestburyJuanita,
i'm not surprised at the impact ferrinject had.... and how people are now more nervous to use it...,2019-11-10 09:05:58+00:00,,,1193454742820646912,,https://twitter.com/pharmerfour/status/1193454742820646912,1,0,KazH61,
"wanambi, who no longer lives at the pharmacy",2019-11-10 07:25:47+00:00,,,1193429531761102848,,https://twitter.com/pharmerfour/status/1193429531761102848,0,0,rodrigMD,
where is the pineapple?,2019-11-10 07:22:20+00:00,,,1193428660134371328,,https://twitter.com/pharmerfour/status/1193428660134371328,1,0,M_YousafAhmad,
nice cpd activity on noacs &amp; warfarin for non-valvular atrial fibrillation https://www.ausdoc.com.au/how-treat/noacs-nonvalvular-atrial-fibrillation i particularly like table 4 - i could see this being printed out by a lot of clinicians.... ,2019-11-10 05:20:26+00:00,,#NOACs,1193397983192051712,@AusDocGroup,https://twitter.com/pharmerfour/status/1193397983192051712,0,0,,https://www.ausdoc.com.au/how-treat/noacs-nonvalvular-atrial-fibrillation
"""everything you know about iron supplements is wrong"" https://www.ausdoc.com.au/news/everything-you-know-about-iron-supplements-wrong unsurprisingly, this study on 40 people has not had a paradigm-changing effect on iron supplement recommendations in the 2 years since it was published... 40 people does not change practice...",2019-11-10 05:03:01+00:00,,,1193393600614162432,,https://twitter.com/pharmerfour/status/1193393600614162432,0,0,,https://www.ausdoc.com.au/news/everything-you-know-about-iron-supplements-wrong
"live pretty close to this building site. have no issues whatsoever with it. there seems to be a larger part of the community who support it or don't oppose it, than those who do.",2019-11-10 04:41:26+00:00,,,1193388171804868609,,https://twitter.com/pharmerfour/status/1193388171804868609,0,0,SouthwickMP,
"they *definitely* don't lead to changes alone. they motivate change if applied regularly by a 3rd party if a facility doesn't have good policies in place, the audit will only lead to a cycle of complacency (outside of audit) & anxiety (during audit) with no change in outcomes",2019-11-10 04:25:02+00:00,,,1193384043389181953,,https://twitter.com/pharmerfour/status/1193384043389181953,0,0,WestburyJuanita,
currently i have a piece of software that looks at both of my calendars and ensures they match.... but this has lead to a few appointments appearing 2 or 3 times... but this is much better than zero.,2019-11-10 03:26:19+00:00,,,1193369265732063232,,https://twitter.com/pharmerfour/status/1193369265732063232,0,0,AmyTPage,
the hunt continues for a calendar tool then. thanks,2019-11-10 03:23:15+00:00,,,1193368496488382464,,https://twitter.com/pharmerfour/status/1193368496488382464,0,0,DanGuidone,
"does it coordinate calendars as well? need something similar for my inboxes, but my biggest issue is coordinating 2 calendars efficiently",2019-11-10 02:56:01+00:00,,,1193361639526912001,,https://twitter.com/pharmerfour/status/1193361639526912001,1,0,DanGuidone,
"i guarantee that the amount of work needed to get up to standard will be more than a few checklists as audits. from my experience, there is a need to comprehensively address every *existing* policy of the facility & update them, plus the need to fill policy gaps",2019-11-10 02:48:20+00:00,,,1193359707370442753,,https://twitter.com/pharmerfour/status/1193359707370442753,1,0,WestburyJuanita,
part of the solution is to have a pharmacist on staff to help implement the qum changes you recommend....,2019-11-10 02:39:51+00:00,,,1193357572612321281,,https://twitter.com/pharmerfour/status/1193357572612321281,1,0,KazH61,
"here's a simple example a guy asks about another guy's partner, their sex life together, what she likes etc. happens a lot, treated like it's ok... yet it makes people uncomfortable. a lot of male interaction & social dominance is built around this type of 'dynamic'",2019-11-09 10:59:23+00:00,,,1193120897961316352,,https://twitter.com/pharmerfour/status/1193120897961316352,0,0,nayanikaaa,
"i would say both are under-reported. sexual harassment of men isn't well recognised, and is often instigated by heterosexual men; the targets are both heterosexual & homosexual men",2019-11-09 08:13:33+00:00,,,1193079162661036033,,https://twitter.com/pharmerfour/status/1193079162661036033,1,1,brookmanknight,
this feels like this video at 47 seconds..... ignoring evidence against the preformed opinion & focussing on anything that fgould be used to support the opinion,2019-11-09 03:18:58+00:00,,,1193005029235425280,,https://twitter.com/pharmerfour/status/1193005029235425280,1,0,Kate_Seear,https://youtu.be/yJD1Iwy5lUY
i think the racf setting brings it to a head... complacency from some hits professionalism from others... the path of least resistance (& least expense) wins when you can keep bringing in more complacent people,2019-11-08 21:44:18+00:00,,,1192920806696767488,,https://twitter.com/pharmerfour/status/1192920806696767488,0,0,GongGasGirl,
"the problem we have is that for every practitioner who is passionate & wants best outcomes for residents *as people*... there are more who will ""do the job without causing trouble""",2019-11-08 21:40:14+00:00,,,1192919785643708416,,https://twitter.com/pharmerfour/status/1192919785643708416,1,0,pharmerfour,
"the combative nature of standing up for residents i've encountered - & it comes from everyone... my colleagues, your colleagues, facility staff, family... i've had gps recommend that my services be terminated; i've heard or pharmacists making the same recommendation about a gp.",2019-11-08 21:37:55+00:00,,,1192919201100398593,,https://twitter.com/pharmerfour/status/1192919201100398593,2,2,brookmanknight,
"on this i agree with you the number of planning & scoping events where ""more training"" is one of the recommendations it's rarely correct. implement structural changes that empower a practitioner to use their expertise; cultural changes that change how professionals are utilised",2019-11-08 21:34:43+00:00,,,1192918396351893504,,https://twitter.com/pharmerfour/status/1192918396351893504,1,1,brookmanknight,
"of course, for illnesses where they are indicated. it seems the response to this article & tweet has been ""but it's just too hard to put in the work needed to address inappropriate prescribing""",2019-11-08 21:30:12+00:00,,,1192917258902720512,,https://twitter.com/pharmerfour/status/1192917258902720512,1,0,chrisApharm,
"those two are very often related to the agitation that is being treated with chemical restrains - as are acute infections (think uti), and many other conditions for which a better solution/strategy could be found if the person looking had the time or inclination",2019-11-08 02:23:45+00:00,,,1192628746043346945,,https://twitter.com/pharmerfour/status/1192628746043346945,0,0,KazH61,
crikey newchild at 5 weeks is enough to disrupt sleeping patterns (directly proportional to satisfaction levels)..... i can only guess what double the fun is like....,2019-11-07 23:32:09+00:00,,,1192585559618674694,,https://twitter.com/pharmerfour/status/1192585559618674694,1,0,blmerriman,
great news hopefully it can demonstrate the benefits locally - i'm sure  will be interested in the results.,2019-11-07 22:23:28+00:00,,,1192568276955484160,@MartinFoleyMP,https://twitter.com/pharmerfour/status/1192568276955484160,0,0,JMasanauskas,
"""to respond to, say, the symptom of agitation by prescribing an antipsychotic without looking for the causes of that agitation is inappropriate, & the same applies to any other behaviour."" https://www.ausdoc.com.au/news/antipsychotics-aged-care-psychiatrist-suggests-realworld-alternatives the number of times i've communicated this to a prescriber.....",2019-11-07 22:21:13+00:00,,,1192567709709373441,,https://twitter.com/pharmerfour/status/1192567709709373441,4,1,,https://www.ausdoc.com.au/news/antipsychotics-aged-care-psychiatrist-suggests-realworld-alternatives
"i live in melbourne...... the advertising for gambling here is reaching ridiculous proportions. billboards, radio, even  full of gambling adds here. hate it",2019-11-07 22:17:15+00:00,,,1192566710651351040,@Spotify,https://twitter.com/pharmerfour/status/1192566710651351040,1,0,Cleverestcookie,
i get lots and lots of gambling adds..... so much for targeted advertising.,2019-11-07 22:00:39+00:00,,,1192562533426548736,,https://twitter.com/pharmerfour/status/1192562533426548736,1,0,Cleverestcookie,
we should get the band back together.....,2019-11-07 01:22:13+00:00,,,1192250870068477952,,https://twitter.com/pharmerfour/status/1192250870068477952,1,0,KennyPharmPhD,
tell your colleagues about this https://www.amavic.com.au/assistance-for-doctors/support-programs/peer-support-service contact ama victoria peer support 365 days of the year from 8am to 10pm. when you dial 1300 853 338 your call will be transferred to a mobile phone carried by a volunteer ama victoria peer support service counsellor.,2019-11-07 01:21:44+00:00,,,1192250749901664256,,https://twitter.com/pharmerfour/status/1192250749901664256,0,1,MattScott410,https://www.amavic.com.au/assistance-for-doctors/Support-Programs/peer-support-service
"our biggest fans this week: pash22, cleverestcookie, bsadams25. thank you! via https://sumall.com/thankyou?utm_source=twitter&amp;utm_medium=publishing&amp;utm_campaign=thank_you_tweet&amp;utm_content=text_and_media&amp;utm_term=b01b175b28b8ed7dac474a0a",2019-11-05 22:01:09+00:00,,,1191837883914686465,,https://twitter.com/pharmerfour/status/1191837883914686465,0,0,,https://sumall.com/thankyou?utm_source=twitter&utm_medium=publishing&utm_campaign=thank_you_tweet&utm_content=text_and_media&utm_term=b01b175b28b8ed7dac474a0a
1997 at wagga. also a year before i started,2019-11-04 06:24:31+00:00,,,1191239785668435968,,https://twitter.com/pharmerfour/status/1191239785668435968,1,0,SafeeraHussainy,
https://www.improbable.com/ig-about/ nominate them....,2019-11-03 22:12:29+00:00,,,1191115961044103169,,https://twitter.com/pharmerfour/status/1191115961044103169,0,0,MattScott410,https://www.improbable.com/ig-about/
oops i got my magical logic wrong.... 60 times worse,2019-11-03 20:15:28+00:00,,,1191086513699741696,,https://twitter.com/pharmerfour/status/1191086513699741696,0,0,pharmerfour,
"if fluoride is toxic, isn't 6x homeopathic fluoride 600 times worse?",2019-11-03 20:14:32+00:00,,,1191086275559747584,,https://twitter.com/pharmerfour/status/1191086275559747584,1,0,MarkNaunton,
every nurse should be degree level; pharmacists should be employed in a manner like a hospital. there should be a resident medical officer. there should be a minimum qualification required *before* staffing is adjusted or we'll end up back here in a decade. 2/2,2019-11-03 18:46:27+00:00,,,1191064112555364352,,https://twitter.com/pharmerfour/status/1191064112555364352,0,0,pharmerfour,
"every workforce can be assisted by increased volume but it doesn't fix the issue here i've worked with racfs on many levels, including policy development. the use of unqualified people ""endorsed"" to undertake a role after a certificate-level period of study is the problem 1/2",2019-11-03 18:43:56+00:00,,,1191063475562237952,,https://twitter.com/pharmerfour/status/1191063475562237952,1,0,vipergreen,
"my week on twitter : 15 mentions, 8.02k mention reach, 31 likes, 14 retweets, 40.1k retweet reach. see yours with https://sumall.com/performancetweet?utm_source=twitter&amp;utm_medium=publishing&amp;utm_campaign=performance_tweet&amp;utm_content=text_and_media&amp;utm_term=b01b175b28b8ed7dac474a0a",2019-11-03 09:03:18+00:00,,,1190917356459048962,,https://twitter.com/pharmerfour/status/1190917356459048962,0,0,,https://sumall.com/performancetweet?utm_source=twitter&utm_medium=publishing&utm_campaign=performance_tweet&utm_content=text_and_media&utm_term=b01b175b28b8ed7dac474a0a
"it is not as simple as ""not enough staff"" if a person is working in an understaffed situation, is relying on chemical restrain an ethical solution? or is it more likely that there is inadequate appreciation for the inappropriateness of chemical restraint",2019-11-02 11:17:14+00:00,,,1190588671553966086,,https://twitter.com/pharmerfour/status/1190588671553966086,0,0,BoydFraser1,
"it's not the volume of staff that needs to be addressed... it's the type & qualification. and training, as  has already pointed out, upskilling in the right area makes a difference",2019-11-02 11:12:30+00:00,,,1190587483798425600,@WestburyJuanita,https://twitter.com/pharmerfour/status/1190587483798425600,1,0,BoydFraser1,
ceres restaurant....,2019-11-02 11:06:18+00:00,,,1190585921961201664,,https://twitter.com/pharmerfour/status/1190585921961201664,1,0,cdmpharmacist,
maybe not actually.... that's 75 tablets bd...... or a sizable infusion,2019-11-02 11:05:42+00:00,,,1190585769343119360,,https://twitter.com/pharmerfour/status/1190585769343119360,0,0,DigitalPhamcist,
pretty good ant killer....,2019-11-02 11:04:26+00:00,,,1190585453767880704,,https://twitter.com/pharmerfour/status/1190585453767880704,1,0,cdmpharmacist,
guaranteed fatal if it had been dispensed,2019-11-02 11:01:32+00:00,,,1190584721882804226,,https://twitter.com/pharmerfour/status/1190584721882804226,1,0,DigitalPhamcist,
started using both in the organisations i'm involved with until drug checking takes hold.,2019-11-02 09:02:42+00:00,,,1190554817631928320,,https://twitter.com/pharmerfour/status/1190554817631928320,1,0,ACTINOSProject,
"added to ""watch later"" since i'm taking newchild out for lunch. will check out their upcoming sessions too",2019-11-02 03:37:33+00:00,,,1190472989130706944,,https://twitter.com/pharmerfour/status/1190472989130706944,0,0,IndigenousX,
,2019-11-02 03:34:53+00:00,,,1190472318645985280,,https://twitter.com/pharmerfour/status/1190472318645985280,0,0,paulkidd,
also time for people living in nursing facilities to have the same level of care as hospitals. this means pharmacists present to provide expertise on quality and safe use of medicines.... & putting a stop to chemical restraints.,2019-11-02 02:03:17+00:00,,,1190449268915441664,,https://twitter.com/pharmerfour/status/1190449268915441664,0,3,JennyMikakos,
with a standard (not premium) account  is there a way to block specific advertising types? like gambling?,2019-10-31 22:31:12+00:00,,,1190033505885065217,@Spotify,https://twitter.com/pharmerfour/status/1190033505885065217,1,0,,
" there is an error in your media release about terbutaline ""from november 1, 2019, people with asthma will only be dispensed a bricanyl inhaler if they have a prescription from their doctor"" it remains schedule 3 available without prescription.",2019-10-30 19:20:23+00:00,,,1189623098317762560,@AsthmaAustralia,https://twitter.com/pharmerfour/status/1189623098317762560,1,0,,
support for hat is particularly surprising &amp; welcome would be straightforward to draw up a clinical framework...,2019-10-30 05:24:08+00:00,,#HAT,1189412650792316928,,https://twitter.com/pharmerfour/status/1189412650792316928,0,1,Kate_Seear,
"have been in a meeting in sydney, and very much appreciate being able to follow in almost-real-time good outcome, disappointing that the motion was even introduced.",2019-10-30 04:54:44+00:00,,,1189405250978844672,,https://twitter.com/pharmerfour/status/1189405250978844672,1,0,Kate_Seear,
"you are 100% correct. not only that, ""i'll be watching you"" is about a stalker, and ""son of a preacher man"" is about a woman's first orgasm with a sexual partner",2019-10-30 03:17:04+00:00,,,1189380670893649921,,https://twitter.com/pharmerfour/status/1189380670893649921,0,0,cmogorman,
the sparky has you amped? ded?,2019-10-30 02:55:49+00:00,,,1189375324896681984,,https://twitter.com/pharmerfour/status/1189375324896681984,0,0,cdmpharmacist,
it's refreshing to see some balance & objectivity in coverage of the north richmond community health centre & the msir located within it https://lens.monash.edu/-society/2019/10/29/1378003/richmonds-safe-injecting-room-controversy-overshadows-positive-community-impact?amp=1&amp;__twitter_impression=true well written  - recommended reading for all people with something to say about harm reduction &amp; drug use,2019-10-30 00:59:37+00:00,,#MSIR,1189346080217010180,@Kate_Seear,https://twitter.com/pharmerfour/status/1189346080217010180,1,5,,https://lens.monash.edu/@politics-society/2019/10/29/1378003/richmonds-safe-injecting-room-controversy-overshadows-positive-community-impact?amp=1&__twitter_impression=true
i wonder if this will be applied to colleagues as well?,2019-10-30 00:39:39+00:00,,,1189341055013085184,,https://twitter.com/pharmerfour/status/1189341055013085184,1,0,docxy75,
"our biggest fans this week: trisha_the_doc, renzas, bromleydiabetic. thank you! via https://sumall.com/thankyou?utm_source=twitter&amp;utm_medium=publishing&amp;utm_campaign=thank_you_tweet&amp;utm_content=text_and_media&amp;utm_term=b01b175b28b8ed7dac474a0a",2019-10-29 22:00:16+00:00,,,1189300948595892226,,https://twitter.com/pharmerfour/status/1189300948595892226,0,0,,https://sumall.com/thankyou?utm_source=twitter&utm_medium=publishing&utm_campaign=thank_you_tweet&utm_content=text_and_media&utm_term=b01b175b28b8ed7dac474a0a
"2 years since this piece was published & we are yet to see significant investment by australian governments in pharmacists in delivering medicine safety. a continued focus on supply funding, without funding medication safety interventions, will not address this target",2019-10-29 04:09:49+00:00,,,1189031557865951232,,https://twitter.com/pharmerfour/status/1189031557865951232,0,4,,
"how to change antibiotic over-prescribing? compare your prescribing to your peers, and document your reasons for using the antibiotic. both lead to reduced antibiotic use https://ajp.com.au/news/intervention-changed-docs-antibiotic-prescribing/   ",2019-10-29 03:44:14+00:00,,,1189025121182179328,@AJPEditor @jasndoc @JAMA_current,https://twitter.com/pharmerfour/status/1189025121182179328,0,1,,https://ajp.com.au/news/intervention-changed-docs-antibiotic-prescribing/
both of the analogies used in this article by  and  &amp; bill coote are on point. well done.,2019-10-29 03:21:41+00:00,,,1189019444225302528,@CroakeyNews @stephenjduckett,https://twitter.com/pharmerfour/status/1189019444225302528,0,0,stephenjduckett,https://twitter.com/stephenjduckett/status/1189007778762743808
"randomised control trials: what makes them the gold standard in medical research? interesting article, but clearly there are many places where rcts aren't useful or practical... http://theconversation.com/randomised-control-trials-what-makes-them-the-gold-standard-in-medical-research-78913?utm_source=twitter&amp;utm_medium=twitterbutton ",2019-10-29 01:55:56+00:00,,,1188997866926166016,@ConversationEDU,https://twitter.com/pharmerfour/status/1188997866926166016,0,0,,http://theconversation.com/randomised-control-trials-what-makes-them-the-gold-standard-in-medical-research-78913?utm_source=twitter&utm_medium=twitterbutton
does your article discuss the proportion of people who don't get an accurate diagnosis?,2019-10-28 05:53:47+00:00,,,1188695333578010624,,https://twitter.com/pharmerfour/status/1188695333578010624,0,0,kemal_atlay,
there's also the other side of the statement.... the number of people with employment who use drugs regularly,2019-10-28 01:00:31+00:00,,,1188621533217865728,,https://twitter.com/pharmerfour/status/1188621533217865728,1,0,brookmanknight,
interesting piece on the process of getting a new medicine to market (notwithstanding data/study quality & politics....) explainer: how do drugs get from the point of discovery to the pharmacy shelf? http://theconversation.com/explainer-how-do-drugs-get-from-the-point-of-discovery-to-the-pharmacy-shelf-78915?utm_source=twitter&amp;utm_medium=twitterbutton ,2019-10-28 00:44:07+00:00,,,1188617406161158144,@ConversationEDU,https://twitter.com/pharmerfour/status/1188617406161158144,0,1,,http://theconversation.com/explainer-how-do-drugs-get-from-the-point-of-discovery-to-the-pharmacy-shelf-78915?utm_source=twitter&utm_medium=twitterbutton
"my week on twitter : 33 mentions, 374 mention reach, 115 likes, 11 retweets, 59.2k retweet reach. see yours with https://sumall.com/performancetweet?utm_source=twitter&amp;utm_medium=publishing&amp;utm_campaign=performance_tweet&amp;utm_content=text_and_media&amp;utm_term=b01b175b28b8ed7dac474a0a",2019-10-27 09:04:26+00:00,,,1188380925828255746,,https://twitter.com/pharmerfour/status/1188380925828255746,0,0,,https://sumall.com/performancetweet?utm_source=twitter&utm_medium=publishing&utm_campaign=performance_tweet&utm_content=text_and_media&utm_term=b01b175b28b8ed7dac474a0a
"i have the 2 bay robot & fama draws. excellent space, time, & accuracy solution",2019-10-26 23:09:48+00:00,,,1188231282003607555,,https://twitter.com/pharmerfour/status/1188231282003607555,0,0,KazH61,
"it gets even more interesting when you start asking ""which of these interactions are actually clinically relevant"" for instance, ppis and clopidogrel....",2019-10-24 12:02:17+00:00,,,1187338518474809345,,https://twitter.com/pharmerfour/status/1187338518474809345,0,0,cdmpharmacist,
