text,date,geo,hashtags,tweet_id,mentions,permalink,replies,retweets,replies_to,mentioned_urls
explaining that personal experience isn't transferable rarely works either especially for self limiting conditions where the 'proof' of effectivess reveals itself every time in 7-10 days....,2020-02-28 21:51:02+00:00,,,1233509943476662274,,https://twitter.com/pharmerfour/status/1233509943476662274,1,0,TcameronTodd,
"not to mention the concept of ""it works for me, because i'm special... who cares about evidence""",2020-02-28 21:44:25+00:00,,,1233508278619037698,,https://twitter.com/pharmerfour/status/1233508278619037698,1,0,TcameronTodd,
"i think a lot of that pressure still came from the idea of ""getting the strongest thing""",2020-02-28 02:06:26+00:00,,,1233211830408863745,,https://twitter.com/pharmerfour/status/1233211830408863745,0,1,SKeitaanpaa,
the pip is a concealed weapon. at least the corn chip you know what you are getting yourself in for. the only thing i hate worse is an unidentified crunchyness in something that should be soft.... like wtf was that!?! o_o,2020-02-27 05:42:42+00:00,,,1232903863839019009,,https://twitter.com/pharmerfour/status/1232903863839019009,0,0,joshuabadge,
is it worse than the same effect caused by smoking?,2020-02-27 01:30:31+00:00,,,1232840400852795393,,https://twitter.com/pharmerfour/status/1232840400852795393,1,0,SarahWhisar,
an interesting day ahead in canberra representing  in the important discussion on research funding for medicinalcannabis as supportive therapy for symptoms associated with the treatment of cancers,2020-02-26 22:58:12+00:00,,#MedicinalCannabis,1232802069397950464,@PSA_National,https://twitter.com/pharmerfour/status/1232802069397950464,1,3,,
would love to sit down with zubin some time and pick his brain we have one with  coming out very soon... i find their work on pharmacists' culture to be extremely interesting.,2020-02-26 22:55:04+00:00,,,1232801282659762176,@Ross_Tsuyuki,https://twitter.com/pharmerfour/status/1232801282659762176,0,0,JohnathanLaird,
when is this one out?,2020-02-26 22:27:23+00:00,,,1232794313538465792,,https://twitter.com/pharmerfour/status/1232794313538465792,1,0,JohnathanLaird,
"not only is that volume ridiculous & dangerous, there is no strength specified. at the lowest strength this would be 200mg (fatal) and at the highest strength it would be 2 grams of morphine. what is the setting?",2020-02-26 21:38:59+00:00,,,1232782132990238721,,https://twitter.com/pharmerfour/status/1232782132990238721,2,0,bonnie_w_tai,
blood tests won't assist with that verdict....,2020-02-26 21:18:04+00:00,,,1232776868996112384,,https://twitter.com/pharmerfour/status/1232776868996112384,0,0,JarrydBartle,
yeah that one still needs you to fast. the wait until monday won't cause any issues..... ironic though,2020-02-26 20:54:25+00:00,,,1232770920680308736,,https://twitter.com/pharmerfour/status/1232770920680308736,1,0,JarrydBartle,
that particular test requiring fasting has been deprecated. there is a blood test that doesn't require fasting that is diagnostic.,2020-02-26 20:51:09+00:00,,,1232770096029847553,,https://twitter.com/pharmerfour/status/1232770096029847553,1,0,JarrydBartle,
media: covid19 is a verydangerousthing coming to australia very soon likely to devastate the country - you should be worried also media: we don't understand why everyone is acting in fear &amp; being horribly racist - what's wrong with everyone? no link between the two...,2020-02-26 18:48:12+00:00,,#COVID19,1232739155513208832,,https://twitter.com/pharmerfour/status/1232739155513208832,0,0,,
"getting safe injection facilities is generally difficult, but i can only imagine how much harder it is in the us...",2020-02-26 00:40:45+00:00,,,1232465490146033665,,https://twitter.com/pharmerfour/status/1232465490146033665,0,0,LeoBeletsky,
"it's quite clear that institutions are more important than people.... the same mentality around denying paedophilia by ""religious"" people. the 'idyllic' 50s image must be retained no matter the cost on human suffering",2020-02-25 20:34:03+00:00,,,1232403407526223872,,https://twitter.com/pharmerfour/status/1232403407526223872,0,0,helonweels,
"the risks of uncontrolled asthma need to be squarely placed on the under-utilisation of ics & the attitude of ""my asthma isn't that bad"" demonizing saba (which is still life-saving for rare flareups in well controlled asthma) is a risk of poorly communicating this issue 2/2",2020-02-25 19:55:01+00:00,,,1232393581232455680,,https://twitter.com/pharmerfour/status/1232393581232455680,0,0,pharmerfour,
"historically, the health sector is not very effective at communicating complex issues like this ""the message around over-reliance on saba, & underuse of ics, does not seem to be getting through"" not only is this quote true, but the messaging around saba use is also fraught 1/2",2020-02-25 19:51:49+00:00,,,1232392776550993920,,https://twitter.com/pharmerfour/status/1232392776550993920,1,0,DRugby56,
a pioneer of stem has passed away at the age of 101 what a contribution katherine johnson made to science &amp; human achievements,2020-02-25 09:08:31+00:00,,#STEM,1232230884100603904,,https://twitter.com/pharmerfour/status/1232230884100603904,0,0,,
"assuming you are suggesting the family of the man who died shouldn't sue because the company didn't force him to use vivitrol? i so, consider that vivitrol is marketed as a safe solution to ""treat"" substance use disorder that ""prevents overdose""; which it failed to do here",2020-02-24 22:37:54+00:00,,,1232072184224333825,,https://twitter.com/pharmerfour/status/1232072184224333825,1,0,lucfrenette,
"thankyou for the response relative rates are important, but the context can be missed without the absolute rates as comparison. i ask this kind of question a lot, & it's great that you provided the details",2020-02-24 05:23:45+00:00,,,1231811931448565760,,https://twitter.com/pharmerfour/status/1231811931448565760,0,0,kemal_atlay,
"i read stories like this & i wonder if it's even about profits, or if the usa has moved so far from the idea of the ""land of the free"" to being about preventing people from accessing the opportunities that they were always famous for.",2020-02-24 04:43:27+00:00,,,1231801792645648385,,https://twitter.com/pharmerfour/status/1231801792645648385,0,0,TcameronTodd,
what is the actual incidence? is twice as likely 1% compared to 0.5% incidence (for instance)?,2020-02-24 03:30:46+00:00,,,1231783501436837890,,https://twitter.com/pharmerfour/status/1231783501436837890,2,0,kemal_atlay,
"may have undertones of the grifter and the smiler , while employing the tactics of the psychopath or the zealot as necessary",2020-02-23 03:20:24+00:00,,,1231418502021406722,,https://twitter.com/pharmerfour/status/1231418502021406722,1,0,,
"work is often unchallenged; their propensity to challenge other people's works creates an illusion of being infallible. criticisms of other's works are aimed at undermining hypothesis, conclusion, methods, analysis, or anything else that causes delay.",2020-02-23 03:20:23+00:00,,,1231418500746399744,,https://twitter.com/pharmerfour/status/1231418500746399744,1,0,,
features: gregarious & personable; well respected in the industry but mistrust from colleagues gradually builds over time; results in new collaborators relatively quickly,2020-02-23 03:20:23+00:00,,,1231418499349667840,,https://twitter.com/pharmerfour/status/1231418499349667840,1,0,,
"how they see science: as their property, & no one else should trespass unless they are in control how they see a scientific paper: similar to fankenstins monster... creates a ""new"" publication grotesquely stitched together from other people's buried ideas",2020-02-23 03:20:23+00:00,,,1231418498003292160,,https://twitter.com/pharmerfour/status/1231418498003292160,1,0,,
"they sit on committees related to their field of work & ensure that other work is buried by keeping debates & discussion running as long as possible. likely to resurrect other's ideas as their own ""lets adjourn this discussion to our next meeting in 6 weeks""",2020-02-23 03:20:22+00:00,,,1231418494442299397,,https://twitter.com/pharmerfour/status/1231418494442299397,1,0,,
"i really enjoyed this article by  &amp; thanks to  for tweeting it. https://medium.com//the-four-horsemen-6ff159725a76 i recognise them all, including some aspects in me. one archetype i was looking for was the undertaker....",2020-02-23 03:20:22+00:00,,,1231418493028823040,@jamesheathers @pash22,https://twitter.com/pharmerfour/status/1231418493028823040,1,0,,https://medium.com/@jamesheathers/the-four-horsemen-6ff159725a76
"good idea, hardly original.... although here in australia we still aren't remunerated for services like this that we've provided free for so long. btw bring this to me hancock's attention",2020-02-22 23:12:47+00:00,,,1231356187494346752,,https://twitter.com/pharmerfour/status/1231356187494346752,0,0,ChemistDruggist,https://twitter.com/Ross_Tsuyuki/status/1231317690830090240?s=19
the number of doctors who think like this but also think that a doctor can't profit from a conflict of interest is astounding,2020-02-22 12:49:46+00:00,,,1231199400841502720,,https://twitter.com/pharmerfour/status/1231199400841502720,0,0,gorskon,
,2020-02-22 03:54:23+00:00,,,1231064666299760640,,https://twitter.com/pharmerfour/status/1231064666299760640,1,0,DrSuziNielsen,
revoke bettina arndt's australia day honours - sign the petition! http://chng.it/2mhx9cvp via ,2020-02-22 01:27:31+00:00,,,1231027709054029825,@ChangeAus,https://twitter.com/pharmerfour/status/1231027709054029825,0,0,,http://chng.it/2mHX9cvp
"it's interesting that homeopathy is on here as a traditional technique that is centuries old. it's actually been around for less time than the modern standard of surgery more importantly, it is only 2 years older than vaccines.... so i guess vaccines are traditional?",2020-02-21 22:50:00+00:00,,,1230988065960685568,,https://twitter.com/pharmerfour/status/1230988065960685568,0,2,HomegrownJoan,
"i don't disagree. if an option like this meant there were no human interaction - no ""hello"" ""thanks"" etc, then that's ultimately a bad thing... i doubt that's what the outcome will be though. introverts aren't shy or incapable of niceties... but we don't need to chit chat either",2020-02-21 04:35:10+00:00,,,1230712544106409990,,https://twitter.com/pharmerfour/status/1230712544106409990,0,0,ben_hr,
i **especially** recommend watching the experiences of the person at the 42 minute mark for anyone who claims that use of cam is inherently safe. everything carries risk....,2020-02-21 03:24:52+00:00,,,1230694849923309568,,https://twitter.com/pharmerfour/status/1230694849923309568,0,0,pharmerfour,
"there was one section i spoke to that didn't make it in - the difference between anecdotes & evidence. i explain that a person's experience is valid, but it not transferable to any other person's outcomes or experiences.",2020-02-21 03:23:24+00:00,,,1230694484054175745,,https://twitter.com/pharmerfour/status/1230694484054175745,1,0,pharmerfour,
you should watch the episode (requires registration)..... the concept of selling hope (rather than effectiveness) is a problem.,2020-02-21 03:22:51+00:00,,,1230694344652312576,,https://twitter.com/pharmerfour/status/1230694344652312576,1,0,SciencePharmer,
https://www.sbs.com.au/news/insight/tvepisode/vitamins-supplements there is some discussion in here about unregulated medicines alongside complementary medicines. infusions of vitamin c is one.... promoted by a pharmacist i happen to be in the episode too.....,2020-02-21 03:05:05+00:00,,,1230689874593738752,,https://twitter.com/pharmerfour/status/1230689874593738752,1,1,,https://www.sbs.com.au/news/insight/tvepisode/vitamins-supplements
"oh, if only everyone in this world were an extrovert. of course extroverts would want to shout down an *option* that allows introverts to travel in a manner that doesn't expend more of their energy.... because extroverts seem to forget that other ways of doing things exist",2020-02-21 01:47:37+00:00,,,1230670376859922432,,https://twitter.com/pharmerfour/status/1230670376859922432,0,0,hannahrlmoore,
"this is such a great video it addresses much of the fear-driven behaviour that is happening in response of covid19 if you know anyone who is scared or stressed, this is 9 minutes they should spend to feel better",2020-02-21 01:39:28+00:00,,#COVID19,1230668328944820225,,https://twitter.com/pharmerfour/status/1230668328944820225,0,0,techinsider,https://twitter.com/techinsider/status/1230119682147004416
"it's concerning that this statement implies that the qld police have a threshold for which there could be extenuating circumstances that would make this or similar actions ""explainable""",2020-02-20 23:54:30+00:00,,,1230641911943188480,,https://twitter.com/pharmerfour/status/1230641911943188480,0,0,JarrydBartle,
"i hope it gets results. i've seen pile-ons of 1 star reviews for small business because the owner made a comment online that people didn't like (in that instance, defending a craft beer label's choice of graphics...) there needs to be balance",2020-02-20 23:47:10+00:00,,,1230640067594448896,,https://twitter.com/pharmerfour/status/1230640067594448896,0,0,JarrydBartle,
"advise her to get a second opinion. a clinician can skip methotrexate & move on to biologics if there is a clinically relevant reason to do so. in this case, it would seem that the clinician doesn't not believe that maintaining breastfeeding is a clinically relevant reason.",2020-02-20 23:42:33+00:00,,,1230638905738661889,,https://twitter.com/pharmerfour/status/1230638905738661889,1,0,BfWendy,
would be happy to work with  to help with understanding how poor stock management by pharmaceutical companies leads to delays in people accessing medicines https://ajp.com.au/news/confusion-reigns-over-epipen-availability/ suggesting that pharmacists are complacent is inaccurate &amp; unhelpful,2020-02-20 22:04:02+00:00,,,1230614111421071360,@AAAaust,https://twitter.com/pharmerfour/status/1230614111421071360,1,0,,https://ajp.com.au/news/confusion-reigns-over-epipen-availability/
"the discipline of therapeutics specifically utilises the most *effective* dose for an indication. that does not mean ""highest dose""... although in some situstions it will.",2020-02-20 21:48:44+00:00,,,1230610262912188416,,https://twitter.com/pharmerfour/status/1230610262912188416,0,0,JamieConner8,
change a in codeine used in australia overall (in tonnes),2020-02-20 14:47:20+00:00,,,1230504212754132992,,https://twitter.com/pharmerfour/status/1230504212754132992,1,0,pharmerfour,https://www.tga.gov.au/media-release/significant-decrease-amount-codeine-supplied-australians
"lack of impact on publicly subsidies opioids https://www.ncbi.nlm.nih.gov/m/pubmed/31622949/ ie no shift to stronger opioids. this doesn't take in to account private prescriptions, which are harder to monitor",2020-02-20 14:46:03+00:00,,,1230503887527796736,,https://twitter.com/pharmerfour/status/1230503887527796736,1,0,pharmerfour,https://www.ncbi.nlm.nih.gov/m/pubmed/31622949/
impact on poisonings & sales,2020-02-20 14:45:11+00:00,,,1230503669612728327,,https://twitter.com/pharmerfour/status/1230503669612728327,0,0,pharmerfour,https://onlinelibrary.wiley.com/doi/10.1111/add.14798
yes... let me find the link,2020-02-20 14:36:58+00:00,,,1230501601514622977,,https://twitter.com/pharmerfour/status/1230501601514622977,2,0,Clairewynn,
"epipen shortages in australia have been going on for a lot longer than the recent issues in china. you might want to ring  and ask them why there is still ""no stock"" according to wholesaler data",2020-02-20 14:34:54+00:00,,,1230501083841064961,@MylanNews,https://twitter.com/pharmerfour/status/1230501083841064961,0,0,Dana_Adele,
not to mention the obligatory salacious crumb inclusion.,2020-02-19 02:35:44+00:00,,,1229957710310854659,,https://twitter.com/pharmerfour/status/1229957710310854659,1,0,surliestgirl,
"there is the issue of access & self-determination - many people treating chronic pain conditions reported using otc codeine. the problem is, otc codeine was only ever approved for acute pain. anyone needing it for chronic pain should have had it prescribed.",2020-02-19 02:25:27+00:00,,,1229955123922731013,,https://twitter.com/pharmerfour/status/1229955123922731013,0,0,pharmerfour,
"for the majority of people who were using otc codeine, they were probably doing so since ""it's the strongest"" rather than it being particularly effective, so these people would have transitioned to other analgesics",2020-02-19 02:24:21+00:00,,,1229954847622828033,,https://twitter.com/pharmerfour/status/1229954847622828033,1,0,pharmerfour,
"no problems yet. there may be a lag, but reality is, the people who may have been accessing codeine to supplement a substance use disorder is probably a small population. the impact is therefore restricted, & may have been diverted to unregulated opioids or prescribed opioids",2020-02-19 02:22:01+00:00,,,1229954259522707457,,https://twitter.com/pharmerfour/status/1229954259522707457,1,0,JohnathanLaird,
that is pretty much where we were 3 years ago.,2020-02-18 23:10:57+00:00,,,1229906176797597696,,https://twitter.com/pharmerfour/status/1229906176797597696,1,0,emma_davies50,
"on internet sales - we aren't like the uk in that area. medicines are tightly regulated; only pharmacists can own an online pharmacy business, & we're too far from other countries to make smuggling or counterfeiting a common problem but it does happen with pde5 inhibitors...",2020-02-18 23:10:11+00:00,,,1229905984027385856,,https://twitter.com/pharmerfour/status/1229905984027385856,0,0,JonnyB_at_RMP,
"that particular problem is leading to some interesting discussions in new zealand i believe, where single-ingredient codeine is being considered for otc sale? i could be mistaken there but  could correct me",2020-02-18 23:07:45+00:00,,,1229905369276698624,@GJSmith2810,https://twitter.com/pharmerfour/status/1229905369276698624,1,0,pharmerfour,
there was definitely a population of people with opioid substance use disorder who were experiencing serious harm from codeine otc due to the huge doses of paracetamol of nsaid they were consuming. small population with huge consequences.,2020-02-18 23:03:23+00:00,,,1229904273112096768,,https://twitter.com/pharmerfour/status/1229904273112096768,1,0,pharmerfour,
"that is, if you have a headache, you're not going to go for paracetamol or an nsaid, you'll go for those products that are perceived as the strongest, so it's gotta have codeine in it.",2020-02-18 23:02:14+00:00,,,1229903981494718464,,https://twitter.com/pharmerfour/status/1229903981494718464,1,0,pharmerfour,
"given that the use of codeine dropped so much, yet stronger opioids have not spiked in response, nor has ost, it's probably safe to say that the use of codeine over-the-counter was probably driven by the human nature of ""strongest is best""",2020-02-18 22:59:46+00:00,,,1229903362927161344,,https://twitter.com/pharmerfour/status/1229903362927161344,0,0,pharmerfour,
"anecdotally, many people were referred for ost at the early stages of the awareness campaign around codeine scheduling changes. i don't think the volume would be enough to account for the massive change in codeine use",2020-02-18 22:58:47+00:00,,,1229903114959867904,,https://twitter.com/pharmerfour/status/1229903114959867904,2,0,pharmerfour,
there also doesn't seem to have been a change in the population of people accessing opioid replacement therapy - although this may be delayed as people with a substance use disorder driven by otc codeine find alternatives in the short term.,2020-02-18 22:57:55+00:00,,,1229902896591822848,,https://twitter.com/pharmerfour/status/1229902896591822848,1,0,pharmerfour,
"the end result, though, has been no detectable change in prescription opioid use (to date), while gross tonnage of codeine used in australia has halved.",2020-02-18 22:57:17+00:00,,,1229902735434113024,,https://twitter.com/pharmerfour/status/1229902735434113024,1,0,pharmerfour,
"we also still do not have consistent real time prescription monitoring in all jurisdictions, so if a person transferred to otc codeine to prescription opioids, this may be hard to monitor",2020-02-18 22:55:18+00:00,,,1229902238182604800,,https://twitter.com/pharmerfour/status/1229902238182604800,1,0,pharmerfour,
"some of the concerns were that investment in other options to treat pain aren't adequate, while prescriptions & medical consultations are not - someone with moderate to severe pain may be channeled in to stronger opioids.",2020-02-18 22:54:34+00:00,,,1229902053981315073,,https://twitter.com/pharmerfour/status/1229902053981315073,1,0,pharmerfour,
"the campaign to make is ""schedule 4"" (prescription only) was fraught with high emotions - consumer groups & pharmacy groups advised against it; government aligned groups, hospital groups & medical groups argued for it to be prescription",2020-02-18 22:50:05+00:00,,,1229900922895003649,,https://twitter.com/pharmerfour/status/1229900922895003649,1,0,pharmerfour,
"in the australian context, codeine was originally available c paracetamol at very low doses (8 or 9mg from memory) in small sizes ""over the counter"" then it was restricted to our ""schedule 3"" which is ""pharmacist intervention required"" - 8mg or 15mg c paracetamol",2020-02-18 22:48:22+00:00,,,1229900491527577601,,https://twitter.com/pharmerfour/status/1229900491527577601,1,0,JonnyB_at_RMP,
"give me more background so i can comment as completely as possible... what strength of low-dose codeine is available? what is the mechanism to access it (ie prescription only, over the counter, pharmacist-interaction only?) keep in mind i don't know your acronyms!",2020-02-18 22:46:03+00:00,,,1229899908401917952,,https://twitter.com/pharmerfour/status/1229899908401917952,2,0,JohnathanLaird,
it's great to see this work. have a few projects looking at pharmacist-led stewardship in clinics & racfs. international work helps a lot with the evidence base,2020-02-18 08:11:50+00:00,,,1229679904595177472,,https://twitter.com/pharmerfour/status/1229679904595177472,0,1,M_YousafAhmad,
(later means when i'm off this plane and can actually follow links),2020-02-18 05:03:06+00:00,,,1229632407709466630,,https://twitter.com/pharmerfour/status/1229632407709466630,1,0,DrSuziNielsen,
anaesthesia (pulling teeth),2020-02-18 05:01:23+00:00,,,1229631977755537409,,https://twitter.com/pharmerfour/status/1229631977755537409,0,0,Atkins_Sam,
any chance this will be available online for later?,2020-02-18 04:58:09+00:00,,,1229631165247524869,,https://twitter.com/pharmerfour/status/1229631165247524869,1,0,DrSuziNielsen,
you'll have to withdraw from all social media now it's the law,2020-02-18 02:20:35+00:00,,,1229591511748104193,,https://twitter.com/pharmerfour/status/1229591511748104193,0,0,JarrydBartle,
is that self identified?,2020-02-17 23:00:36+00:00,,,1229541181865938944,,https://twitter.com/pharmerfour/status/1229541181865938944,1,0,strom_m,
i hope there were no submissions like dawkins' ill-advised musings,2020-02-17 05:00:21+00:00,,,1229269331432722432,,https://twitter.com/pharmerfour/status/1229269331432722432,1,0,DanGuidone,https://twitter.com/RichardDawkins/status/1228943686953664512?s=19
nobody has claimed that this isn't the case,2020-02-16 20:46:36+00:00,,,1229145073612279809,,https://twitter.com/pharmerfour/status/1229145073612279809,1,0,StalkerDetector,
"i've watched 2 episodes so far very well made, but one thing doesn't sit well with me as a pharmacist - why was he recording conversations with his patients? it's tragic about his son, & great he made an impact on pill mills, but this is wrong & seems to be overlooked",2020-02-16 16:38:46+00:00,,,1229082703368077312,,https://twitter.com/pharmerfour/status/1229082703368077312,0,0,PJOnline_News,
"is that last emoji ""yarn"" if so, great use, well done.",2020-02-16 16:17:32+00:00,,,1229077361527648257,,https://twitter.com/pharmerfour/status/1229077361527648257,0,0,Sarah_Mojarad,
"if this has been your experience, i am very sorry for you",2020-02-16 16:12:41+00:00,,,1229076140834394112,,https://twitter.com/pharmerfour/status/1229076140834394112,1,0,StalkerDetector,
are private hospitals not subject to clinical governance? the core principles include transparency....,2020-02-16 15:37:31+00:00,,,1229067291272208384,,https://twitter.com/pharmerfour/status/1229067291272208384,0,0,bmj_latest,
it's in the australian netflix at least... i never get a chance to read fiction anymore.... maybe i should address that,2020-02-16 15:32:25+00:00,,,1229066004967198725,,https://twitter.com/pharmerfour/status/1229066004967198725,0,0,DigitalPhamcist,
"the reason the first report was not published was due to the issues with how it was written, not what it said. the second report is new work - it is not a ""re-do"" of the first report. it's worth reading them both. you'll find it enlightening.",2020-02-16 15:30:39+00:00,,,1229065561214054404,,https://twitter.com/pharmerfour/status/1229065561214054404,0,0,StalkerDetector,
this has been on my netflix cue for a very long time....just never dove in (yet),2020-02-16 15:05:33+00:00,,,1229059246618054659,,https://twitter.com/pharmerfour/status/1229059246618054659,1,0,DigitalPhamcist,
none of the details in the first report were deleted. it still exists intact. the second report didn't start with the first report; it was a completely new piece of work,2020-02-16 14:59:18+00:00,,,1229057672147689472,,https://twitter.com/pharmerfour/status/1229057672147689472,1,0,StalkerDetector,
