text,date,geo,hashtags,tweet_id,mentions,permalink,replies,retweets,replies_to,mentioned_urls
that article would make me angry if i had no idea about the stupidity of people when it comes to decisions about health that affect millions of people. scratch that.... it still makes me angry,2020-01-05 02:02:29+00:00,,,1213641890962083841,,https://twitter.com/pharmerfour/status/1213641890962083841,1,0,SciencePharmer,
"“i am unable to find any risk to (the children) if they remain unvaccinated. further, i am satisfied on the evidence the vaccines may pose additional risk to them.” insanity..... incompetence, endangering children.",2020-01-05 02:00:53+00:00,,,1213641485213519872,,https://twitter.com/pharmerfour/status/1213641485213519872,1,0,SciencePharmer,https://twitter.com/SciencePharmer/status/1213640959646470144
on my listening queue....,2020-01-04 01:16:11+00:00,,,1213267851475206144,,https://twitter.com/pharmerfour/status/1213267851475206144,0,0,JohnathanLaird,
i can't open your link is it the video of raj gupta?,2020-01-03 10:06:08+00:00,,,1213038830388822016,,https://twitter.com/pharmerfour/status/1213038830388822016,0,0,nissen_l,
i searched so long and i still didn't find 's profile thanks jacinta,2020-01-03 03:41:59+00:00,,,1212942154911244289,@DrRenly,https://twitter.com/pharmerfour/status/1212942154911244289,1,0,JacintaAdelaide,
that emoji is perfect for this tweet!,2020-01-02 22:45:57+00:00,,,1212867655071236096,,https://twitter.com/pharmerfour/status/1212867655071236096,0,0,KazH61,
this is a good use of digital connectivity & data-matching. we expect that public money isn't abused; matching data from two complementary data sources to look for over-services makes sense ,2020-01-02 21:00:00+00:00,,,1212840991742234624,@pharmacydaily,https://twitter.com/pharmerfour/status/1212840991742234624,0,0,,
congratulations to dr renly lim for her appointment to the  young pharmacist group presidency a great appointment of an impressive pharmacist ,2020-01-02 20:30:00+00:00,,,1212833440418058240,@FIPYPG @pharmacydaily,https://twitter.com/pharmerfour/status/1212833440418058240,1,2,,
"australians are becoming “increasingly misinformed” about sunscreen research has shown https://ajp.com.au/news/survey-reveals-suncare-myths this is an opportunity for pharmacists to make an impact on preventive healthcare as well as ""mythbusting"" things people believe that just aren't true ",2020-01-02 20:00:00+00:00,,,1212825892260438017,@AJPEditor,https://twitter.com/pharmerfour/status/1212825892260438017,0,0,,https://ajp.com.au/news/survey-reveals-suncare-myths
,2020-01-02 08:18:48+00:00,,,1212649430869897218,@AlexWodak,https://twitter.com/pharmerfour/status/1212649430869897218,0,0,ZacMabry,
"the majority of the issues can be tied to lack of regulation of ""prohibition"" as it's more commonly known",2020-01-02 04:29:13+00:00,,,1212591653355024384,,https://twitter.com/pharmerfour/status/1212591653355024384,0,0,traceyh415,
"what are the mesicines that need to change in spain, and what are the greatest barriers?",2020-01-01 21:01:03+00:00,,,1212478866561761280,,https://twitter.com/pharmerfour/status/1212478866561761280,0,0,ElenaSaiz63,
"nice study, it would be great to see an analysis of cost effectiveness from two perspectives: 1) the 5-16 minutes added to pharmacists' workload vs time saved for physicians 2) the downflow cost saving to the health system due to improved accuracy of medicine discharge",2020-01-01 02:04:55+00:00,,,1212192951855505408,,https://twitter.com/pharmerfour/status/1212192951855505408,0,0,elliott_rohan,
"exploratory analysis of the first 2 years of adult vaccination data recorded on air http://ncirs.org.au/new-ncirs-report-exploratory-analysis-first-2-years-adult-vaccination-data-recorded-air it is estimated that as much as 50% of vaccine records are not uploaded to air, especially for nip &amp; zoster vaccines ",2019-12-31 22:30:00+00:00,,,1212138863683981312,@NCIRS,https://twitter.com/pharmerfour/status/1212138863683981312,0,1,,http://ncirs.org.au/new-ncirs-report-exploratory-analysis-first-2-years-adult-vaccination-data-recorded-air
"our biggest fans this week: alexwodak, patrickdoyle_35, jefbratberg. thank you! via https://sumall.com/thankyou?utm_source=twitter&amp;utm_medium=publishing&amp;utm_campaign=thank_you_tweet&amp;utm_content=text_and_media&amp;utm_term=b01b175b28b8ed7dac474a0a",2019-12-31 22:01:51+00:00,,,1212131778925862916,,https://twitter.com/pharmerfour/status/1212131778925862916,0,0,,https://sumall.com/thankyou?utm_source=twitter&utm_medium=publishing&utm_campaign=thank_you_tweet&utm_content=text_and_media&utm_term=b01b175b28b8ed7dac474a0a
most australians don't know heart disease is the leading cause of death for women as well as men; & most don't know about modifiable risk factors https://doi.org/10.1016/j.pmedr.2017.10.007     an opportunity for education &amp; case finding,2019-12-31 22:00:00+00:00,,,1212131314385772545,@ElsevierConnect @Erin_Hoare @BillStavreski @garryjennings,https://twitter.com/pharmerfour/status/1212131314385772545,0,0,,https://doi.org/10.1016/j.pmedr.2017.10.007
"an overview of perinatal depression https://bpac.org.nz/2019/perinatal-depression.aspx ""during pregnancy, birth &amp; the postpartum period, women will usually interact with multiple healthcare professionals"" pharmacists benefit from mental health triage training to assist in referring ",2019-12-31 21:30:00+00:00,,,1212123765347246080,@bpacnz,https://twitter.com/pharmerfour/status/1212123765347246080,0,0,,https://bpac.org.nz/2019/perinatal-depression.aspx
"managing cows milk protein allergy in infants https://bpac.org.nz/2019/cmpa.aspx a good overview of the different presentations of cmpa, including debunking of myths about cows milk a good resource for pharmacist to familiarise themselves with. ",2019-12-31 21:00:01+00:00,,,1212116218905317376,@bpacnz,https://twitter.com/pharmerfour/status/1212116218905317376,0,0,,https://bpac.org.nz/2019/cmpa.aspx
"an overview of abnormal vaginal bleeding https://bpac.org.nz/2019/bleeding.aspx pharmacists often encounter questions about ""what's normal?"" - having access to an evidence-based overview can help address those questions &amp; determine when referral is appropriate ",2019-12-31 20:30:00+00:00,,,1212108665609740288,@bpacnz,https://twitter.com/pharmerfour/status/1212108665609740288,1,0,,https://bpac.org.nz/2019/bleeding.aspx
"most pharmacist encounter requests each week to provide medicines without a prescription. some aren't appropriate, but many could be provided by pharmacists. evidence shows that this is safe & appropriate we still don't have change: note the date of this article ",2019-12-31 20:00:00+00:00,,,1212101115120177154,@pharmacydaily,https://twitter.com/pharmerfour/status/1212101115120177154,0,3,,
"there are ways to influence these things, so it happens in the future. ask for it... squeaky wheel...",2019-12-31 15:41:59+00:00,,,1212036184676818955,,https://twitter.com/pharmerfour/status/1212036184676818955,0,0,simonmarkdaley,
keep it up - and hopefully we overtake you soon here in australia,2019-12-31 15:37:58+00:00,,,1212035171286827008,,https://twitter.com/pharmerfour/status/1212035171286827008,0,0,CPhAAPhC,
it seems that the situation is very combative... one more aspect that makes the us system seem broken & dysfunctional - even harmful - from afar,2019-12-29 16:01:14+00:00,,,1211316253165412352,,https://twitter.com/pharmerfour/status/1211316253165412352,1,0,louisanamom,
yes i guess the disconnect was that i always expect to have a discussion with people about their care - even people i have treated for years... but it's how the questions are posed (& what is asked) that leads to the issues you describe.,2019-12-29 15:59:17+00:00,,,1211315763484618752,,https://twitter.com/pharmerfour/status/1211315763484618752,1,0,louisanamom,
"any intrusive question is too many. quote from the previous year's survey: http://www.nationalpainweek.org.au/images/documents/surveys/national-pain-survey-2018-.pdf it's an issue - prevalence may be low, but impact is high",2019-12-29 15:57:14+00:00,,,1211315245165101056,,https://twitter.com/pharmerfour/status/1211315245165101056,0,0,louisanamom,http://www.nationalpainweek.org.au/images/documents/Surveys/National-Pain-Survey-2018-.pdf
"if you know of a group that represents the interests of people in pain, i can provide them with the methods we used to deliver the survey so they can implement it as well. we do it each year in july",2019-12-29 15:44:51+00:00,,,1211312128616886273,,https://twitter.com/pharmerfour/status/1211312128616886273,1,0,louisanamom,
a pharmacist can always refuse to dispense a medicine... but there must be a clinically relevant reason for that refusal doing so on a whim is professional misconduct. doing so with clinical reason but communicating this in a manner that causes distress is unprofessional conduct,2019-12-29 15:43:11+00:00,,,1211311711665307653,,https://twitter.com/pharmerfour/status/1211311711665307653,0,0,pharmerfour,
"if a pharmacist were to practice like that here in australia, there are several pathways for professional review. even when supply is not appropriate (regardless of the reason) the information must be delivered tactfully & in private, with a valid reason provided.",2019-12-29 15:41:18+00:00,,,1211311238505881600,,https://twitter.com/pharmerfour/status/1211311238505881600,2,0,louisanamom,
"i'm reminded of the pharmacist scene from the movie magnolia - how the pharmacists interact in that scene is poorly done & creates a completely unprofessional environment. it's a tragedy that this isn't a parody, but seemingly a real representation of what people are experiencing",2019-12-29 15:40:00+00:00,,,1211310910297399298,,https://twitter.com/pharmerfour/status/1211310910297399298,2,0,louisanamom,
"starting to see this here - our chief medical officer wrote a ""please explain"" letter to gps who prescribe opioids more often than their colleagues. he apologised to the gps for the fear this caused, but not to patients who were affected by it",2019-12-29 15:32:38+00:00,,,1211309054057861120,,https://twitter.com/pharmerfour/status/1211309054057861120,0,0,louisanamom,https://www1.racgp.org.au/newsgp/professional/australia-s-chief-medical-officer-responds-to-gp-q
i'm familiar with the way stigma is perpetuated by pharmacists & other health professionals when they do their job poorly - have a look at questions 10 & 11 of  survey here https://www.nationalpainweek.org.au/images/documents/surveys/national_pain_survey_2019.pdf,2019-12-29 15:27:55+00:00,,,1211307867044626434,@ChronicPainAust,https://twitter.com/pharmerfour/status/1211307867044626434,2,0,louisanamom,https://www.nationalpainweek.org.au/images/documents/Surveys/National_Pain_Survey_2019.pdf
"in either cause, this isn't the reason that a pharmacist needs to discuss your treatment plan with you - it isn't about tripping you up or finding an excuse to refuse supply - it's about establishing the context & providing individualised advise on quality use of your medicine",2019-12-29 15:22:34+00:00,,,1211306523093168130,,https://twitter.com/pharmerfour/status/1211306523093168130,0,0,pharmerfour,
"the same for pain - refusing supply or ceasing a person's medicines suddenly isn't helpful & causes significant harm; it is unethical to do so without a justifiable clinical reason, & in this situation, refusing supply without adequate referral for alternatives is unethical",2019-12-29 15:20:54+00:00,,,1211306101133598720,,https://twitter.com/pharmerfour/status/1211306101133598720,2,0,pharmerfour,
"judgement & stigma aren't ever appropriate - i'm not defending that behaviour. off topic, but refusing to provide medicines to a person with a substance use disorder is unethical as it would cause significant short-term harm & probable long-term harm",2019-12-29 15:18:53+00:00,,,1211305593706663936,,https://twitter.com/pharmerfour/status/1211305593706663936,1,0,louisanamom,
"i'm unsure of the technology available to pharmacists in your country, but this is unlikely to be correct no matter how advanced their health information infrastructure is talking to you is often the most effective communication - but again, tactfully, privately, with empathy",2019-12-29 15:16:25+00:00,,,1211304974543552514,,https://twitter.com/pharmerfour/status/1211304974543552514,2,0,louisanamom,
"""a pharmacist has no business humiliating a patient"" completely true but asking relevant questions & understanding the intent of treatment should never constitute humiliation if a pharmacist has done this to you, i sincerely regret that this unprofessional behaviour",2019-12-29 15:13:55+00:00,,,1211304346350080001,,https://twitter.com/pharmerfour/status/1211304346350080001,0,0,louisanamom,
"a pharmacist knowing your treatment plan is relevant on several levels. of course, you can keep that information to yourself, but why would you not want to have the pharmacists clinical expertise included in your healthcare?",2019-12-29 15:10:55+00:00,,,1211303591492780032,,https://twitter.com/pharmerfour/status/1211303591492780032,3,0,pharmerfour,
"the pharmacists' role is far greater than looking at two medicines & deciding if they go together or not. interactions happen between medicines, yes; but also between a medicine & other conditions.",2019-12-29 15:09:27+00:00,,,1211303222758895616,,https://twitter.com/pharmerfour/status/1211303222758895616,1,0,louisanamom,
"that's sort of essential to do the job i'm afraid and it's not ""questioning"" like ""what do you think you are doing"" it is clinically assessing appropriateness. it tends to stop a large number (but not all) of errors causing harm",2019-12-29 15:07:14+00:00,,,1211302664757116928,,https://twitter.com/pharmerfour/status/1211302664757116928,0,0,louisanamom,
if you had been trailing in masterchef you could have pulled this out and just taken out the whole show in one move.,2019-12-29 15:03:45+00:00,,,1211301786402705409,,https://twitter.com/pharmerfour/status/1211301786402705409,0,0,adamliaw,
"do you mean lengthwise ""as well as"" sideways? that just produces soft croutons....",2019-12-29 15:01:14+00:00,,,1211301151783571458,,https://twitter.com/pharmerfour/status/1211301151783571458,1,0,ozjohnd,
"having a convenient service is laudable, yet potential harms need to be addressed and services modified to reduce this potential",2019-12-29 14:51:09+00:00,,,1211298615156604929,,https://twitter.com/pharmerfour/status/1211298615156604929,0,0,,
"there is a clear need for an examination of how the legislation around licensing is covering these ""on-demand"" services that allow a person to continue to drink when they would not have previously been able to do so",2019-12-29 14:51:08+00:00,,,1211298613625622528,,https://twitter.com/pharmerfour/status/1211298613625622528,1,0,,
"could a person who has been refused service in a licensed premises put their health at risk by purchasing alcohol using an on-demand service, facilitating much riskier drinking that would otherwise have occurred?",2019-12-29 14:51:08+00:00,,,1211298612140883968,,https://twitter.com/pharmerfour/status/1211298612140883968,1,0,,
"people are using these services when they would have otherwise stopped drinking - if the driver could observe that the person was intoxicated, should there be a requirement for rsa training & the potential for a delivery being withheld?",2019-12-29 14:51:08+00:00,,,1211298610677075968,,https://twitter.com/pharmerfour/status/1211298610677075968,1,0,,
"what i couldn't find was whether the on-demand services - including the drivers - were required to undertake any rsa training if a person was in a licensed venue, their access would cease when they became intoxicated.",2019-12-29 14:51:07+00:00,,,1211298609158750210,,https://twitter.com/pharmerfour/status/1211298609158750210,1,0,,
"""on-demand delivery services are likely to be a particular concern for acute harms, as they are often associated with (and directly facilitate) heavy drinking occasions""",2019-12-29 14:51:07+00:00,,,1211298607720062976,,https://twitter.com/pharmerfour/status/1211298607720062976,1,1,,
"... these people tend to be younger, more likely to engage in heavy episodic drinking & often report that the delivery enabled them to continue drinking when they would otherwise have had to stop""",2019-12-29 14:51:07+00:00,,,1211298606180757504,,https://twitter.com/pharmerfour/status/1211298606180757504,1,1,,
"these points from the discussion in the  paper are particularly poignant from a harm reduction point of view: ""there were people ordering alcohol to be delivered quickly (&lt;2 hours) from either bottle shops or specialised fast delivery services...",2019-12-29 14:51:06+00:00,,,1211298604603756549,@CAPRAustralia,https://twitter.com/pharmerfour/status/1211298604603756549,1,1,,
"there is general discussion on access & availability, but no acknowledgement for the potential of ""on demand"" delivery services to impact on risky drinking behaviours",2019-12-29 14:51:06+00:00,,,1211298602489794560,,https://twitter.com/pharmerfour/status/1211298602489794560,1,0,,
"""with the proportion of online alcohol sales in australia increasing & with expectations of future growth, work is required to ensure that regulation is keeping up with these shifts."" no doubt.... yet the national strategy is silent on the concept of ""on demand"" delivery",2019-12-29 14:51:04+00:00,,,1211298592847089666,,https://twitter.com/pharmerfour/status/1211298592847089666,1,0,,
interesting paper from    yvette mojica-perez &amp; sarah callinan on the rising use of home-delivered alcohol https://apo.org.au/node/270681 it arrived just a fortnight before the national alcohol strategy 2019-2028 https://apo.org.au/node/270691,2019-12-29 14:51:03+00:00,,,1211298591106424832,@CAPRAustralia @FAREAustralia @Michael_CAPR,https://twitter.com/pharmerfour/status/1211298591106424832,1,0,,"https://apo.org.au/node/270681,https://apo.org.au/node/270691"
"we have to examine why these choices are made, & what it is about the health system that would have people ""likely to live in fear of a severe asthma attack despite taking their reliever medication as instructed"" rather than seek comprehensive treatment",2019-12-29 13:00:45+00:00,,,1211270833936592896,,https://twitter.com/pharmerfour/status/1211270833936592896,1,0,,
"""because even if they don’t see their gp, they can get ventolin and other short-acting beta agonists over the counter in australia, so pharmacy may be their only point of contact with health professionals about their asthma"" https://ajp.com.au/news/hard-proof-asthma-reliever-reliance/  ",2019-12-29 13:00:45+00:00,,,1211270832363732993,@AJPEditor @Woolcockmedical,https://twitter.com/pharmerfour/status/1211270832363732993,1,0,,https://ajp.com.au/news/hard-proof-asthma-reliever-reliance/
i couldn't help but think of  when i read this article,2019-12-29 12:17:45+00:00,,,1211260009910284288,@DavidJuurlink,https://twitter.com/pharmerfour/status/1211260009910284288,0,0,,https://medium.com/mosaic-science/the-opioid-epidemic-you-havent-heard-about-b5c65e27e8b3
i think it's more the symbolism of it like naming public swimming pools after a prime minister who drowned oh wait......,2019-12-29 10:58:31+00:00,,,1211240070704877570,,https://twitter.com/pharmerfour/status/1211240070704877570,1,0,GidMK,
"if you've taken your prescription to a pharmacist, you invited them to make it their business. there is quite a lot to medicine safety. people die when a medication error is made. every*single*detail*is*important! why would you want to make it harder for them to keep you safe?",2019-12-29 10:51:35+00:00,,,1211238328701341699,,https://twitter.com/pharmerfour/status/1211238328701341699,5,0,louisanamom,
"you should see the reputation you earn when you call people out for undeserved criticism of pharmacists. the base assumption that pharmacists are uneducated, driven by money, incompetent, or compromise treatment is pervasive & undeserved.",2019-12-29 10:32:29+00:00,,,1211233519101300736,,https://twitter.com/pharmerfour/status/1211233519101300736,0,0,Claudette_RPh,
it may also be appealing to trust in the consumer. many tablets are scored (in fact some countries legislate for all pharmaceuticals to be scored) including a score may give a false sense of quality & regulated production,2019-12-29 09:49:46+00:00,,,1211222771578986496,,https://twitter.com/pharmerfour/status/1211222771578986496,0,0,ACTINOSProject,
"no need for evidence, just assumptions. ironically, if anyone is making it personal, it seems to be you, since you get offended when i respond to your tweets. it's not that i have a valid comment about your public opinion; it couldn't be that.",2019-12-29 09:44:59+00:00,,,1211221564802232320,,https://twitter.com/pharmerfour/status/1211221564802232320,0,0,pharmerfour,
you haven't established a credible link between fragmentation of care & pharmacists practicing to full scope you haven't established a link between commercialisation of care & pharmacists practicing to full scope you just talk about them as if they are facts.,2019-12-29 09:41:19+00:00,,,1211220641925361665,,https://twitter.com/pharmerfour/status/1211220641925361665,1,0,pharmerfour,
"you've also discussed fragmentation of care with regards to pharmacists as if this is a guaranteed outcome... as if fragmentation is caused by those ""other than gps"" being involved in a person's health, rather than it being the result of poor communication infrastructure.",2019-12-29 09:39:15+00:00,,,1211220124276940801,,https://twitter.com/pharmerfour/status/1211220124276940801,1,0,pharmerfour,
"you've now introduced into this specific discussion ""quality care vs commercialisation of care"" without context. the implication is that a pharmacist working to full scope of practice is motivated by commercial pressures, not professional standards.",2019-12-29 09:37:43+00:00,,,1211219737931206656,,https://twitter.com/pharmerfour/status/1211219737931206656,1,0,pharmerfour,
"it's far from a personal issue or private war, & framing criticism of your comments as ""personal or private"" is seeking to undermine the legitimate concern that the comments about pharmacist practice are often biased for instance....",2019-12-29 09:35:50+00:00,,,1211219265539305472,,https://twitter.com/pharmerfour/status/1211219265539305472,1,0,brookmanknight,
but maybe i've just read every tweet out of order? perhaps you could point me in the direction of tweets about pharmacist practice that aren't critical & framed from the point of view of gps losing out or being undermined? 2/2,2019-12-29 09:27:43+00:00,,,1211217222049267713,,https://twitter.com/pharmerfour/status/1211217222049267713,0,0,pharmerfour,
"quality does certainly concern us all. it is interesting though that when there is an article about pharmacists & scope of practice the comments are invariably negative, imply or directly state incompetence, & assume fragmentation & poor quality will be the result 1/2",2019-12-29 09:26:06+00:00,,,1211216812202852352,,https://twitter.com/pharmerfour/status/1211216812202852352,1,0,brookmanknight,
oh it's an interpretation problem! that makes so much sense. it's not that the comments about inferior care & fragmentation are made in direct reference to articles about pharmacists.... it's that the tweet & comments they contain are misinterpreted by the reader. got it.,2019-12-29 09:23:56+00:00,,,1211216269296324608,,https://twitter.com/pharmerfour/status/1211216269296324608,1,0,brookmanknight,
"it's not appropriate to judge a person's intentions by their public comments, but only by the thoughts that they don't share? your comments are framed in response to articles about pharmacists... i guess it's not appropriate to link them though?",2019-12-29 09:16:00+00:00,,,1211214271993958400,,https://twitter.com/pharmerfour/status/1211214271993958400,2,0,brookmanknight,
"my week on twitter : 7 mentions, 15 likes, 3 retweets, 9.96k retweet reach, 1 new follower. see yours with https://sumall.com/performancetweet?utm_source=twitter&amp;utm_medium=publishing&amp;utm_campaign=performance_tweet&amp;utm_content=text_and_media&amp;utm_term=b01b175b28b8ed7dac474a0a",2019-12-29 09:05:01+00:00,,,1211211509164052481,,https://twitter.com/pharmerfour/status/1211211509164052481,0,0,,https://sumall.com/performancetweet?utm_source=twitter&utm_medium=publishing&utm_campaign=performance_tweet&utm_content=text_and_media&utm_term=b01b175b28b8ed7dac474a0a
does this constitute health advice ;),2019-12-29 07:45:02+00:00,,,1211191380678082560,,https://twitter.com/pharmerfour/status/1211191380678082560,0,0,GidMK,
i think it made it to 4.5,2019-12-29 06:58:30+00:00,,,1211179668641959936,,https://twitter.com/pharmerfour/status/1211179668641959936,0,0,Patwreid,
"your response comes from the assumption that only a gp can provide holistic longitudinal care, and that involvement of other health care providers results in fragmentation of care evidence clearly shows that removing silos improves care & outcomes. fragmentation comes from silos",2019-12-29 04:23:57+00:00,,,1211140773967564806,,https://twitter.com/pharmerfour/status/1211140773967564806,1,0,brookmanknight,
"very counterintuitive.... yet i've seen what you are describing plenty of times from ""compassionate"" people",2019-12-29 04:18:00+00:00,,,1211139276970180610,,https://twitter.com/pharmerfour/status/1211139276970180610,0,0,DF19463506,
"yes, fair observation. i don't think those people fit in to the inforgraphic you've provided though there's a word other than 'rebel' to describe those people",2019-12-29 04:16:35+00:00,,,1211138922652110849,,https://twitter.com/pharmerfour/status/1211138922652110849,0,0,M_Kay_Dunkley,
