text,date,geo,hashtags,tweet_id,mentions,permalink,replies,retweets,replies_to,mentioned_urls
how does meghan mccain have a job channeling what “my dad” said and she’s the token conservative. neither woman has a clue what a normal american is.,2019-11-11 12:40:45+00:00,,,1193871184032665600,,https://twitter.com/simplylorilee/status/1193871184032665600,0,0,WayneDupreeShow,
i’m protestant but i will pray for you. (not that prosperity preachers aren’t an enemy to our denomination and to the true gospel of jesus christ),2019-11-11 12:26:33+00:00,,,1193867610271682562,,https://twitter.com/simplylorilee/status/1193867610271682562,0,0,JackPosobiec,
,2019-11-11 12:13:57+00:00,,,1193864438396456960,@megynkelly,https://twitter.com/simplylorilee/status/1193864438396456960,0,0,redsteeze,https://twitter.com/redsteeze/status/1193764188448886784
"i’m more conservative than most and i would have told the officer to go to heck. people poop in the streets and can shop lift, shoot up, etc. in ca. i hate bullies and that cop was being a butthead. of course the guy was angry.",2019-11-11 00:05:44+00:00,,,1193681177187627008,,https://twitter.com/simplylorilee/status/1193681177187627008,0,0,heckyessica,
there is no way i wouldn’t end up in jail if i was that man. in mi where i live officers can request to swab your cheek at a traffick stop and if you refuse it’s a ticket for $200. i already told my lawyer to expect my call.,2019-11-11 00:02:19+00:00,,,1193680314889101312,,https://twitter.com/simplylorilee/status/1193680314889101312,0,0,chadfelixg,
a felony?,2019-11-10 22:54:04+00:00,,,1193663139990179842,,https://twitter.com/simplylorilee/status/1193663139990179842,0,0,MrAndyNgo,
thank you.,2019-11-10 22:41:49+00:00,,,1193660058514731015,,https://twitter.com/simplylorilee/status/1193660058514731015,0,0,JimHansonDC,
what is the senate doing to help stop this coup? lindsey graham is able to call witnesses is he not?,2019-11-10 22:37:13+00:00,,,1193658900807110656,,https://twitter.com/simplylorilee/status/1193658900807110656,0,0,marklevinshow,
"to be honest, i find okboomer funny. for the record though, this boomer didn’t raise millenials. my kids are 1978, 80, and 82 and they are doing well. (by the grace of god)",2019-11-10 22:34:18+00:00,,#OkBoomer,1193658164891262976,,https://twitter.com/simplylorilee/status/1193658164891262976,0,0,bethanyshondark,
the most badass men i’ve ever known. happy birthday!,2019-11-10 13:51:13+00:00,,,1193526527729831942,,https://twitter.com/simplylorilee/status/1193526527729831942,0,0,JesseKellyDC,
"boomeradvice advice for any generation. “life isn’t fair. get over it.” “being able to work is a gift” “you are special, but you’re not more special than anybody else” “be teachable. you don’t know everything” “no one owes you anything” “everyone is in pain. suck it up.”",2019-11-10 13:28:42+00:00,,#BoomerAdvice,1193520861548032001,,https://twitter.com/simplylorilee/status/1193520861548032001,0,2,dbongino,
"i and my family work with, adopt, teach and foster kids who are broken. kids who got dealt a terrible hand by lousy birth parents. i usually try to be hopeful, but right now i’m overwhelmed with their pain and hopelessness. i’m going to pray and cry myself to sleep tonight. ",2019-11-10 02:05:53+00:00,,,1193349023396245504,,https://twitter.com/simplylorilee/status/1193349023396245504,2,1,,
i went out to my van the other morning and it was covered in snow! because i live in mi.,2019-11-10 00:25:06+00:00,,,1193323661777920001,,https://twitter.com/simplylorilee/status/1193323661777920001,0,0,chadfelixg,
"school of choice is a must. common core is a disaster, but the “promise program” has destroyed public schools. that and parents who take zero responsibility for raising decent human beings and blame teachers for their undisciplined kids.",2019-11-10 00:19:59+00:00,,,1193322372209762304,,https://twitter.com/simplylorilee/status/1193322372209762304,0,0,JedediahBila,
people commit perjury because there are no real consequences for it anymore. example: bill clinton,2019-11-10 00:15:22+00:00,,,1193321210446274562,,https://twitter.com/simplylorilee/status/1193321210446274562,0,0,realDonaldTrump,
consequences for bad decisions suck. make better decisions going forward.,2019-11-10 00:13:38+00:00,,,1193320774360326147,,https://twitter.com/simplylorilee/status/1193320774360326147,0,0,MrAndyNgo,
boomeradvice you are special but you’re no more special than anybody else.,2019-11-10 00:11:20+00:00,,#BoomerAdvice,1193320195647057929,,https://twitter.com/simplylorilee/status/1193320195647057929,0,0,,
"boomeradvice the harder you work, the luckier you get.",2019-11-10 00:09:23+00:00,,#BoomerAdvice,1193319704808566786,,https://twitter.com/simplylorilee/status/1193319704808566786,0,0,,
boomeradvice life isn’t fair. get over it.,2019-11-10 00:08:46+00:00,,#BoomerAdvice,1193319549275443201,,https://twitter.com/simplylorilee/status/1193319549275443201,1,0,,
no.,2019-11-09 23:46:28+00:00,,,1193313939993575424,,https://twitter.com/simplylorilee/status/1193313939993575424,0,0,Jim_Jordan,
 i hope he had friends with him. ,2019-11-09 18:31:01+00:00,,,1193234552153673728,,https://twitter.com/simplylorilee/status/1193234552153673728,0,0,KurtSchlichter,
it’s the eyes. soulless.,2019-11-09 18:23:21+00:00,,,1193232626338979841,,https://twitter.com/simplylorilee/status/1193232626338979841,0,0,MrAndyNgo,
who talks to 4 yr olds about periods?,2019-11-09 18:22:20+00:00,,,1193232366908706816,,https://twitter.com/simplylorilee/status/1193232366908706816,0,0,JesseKellyDC,
i really hope you carry.,2019-11-09 16:38:14+00:00,,,1193206169021628416,,https://twitter.com/simplylorilee/status/1193206169021628416,0,0,MrAndyNgo,
i have no idea what a womxn is. is it like a wombat?,2019-11-09 16:31:49+00:00,,,1193204556311777283,,https://twitter.com/simplylorilee/status/1193204556311777283,0,0,stillgray,
i’m old enough to remember gender reveal parties being in the delivery room.,2019-11-09 16:28:23+00:00,,,1193203690427109381,,https://twitter.com/simplylorilee/status/1193203690427109381,0,1,nypost,https://twitter.com/nypost/status/1193059720984236032
okcommie,2019-11-09 16:22:06+00:00,,#OkCommie,1193202110206300160,,https://twitter.com/simplylorilee/status/1193202110206300160,0,0,ericswalwell,
okcommie,2019-11-09 16:21:32+00:00,,#OkCommie,1193201966375198721,,https://twitter.com/simplylorilee/status/1193201966375198721,0,0,ericswalwell,https://twitter.com/ericswalwell/status/1192146713672179712
i was born in 1958 and to me it was a miracle.,2019-11-09 16:07:21+00:00,,,1193198399996223488,,https://twitter.com/simplylorilee/status/1193198399996223488,1,0,JusticeAnderson,
,2019-11-09 15:01:38+00:00,,,1193181860345647104,,https://twitter.com/simplylorilee/status/1193181860345647104,0,0,Solmemes1,
 ,2019-11-09 14:36:45+00:00,,,1193175598409097221,,https://twitter.com/simplylorilee/status/1193175598409097221,0,0,JesseKellyDC,
 please read the court documents before signing on to this. talk to  i would hate to see you duped by a evil man.,2019-11-09 14:28:30+00:00,,,1193173520760672256,@tedcruz @GregAbbott_TX,https://twitter.com/simplylorilee/status/1193173520760672256,0,0,brandondarby,https://twitter.com/brandondarby/status/1193031219157467137
is wrongful dismissal still a thing? a lawyer might be able to assure this lady’s financial future.,2019-11-08 23:52:14+00:00,,,1192953004619685889,,https://twitter.com/simplylorilee/status/1192953004619685889,1,0,megynkelly,
"sol, you really must make a filter that puts maga hats on everyone so we can put them on democrats.",2019-11-08 23:43:41+00:00,,,1192950850903314432,,https://twitter.com/simplylorilee/status/1192950850903314432,1,0,Solmemes1,
i’m just sick for the victims. they’ve seen the most powerful man in the world in their eyes “suicided.” they must be terrified of epstein’s clients finding them.,2019-11-08 23:40:45+00:00,,,1192950111782883328,,https://twitter.com/simplylorilee/status/1192950111782883328,1,0,DLoesch,
my grandson calls them pizza warts.,2019-11-08 22:28:34+00:00,,,1192931948307664900,,https://twitter.com/simplylorilee/status/1192931948307664900,0,0,JesseKellyDC,
people on medicare pay 20% of their healthcare. it should be called medicaid for all.,2019-11-08 19:15:34+00:00,,,1192883375763283970,,https://twitter.com/simplylorilee/status/1192883375763283970,0,0,redsteeze,
drugs cost money. where do they get money?,2019-11-08 19:04:50+00:00,,,1192880675541725184,,https://twitter.com/simplylorilee/status/1192880675541725184,0,0,AdamBaldwin,
how do homeless people buy drugs? where do they get the money?,2019-11-08 19:04:04+00:00,,,1192880482167468033,,https://twitter.com/simplylorilee/status/1192880482167468033,1,0,drawandstrike,
    ,2019-11-08 16:25:27+00:00,,,1192840566951821312,@WhoopiGoldberg @TheView @DonaldJTrumpJr @kimguilfoyle,https://twitter.com/simplylorilee/status/1192840566951821312,0,0,hodgetwins,https://twitter.com/hodgetwins/status/1192653601732055041
i wouldn’t want her soul within a thousand yards of me. i shudder to think of it.,2019-11-08 16:05:46+00:00,,,1192835612157591557,,https://twitter.com/simplylorilee/status/1192835612157591557,0,0,scrowder,
i wish harf wasn’t on. she was part of the state department cover up and lies. i won’t watch her.,2019-11-08 15:57:28+00:00,,,1192833525508128768,,https://twitter.com/simplylorilee/status/1192833525508128768,0,0,johnnydollar01,
 robach and her bosses chose not to report evidence of child abuse and trafficking that was ongoing. maybe “journalists” should be mandated reporters since so many of them have no moral compassion or decency. most people would be driven to try to help the victims.,2019-11-08 15:37:15+00:00,,,1192828435829284864,@arobach,https://twitter.com/simplylorilee/status/1192828435829284864,0,0,redsteeze,
all three.,2019-11-08 15:29:22+00:00,,,1192826450883293185,,https://twitter.com/simplylorilee/status/1192826450883293185,0,0,seanmdav,
"exodus 20:4-5 “you shall not make for yourself an idol, or any likeness of what is in heaven above or on the earth beneath or in the water under the earth. 5“you shall not worship them or serve them; for i, the lord your god, am a jealous god...”",2019-11-08 15:28:38+00:00,,,1192826266589765634,,https://twitter.com/simplylorilee/status/1192826266589765634,1,0,TaylorRMarshall,
"i’m not catholic. my protestant bible says leviticus 26:1 “do not make idols or set up an image or a sacred stone for yourselves, and do not place a carved stone in your land to bow down before it. i am the lord your god.”",2019-11-08 15:24:50+00:00,,,1192825313136435200,,https://twitter.com/simplylorilee/status/1192825313136435200,0,0,TaylorRMarshall,
when did perjury become “no big deal?” how can we have a justice system where lying isn’t severely punished?,2019-11-08 15:20:57+00:00,,,1192824335456706560,,https://twitter.com/simplylorilee/status/1192824335456706560,0,0,CongressmanHice,
    journalists should be mandated reporters since most of them don’t seem to have the moral character to protect children without being forced to by law. ,2019-11-08 15:18:44+00:00,,,1192823774695116801,@SenTedCruz @RandPaul @Jim_Jordan @realDonaldTrump @arobach,https://twitter.com/simplylorilee/status/1192823774695116801,0,0,,
why wasn’t abc news and  required by law to report evidence of possible ongoing child abuse? mandated reporting should apply to journalists if they have access to information about a danger to children. it’s a shame she didn’t just have the moral character.,2019-11-08 15:15:14+00:00,,,1192822894763618305,@arobach,https://twitter.com/simplylorilee/status/1192822894763618305,1,1,yashar,
"any lawyer: why is  not in big trouble? i was a mandatory reporter. all teachers, dr’s, counselors, etc are. journalists can ignore evidence of child abuse?",2019-11-08 15:07:36+00:00,,,1192820974753857536,@arobach,https://twitter.com/simplylorilee/status/1192820974753857536,0,0,,
 i was a mandatory reporter. why is  not in huge trouble?,2019-11-08 15:05:41+00:00,,,1192820492245311488,@DavidLimbaugh @arobach,https://twitter.com/simplylorilee/status/1192820492245311488,0,0,,
 does nancy realize that normal’s can read and watch the news and comprehend what we see and hear? her low opinion of us is insulting. her “prayers” are also creepy when we don’t know who she’s praying to. it’s not the god of the bible.,2019-11-08 14:55:34+00:00,,,1192817944771862529,@SpeakerPelosi,https://twitter.com/simplylorilee/status/1192817944771862529,0,0,GOPLeader,
i like the bible’s standard. two witnesses required and bearing false witness is also a capital crime.,2019-11-08 14:45:56+00:00,,,1192815521890258950,,https://twitter.com/simplylorilee/status/1192815521890258950,0,0,JackPosobiec,
what is a womxn?,2019-11-08 14:42:09+00:00,,,1192814569586118658,,https://twitter.com/simplylorilee/status/1192814569586118658,0,0,JesseKellyDC,
congratulations. that’s a fine bit of sausage and jerky.,2019-11-08 14:40:39+00:00,,,1192814193977778176,,https://twitter.com/simplylorilee/status/1192814193977778176,0,0,nedryun,
"thank you, dana. you speak for many of us and you take more heat than any of those whiney journalists like stelter because of it. i applaud your courage.",2019-11-08 14:38:48+00:00,,,1192813727889993731,,https://twitter.com/simplylorilee/status/1192813727889993731,0,0,DLoesch,
 mccain holding up her father as an example of morality is laughable. she lives in some weird bubble for heiresses. she knows nothing about reality and just channels what her daddy said.,2019-11-08 00:50:23+00:00,,,1192605249539891200,@MeghanMcCain,https://twitter.com/simplylorilee/status/1192605249539891200,0,0,kimguilfoyle,
 john mccain caused millions of people a great deal of pain when he voted not to repeal obamacare. me personally. she is delusional in thinking that her dad was an epitome of character.,2019-11-07 19:18:33+00:00,,,1192521740439760896,@MeghanMcCain,https://twitter.com/simplylorilee/status/1192521740439760896,1,1,McAllisterDen,
"sure, let’s turn disabled people into snowflake babies who get offended over words. the disabled overcome everyday. don’t turn them into helpless neurotics.",2019-11-07 12:08:54+00:00,,,1192413616399691776,,https://twitter.com/simplylorilee/status/1192413616399691776,0,0,crippledscholar,
do it again.,2019-11-07 02:02:09+00:00,,,1192260919612583936,,https://twitter.com/simplylorilee/status/1192260919612583936,0,0,KurtSchlichter,
"but the truth sets us free, neera! eric ciaramella.",2019-11-07 01:53:17+00:00,,,1192258690746851328,,https://twitter.com/simplylorilee/status/1192258690746851328,0,5,neeratanden,
,2019-11-07 01:38:25+00:00,,,1192254950140715009,,https://twitter.com/simplylorilee/status/1192254950140715009,0,0,scrowder,
" thank you, mrs. trump for showing compassion to those precious babies. https://twitter.com/dloesch/status/1192233581768331265",2019-11-07 01:37:09+00:00,,,1192254628487979008,@FLOTUS,https://twitter.com/simplylorilee/status/1192254628487979008,0,0,,https://twitter.com/DLoesch/status/1192233581768331265
"my adopted grandson was born addicted and there were too few nurses in the special care nursery to hold the babies who were suffering withdrawals. my daughter and i were able to hold her son day and night, but most of the babies had no one. god bless the cuddler volunteers.",2019-11-07 01:33:58+00:00,,,1192253830160945159,,https://twitter.com/simplylorilee/status/1192253830160945159,2,4,DLoesch,
"a year to election day is an eternity in terms of public interest. when the ig report comes out, the headlines will change and public interest will change.",2019-11-07 01:24:36+00:00,,,1192251470411907072,,https://twitter.com/simplylorilee/status/1192251470411907072,0,0,MZHemingway,
apparently blackface is ok now. democrats re-elected him so i guess it’s no big deal. cultural appropriation outrage is cancelled.,2019-11-07 01:08:05+00:00,,,1192247314359955456,,https://twitter.com/simplylorilee/status/1192247314359955456,0,1,Barnes_Law,
"in this add world, timing is everything.",2019-11-07 01:02:53+00:00,,,1192246006429159424,,https://twitter.com/simplylorilee/status/1192246006429159424,0,0,drawandstrike,
i don’t care what that family was doing. the cartel slaughtered unarmed women and children. every soldier in mexico should be hunting them down.,2019-11-07 00:48:36+00:00,,,1192242413085110272,,https://twitter.com/simplylorilee/status/1192242413085110272,0,0,JimHansonDC,
my grandfather’s generation would be.,2019-11-07 00:45:29+00:00,,,1192241629198983169,,https://twitter.com/simplylorilee/status/1192241629198983169,4,0,johncardillo,
amen! all women should be furious over losers who think that they can just put on a dress and be one of us. we are uniquely created with gifts that men can never imitate. (same in reverse),2019-11-07 00:41:18+00:00,,,1192240573526290432,,https://twitter.com/simplylorilee/status/1192240573526290432,1,1,MattWalshBlog,
"robach had a moral obligation to get the evidence she had to someone who would try to save the victims still in epstein’s reach. she chose to ignore a still active pedophile ring. what kind of woman can live with that? news stars may not be mandatory reporters, but still...",2019-11-07 00:30:45+00:00,,,1192237919475585025,,https://twitter.com/simplylorilee/status/1192237919475585025,0,0,JaniceDean,
"ms. white needs to read a bible. she and other “prosperity gospel” preachers are leading people to hell. the bible promises nothing of earthly value. god’s gifts are spiritual, not tangible stuff that “the world” values. in heaven, gold is just for walking on.",2019-11-06 23:54:17+00:00,,,1192228743659630593,,https://twitter.com/simplylorilee/status/1192228743659630593,1,0,MattWalshBlog,
"acts 5:29 “peter and the apostles answered, “we must obey god rather than men.” this is persecution. matthew 5:10 “blessed are those who are persecuted because of righteousness, for theirs is the kingdom of heaven.”",2019-11-06 22:29:09+00:00,,,1192207319330967552,,https://twitter.com/simplylorilee/status/1192207319330967552,0,0,SenTedCruz,
" robach had a moral duty as a human being to get that information to someone no matter what it did to her career. she’s pissed that she didn’t get credit for the story, but she did nothing to help epstein’s victims. there were 100’s of people she could have gone to.",2019-11-06 16:04:25+00:00,,,1192110496801075201,@arobach,https://twitter.com/simplylorilee/status/1192110496801075201,7,57,drawandstrike,
"teachers, dr’s, counselors, etc are mandatory reporters of any suspicion of child abuse. you would think that any decent human being would do anything within their power to stop a pedophile ring. yet,  did nothing because she wanted to keep her job. i’m repulsed.",2019-11-06 16:00:46+00:00,,,1192109580379136001,@arobach,https://twitter.com/simplylorilee/status/1192109580379136001,0,0,JackPosobiec,
 amy robach is personally responsible for the rape of any child that epstein and his group hurt in the 3 yrs she knew the facts and did nothing. she has no excuse for not getting that info to whoever needed to get it to try to stop him. she protected her career.,2019-11-06 15:56:43+00:00,,,1192108557480660993,@arobach,https://twitter.com/simplylorilee/status/1192108557480660993,0,0,JackPosobiec,
so only right wing people care about child rape? or only the left hides reporting on pedophiles?,2019-11-06 15:39:17+00:00,,,1192104173778673670,,https://twitter.com/simplylorilee/status/1192104173778673670,0,1,redsteeze,
agree.,2019-11-06 14:16:23+00:00,,,1192083311037992960,,https://twitter.com/simplylorilee/status/1192083311037992960,0,0,RakestrawJeff,
"god chose parents to raise children, not institutions.",2019-11-06 14:10:35+00:00,,,1192081848236675072,,https://twitter.com/simplylorilee/status/1192081848236675072,1,0,karavoght,
i had 3 natural childbirths because it was all they had. i told my daughter and daughters-in-law to take the epidural if offered.,2019-11-06 00:22:25+00:00,,,1191873433564520448,,https://twitter.com/simplylorilee/status/1191873433564520448,0,0,yarbroughtracey,
does your bill include abortion dr’s.? savethebabyhumans,2019-11-05 23:31:59+00:00,,#SaveTheBabyHumans,1191860743865618432,,https://twitter.com/simplylorilee/status/1191860743865618432,0,0,SenBlumenthal,
 ,2019-11-05 22:04:52+00:00,,,1191838817734578177,,https://twitter.com/simplylorilee/status/1191838817734578177,0,0,MBCompanyMan,
there is no medal or monetary award for natural childbirth. take the epidural.,2019-11-05 21:22:45+00:00,,,1191828222326931456,,https://twitter.com/simplylorilee/status/1191828222326931456,1,0,JedediahBila,
  maybe virginia roberts would present her evidence to ronan or james and they can get it out to the people who need to hear it. there is definitely an audience now that wants to know.,2019-11-05 20:08:52+00:00,,,1191809626515394563,@RonanFarrow @JamesOKeefeIII,https://twitter.com/simplylorilee/status/1191809626515394563,0,2,MZHemingway,
maybe ask amy robach who saw the evidence.,2019-11-05 19:02:58+00:00,,,1191793043604725767,,https://twitter.com/simplylorilee/status/1191793043604725767,0,0,redsteeze,
so horrifying.,2019-11-05 14:36:03+00:00,,,1191725871272472577,,https://twitter.com/simplylorilee/status/1191725871272472577,0,0,KurtSchlichter,
,2019-11-05 14:34:40+00:00,,,1191725524399403008,,https://twitter.com/simplylorilee/status/1191725524399403008,1,29,mad_liberals,
horrifying.,2019-11-05 14:32:17+00:00,,,1191724924810993664,,https://twitter.com/simplylorilee/status/1191724924810993664,0,0,brandondarby,
"i agree. doubts drive me to study the bible with the original language, history, evidence from archeology, commentaries...i consult teachers and prophecies that were fulfilled...facts confirm faith.",2019-11-05 01:49:53+00:00,,,1191533060761833474,,https://twitter.com/simplylorilee/status/1191533060761833474,0,0,michaelmalice,
,2019-11-05 00:57:37+00:00,,,1191519905864146946,,https://twitter.com/simplylorilee/status/1191519905864146946,0,0,,
" you are correct, steve. i won’t watch marie harf because she is part of the swamp cover-up. she was there as she admits.",2019-11-04 22:33:35+00:00,,,1191483656390483969,@SteveHiltonx,https://twitter.com/simplylorilee/status/1191483656390483969,0,0,justinbaragona,https://twitter.com/justinbaragona/status/1191409436205756416
i’m a boomer but my kids aren’t millennials. are you sure boomers are their parents?,2019-11-04 19:31:06+00:00,,,1191437735040626688,,https://twitter.com/simplylorilee/status/1191437735040626688,0,0,MattWalshBlog,
i’m torn between being heartbroken and angry.,2019-11-03 22:59:57+00:00,,,1191127906921205761,,https://twitter.com/simplylorilee/status/1191127906921205761,1,0,MattWalshBlog,
"they’ve got epidurals now, jed.",2019-11-03 21:19:54+00:00,,,1191102727570575361,,https://twitter.com/simplylorilee/status/1191102727570575361,0,0,JedediahBila,
"the most deadly addiction in the us isn’t opioids, it’s food.",2019-11-03 21:02:33+00:00,,,1191098361165864965,,https://twitter.com/simplylorilee/status/1191098361165864965,1,0,iheartmindy,
not to mention that taxpayers are probably going to have to buy her insulin.,2019-11-03 21:01:31+00:00,,,1191098099789381632,,https://twitter.com/simplylorilee/status/1191098099789381632,0,0,iheartmindy,
"enabling addicts, criminals, and the lazy is not compassionate to them or their victims. methadone for addicts is not compassionate. pain from consequences is the best chance people have.",2019-11-03 20:58:36+00:00,,,1191097366729891840,,https://twitter.com/simplylorilee/status/1191097366729891840,2,2,GregAbbott_TX,
baghdadi took his children to use as human shields and blew them up with himself because he was afraid of the dog getting him before the soldiers got to him to call the dog off. total braveheart. ,2019-11-03 20:25:35+00:00,,,1191089058233114627,,https://twitter.com/simplylorilee/status/1191089058233114627,0,0,stillgray,
clinton’s e-mails belong to the citizens of the united states. they were stolen or foolishly lost so of course our president wants them back.,2019-11-03 20:20:18+00:00,,,1191087728437473283,,https://twitter.com/simplylorilee/status/1191087728437473283,1,0,thehill,
"dear senator sanders, i know jesus. jesus is my best friend and savior. i’ve studied jesus’ book. jesus is no socialist. jesus is the king of kings. he’ll rule in pure justice and righteousness and you won’t like it.",2019-11-03 20:17:31+00:00,,,1191087028387172352,,https://twitter.com/simplylorilee/status/1191087028387172352,15,7,adamkelsey,
"  in 2025 we can call him “father of the president, former president trump.”",2019-11-03 20:12:26+00:00,,,1191085749724237824,@realDonaldTrump @DonaldJTrumpJr,https://twitter.com/simplylorilee/status/1191085749724237824,0,0,JoeBiden,
 better than “failed ex-president obama”. or “worse than jimmy carter obama”,2019-11-03 20:10:02+00:00,,,1191085146419712000,@realDonaldTrump,https://twitter.com/simplylorilee/status/1191085146419712000,0,0,JoeBiden,
"“when you're a company as big as wal-mart , everything about you is huge, even your losses from shoplifting. the retailing giant says that it loses about $3 billion every year from theft...reuters reports.aug 21, 2016”. who do you think pays for that $3 bil loss?",2019-11-03 19:54:47+00:00,,,1191081306299482112,,https://twitter.com/simplylorilee/status/1191081306299482112,0,0,JamesPPinkerton,
if people realized how much of the price that they pay for goods is due to “shrinkage” they would not consider shoplifting a low level crime.,2019-11-03 19:52:03+00:00,,,1191080620568514561,,https://twitter.com/simplylorilee/status/1191080620568514561,0,1,JamesPPinkerton,
