text,date,geo,hashtags,tweet_id,mentions,permalink,replies,retweets,replies_to,mentioned_urls
has paisley met  ‘s pet unicorn chet? ,2019-12-09 15:14:03+00:00,,,1204056621594423297,@KurtSchlichter,https://twitter.com/simplylorilee/status/1204056621594423297,0,0,greggutfeld,
"this will be very helpful to commuters and others who are very busy. i plan to listen while driving, cooking, cleaning etc. thank you!",2019-12-09 14:51:39+00:00,,,1204050986333089792,,https://twitter.com/simplylorilee/status/1204050986333089792,0,0,AdamBaldwin,
 i read that adam will be reading the entire report out loud for busy people who find it hard to read the whole thing. it would be helpful for people who commute to work or like me run grandkids around all day and can listen easier than reading. it’s much appreciated,2019-12-09 14:49:59+00:00,,,1204050566835519489,@AdamBaldwin,https://twitter.com/simplylorilee/status/1204050566835519489,0,0,tracybeanz,
 adam is going to be narrating the whole report for busy people who can’t sit down to read it but can listen on their commutes etc. i appreciate that. pray his voice holds out. ,2019-12-09 14:46:43+00:00,,,1204049743665610758,@AdamBaldwin,https://twitter.com/simplylorilee/status/1204049743665610758,0,1,MikeKGilmore,
"my immediate family with siblings and their children is over 50 ppl. about 30 vote. three are raging liberals, the rest conservative. i alone watch the impeachment hearings and report back. the conservatives are primarily just angry that congress is wasting their tax $.",2019-12-09 14:44:55+00:00,,,1204049288973750273,,https://twitter.com/simplylorilee/status/1204049288973750273,0,0,CarpeDonktum,
i started following your dad so that i can continue to hear from you. thank you. thanks to dad also.,2019-12-09 14:40:06+00:00,,,1204048076572385280,,https://twitter.com/simplylorilee/status/1204048076572385280,0,0,BrianHegseth,
unless she’s under oath in a court of law why would anyone care what a sex trafficking madam says? she shouldn’t have a platform.,2019-12-09 14:11:06+00:00,,,1204040778173091840,,https://twitter.com/simplylorilee/status/1204040778173091840,0,0,redsteeze,
my daughter adopted a baby born addicted. his mother received “free” methadone for at least 15 yrs before she died of an overdose. she had 8 children all taken away from her. methadone is job security for the dea. it keeps addicts addicted.,2019-12-09 14:09:20+00:00,,,1204040335032238080,,https://twitter.com/simplylorilee/status/1204040335032238080,0,0,,
please also stop giving methadone to opioid addicts. taxpayers shouldn’t be paying for people to have drugs. it doesn’t wean them off and it hurts an addict unborn child. my daughter adopted an addicted newborn and he will struggle cognitively for his whole life.,2019-12-09 14:05:27+00:00,,,1204039359219085313,,https://twitter.com/simplylorilee/status/1204039359219085313,0,0,JesseKellyDC,
thank you. i have never understood why our troops weren’t burning the poppy fields if we had to be over there.,2019-12-09 14:03:15+00:00,,,1204038803343773696,,https://twitter.com/simplylorilee/status/1204038803343773696,0,0,JesseKellyDC,
it’s menopause. it’ll be over in ten years.,2019-12-09 02:53:44+00:00,,,1203870314725281795,,https://twitter.com/simplylorilee/status/1203870314725281795,1,0,Alyssa_Milano,
mix that with “i was too stupid to know hunter’s ukrainian job was a conflict of interest without my aides telling me.” and i see too dumb to be president.,2019-12-09 02:46:03+00:00,,,1203868380920459264,,https://twitter.com/simplylorilee/status/1203868380920459264,0,0,MZHemingway,
"while you’re upholding it, could you read it. especially the 1st, 2nd, 4th, and 5th amendments. you won’t find abortion but you will find guns and my right to own them without your interference.",2019-12-09 02:44:11+00:00,,,1203867909707247616,,https://twitter.com/simplylorilee/status/1203867909707247616,0,0,RepSwalwell,
i would get bored without twitter to laugh at. you bring out some very funny comments. thank you.,2019-12-09 01:44:36+00:00,,,1203852915917705216,,https://twitter.com/simplylorilee/status/1203852915917705216,0,0,michaelmalice,
satan offered worldly things to jesus if he’d give up the cross. i’m grateful he made the sacrifice instead. i’ll take my cross and follow him.,2019-12-08 23:04:48+00:00,,,1203812702541549569,,https://twitter.com/simplylorilee/status/1203812702541549569,0,0,conservmillen,
i’m deeply sorry. grief is so hard to bear and i know you feel both your mom and dad’s suffering with your own. my prayer is that you will feel god very close to you at this time.,2019-12-08 22:54:34+00:00,,,1203810128450990081,,https://twitter.com/simplylorilee/status/1203810128450990081,0,0,Johnny_Joey,
"    he’s talking to you, guys.",2019-12-08 22:22:29+00:00,,,1203802050695446530,@LindseyGrahamSC @SenTedCruz @senatemajldr @senjudiciary,https://twitter.com/simplylorilee/status/1203802050695446530,0,0,MattWalshBlog,https://twitter.com/MattWalshBlog/status/1203797995805904900
 pelosi defended bill clinton when there was video of him telling a complete lie under oath to keep from being found guilty in a civil case against him even though there was dna evidence proving that he lied so nancy’s sudden concern for what is “right” rings hollow,2019-12-08 22:14:45+00:00,,,1203800108132945921,@SpeakerPelosi,https://twitter.com/simplylorilee/status/1203800108132945921,0,0,paulsperry_,
"    conservative didn’t choose the weapons, but we can’t fight back without using the weapons democrats use. quit being a gentleman in a street fight.",2019-12-08 21:28:36+00:00,,,1203788491290755075,@LindseyGrahamSC @SenTedCruz @senatemajldr @senjudiciary,https://twitter.com/simplylorilee/status/1203788491290755075,0,0,JackPosobiec,https://twitter.com/JackPosobiec/status/1203711236036341762
if democrats were serious they would have voted to impeach bill clinton and they would have convicted him in the senate. there was video of his lying and dna evidence. they exonerated clinton him for political reasons and they are impeaching trump for the same.,2019-12-08 21:26:14+00:00,,,1203787897033412608,,https://twitter.com/simplylorilee/status/1203787897033412608,1,0,JimHansonDC,
children can’t gamble on the internet. they can’t make purchases without an adult giving them a credit card. how hard is it to make people prove who they are and if they are 18 yrs old before they access porn? the gov’t regulates a lot of things in regard to children.,2019-12-08 21:22:19+00:00,,,1203786911103569920,,https://twitter.com/simplylorilee/status/1203786911103569920,0,0,stillgray,
" why do leftist always default to “i was too stupid to know,” as a defense? first hillary, then biden, and now kerry. if you’re that stupid, you are not qualified to be president.",2019-12-08 21:17:05+00:00,,,1203785593785921537,@realDonaldTrump,https://twitter.com/simplylorilee/status/1203785593785921537,0,0,amandawgolden,
amen!!,2019-12-08 21:07:31+00:00,,,1203783187845046272,,https://twitter.com/simplylorilee/status/1203783187845046272,0,0,JimHansonDC,
biden isn’t smart enough to know a conflict of interest when he sees one but he wants to run the whole country? no thanks.,2019-12-08 21:04:20+00:00,,,1203782383855656962,,https://twitter.com/simplylorilee/status/1203782383855656962,0,0,kenvogel,
" or, ted cruz cares more about this country and the constitution than he does his personal feelings about petty insults during an election.",2019-12-08 20:53:08+00:00,,,1203779566550110213,@SenTedCruz,https://twitter.com/simplylorilee/status/1203779566550110213,1,0,keithboykin,
"at a family gathering today my millennial niece started screaming at me, “don’t blame obama,” when i explained a change in the irs child tax credit to my son because he got audited. next my sisters start yelling at me about me talking politics. wth is wrong with people?",2019-12-08 20:00:55+00:00,,,1203766427121045504,,https://twitter.com/simplylorilee/status/1203766427121045504,0,0,,
truth!,2019-12-08 16:23:42+00:00,,,1203711760538189824,,https://twitter.com/simplylorilee/status/1203711760538189824,0,0,KurtSchlichter,
"sure, lindsey. gentleman us all into slavery to the left.",2019-12-08 16:22:23+00:00,,,1203711430807244800,,https://twitter.com/simplylorilee/status/1203711430807244800,0,0,DineshDSouza,
i have a couple of 14 yr old granddaughter that are pretty good at push ups. let a girl challenge him. pushuporshutupjoe,2019-12-08 16:20:50+00:00,,#PushUpOrShutUpJoe,1203711040808243202,,https://twitter.com/simplylorilee/status/1203711040808243202,0,0,TimRunsHisMouth,
amen and amen!,2019-12-08 16:15:49+00:00,,,1203709778998054912,,https://twitter.com/simplylorilee/status/1203709778998054912,0,0,DavidLimbaugh,
"well, i trust ted cruz far more than the intel community who have proven to be unconscionably partisan and dishonest.",2019-12-08 16:14:21+00:00,,,1203709407336513541,,https://twitter.com/simplylorilee/status/1203709407336513541,0,0,kwelkernbc,
"if democrats want to bring a gun to a knife fight, republicans need to bring out bigger guns.  i’m tired of being the polite losers in this war for the soul of america’s constitution.",2019-12-08 16:12:57+00:00,,,1203709055891623937,@LindseyGrahamSC,https://twitter.com/simplylorilee/status/1203709055891623937,0,0,EliseStefanik,
 why haven’t you expelled saudi nationals until this incident has been investigated? we have troops in danger and unarmed on military bases.,2019-12-08 16:10:47+00:00,,,1203708510267162624,@realDonaldTrump,https://twitter.com/simplylorilee/status/1203708510267162624,0,0,paulsperry_,
i wouldn’t brag about a catholic priest concocting the big bang theory. god doesn’t need people to explain away his omnipotent power to create.,2019-12-08 16:09:15+00:00,,,1203708123074252806,,https://twitter.com/simplylorilee/status/1203708123074252806,0,0,Woj_Pawelczyk,
 get them out of our country.,2019-12-08 16:07:00+00:00,,,1203707557447163905,@realDonaldTrump,https://twitter.com/simplylorilee/status/1203707557447163905,0,0,SenRickScott,https://twitter.com/SenRickScott/status/1203705699395653634
 republicans need to toughen the hell up and start fighting back with the democrat’s weapons?,2019-12-08 16:05:48+00:00,,,1203707256711331842,@LindseyGrahamSC,https://twitter.com/simplylorilee/status/1203707256711331842,0,1,KurtSchlichter,
please don’t allow illegal aliens to receive these tax credits. obama did and it was so wrong.,2019-12-08 16:01:24+00:00,,,1203706149918380033,,https://twitter.com/simplylorilee/status/1203706149918380033,0,0,IvankaTrump,
"i pray for truth, protection for the innocent, justice, and righteousness. “thy will be done one earth as it is in heaven.” godisamultitasker",2019-12-08 15:59:48+00:00,,#GodIsAMultiTasker,1203705747101626368,,https://twitter.com/simplylorilee/status/1203705747101626368,0,0,johncardillo,
of course.,2019-12-08 15:56:17+00:00,,,1203704861122007040,,https://twitter.com/simplylorilee/status/1203704861122007040,0,0,shanejenn2020,
"i don’t listen to popular music so i looked up the lyrics and i love this. thank you, sol.",2019-12-08 15:55:25+00:00,,,1203704642040926208,,https://twitter.com/simplylorilee/status/1203704642040926208,0,0,Solmemes1,
 this is heinous. deport these people now!,2019-12-08 15:52:52+00:00,,,1203704000446652416,@realDonaldTrump,https://twitter.com/simplylorilee/status/1203704000446652416,1,1,JesseKellyDC,
"it reads like fiction. my mother-in-law committed suicide as did my 35 yr old nephew. it was tragic. it caused immeasurable pain, but it was their choice. it was no ones fault but theirs.",2019-12-08 15:51:32+00:00,,,1203703667221835776,,https://twitter.com/simplylorilee/status/1203703667221835776,0,0,AsheSchow,
"i’m not trying to be rude, but seriousl i would be afraid to walk through that mess or let my kids. what if an innocent person stepped on a needle or got bit by a rat flea? it could be deadly. do californians just avoid these areas?",2019-12-08 15:45:53+00:00,,,1203702243725336576,,https://twitter.com/simplylorilee/status/1203702243725336576,0,0,courrielche,
good thread: ,2019-12-08 14:51:57+00:00,,,1203688672174002178,,https://twitter.com/simplylorilee/status/1203688672174002178,0,0,COsweda,https://twitter.com/COsweda/status/1203168539839827968
porn sites deliberately look for young men to solicit and it’s so easy to get a young man to click on the sites out of curiosity and then drag them down into a really dangerous rabbit hole.,2019-12-08 14:33:14+00:00,,,1203683961924444160,,https://twitter.com/simplylorilee/status/1203683961924444160,0,0,simplylorilee,
in hs my nephew accepted a “friend request” on facebook from a pretty woman. i saw it and called his mother because he had signed to play football on scholarship and coaches monitor social media. his whole team accepted this “friend request.” he could have lost his scholarship.,2019-12-08 14:29:40+00:00,,,1203683065463279616,,https://twitter.com/simplylorilee/status/1203683065463279616,1,0,MattWalshBlog,
"many of the porn sites that are hard core show behaviors that are illegal. bestiality, child rape, involuntary bondage. it’s not harmless. especially to a child that sees it accidentally thinking they are looking at “naked women.”",2019-12-08 14:23:39+00:00,,,1203681551499907072,,https://twitter.com/simplylorilee/status/1203681551499907072,0,0,MattWalshBlog,
“legal scholars” as in academic’s who are totally partisan and think they know more than the rest of the world?,2019-12-08 14:17:05+00:00,,,1203679898482728961,,https://twitter.com/simplylorilee/status/1203679898482728961,0,0,RepAdamSchiff,https://twitter.com/RepAdamSchiff/status/1203397588004810752
this is insane. potus is not adam schiff. conservative’s support rule of law and the constitution.,2019-12-08 14:12:35+00:00,,,1203678764665888769,,https://twitter.com/simplylorilee/status/1203678764665888769,0,0,secupp,https://twitter.com/secupp/status/1203549674508103681
"   please answer these patriots, sir. why haven’t you called pensacola “radical islamic terrorism?” men died.",2019-12-08 14:08:52+00:00,,,1203677828811804672,@realDonaldTrump @PeteHegseth @dbongino,https://twitter.com/simplylorilee/status/1203677828811804672,0,0,,
nancy’s prayers.,2019-12-08 13:55:00+00:00,,,1203674341784932353,,https://twitter.com/simplylorilee/status/1203674341784932353,0,0,,https://youtu.be/JvD7O_dmtjc
i can see you in his precious little face!,2019-12-08 05:06:57+00:00,,,1203541452589920256,,https://twitter.com/simplylorilee/status/1203541452589920256,0,0,JedediahBila,
fifi and harley.,2019-12-08 04:46:07+00:00,,,1203536208778928130,,https://twitter.com/simplylorilee/status/1203536208778928130,0,0,PolitiBunny,
,2019-12-08 02:41:25+00:00,,,1203504828128923648,,https://twitter.com/simplylorilee/status/1203504828128923648,0,2,foot_slew,
,2019-12-08 02:37:41+00:00,,,1203503888558632962,,https://twitter.com/simplylorilee/status/1203503888558632962,0,3,foot_slew,
what if some child touched the stuffed animal after he put it back?,2019-12-08 02:29:17+00:00,,,1203501775061504000,,https://twitter.com/simplylorilee/status/1203501775061504000,0,0,HeyTammyBruce,
i think it would be a blessing to have you follow me but i would only ask politely. would you follow me please?,2019-12-08 01:46:29+00:00,,,1203491003304480768,,https://twitter.com/simplylorilee/status/1203491003304480768,0,0,catturd2,
he swings like a girl in a slap fight.,2019-12-08 01:39:07+00:00,,,1203489148172197888,,https://twitter.com/simplylorilee/status/1203489148172197888,0,0,ElijahSchaffer,
as a retired banker i can testify that this is true. people inherit money all of the time and most are broke again within 2 yrs.,2019-12-08 01:23:57+00:00,,,1203485333809192962,,https://twitter.com/simplylorilee/status/1203485333809192962,0,0,ZubyMusic,
you would “kill” to look that good in any color. jealous.,2019-12-08 01:19:16+00:00,,,1203484154932932610,,https://twitter.com/simplylorilee/status/1203484154932932610,0,0,ananavarro,
the dem’s did a wonderful job of convincing most of the country that clinton was impeached for adultery. most people don’t realize he lied under oath to try to win a lawsuit against himself for sexual harassment of a different woman. monica just established a pattern of behavior.,2019-12-08 01:02:00+00:00,,,1203479808656781312,,https://twitter.com/simplylorilee/status/1203479808656781312,0,0,drawandstrike,
as an investment/banking professional i was required to take 2 credit hours of continuing education on ethics every year. gov’t officials know what ethics are. they write the regulations for everyone else. even the appearance of being unethical would have cost me my job.,2019-12-08 00:53:37+00:00,,,1203477696728227840,,https://twitter.com/simplylorilee/status/1203477696728227840,0,0,Peoples_Pundit,
i did international banking and investing and canadians and canadian businesses often their primary accounts in the us. a lot of canadians work in the us for our healthcare and 401k’s.,2019-12-08 00:45:07+00:00,,,1203475560686637058,,https://twitter.com/simplylorilee/status/1203475560686637058,1,0,Cernovich,
my mom had alzheimer’s and it’s so obvious that he’s got some kind of dementia. he’s just an excuse for democrat’s to attempt impeachment. no one seems to actually love him enough to stop his humiliation.,2019-12-08 00:20:09+00:00,,,1203469276172169217,,https://twitter.com/simplylorilee/status/1203469276172169217,0,0,johncardillo,
excellent and very funny.,2019-12-08 00:04:21+00:00,,,1203465300919894016,,https://twitter.com/simplylorilee/status/1203465300919894016,0,0,KTHopkins,
"you’re a good man, scott.",2019-12-07 23:27:56+00:00,,,1203456137242316800,,https://twitter.com/simplylorilee/status/1203456137242316800,0,0,ScottPresler,
alzheimer’s.,2019-12-07 23:23:02+00:00,,,1203454902946746369,,https://twitter.com/simplylorilee/status/1203454902946746369,0,0,DailyCaller,
porn “pops up” too often and solicits boys. it should just be harder to access so than grown ups have to be more deliberate to get to it. boys aren’t mature enough to handle the hard core stuff.,2019-12-07 23:22:30+00:00,,,1203454768175353856,,https://twitter.com/simplylorilee/status/1203454768175353856,2,0,JackPosobiec,
that’s crazy. i had no idea how much has been hidden.,2019-12-07 23:10:20+00:00,,,1203451705947492354,,https://twitter.com/simplylorilee/status/1203451705947492354,0,0,JackPosobiec,
i’ve ridden since i was very young but my hips can’t ride horses or harley’s anymore. i leave it to the grandkids.,2019-12-07 23:07:50+00:00,,,1203451075568848903,,https://twitter.com/simplylorilee/status/1203451075568848903,0,0,johncardillo,
if you develop alzheimer’s one day you will.,2019-12-07 23:01:54+00:00,,,1203449585361981440,,https://twitter.com/simplylorilee/status/1203449585361981440,0,0,alx,
my nephew is in the secret services. why do you hate brave americans?,2019-12-07 22:03:39+00:00,,,1203434924579180544,,https://twitter.com/simplylorilee/status/1203434924579180544,0,0,NEWS_MAKER,
porn sites try to get boys hooked by soliciting them through innocent looking sites. boys become aroused visually and with natural curiosity get aroused and hooked before they know it. like free crack. it can’t be erased and will destroy their normal future relationships.,2019-12-07 21:41:30+00:00,,,1203429352102338560,,https://twitter.com/simplylorilee/status/1203429352102338560,1,0,MattWalshBlog,
porn is not just naked pictures. it is vile stuff that most people wouldn’t even consider. boys should never “accidentally” see arousing images because porn spirals down like drugs and it takes more and more vile images to get the same “high.” it makes “normal” sex impossible.,2019-12-07 21:35:36+00:00,,,1203427867448754178,,https://twitter.com/simplylorilee/status/1203427867448754178,0,0,InezFeltscher,
     at least until we can reconsider this program.,2019-12-07 18:36:32+00:00,,,1203382803246854147,@realDonaldTrump @SenTedCruz @senatemajldr @ChuckGrassley @LindseyGrahamSC,https://twitter.com/simplylorilee/status/1203382803246854147,0,0,JackPosobiec,https://twitter.com/JackPosobiec/status/1203376732994228225
of course she won’t. her lie also got her in a position to run for the senate and presidency.,2019-12-07 18:31:01+00:00,,,1203381415716499457,,https://twitter.com/simplylorilee/status/1203381415716499457,0,0,Cernovich,
  tlaib and omar are the one’s who agree with the terrorist shooter’s ideology as he wrote on his social media. not potus or republicans.,2019-12-07 18:28:53+00:00,,,1203380875624366082,@RashidaTlaib @IlhanMN,https://twitter.com/simplylorilee/status/1203380875624366082,0,0,conservmillen,
i sued the police in mi and the judge allowed the lawsuit but their lawyers appealed it and said they would go to mi supreme court. they have unlimited money and they are claiming immunity for their actions because they are police. i appreciate leo’s but a few do bad things.,2019-12-07 18:26:34+00:00,,,1203380295426334721,,https://twitter.com/simplylorilee/status/1203380295426334721,1,0,KrisAnneHall,
"i try not to hate people, but i do hate radical islam and i hate that our military personnel are not allowed to be armed at all times.",2019-12-07 18:22:13+00:00,,,1203379199274344449,,https://twitter.com/simplylorilee/status/1203379199274344449,0,0,conservmillen,
so true! ,2019-12-07 15:09:42+00:00,,,1203330749635735553,,https://twitter.com/simplylorilee/status/1203330749635735553,0,0,caroljsroth,
is there anything more hateful than abortion? nancy has a lot of blood on her hands.,2019-12-07 15:08:34+00:00,,,1203330466172080128,,https://twitter.com/simplylorilee/status/1203330466172080128,0,0,JimHansonDC,
liberal women often have weak husbands and loser children who don’t know what sex they are.,2019-12-07 15:07:33+00:00,,,1203330211363934213,,https://twitter.com/simplylorilee/status/1203330211363934213,0,0,KurtSchlichter,
"didn’t we all, really? my son was in a war zone at 19.",2019-12-07 15:03:00+00:00,,,1203329063500361730,,https://twitter.com/simplylorilee/status/1203329063500361730,0,0,BoreGuru,
luke 17:2 “verse “it would be better for them to be thrown into the sea with a millstone tied around their neck than to cause one of these little ones to stumble.”,2019-12-07 14:57:32+00:00,,,1203327687961563137,,https://twitter.com/simplylorilee/status/1203327687961563137,1,0,JackPosobiec,
,2019-12-07 14:54:43+00:00,,,1203326981909204998,,https://twitter.com/simplylorilee/status/1203326981909204998,0,0,alx,
a 19 yr old should have a damn job. my kids were in college and working to feed themselves at 19.,2019-12-07 14:52:22+00:00,,,1203326389065330690,,https://twitter.com/simplylorilee/status/1203326389065330690,1,0,KurtSchlichter,
"death by execution by the state isn’t excruciatingly painful, but dying from burns is. i’m sure this young woman spent hours in agony.",2019-12-07 14:31:39+00:00,,,1203321177357398017,,https://twitter.com/simplylorilee/status/1203321177357398017,0,0,PopRelics,
do you sleep?,2019-12-07 14:24:01+00:00,,,1203319253442670592,,https://twitter.com/simplylorilee/status/1203319253442670592,0,0,KurtSchlichter,
"jesus died between two other men. do you think that he was incapable of taking them off of their crosses. he promised the repentant thief that he would be with jesus in paradise that day, but he didn’t save him from death.",2019-12-07 02:27:16+00:00,,,1203138880259731456,,https://twitter.com/simplylorilee/status/1203138880259731456,0,0,ebruenig,
"eenie, meanie, minie, no!",2019-12-07 02:24:42+00:00,,,1203138233049239552,,https://twitter.com/simplylorilee/status/1203138233049239552,0,0,KurtSchlichter,
better idea! https://twitter.com/solmemes1/status/1203125034698588161,2019-12-07 02:17:29+00:00,,,1203136415757930497,,https://twitter.com/simplylorilee/status/1203136415757930497,0,5,KurtSchlichter,https://twitter.com/solmemes1/status/1203125034698588161
"my son has been so financially successful that he bought a 2nd house on the beach for me to live in during the summers. of course now i have to spend more time with my grandchildren as they each take turns spending a week with me swimming, laying in the sun, and being spoiled. ",2019-12-07 02:14:19+00:00,,,1203135618726998016,,https://twitter.com/simplylorilee/status/1203135618726998016,1,0,davereaboi,
" people who run as republicans and then vote as democrats are just evil liars who conned their constituents. him and romney are hateful, lying con-men. they should be impeached.",2019-12-07 02:00:30+00:00,,,1203132144006189057,@justinamash,https://twitter.com/simplylorilee/status/1203132144006189057,0,1,alx,
i need a bridget!,2019-12-07 01:50:28+00:00,,,1203129619077091329,,https://twitter.com/simplylorilee/status/1203129619077091329,0,0,HeyTammyBruce,
this brought me to tears.,2019-12-07 01:45:02+00:00,,,1203128248479162368,,https://twitter.com/simplylorilee/status/1203128248479162368,0,0,Solmemes1,
"   thank you, gentlemen. we just want the truth.",2019-12-07 00:33:33+00:00,,,1203110262062174208,@LindseyGrahamSC @ChuckGrassley @RonJohnsonWI,https://twitter.com/simplylorilee/status/1203110262062174208,0,0,JackPosobiec,https://twitter.com/JackPosobiec/status/1203106957386756096
i still want a “militant normal” tee-shirt.,2019-12-07 00:22:35+00:00,,,1203107500565975040,,https://twitter.com/simplylorilee/status/1203107500565975040,0,0,LibertyFan76,
truth.,2019-12-07 00:21:49+00:00,,,1203107306025734150,,https://twitter.com/simplylorilee/status/1203107306025734150,0,0,LibertyFan76,
amen!,2019-12-06 23:00:09+00:00,,,1203086757635473409,,https://twitter.com/simplylorilee/status/1203086757635473409,0,0,JesseKellyDC,
