text,date,geo,hashtags,tweet_id,mentions,permalink,replies,retweets,replies_to,mentioned_urls
"seriously, jed, he has alzheimer’s. my mom had it and his behavior is typical. it’s sad.",2020-02-28 19:08:06+00:00,,,1233468940535443457,,https://twitter.com/simplylorilee/status/1233468940535443457,1,1,JedediahBila,
,2020-02-28 17:18:18+00:00,,,1233441307475038209,,https://twitter.com/simplylorilee/status/1233441307475038209,0,0,paulsperry_,
what is the matter with these adults?,2020-02-28 12:07:25+00:00,,,1233363069092405249,,https://twitter.com/simplylorilee/status/1233363069092405249,0,0,MattWalshBlog,
"“by far the most celebrated and expensive use of civet, however, is in the elaborate chinese soup known as dragon, tiger, and phoenix. civet flesh is used as the “tiger” portion of the concoction, along with rat snake or cobra (“dragon”) and ordinary chicken (“phoenix”).”",2020-02-28 00:35:56+00:00,,,1233189051399839745,,https://twitter.com/simplylorilee/status/1233189051399839745,0,0,maggieNYT,
"this seems to me to be the biggest danger the us faces from any disease. no hygiene, compromised immune systems, sharing needles and only god knows what else.",2020-02-27 23:33:05+00:00,,,1233173234759192576,,https://twitter.com/simplylorilee/status/1233173234759192576,0,0,stillgray,
teacher.,2020-02-27 21:24:38+00:00,,,1233140909375660034,,https://twitter.com/simplylorilee/status/1233140909375660034,0,0,xan_desanctis,
his wife is so beautiful and seems very nice. i’d love to meet her.,2020-02-27 20:03:14+00:00,,,1233120424780849157,,https://twitter.com/simplylorilee/status/1233120424780849157,0,0,PolitiBunny,
i don’t believe any thinking person didn’t get what you were saying. people are ridiculous with their faux outrage.,2020-02-27 19:40:43+00:00,,,1233114757999276033,,https://twitter.com/simplylorilee/status/1233114757999276033,0,0,DLoesch,
this whole article is an enormous lie by omission.,2020-02-27 19:39:09+00:00,,,1233114363592085505,,https://twitter.com/simplylorilee/status/1233114363592085505,1,0,mmfa,
i went through a bank merger and i can attest to the fact that all employees are asked to sign onto the new program or quit. refusing to change to the new ceo’s standard is to be fired.,2020-02-27 04:42:53+00:00,,,1232888812667310080,,https://twitter.com/simplylorilee/status/1232888812667310080,0,0,yesnicksearcy,
the only murder that is legal in the us is abortion. no one is being lynched. millions of children are being murdered.,2020-02-27 04:36:26+00:00,,,1232887188020396033,,https://twitter.com/simplylorilee/status/1232887188020396033,0,0,RashidaTlaib,
how can i watch it?,2020-02-27 00:01:17+00:00,,,1232817944306102272,,https://twitter.com/simplylorilee/status/1232817944306102272,1,0,REBELLER,
 happy birthday lovely person.,2020-02-26 19:21:47+00:00,,,1232747607686078465,@_hublette,https://twitter.com/simplylorilee/status/1232747607686078465,0,0,,
i’m sick seeing this.,2020-02-26 19:14:51+00:00,,,1232745862125715456,,https://twitter.com/simplylorilee/status/1232745862125715456,0,0,MattWalshBlog,
,2020-02-26 03:43:41+00:00,,,1232511524494872579,,https://twitter.com/simplylorilee/status/1232511524494872579,0,0,senatorshoshana,
he seems to be channeling barack obama except he pretends to be a christian. oh wait...,2020-02-26 03:40:20+00:00,,,1232510683398463489,,https://twitter.com/simplylorilee/status/1232510683398463489,0,0,bourgeoisalien,
it’s tragic and if he gets nominated his vp pick will be the real candidate.,2020-02-26 03:06:24+00:00,,,1232502144827371520,,https://twitter.com/simplylorilee/status/1232502144827371520,0,0,DonaldJTrumpJr,
the dea gives methadone to addicts at taxpayer expense. i saw my adopted grandson withdraw and it was brutal. he is cognitively disabled. first govt should quit supplying addicts with free drugs. my grandson’s birth mother had 7 kids on methadone and died of an overdose anyway.,2020-02-26 02:58:44+00:00,,,1232500214038032385,,https://twitter.com/simplylorilee/status/1232500214038032385,0,0,Johnny_Joey,
i don’t like buttigieg at all because he is a good politician and he looks less crazy than the rest of the democrats. (he lies about the bible),2020-02-26 02:51:49+00:00,,,1232498471992610816,,https://twitter.com/simplylorilee/status/1232498471992610816,0,0,AmandaPresto,
repete,2020-02-26 02:34:27+00:00,,#RePete,1232494104421920768,,https://twitter.com/simplylorilee/status/1232494104421920768,0,0,DonaldJTrumpJr,
plain - re-pete,2020-02-26 02:33:55+00:00,,,1232493968371245058,,https://twitter.com/simplylorilee/status/1232493968371245058,0,0,G_TheOriginal,
,2020-02-26 02:31:11+00:00,,,1232493282397229057,,https://twitter.com/simplylorilee/status/1232493282397229057,0,0,BuckSexton,
when i was a child i only knew catholics that observed lent but as an adult i’ve known non-catholics that do. i guess i really don’t know how common it is.,2020-02-26 00:21:49+00:00,,,1232460724351295490,,https://twitter.com/simplylorilee/status/1232460724351295490,1,0,EyeOnHealthNews,
i’m not catholic but i think lent is a great discipline and i admire people that can do it. i want to give up snacking and it will definitely drive me to my knees. gluttony is a sin that i need to repent of and i will need him to do it.,2020-02-25 23:56:15+00:00,,,1232454290549002241,,https://twitter.com/simplylorilee/status/1232454290549002241,1,0,ShannonBream,
i hope potus retweets because being able to take a joke is cool.,2020-02-25 23:51:08+00:00,,,1232453003837181952,,https://twitter.com/simplylorilee/status/1232453003837181952,0,0,CarpeDonktum,
i sent it to my kids. i laughed so hard.,2020-02-25 23:47:02+00:00,,,1232451969375039489,,https://twitter.com/simplylorilee/status/1232451969375039489,0,0,CarpeDonktum,
2/2 re-amortization of loans with zero interest and forgiveness after paying off the original principal would make re-payment possible. getting part of the $back is better than having defaults. bankruptcy relief. universities sharing the risk of defaults. seize endowments.,2020-02-25 23:43:48+00:00,,,1232451157760471041,,https://twitter.com/simplylorilee/status/1232451157760471041,0,0,simplylorilee,
"i agree that govt taking over student lending allowed universities to charge whatever they wanted. as a banker, however, i know that there are hundreds of solutions between ignoring the problem and total debt forgiveness. 1/2",2020-02-25 23:37:20+00:00,,,1232449529888137217,,https://twitter.com/simplylorilee/status/1232449529888137217,1,0,InezFeltscher,
the whole country has witnessed you leaking confidential information and lying about knowing the whistle blowers identity. you also lied about seeing evidence condemning potus. that’s our money you wasted.,2020-02-25 23:27:42+00:00,,,1232447104326328321,,https://twitter.com/simplylorilee/status/1232447104326328321,0,0,RepAdamSchiff,
you cannot be a christian and deny what jesus taught.,2020-02-25 17:28:42+00:00,,,1232356758997344257,,https://twitter.com/simplylorilee/status/1232356758997344257,0,1,MattWalshBlog,
"my mother was a beautiful pianist who played for every theater production, wedding, funeral, christmas musical etc. when she got alzheimer’s she started making obvious errors. we loved her enough to take her off the stage so that the public would remember her as she was.",2020-02-25 13:42:29+00:00,,,1232299829382045696,,https://twitter.com/simplylorilee/status/1232299829382045696,0,0,johncardillo,
acosta is a jr high school girl. i cringe every time he speaks.,2020-02-25 13:36:48+00:00,,,1232298402148495362,,https://twitter.com/simplylorilee/status/1232298402148495362,0,0,JimHansonDC,
that’s so cruel.,2020-02-25 12:01:29+00:00,,,1232274414089142272,,https://twitter.com/simplylorilee/status/1232274414089142272,0,0,MattWalshBlog,
"bernie teaches that his morality is superior to biblical morality, but it is a morality. ex. an old person shouldn’t get expensive medical care when young, healthy people can’t. keeping a disabled child alive is cruel. stealing through taxes to provide forced charity is ok, etc.",2020-02-25 02:11:32+00:00,,,1232125948843167744,,https://twitter.com/simplylorilee/status/1232125948843167744,0,0,MattWalshBlog,
  thank you!!!,2020-02-25 01:04:22+00:00,,,1232109043885527040,@senatemajldr @realDonaldTrump,https://twitter.com/simplylorilee/status/1232109043885527040,0,0,RyanAFournier,
washington crossed a river in a winter storm then marched miles soaking wet and cold to murder his enemies in their beds on christmas eve. i’ll go with ruthless.,2020-02-24 23:54:02+00:00,,,1232091346359459840,,https://twitter.com/simplylorilee/status/1232091346359459840,0,0,JesseKellyDC,
thank you! democrats run every major city but they blame trump for all of the damage they cause.,2020-02-24 23:47:33+00:00,,,1232089714188050432,,https://twitter.com/simplylorilee/status/1232089714188050432,0,0,JustEric,
notice she didn’t mention american.,2020-02-24 21:39:24+00:00,,,1232057461550600194,,https://twitter.com/simplylorilee/status/1232057461550600194,0,0,Johnny_Joey,
whatever happened to sacrificing to have what you want? i wanted to be a stay at home mom so our first house was a 2 bedroom fixer upper. i’ve never owned a brand new car. my husband and his friends traded skills for repairs etc and i still clip coupons to save 37% on groceries.,2020-02-24 21:33:56+00:00,,,1232056089358852097,,https://twitter.com/simplylorilee/status/1232056089358852097,1,0,JimHansonDC,
wow! sounds like jonathan edwards “sinners in the hands of an angry god.” appropriate.,2020-02-24 21:27:40+00:00,,,1232054512552161281,,https://twitter.com/simplylorilee/status/1232054512552161281,0,0,Solmemes1,
thank you.,2020-02-24 21:18:53+00:00,,,1232052301302550534,,https://twitter.com/simplylorilee/status/1232052301302550534,0,0,Solmemes1,
never trumper’s told us who they are with their actions. we need to believe their actions no matter what they say.,2020-02-24 21:18:22+00:00,,,1232052172331900929,,https://twitter.com/simplylorilee/status/1232052172331900929,0,0,yesnicksearcy,
i’m not familiar with the song. please tell. me the title so i can read the words and appreciate it.,2020-02-24 21:15:46+00:00,,,1232051516225261574,,https://twitter.com/simplylorilee/status/1232051516225261574,1,0,Solmemes1,
like one isn’t bad enough. they piggyback.,2020-02-24 00:20:16+00:00,,,1231735558981988358,,https://twitter.com/simplylorilee/status/1231735558981988358,0,0,senatorshoshana,
i was a banker before govt took over student lending. we knew this would come. the govt could amortize student loans for longer periods of time and lower interest rates so that students could afford the payments. govt destroyed student lending on purpose. they wanted a crisis.,2020-02-23 15:59:04+00:00,,,1231609427633098752,,https://twitter.com/simplylorilee/status/1231609427633098752,0,0,willchamberlain,
"and theft through fraud as with your brother/husband, although that’s still greed on your part. we gave you everything, but you stole more. shame on you and yours.",2020-02-23 15:51:46+00:00,,,1231607590574002177,,https://twitter.com/simplylorilee/status/1231607590574002177,0,0,IlhanMN,
,2020-02-23 15:45:12+00:00,,,1231605936533495811,,https://twitter.com/simplylorilee/status/1231605936533495811,0,0,ThatEricAlper,
biden’s behavior is absolutely typical of a person with alzheimer’s. my mom was the same way and they are worse in the evenings. it’s called “sundowners.”,2020-02-22 21:32:53+00:00,,,1231331048614703104,,https://twitter.com/simplylorilee/status/1231331048614703104,0,0,Heminator,
"i too have a chronic, painful, and incurable disease. it has never excused me from anything. i’ve raised 5 kids and am helping with 11 gkids. cavuto is a big boy and if he throws punches he deserves to take one back. he’s not a victim.",2020-02-22 03:20:14+00:00,,,1231056075614494720,,https://twitter.com/simplylorilee/status/1231056075614494720,0,0,JaniceDean,
he certainly couldn’t make anything worse.,2020-02-21 22:10:58+00:00,,,1230978244356313088,,https://twitter.com/simplylorilee/status/1230978244356313088,0,0,CarpeDonktum,
" matthew 6:22-23 “blessed are you when people hate you...and insult you and reject your name as evil because of the son of man. rejoice in that day and leap for joy, because great is your reward in heaven. for their fathers treated the prophets in the same way.”",2020-02-21 22:06:32+00:00,,,1230977129661304832,@RichardGrenell,https://twitter.com/simplylorilee/status/1230977129661304832,0,0,dbongino,
“sow the wind...reap the whirlwind.”,2020-02-21 21:54:01+00:00,,,1230973979600527360,,https://twitter.com/simplylorilee/status/1230973979600527360,0,0,Cernovich,
life used to have purpose. i had children because i wanted to raise up people who would honor and glorify god and be a testimony to him and his goodness by living lives that contributed good to this world. they are now doing the same.,2020-02-21 21:26:02+00:00,,,1230966934558199808,,https://twitter.com/simplylorilee/status/1230966934558199808,0,0,StefanMolyneux,
putin is obviously aiding adam schiff to discredit the 2020 election so that potus has to work with one hand tied behind his back. democrats are the ones benefitting from russia. schiff is the russian operative.,2020-02-21 19:12:10+00:00,,,1230933245493207041,,https://twitter.com/simplylorilee/status/1230933245493207041,0,0,dbongino,
i hope she uses it to take the poor kid out of whatever school he goes to.,2020-02-21 18:43:11+00:00,,,1230925953347596288,,https://twitter.com/simplylorilee/status/1230925953347596288,0,0,dbongino,
schools should also have “to go” containers for any leftovers for kids most at risk of not eating on weekends. they throw a lot of food out.,2020-02-21 13:28:57+00:00,,,1230846874833313796,,https://twitter.com/simplylorilee/status/1230846874833313796,1,0,JFairSalon,
they are demanding that we lie. we can’t lie.,2020-02-21 13:26:12+00:00,,,1230846181867167744,,https://twitter.com/simplylorilee/status/1230846181867167744,0,0,conservmillen,
    ,2020-02-21 13:22:17+00:00,,,1230845197212409857,@realDonaldTrump @DonaldJTrumpJr @EricTrump @LaraLeaTrump @kimguilfoyle,https://twitter.com/simplylorilee/status/1230845197212409857,0,0,Solmemes1,https://twitter.com/Solmemes1/status/1230740219667734529
make ric permanent.,2020-02-21 13:20:31+00:00,,,1230844752557477889,,https://twitter.com/simplylorilee/status/1230844752557477889,0,0,realDonaldTrump,
" i’m sincere when i ask how you can judge potus so harshly for past sins when your own father left his disabled wife and children to marry a young heiress. john mccain was also known to be brash, salty, and temperamental. humans are a combination of good and bad.",2020-02-21 04:13:38+00:00,,,1230707122779770881,@MeghanMcCain,https://twitter.com/simplylorilee/status/1230707122779770881,0,0,,
ominous.,2020-02-21 03:37:49+00:00,,,1230698109044281346,,https://twitter.com/simplylorilee/status/1230698109044281346,0,0,AOC,https://twitter.com/AOC/status/1230696676471562242
,2020-02-21 03:36:17+00:00,,,1230697726003695618,,https://twitter.com/simplylorilee/status/1230697726003695618,0,0,,
this is insulting.,2020-02-21 03:35:17+00:00,,,1230697471199727616,,https://twitter.com/simplylorilee/status/1230697471199727616,1,1,BreitbartNews,https://twitter.com/BreitbartNews/status/1230655521469992962
 ambassador grenell is volunteering to stand on the front line of a very dangerous spiritual battle. may he always be dressed in the armor of god and may the warrior angels of heaven be a flaming circle around him and his husband.,2020-02-21 02:44:55+00:00,,,1230684797082775554,@RichardGrenell,https://twitter.com/simplylorilee/status/1230684797082775554,0,0,KurtSchlichter,
may god have ric’s back and surround him with warrior angels.,2020-02-21 02:41:10+00:00,,,1230683852776935424,,https://twitter.com/simplylorilee/status/1230683852776935424,0,0,RepLeeZeldin,
why do politicians like joe biden appeal to the illegal immigrant vote? because they know that they are voting!,2020-02-21 02:39:20+00:00,,,1230683393131732992,,https://twitter.com/simplylorilee/status/1230683393131732992,0,0,robbystarbuck,
"take your children out of those situations. i thank god that parents in the us can still take their children out of public school.  is right that public school is the most violent, dangerous place most people will ever face.",2020-02-21 02:37:02+00:00,,,1230682815907422213,@michaelmalice,https://twitter.com/simplylorilee/status/1230682815907422213,0,1,JedediahBila,
"excellent, dana. i’ve been waiting for someone with the gift of speaking/teaching/exhortation to say exactly that. i will buy your book as i feel that it will help me to grow in grace. thank you.",2020-02-21 02:30:24+00:00,,,1230681143747522560,,https://twitter.com/simplylorilee/status/1230681143747522560,0,0,DLoesch,
they were already rewarded with taxpayer money for years.,2020-02-21 01:44:23+00:00,,,1230669565249626113,,https://twitter.com/simplylorilee/status/1230669565249626113,0,0,ChrisLoesch,
why do parents leave their children in a school that allows this? take him out of that situation.,2020-02-21 01:43:09+00:00,,,1230669253084356608,,https://twitter.com/simplylorilee/status/1230669253084356608,1,0,StefanMolyneux,
take the kid out of the damn school. i would never allow my child to stay in that situation.,2020-02-21 01:41:25+00:00,,,1230668816822263815,,https://twitter.com/simplylorilee/status/1230668816822263815,0,0,newscomauHQ,
why does comey find his crimes so funny? it’s like he’s daring ag barr to charge him.,2020-02-20 22:23:08+00:00,,,1230618918177382401,,https://twitter.com/simplylorilee/status/1230618918177382401,0,0,JimHansonDC,
 i have been on the phone with your company off and on for 2 wks and i’ve been hung up on after being on hold for over an hour just today. yours service sucks. wth?,2020-02-20 18:18:35+00:00,,,1230557375259525124,@PayPal,https://twitter.com/simplylorilee/status/1230557375259525124,1,0,,
" i truly don’t understand, sir. we watched gov’t employees lie to congress and they aren’t being charged for it, yet, roger stone will go to prison. would ag barr explain how the law works? it’s not like i was taught.",2020-02-20 17:58:16+00:00,,,1230552262004682754,@realDonaldTrump,https://twitter.com/simplylorilee/status/1230552262004682754,0,0,,
buttigieg is frightening because he speaks with “ authority” concerning god and the bible even though he’s spouting lies. if pete believed the bible is gods authoritative word than he wouldn’t be so cocky about rebelling against it.,2020-02-20 16:53:17+00:00,,,1230535906836303878,,https://twitter.com/simplylorilee/status/1230535906836303878,0,0,JesseKellyDC,
cold.,2020-02-20 12:24:52+00:00,,,1230468360854474755,,https://twitter.com/simplylorilee/status/1230468360854474755,0,0,NathanBrandWA,
do they hate ambassador grenell just because he has been so effective in his duties? i’ve never heard a bad thing about him and ive been following his career for yrs because i admire him as a person.,2020-02-20 12:18:18+00:00,,,1230466707443134465,,https://twitter.com/simplylorilee/status/1230466707443134465,0,0,hughhewitt,
,2020-02-20 03:19:55+00:00,,,1230331217456791552,@Solmemes1,https://twitter.com/simplylorilee/status/1230331217456791552,0,0,hughhewitt,https://twitter.com/hughhewitt/status/1230330866091511810
i caught that too.,2020-02-20 02:30:52+00:00,,,1230318874257698818,,https://twitter.com/simplylorilee/status/1230318874257698818,0,0,DLoesch,
rudy will be surprised to hear that.,2020-02-20 02:23:38+00:00,,,1230317054512762880,,https://twitter.com/simplylorilee/status/1230317054512762880,0,1,ChuckRossDC,
buttigiege bothers me the most because he pretends to be a christian who is knowledgeable about the bible and he “speaks for god.” pete hasn’t read much of the bible if he’s read it at all and he’s lying.,2020-02-20 02:16:32+00:00,,,1230315266367729666,,https://twitter.com/simplylorilee/status/1230315266367729666,0,0,AlfonZoRachel,
"that’s beautiful, but not surprising. everyday americans are really very kind.",2020-02-20 01:51:54+00:00,,,1230309066452455424,,https://twitter.com/simplylorilee/status/1230309066452455424,0,1,DonaldJTrumpJr,
,2020-02-20 01:06:37+00:00,,,1230297673821016064,@Solmemes1,https://twitter.com/simplylorilee/status/1230297673821016064,0,0,KurtSchlichter,https://twitter.com/KurtSchlichter/status/1230297521974468608
this is a wonderful decision. i’ve followed ric’s career for a few years and i think he’s a man of high character.,2020-02-20 00:38:57+00:00,,,1230290711259557889,,https://twitter.com/simplylorilee/status/1230290711259557889,0,0,realDonaldTrump,
"my grandfather was 5’0” tall. he was self taught, ran a business as a house painter, and became a millionaire in the stock market. i never even considered his height as a problem. it must have hard for him but i never thought about it. i idolized him.",2020-02-20 00:32:45+00:00,,,1230289148323471361,,https://twitter.com/simplylorilee/status/1230289148323471361,0,0,Cernovich,
"i’d prefer to see rich, career politicians stock portfolio’s.",2020-02-20 00:15:00+00:00,,,1230284684149624835,,https://twitter.com/simplylorilee/status/1230284684149624835,0,0,Cernovich,
bacon and egg mcgriddle.,2020-02-19 21:38:24+00:00,,,1230245271025672197,,https://twitter.com/simplylorilee/status/1230245271025672197,0,0,WayneDupreeShow,
please vote no on america last amnesty.,2020-02-19 21:27:21+00:00,,,1230242491535937537,,https://twitter.com/simplylorilee/status/1230242491535937537,0,0,tedcruz,
"       no! no! no! 1000x’s no! please, no amnesty. americafirst",2020-02-19 21:25:55+00:00,,#AmericaFirst,1230242130955771904,@SenateGOP @SenTedCruz @senatemajldr @SenMikeLee @RandPaul @LindseyGrahamSC @realDonaldTrump,https://twitter.com/simplylorilee/status/1230242130955771904,0,0,ColumbiaBugle,https://twitter.com/ColumbiaBugle/status/1229866232020553729
mccabe was the last straw for me. i lost all hope for any justice.,2020-02-19 16:10:13+00:00,,,1230162683590324231,,https://twitter.com/simplylorilee/status/1230162683590324231,0,0,RepLeeZeldin,
god created countries at the tower of babel.,2020-02-19 15:48:42+00:00,,,1230157267187765254,,https://twitter.com/simplylorilee/status/1230157267187765254,0,0,benshapiro,
"adultery and homosexuality, lying and murder, are all spoken about in the bible very clearly and with zero interpretation needed. if buttigieg is a bible scholar, capable of teaching and using it to rebuke others, than he should know the whole bible and believe every word in it.",2020-02-19 12:41:17+00:00,,,1230110102545477632,,https://twitter.com/simplylorilee/status/1230110102545477632,0,0,LarryOConnor,
schools don’t allow wikipedia as a source for students in writing reports anymore.,2020-02-19 12:03:56+00:00,,,1230100704506851328,,https://twitter.com/simplylorilee/status/1230100704506851328,0,0,dbongino,
"i worked for many yrs and married a man younger than me. after i raised his children while he stayed home, he left me to be bi-sexual and in the divorce i had to give him a lot of money, pay off his debts and give him my house. my step children sided with him and left me also.",2020-02-18 14:06:52+00:00,,,1229769251738832896,,https://twitter.com/simplylorilee/status/1229769251738832896,0,0,Cernovich,
you’re not trying to claim that the successful economy is because of you? hubris can make a person crazy.,2020-02-17 22:36:16+00:00,,,1229535059176280065,,https://twitter.com/simplylorilee/status/1229535059176280065,0,0,BarackObama,
my grandkids love lego’s.,2020-02-17 03:48:01+00:00,,,1229251126840766464,,https://twitter.com/simplylorilee/status/1229251126840766464,0,0,cvpayne,
"my concern with buttigieg is that he often speaks with “authority” on what god says in the bible and he is always wrong. if he believes the bible and trusts that it is god’s authority, he needs to study all of it.",2020-02-17 03:42:55+00:00,,,1229249842351935488,,https://twitter.com/simplylorilee/status/1229249842351935488,0,0,McAllisterDen,
wth?,2020-02-17 02:41:53+00:00,,,1229234481527238656,,https://twitter.com/simplylorilee/status/1229234481527238656,0,0,johncardillo,
"anna karenina cs lewis, narnia series wuthering heights, gone with the wind",2020-02-17 02:36:39+00:00,,,1229233165966991365,,https://twitter.com/simplylorilee/status/1229233165966991365,0,0,exjon,
"i’m not afraid to die and at 95 i don’t think i’d want treatment, but 95 will become 85, 75, and so on. i’ve read ezekiel emanuel’s writing on a “complete lives system” for determining healthcare.",2020-02-17 02:16:56+00:00,,,1229228204541587456,,https://twitter.com/simplylorilee/status/1229228204541587456,0,0,DLoesch,
very cool.,2020-02-16 22:00:33+00:00,,,1229163684229939201,,https://twitter.com/simplylorilee/status/1229163684229939201,0,0,DonaldJTrumpJr,
 ,2020-02-16 18:23:45+00:00,,,1229109122194427904,,https://twitter.com/simplylorilee/status/1229109122194427904,0,0,brithume,
you look totally pissed that a virus had the audacity to attack you. ,2020-02-16 17:13:48+00:00,,,1229091518339788815,,https://twitter.com/simplylorilee/status/1229091518339788815,0,0,KurtSchlichter,
they obviously don’t know a jesus.,2020-02-16 17:07:53+00:00,,,1229090030519541762,,https://twitter.com/simplylorilee/status/1229090030519541762,0,0,bennyjohnson,
ouch!,2020-02-16 16:48:53+00:00,,,1229085248572608513,,https://twitter.com/simplylorilee/status/1229085248572608513,0,1,johncardillo,
  you have to love this guy!,2020-02-16 16:42:39+00:00,,,1229083679374348289,@DonaldJTrumpJr @EricTrump,https://twitter.com/simplylorilee/status/1229083679374348289,0,0,Johnny_Joey,https://twitter.com/Johnny_Joey/status/1229082758577868808
